https://kawalpemilu.org#50089,"BATONAONG, AROSBAYA, BANGKALAN, JAWA TIMUR",4,85,92,177
https://kawalpemilu.org#48262,"PELANG KIDUL, KEDUNGGALAR, NGAWI, JAWA TIMUR",7,164,37,201
https://kawalpemilu.org#49626,"KENTONG, GLAGAH, LAMONGAN, JAWA TIMUR",6,148,44,192
https://kawalpemilu.org#46248,"SUMBER AGUNG, GRATI, PASURUAN, JAWA TIMUR",4,165,89,254
https://kawalpemilu.org#44783,"JATISARI, JENGGAWAH, JEMBER, JAWA TIMUR",25,67,92,159
https://kawalpemilu.org#51381,"NGAGEL REJO, WONOKROMO, KOTA SURABAYA, JAWA TIMUR",34,146,62,208
https://kawalpemilu.org#51526,"SIMOMULYO BARU, SUKOMANUNGGAL, KOTA SURABAYA, JAWA TIMUR",34,152,46,198
https://kawalpemilu.org#43956,"SRIKATON, RINGINREJO, KEDIRI, JAWA TIMUR",1,156,40,196
https://kawalpemilu.org#45449,"TAMBAK UKIR, KENDIT, SITUBONDO, JAWA TIMUR",1,72,140,212
https://kawalpemilu.org#51472,"LAKARSANTRI, LAKARSANTRI, KOTA SURABAYA, JAWA TIMUR",7,148,46,194
https://kawalpemilu.org#50814,"JULUK, SARONGGI, SUMENEP, JAWA TIMUR",9,110,54,164
https://kawalpemilu.org#45957,"PANDITAN, LUMBANG, PASURUAN, JAWA TIMUR",2,120,101,221
https://kawalpemilu.org#43843,"BELOR, PURWOASRI, KEDIRI, JAWA TIMUR",6,189,31,220
https://kawalpemilu.org#45231,"JETIS, CURAHDAMI, BONDOWOSO, JAWA TIMUR",14,55,146,201
https://kawalpemilu.org#44906,"KARANGHARJO, SILO, JEMBER, JAWA TIMUR",4,126,68,194
https://kawalpemilu.org#45379,"BENDELAN, BINAKAL, BONDOWOSO, JAWA TIMUR",3,49,68,117
https://kawalpemilu.org#47122,"PUNDONG, DIWEK, JOMBANG, JAWA TIMUR",10,135,52,187
https://kawalpemilu.org#43444,"KARANGBENDO, PONGGOK, BLITAR, JAWA TIMUR",18,134,16,150
https://kawalpemilu.org#48214,"BANJARANSARI, PADAS, NGAWI, JAWA TIMUR",1,230,18,248
https://kawalpemilu.org#48892,"MANDER, TAMBAKBOYO, TUBAN, JAWA TIMUR",4,183,19,202
https://kawalpemilu.org#48472,"DROKILO, KEDUNGADEM, BOJONEGORO, JAWA TIMUR",1,31,151,182
https://kawalpemilu.org#45870,"LAWEYAN, SUMBERASIH, PROBOLINGGO, JAWA TIMUR",11,113,71,184
https://kawalpemilu.org#51380,"NGAGEL, WONOKROMO, KOTA SURABAYA, JAWA TIMUR",14,114,60,174
https://kawalpemilu.org#50059,"TUNJUNG, BURNEH, BANGKALAN, JAWA TIMUR",22,53,140,193
https://kawalpemilu.org#47920,"SUGIHREJO, KAWEDANAN, MAGETAN, JAWA TIMUR",9,116,19,135
https://kawalpemilu.org#44875,"PLALANGAN, KALISAT, JEMBER, JAWA TIMUR",13,122,43,165
https://kawalpemilu.org#43331,"GANDONG, BANDUNG, TULUNGAGUNG, JAWA TIMUR",5,141,28,169
https://kawalpemilu.org#43725,"SEMPU, NGANCAR, KEDIRI, JAWA TIMUR",11,144,12,156
https://kawalpemilu.org#42462,"WORAWARI, KEBONAGUNG, PACITAN, JAWA TIMUR",9,22,100,122
https://kawalpemilu.org#44306,"CANDIRENGGO, SINGOSARI, MALANG, JAWA TIMUR",25,107,73,180
https://kawalpemilu.org#48320,"CANTEL, PITU, NGAWI, JAWA TIMUR",4,194,39,233
https://kawalpemilu.org#43188,"TULUNGREJO, KARANGREJO, TULUNGAGUNG, JAWA TIMUR",3,151,40,191
https://kawalpemilu.org#51388,"KEPUTRAN, TEGALSARI, KOTA SURABAYA, JAWA TIMUR",41,148,31,179
https://kawalpemilu.org#50575,"TOBUNGAN, GALIS, PAMEKASAN, JAWA TIMUR",6,63,143,206
https://kawalpemilu.org#48248,"TEMPURAN, PARON, NGAWI, JAWA TIMUR",22,82,92,174
https://kawalpemilu.org#51500,"KEBONSARI, JAMBANGAN, KOTA SURABAYA, JAWA TIMUR",6,129,68,197
https://kawalpemilu.org#50783,"GULUKMANJUNG, BLUTO, SUMENEP, JAWA TIMUR",3,60,162,222
https://kawalpemilu.org#43128,"BANJARSARI, NGANTRU, TULUNGAGUNG, JAWA TIMUR",14,124,28,152
https://kawalpemilu.org#42538,"WONOSIDI, TULAKAN, PACITAN, JAWA TIMUR",13,44,139,183
https://kawalpemilu.org#51470,"BANGKINGAN, LAKARSANTRI, KOTA SURABAYA, JAWA TIMUR",3,141,55,196
https://kawalpemilu.org#51395,"KUPANG KRAJAN, SAWAHAN, KOTA SURABAYA, JAWA TIMUR",12,163,58,221
https://kawalpemilu.org#48301,"PARAS, PANGKUR, NGAWI, JAWA TIMUR",5,188,48,236
https://kawalpemilu.org#42590,"GUNDIK, SLAHUNG, PONOROGO, JAWA TIMUR",7,109,79,188
https://kawalpemilu.org#47239,"KAMPUNGBARU, PLANDAAN, JOMBANG, JAWA TIMUR",2,103,55,158
https://kawalpemilu.org#43074,"TAMANAN, TULUNGAGUNG, TULUNGAGUNG, JAWA TIMUR",4,125,47,172
https://kawalpemilu.org#51267,"JREBENG LOR, KEDOPAK, KOTA PROBOLINGGO, JAWA TIMUR",8,101,151,252
https://kawalpemilu.org#47114,"PUTON, DIWEK, JOMBANG, JAWA TIMUR",8,197,35,232
https://kawalpemilu.org#46813,"SARIREJO, MOJOSARI, MOJOKERTO, JAWA TIMUR",7,85,63,148
https://kawalpemilu.org#44572,"SUMBEREJO, SUKODONO, LUMAJANG, JAWA TIMUR",13,145,57,202
https://kawalpemilu.org#45427,"DEMUNG, BESUKI, SITUBONDO, JAWA TIMUR",3,50,78,128
https://kawalpemilu.org#44093,"BLAYU, WAJAK, MALANG, JAWA TIMUR",5,115,25,140
https://kawalpemilu.org#60364,"PAL SEMBILAN, SUNGAI KAKAP, KUBU RAYA, KALIMANTAN BARAT",41,54,187,241
https://kawalpemilu.org#58802,"KERAMAT JAYA, KENDAWANGAN, KETAPANG, KALIMANTAN BARAT",3,180,49,229
https://kawalpemilu.org#59714,"AMBOYO INTI, NGABANG, LANDAK, KALIMANTAN BARAT",33,80,1,81
https://kawalpemilu.org#59521,"NANGA SANGAN, BOYAN TANJUNG, KAPUAS HULU, KALIMANTAN BARAT",1,33,192,225
https://kawalpemilu.org#60206,"SIANTAN HILIR, PONTIANAK UTARA, KOTA PONTIANAK, KALIMANTAN BARAT",69,33,189,222
https://kawalpemilu.org#59763,"KAYU TANAM, MANDOR, LANDAK, KALIMANTAN BARAT",7,198,2,200
https://kawalpemilu.org#59560,"SUNGAI JAGA A, SUNGAI RAYA, BENGKAYANG, KALIMANTAN BARAT",4,120,5,125
https://kawalpemilu.org#60095,"BINA JAYA, PINOH SELATAN, MELAWI, KALIMANTAN BARAT",2,192,11,203
https://kawalpemilu.org#58524,"JUNGKAT, SIANTAN, MEMPAWAH, KALIMANTAN BARAT",32,67,118,185
https://kawalpemilu.org#59780,"TENGON, AIR BESAR, LANDAK, KALIMANTAN BARAT",4,115,28,143
https://kawalpemilu.org#60192,"BANJAR SERASAN, PONTIANAK TIMUR, KOTA PONTIANAK, KALIMANTAN BARAT",23,56,195,251
https://kawalpemilu.org#58752,"KUALA SATONG, MATAN HILIR UTARA, KETAPANG, KALIMANTAN BARAT",2,60,164,224
https://kawalpemilu.org#60186,"BENUA MELAYU DARAT, PONTIANAK SELATAN, KOTA PONTIANAK, KALIMANTAN BARAT",89,138,51,189
https://kawalpemilu.org#60202,"SUNGAI BELIUNG, PONTIANAK BARAT, KOTA PONTIANAK, KALIMANTAN BARAT",68,53,188,241
https://kawalpemilu.org#60253,"SIJANGKUNG, SINGKAWANG SELATAN, KOTA SINGKAWANG, KALIMANTAN BARAT",7,166,1,167
https://kawalpemilu.org#85358,"PARIT BARU, SUNGAI RAYA, KUBU RAYA, KALIMANTAN BARAT",80,104,109,213
https://kawalpemilu.org#58417,"SUNGAI DEDEN, SUBAH, SAMBAS, KALIMANTAN BARAT",9,107,48,155
https://kawalpemilu.org#58947,"SAMPIT, DELTA PAWAN, KETAPANG, KALIMANTAN BARAT",31,64,150,214
https://kawalpemilu.org#59631,"TERIAK, TERIAK, BENGKAYANG, KALIMANTAN BARAT",1,221,16,237
https://kawalpemilu.org#58572,"ILIR KOTA, KAPUAS, SANGGAU, KALIMANTAN BARAT",10,69,112,181
https://kawalpemilu.org#60213,"SUNGAI JAWI, PONTIANAK KOTA, KOTA PONTIANAK, KALIMANTAN BARAT",111,44,173,217
https://kawalpemilu.org#64063,"ALALAK UTARA, BANJARMASIN UTARA, KOTA BANJARMASIN, KALIMANTAN SELATAN",34,66,191,257
https://kawalpemilu.org#62730,"PUNTIK LUAR, MANDASTANA, BARITO KUALA, KALIMANTAN SELATAN",1,53,148,201
https://kawalpemilu.org#64034,"KELAYAN DALAM, BANJARMASIN SELATAN, KOTA BANJARMASIN, KALIMANTAN SELATAN",1,42,170,212
https://kawalpemilu.org#62731,"PUNTIK DALAM, MANDASTANA, BARITO KUALA, KALIMANTAN SELATAN",1,103,105,208
https://kawalpemilu.org#63759,"RANTAU PANJANG HULU, KUSAN HILIR, TANAH BUMBU, KALIMANTAN SELATAN",1,67,102,169
https://kawalpemilu.org#62023,"SARIKANDI, KURAU, TANAH LAUT, KALIMANTAN SELATAN",3,82,76,158
https://kawalpemilu.org#62255,"SAMPANAHAN, SAMPANAHAN, KOTABARU, KALIMANTAN SELATAN",1,37,90,127
https://kawalpemilu.org#63273,"BANUA JINGAH, BARABAI, HULU SUNGAI TENGAH, KALIMANTAN SELATAN",1,46,179,225
https://kawalpemilu.org#62032,"NUSA INDAH, BATI BATI, TANAH LAUT, KALIMANTAN SELATAN",8,110,120,230
https://kawalpemilu.org#63377,"PARUPUKAN, BABIRIK, HULU SUNGAI UTARA, KALIMANTAN SELATAN",1,54,50,104
https://kawalpemilu.org#63587,"BANUA RANTAU, BANUA LAWAS, TABALONG, KALIMANTAN SELATAN",5,26,142,168
https://kawalpemilu.org#62085,"GUNUNG MELATI, BATU AMPAR, TANAH LAUT, KALIMANTAN SELATAN",2,130,83,213
https://kawalpemilu.org#62887,"MANDURIAN, TAPIN TENGAH, TAPIN, KALIMANTAN SELATAN",1,25,179,204
https://kawalpemilu.org#63993,"LAMIDA BAWAH, PARINGIN, BALANGAN, KALIMANTAN SELATAN",2,12,73,85
https://kawalpemilu.org#64033,"KELAYAN TENGAH, BANJARMASIN SELATAN, KOTA BANJARMASIN, KALIMANTAN SELATAN",17,84,142,226
https://kawalpemilu.org#64110,"SUNGAI  BESAR, BANJARBARU SELATAN, KOTA BANJARBARU, KALIMANTAN SELATAN",21,77,147,224
https://kawalpemilu.org#62517,"PENYIURAN, PENGAROM, BANJAR, KALIMANTAN SELATAN",3,36,112,148
https://kawalpemilu.org#61036,"LEMO I, TEWEH TENGAH, BARITO UTARA, KALIMANTAN TENGAH",5,52,15,67
https://kawalpemilu.org#61758,"MUARA TUHUP, LAUNG TUHUP, MURUNG RAYA, KALIMANTAN TENGAH",5,68,166,234
https://kawalpemilu.org#61905,"TELANG, PAJU EPAT, BARITO TIMUR, KALIMANTAN TENGAH",1,162,24,186
https://kawalpemilu.org#60680,"BAKUNGIN, KAPUAS HILIR, KAPUAS, KALIMANTAN TENGAH",1,45,99,144
https://kawalpemilu.org#61028,"MELAYU, TEWEH TENGAH, BARITO UTARA, KALIMANTAN TENGAH",15,48,108,156
https://kawalpemilu.org#92612,"BAHAUR BATU RAYA, KAHAYAN KUALA, PULANG PISAU, KALIMANTAN TENGAH",2,90,48,138
https://kawalpemilu.org#60549,"PONDOK DAMAR, MENTAYA HILIR UTARA, KOTAWARINGIN TIMUR, KALIMANTAN TENGAH",3,96,36,132
https://kawalpemilu.org#61933,"LANGKAI, PAHANDUT, KOTA PALANGKARAYA, KALIMANTAN TENGAH",10,101,72,173
https://kawalpemilu.org#60398,"BARU, ARUT SELATAN, KOTAWARINGIN BARAT, KALIMANTAN TENGAH",37,121,92,213
https://kawalpemilu.org#61933,"LANGKAI, PAHANDUT, KOTA PALANGKARAYA, KALIMANTAN TENGAH",86,123,38,161
https://kawalpemilu.org#64592,"SEMURUT, TABALAR, BERAU, KALIMANTAN TIMUR",1,65,145,210
https://kawalpemilu.org#65624,"SUNGAI PINANG LUAR, SAMARINDA KOTA, KOTA SAMARINDA, KALIMANTAN TIMUR",16,65,161,226
https://kawalpemilu.org#65218,"JAMBUK MAKMUR, BONGAN, KUTAI BARAT, KALIMANTAN TIMUR",3,137,66,203
https://kawalpemilu.org#65582,"SIDODADI, SAMARINDA ULU, KOTA SAMARINDA, KALIMANTAN TIMUR",40,117,56,173
https://kawalpemilu.org#65488,"JENEBORA, PENAJAM, PENAJAM PASER UTARA, KALIMANTAN TIMUR",9,89,48,137
https://kawalpemilu.org#64316,"KAMPUNG BARU, TENGGARONG, KUTAI KARTANEGARA, KALIMANTAN TIMUR",2,55,127,182
https://kawalpemilu.org#65536,"BARU TENGAH, BALIKPAPAN BARAT, KOTA BALIKPAPAN, KALIMANTAN TIMUR",49,82,142,224
https://kawalpemilu.org#65150,"REJO BASUKI, BARONG TONGKOK, KUTAI BARAT, KALIMANTAN TIMUR",1,228,32,260
https://kawalpemilu.org#87249,"DAMAI BARU, BALIKPAPAN SELATAN, KOTA BALIKPAPAN, KALIMANTAN TIMUR",14,133,84,217
https://kawalpemilu.org#65560,"GUNUNGBAHAGIA, BALIKPAPAN SELATAN, KOTA BALIKPAPAN, KALIMANTAN TIMUR",34,121,129,250
https://kawalpemilu.org#64459,"BUKIT RAYA, TENGGARONG SEBERANG, KUTAI KARTANEGARA, KALIMANTAN TIMUR",1,137,69,206
https://kawalpemilu.org#65603,"LOK BAHU, SUNGAI KUNJANG, KOTA SAMARINDA, KALIMANTAN TIMUR",7,62,77,139
https://kawalpemilu.org#64165,"PASIR MAYANG, KUARO, PASER, KALIMANTAN TIMUR",3,110,135,245
https://kawalpemilu.org#65570,"HANDIL BAKTI, PALARAN, KOTA SAMARINDA, KALIMANTAN TIMUR",25,58,60,118
https://kawalpemilu.org#65633,"KARANG ANYAR, TARAKAN BARAT, KOTA TARAKAN, KALIMANTAN UTARA",45,116,35,151
https://kawalpemilu.org#65636,"KARANG BALIK, TARAKAN BARAT, KOTA TARAKAN, KALIMANTAN UTARA",1,150,75,225
https://kawalpemilu.org#64665,"LEPAK ARU, PESO, BULUNGAN, KALIMANTAN UTARA",1,217,19,236
https://kawalpemilu.org#24998,"KUDAI, SUNGAILIAT, BANGKA, KEPULAUAN BANGKA BELITUNG",14,154,5,159
https://kawalpemilu.org#25006,"BUKIT KETOK, BELINYU, BANGKA, KEPULAUAN BANGKA BELITUNG",5,144,61,205
https://kawalpemilu.org#25350,"BURONG MANDI, DAMAR, BELITUNG TIMUR, KEPULAUAN BANGKA BELITUNG",3,188,19,207
https://kawalpemilu.org#25125,"SERDANG, TOBOALI, BANGKA SELATAN, KEPULAUAN BANGKA BELITUNG",9,174,28,202
https://kawalpemilu.org#25109,"TANJUNG BINGA, SIJUK, BELITUNG, KEPULAUAN BANGKA BELITUNG",9,227,26,253
https://kawalpemilu.org#25770,"BATU BESAR, NONGSA, KOTA BATAM, KEPULAUAN RIAU",30,96,110,206
https://kawalpemilu.org#25513,"TOAPAYA ASRI, TOAPAYA, BINTAN, KEPULAUAN RIAU",9,114,118,232
https://kawalpemilu.org#25421,"SENGGARANG, TANJUNG PINANG KOTA, KOTA TANJUNGPINANG, KEPULAUAN RIAU",4,179,4,183
https://kawalpemilu.org#25554,"SUNGAILAKAM TIMUR, KARIMUN, KARIMUN, KEPULAUAN RIAU",29,84,110,194
https://kawalpemilu.org#25688,"KOTE, SINGKEP PESISIR, LINGGA, KEPULAUAN RIAU",1,70,56,126
https://kawalpemilu.org#84861,"SUNGAILAKAM BARAT, KARIMUN, KARIMUN, KEPULAUAN RIAU",23,69,53,122
https://kawalpemilu.org#25812,"TEMBESI, SAGULUNG, KOTA BATAM, KEPULAUAN RIAU",51,73,151,224
https://kawalpemilu.org#22934,"PUTRA BUYUT, GUNUNG SUGIH, LAMPUNG TENGAH, LAMPUNG",3,117,98,215
https://kawalpemilu.org#23822,"RINGIN SARI, BANJAR MARGO, TULANG BAWANG, LAMPUNG",9,136,49,185
https://kawalpemilu.org#24245,"MUMBANG JAYA, JABUNG, LAMPUNG TIMUR, LAMPUNG",3,108,69,177
https://kawalpemilu.org#23742,"MENGGALA KOTA, MENGGALA, TULANG BAWANG, LAMPUNG",9,20,117,137
https://kawalpemilu.org#22607,"HAJIMENA, NATAR, LAMPUNG SELATAN, LAMPUNG",28,50,107,157
https://kawalpemilu.org#23050,"BUMI RATU, BUMI RATU NUBAN, LAMPUNG TENGAH, LAMPUNG",2,16,119,135
https://kawalpemilu.org#24938,"SIDODADI, TELUK PANDAN, PESAWARAN, LAMPUNG",3,96,77,173
https://kawalpemilu.org#23138,"SENDANG RETNO, SENDANG AGUNG, LAMPUNG TENGAH, LAMPUNG",5,75,109,184
https://kawalpemilu.org#24397,"SRIBHAWONO, BANDAR SRIBHAWONO, LAMPUNG TIMUR, LAMPUNG",27,126,60,186
https://kawalpemilu.org#24799,"RAJABASA RAYA, RAJABASA, KOTA BANDAR LAMPUNG, LAMPUNG",10,68,118,186
https://kawalpemilu.org#22543,"GUNUNG KATUN MALAI, TULANG BAWANG UDIK, TULANG BAWANG BARAT, LAMPUNG",1,39,128,167
https://kawalpemilu.org#23519,"SIMPANGSARI, SUMBER JAYA, LAMPUNG BARAT, LAMPUNG",5,162,40,202
https://kawalpemilu.org#24802,"TANJUNG SENANG, TANJUNG SENANG, KOTA BANDAR LAMPUNG, LAMPUNG",9,67,102,169
https://kawalpemilu.org#24374,"PURWO KENCONO, SEKAMPUNG UDIK, LAMPUNG TIMUR, LAMPUNG",15,226,3,229
https://kawalpemilu.org#24228,"MARGA SARI, LABUHAN MARINGGAI, LAMPUNG TIMUR, LAMPUNG",17,187,64,251
https://kawalpemilu.org#24370,"SIDOREJO, SEKAMPUNG UDIK, LAMPUNG TIMUR, LAMPUNG",15,168,32,200
https://kawalpemilu.org#23409,"PAMPANG TANGGUK JAYA, SUNGKAI TENGAH, LAMPUNG UTARA, LAMPUNG",3,93,93,186
https://kawalpemilu.org#23350,"KEBUN DALAM, ABUNG TINGGI, LAMPUNG UTARA, LAMPUNG",6,48,94,142
https://kawalpemilu.org#23336,"SUBIK, ABUNG TENGAH, LAMPUNG UTARA, LAMPUNG",3,96,33,129
https://kawalpemilu.org#24423,"PELINDUNG JAYA, GUNUNG PELINDUNG, LAMPUNG TIMUR, LAMPUNG",11,109,32,141
https://kawalpemilu.org#22335,"PRINGSEWU TIMUR, PRINGSEWU, PRINGSEWU, LAMPUNG",16,154,33,187
https://kawalpemilu.org#24912,"PEKONDOH GEDUNG, WAY LIMA, PESAWARAN, LAMPUNG",3,117,131,248
https://kawalpemilu.org#92001,"PANARAGAN JAYA, TULANG BAWANG TENGAH, TULANG BAWANG BARAT, LAMPUNG",5,82,139,221
https://kawalpemilu.org#24842,"IRING MULYO, METRO TIMUR, KOTA METRO, LAMPUNG",25,161,74,235
https://kawalpemilu.org#23865,"MAKARTITAMA, GEDUNG AJI BARU, TULANG BAWANG, LAMPUNG",1,163,86,249
https://kawalpemilu.org#23544,"PADANG TAMBAK, WAY TENONG, LAMPUNG BARAT, LAMPUNG",11,85,63,148
https://kawalpemilu.org#22965,"YUKUM JAYA, TERBANGGI BESAR, LAMPUNG TENGAH, LAMPUNG",46,81,88,169
https://kawalpemilu.org#23021,"BANJAR AGUNG, SEPUTIH MATARAM, LAMPUNG TENGAH, LAMPUNG",13,199,28,227
https://kawalpemilu.org#23373,"KARANG REJO II, MUARA SUNGKAI, LAMPUNG UTARA, LAMPUNG",4,0,0,0
https://kawalpemilu.org#23087,"TERBANGGI MULYA, BANDAR MATARAM, LAMPUNG TENGAH, LAMPUNG",2,168,59,227
https://kawalpemilu.org#22990,"REKSO BINANGUN, RUMBIA, LAMPUNG TENGAH, LAMPUNG",12,169,74,243
https://kawalpemilu.org#22533,"MULYA KENCANA, TULANG BAWANG TENGAH, TULANG BAWANG BARAT, LAMPUNG",15,202,46,248
https://kawalpemilu.org#24592,"TANJUNG SERUPA, PAKUAN RATU, WAY KANAN, LAMPUNG",7,165,41,206
https://kawalpemilu.org#24600,"SERUPA INDAH, PAKUAN RATU, WAY KANAN, LAMPUNG",5,173,42,215
https://kawalpemilu.org#87246,"KOTA JAWA, NEGARA BATIN, WAY KANAN, LAMPUNG",1,131,20,151
https://kawalpemilu.org#-990684,"Pretoria, Pretoria, Afrika Selatan, Luar Negeri",1001,27,2,29
https://kawalpemilu.org#-990784,"Singapura, Singapura, Singapura, Luar Negeri",26,1011,122,1133
https://kawalpemilu.org#-991074,"Jeddah, Jeddah, Arab Saudi, Luar Negeri",2004,159,784,943
https://kawalpemilu.org#-990644,"Paris, Paris, Perancis, Luar Negeri",3,237,52,289
https://kawalpemilu.org#77961,"BATU RAJA, WASILE, HALMAHERA TIMUR, MALUKU UTARA",4,72,105,177
https://kawalpemilu.org#77175,"TEDENG, JAILOLO, HALMAHERA BARAT, MALUKU UTARA",6,177,6,183
https://kawalpemilu.org#77443,"GISIK, LOLODA UTARA, HALMAHERA UTARA, MALUKU UTARA",1,116,15,131
https://kawalpemilu.org#77472,"KALI UPA, TOBELO TENGAH, HALMAHERA UTARA, MALUKU UTARA",2,195,7,202
https://kawalpemilu.org#78083,"SANGADJI, KOTA TERNATE UTARA, KOTA TERNATE, MALUKU UTARA",7,62,142,204
https://kawalpemilu.org#77000,"KUDAMATI, NUSANIWE, KOTA AMBON, MALUKU",16,193,6,199
https://kawalpemilu.org#76465,"LARIKE, LEIHITU BARAT, MALUKU TENGAH, MALUKU",3,23,104,127
https://kawalpemilu.org#76421,"SEITH, LEIHITU, MALUKU TENGAH, MALUKU",11,42,103,145
https://kawalpemilu.org#76496,"WAUR, KEI BESAR, MALUKU TENGGARA, MALUKU",4,196,38,234
https://kawalpemilu.org#77023,"BATU MERAH, SIRIMAU, KOTA AMBON, MALUKU",100,208,25,233
https://kawalpemilu.org#76812,"LUHU, HUAMUAL, SERAM BAGIAN BARAT, MALUKU",5,59,235,294
https://kawalpemilu.org#76697,"NAMSINA, WAPLAU, BURU, MALUKU",3,92,107,199
https://kawalpemilu.org#54213,"SEPAKEK, PRINGGARATA, LOMBOK TENGAH, NUSA TENGGARA BARAT",3,53,69,122
https://kawalpemilu.org#54025,"GAPUK, GERUNG, LOMBOK BARAT, NUSA TENGGARA BARAT",6,13,147,160
https://kawalpemilu.org#84995,"TAMAN AYU, GERUNG, LOMBOK BARAT, NUSA TENGGARA BARAT",20,67,168,235
https://kawalpemilu.org#85044,"PRINGGABAYA UTARA, PRINGGABAYA, LOMBOK TIMUR, NUSA TENGGARA BARAT",6,120,114,234
https://kawalpemilu.org#54176,"PRABU, PUJUT, LOMBOK TENGAH, NUSA TENGGARA BARAT",10,128,82,210
https://kawalpemilu.org#54712,"NGALI, BELO, BIMA, NUSA TENGGARA BARAT",12,3,193,196
https://kawalpemilu.org#54282,"SIKUR, SIKUR, LOMBOK TIMUR, NUSA TENGGARA BARAT",13,62,164,226
https://kawalpemilu.org#54676,"TOLOUWI, MONTA, BIMA, NUSA TENGGARA BARAT",10,29,161,190
https://kawalpemilu.org#85108,"MONTONG BETER, SAKRA BARAT, LOMBOK TIMUR, NUSA TENGGARA BARAT",13,64,113,177
https://kawalpemilu.org#54110,"LABUAN TERENG, LEMBAR, LOMBOK BARAT, NUSA TENGGARA BARAT",11,69,92,161
https://kawalpemilu.org#54708,"PENAPALI, WOHA, BIMA, NUSA TENGGARA BARAT",2,13,169,182
https://kawalpemilu.org#55031,"TEGAL MAJA, TANJUNG, LOMBOK UTARA, NUSA TENGGARA BARAT",7,107,20,127
https://kawalpemilu.org#54512,"LABUHAN BADAS, LABUHAN BADAS, SUMBAWA, NUSA TENGGARA BARAT",5,128,47,175
https://kawalpemilu.org#54412,"KALIMANGO, ALAS, SUMBAWA, NUSA TENGGARA BARAT",12,69,105,174
https://kawalpemilu.org#54655,"SUKA DAMAI, MANGGELEWA, DOMPU, NUSA TENGGARA BARAT",2,74,157,231
https://kawalpemilu.org#85083,"BINTANG RINJANI, SURALAGA, LOMBOK TIMUR, NUSA TENGGARA BARAT",1,71,53,124
https://kawalpemilu.org#54976,"BABAKAN, SANDUBAYA, KOTA MATARAM, NUSA TENGGARA BARAT",12,51,159,210
https://kawalpemilu.org#54880,"KELANIR, SETELUK, SUMBAWA BARAT, NUSA TENGGARA BARAT",5,140,41,181
https://kawalpemilu.org#54792,"DUMU, LANGGUDU, BIMA, NUSA TENGGARA BARAT",3,21,61,82
https://kawalpemilu.org#54687,"BONTOKAPE, BOLO, BIMA, NUSA TENGGARA BARAT",1,27,182,209
https://kawalpemilu.org#55587,"NAUKAE, KUATNANA, TIMOR TENGAH SELATAN, NUSA TENGGARA TIMUR",2,183,10,193
https://kawalpemilu.org#57203,"BILLA, TABUNDUNG, SUMBA TIMUR, NUSA TENGGARA TIMUR",4,132,10,142
https://kawalpemilu.org#55212,"FATUNAUS, AMFOANG UTARA, KUPANG, NUSA TENGGARA TIMUR",5,90,8,98
https://kawalpemilu.org#58053,"PENKASE OELETA, ALAK, KOTA KUPANG, NUSA TENGGARA TIMUR",15,141,79,220
https://kawalpemilu.org#56526,"WULIWUTIK, NITA, SIKKA, NUSA TENGGARA TIMUR",4,137,3,140
https://kawalpemilu.org#57635,"SEDEOEN, ROTE BARAT, ROTE NDAO, NUSA TENGGARA TIMUR",1,247,7,254
https://kawalpemilu.org#927912,"GOLO NDEWENG, LEMBOR, MANGGARAI BARAT, NUSA TENGGARA TIMUR",1,188,12,200
https://kawalpemilu.org#56054,"KALABAHI KOTA, TELUK MUTIARA, ALOR, NUSA TENGGARA TIMUR",5,58,70,128
https://kawalpemilu.org#55154,"NOELBAKI, KUPANG TENGAH, KUPANG, NUSA TENGGARA TIMUR",3,166,1,167
https://kawalpemilu.org#56791,"LISEDETU, WOLOWARU, ENDE, NUSA TENGGARA TIMUR",3,162,4,166
https://kawalpemilu.org#57705,"SURUNUMBENG, LEMBOR SELATAN, MANGGARAI BARAT, NUSA TENGGARA TIMUR",2,159,29,188
https://kawalpemilu.org#58190,"SISIR, ELAR, MANGGARAI TIMUR, NUSA TENGGARA TIMUR",2,168,17,185
https://kawalpemilu.org#55994,"UMALAWAIN, WELIMAN, MALAKA, NUSA TENGGARA TIMUR",3,153,2,155
https://kawalpemilu.org#57810,"NATAUTE, NANGARORO, NAGEKEO, NUSA TENGGARA TIMUR",2,135,2,137
https://kawalpemilu.org#58066,"OESAPA, KELAPA LIMA, KOTA KUPANG, NUSA TENGGARA TIMUR",71,198,20,218
https://kawalpemilu.org#56117,"KELAISI TENGAH, ALOR SELATAN, ALOR, NUSA TENGGARA TIMUR",3,102,4,106
https://kawalpemilu.org#55142,"OETETA, SULAMU, KUPANG, NUSA TENGGARA TIMUR",1,235,4,239
https://kawalpemilu.org#56290,"WATOTUTU, ILE MANDIRI, FLORES TIMUR, NUSA TENGGARA TIMUR",2,230,5,235
https://kawalpemilu.org#56304,"KOLAKA, TANJUNG BUNGA, FLORES TIMUR, NUSA TENGGARA TIMUR",1,157,5,162
https://kawalpemilu.org#82133,"MARIYAI, MARIAT, SORONG, PAPUA BARAT",7,55,75,130
https://kawalpemilu.org#927679,"WOMAN, AYAMARU JAYA, MAYBRAT, PAPUA BARAT",1,136,0,136
https://kawalpemilu.org#81953,"SEMBARO, AYAMARU SELATAN, MAYBRAT, PAPUA BARAT",1,228,0,228
https://kawalpemilu.org#83308,"KLAWASI, SORONG BARAT, KOTA SORONG, PAPUA BARAT",12,92,115,155
https://kawalpemilu.org#927740,"FASE, MARE SELATAN, MAYBRAT, PAPUA BARAT",1,102,0,102
https://kawalpemilu.org#81833,"HUSMO, KWIKMA, YAHUKIMO, PAPUA",2,276,0,276
https://kawalpemilu.org#81807,"KABIANGGAMA, KABIANGGAMA, YAHUKIMO, PAPUA",5,287,0,287
https://kawalpemilu.org#80146,"SENTANI KOTA, SENTANI, JAYAPURA, PAPUA",6,65,130,195
https://kawalpemilu.org#81073,"KUALA KENCANA, KUALA KENCANA, MIMIKA, PAPUA",7,200,89,289
https://kawalpemilu.org#79484,"KELILA, KELILA, MAMBERAMO TENGAH, PAPUA",2,231,0,231
https://kawalpemilu.org#88575,"UJUNGKIA, KI, BOVEN DIGOEL, PAPUA",2,83,3,86
https://kawalpemilu.org#79480,"WIYUGOBAK, KOBAGMA, MAMBERAMO TENGAH, PAPUA",1,300,0,300
https://kawalpemilu.org#79423,"GURABESI, JAYAPURA UTARA, KOTA JAYAPURA, PAPUA",29,101,67,168
https://kawalpemilu.org#80148,"DOBONSOLO, SENTANI, JAYAPURA, PAPUA",7,175,110,285
https://kawalpemilu.org#79835,"SERINGGU JAYA, MERAUKE, MERAUKE, PAPUA",3,101,58,159
https://kawalpemilu.org#79983,"IROMORO, TABONJI, MERAUKE, PAPUA",1,119,0,119
https://kawalpemilu.org#929789,"GILO, MELAGI, LANNY JAYA, PAPUA",3,273,0,273
https://kawalpemilu.org#79880,"MARGA MULYA, SEMANGGA, MERAUKE, PAPUA",7,72,111,183
https://kawalpemilu.org#929627,"UWOME, KUYAWAGE, LANNY JAYA, PAPUA",2,152,0,152
https://kawalpemilu.org#79443,"YOBE, ABEPURA, KOTA JAYAPURA, PAPUA",15,52,72,124
https://kawalpemilu.org#79008,"ASIKI I, JAIR, BOVEN DIGOEL, PAPUA",19,72,53,125
https://kawalpemilu.org#80188,"SEKORI, KEMTUK, JAYAPURA, PAPUA",1,145,7,152
https://kawalpemilu.org#79008,"ASIKI I, JAIR, BOVEN DIGOEL, PAPUA",30,66,7,73
https://kawalpemilu.org#86794,"JUTA, GELOK BEAM, LANNY JAYA, PAPUA",2,210,0,210
https://kawalpemilu.org#90487,"SEI MERANTI DARUSSALAM, PUJUD, ROKAN HILIR, RIAU",4,94,46,140
https://kawalpemilu.org#15824,"TANGKERANG  BARAT, MARPOYAN DAMAI, KOTA PEKANBARU, RIAU",37,83,186,269
https://kawalpemilu.org#15515,"KANDIS, KANDIS, SIAK, RIAU",10,158,6,164
https://kawalpemilu.org#14679,"AIR JAMBAN, MANDAU, BENGKALIS, RIAU",128,105,16,121
https://kawalpemilu.org#15837,"LABUH BARU BARAT, PAYUNG SEKAKI, KOTA PEKANBARU, RIAU",41,81,67,148
https://kawalpemilu.org#15812,"PALAS, RUMBAI, KOTA PEKANBARU, RIAU",2,66,135,201
https://kawalpemilu.org#15845,"TEBING TINGGI OKURA, RUMBAI PESISIR, KOTA PEKANBARU, RIAU",6,21,135,156
https://kawalpemilu.org#928984,"SUNGAIMERANTI, PINGGIR, BENGKALIS, RIAU",1,70,85,155
https://kawalpemilu.org#15512,"TELAGA SAM-SAM, KANDIS, SIAK, RIAU",6,29,185,214
https://kawalpemilu.org#14362,"MUARA UWAI, BANGKINANG, KAMPAR, RIAU",6,10,180,190
https://kawalpemilu.org#90465,"BAGAN BATU KOTA, BAGAN SINEMBAH, ROKAN HILIR, RIAU",18,223,20,243
https://kawalpemilu.org#14641,"SENGGORO, BENGKALIS, BENGKALIS, RIAU",4,52,222,274
https://kawalpemilu.org#14888,"Rotan Semelur, Pelangiran, INDRAGIRI HILIR, RIAU",10,83,56,139
https://kawalpemilu.org#14971,"PANGKALAN KERINCI TIMUR, PANGKALAN KERINCI, PELALAWAN, RIAU",57,36,128,164
https://kawalpemilu.org#15150,"KOTA INTAN, KUNTO DARUSSALAM, ROKAN HULU, RIAU",7,49,164,213
https://kawalpemilu.org#14379,"DELI MAKMUR, KAMPA, KAMPAR, RIAU",4,38,84,122
https://kawalpemilu.org#14309,"KARYA INDAH, TAPUNG, KAMPAR, RIAU",4,98,36,134
https://kawalpemilu.org#15878,"BASILAM BARU, SUNGAI SEMBILAN, KOTA DUMAI, RIAU",5,162,70,232
https://kawalpemilu.org#14712,"TITI AKAR, RUPAT UTARA, BENGKALIS, RIAU",2,106,39,145
https://kawalpemilu.org#14687,"TALANG MANDI, MANDAU, BENGKALIS, RIAU",27,40,182,222
https://kawalpemilu.org#14169,"LANGGINI, BANGKINANG KOTA, KAMPAR, RIAU",3,23,178,201
https://kawalpemilu.org#15691,"MARSAWA, SENTAJO RAYA, KUANTAN SINGINGI, RIAU",7,128,81,209
https://kawalpemilu.org#87639,"BONDE BONDE, TUBO SENDANA, MAJENE, SULAWESI BARAT",2,95,133,228
https://kawalpemilu.org#75916,"DARMA, POLEWALI, POLEWALI MANDAR, SULAWESI BARAT",6,102,144,246
https://kawalpemilu.org#75673,"TALIPUKKI, MAMBI, MAMASA, SULAWESI BARAT",1,60,117,177
https://kawalpemilu.org#75440,"GUNUNG SARI, PASANGKAYU, MAMUJU UTARA, SULAWESI BARAT",2,236,19,255
https://kawalpemilu.org#75912,"TAKATIDUNG, POLEWALI, POLEWALI MANDAR, SULAWESI BARAT",17,109,79,188
https://kawalpemilu.org#71957,"TIROMANDA, MAKALE SELATAN, TANA TORAJA, SULAWESI SELATAN",5,98,7,105
https://kawalpemilu.org#70044,"TAENG, PALLANGGA, GOWA, SULAWESI SELATAN",19,73,154,227
https://kawalpemilu.org#70713,"JENETAESA, SIMBANG, MAROS, SULAWESI SELATAN",9,43,129,172
https://kawalpemilu.org#70798,"TONASA, BALOCCI, PANGKAJENE DAN KEPULAUAN, SULAWESI SELATAN",7,87,122,209
https://kawalpemilu.org#70883,"LALOLANG, TANETE RILAU, BARRU, SULAWESI SELATAN",6,84,136,220
https://kawalpemilu.org#72509,"TAKKALALA, WARA SELATAN, KOTA PALOPO, SULAWESI SELATAN",15,88,129,217
