https://kawalpemilu.org#30495,"CIPICUNG, JATIGEDE, SUMEDANG, JAWA BARAT",7,173,39,212
https://kawalpemilu.org#26470,"SUKAMAHI, MEGAMENDUNG, BOGOR, JAWA BARAT",23,23,165,188
https://kawalpemilu.org#26224,"MAMPIR, CILEUNGSI, BOGOR, JAWA BARAT",34,58,192,250
https://kawalpemilu.org#32535,"SUKAMAJU BARU, TAPOS, KOTA DEPOK, JAWA BARAT",108,111,87,198
https://kawalpemilu.org#32509,"KUKUSAN, BEJI, KOTA DEPOK, JAWA BARAT",40,91,73,164
https://kawalpemilu.org#31767,"PASIRGOMBONG, CIKARANG UTARA, BEKASI, JAWA BARAT",17,78,131,209
https://kawalpemilu.org#31557,"CIWARINGIN, LEMAHABANG, KARAWANG, JAWA BARAT",1,123,131,254
https://kawalpemilu.org#31924,"PADAASIH, CISARUA, BANDUNG BARAT, JAWA BARAT",1,182,88,270
https://kawalpemilu.org#28285,"CIPICUNG, CULAMEGA, TASIKMALAYA, JAWA BARAT",15,12,152,164
https://kawalpemilu.org#32139,"CIMAHPAR, BOGOR UTARA, KOTA BOGOR, JAWA BARAT",22,64,151,215
https://kawalpemilu.org#29583,"CEMPAKA, PLUMBON, CIREBON, JAWA BARAT",16,135,73,208
https://kawalpemilu.org#32210,"MARGAHAYU UTARA, BABAKAN CIPARAY, KOTA BANDUNG, JAWA BARAT",13,80,110,190
https://kawalpemilu.org#32672,"LANGENSARI, LANGENSARI, KOTA BANJAR, JAWA BARAT",9,87,89,176
https://kawalpemilu.org#30792,"GANTAR, GANTAR, INDRAMAYU, JAWA BARAT",18,91,111,202
https://kawalpemilu.org#31702,"KEBALEN, BABELAN, BEKASI, JAWA BARAT",133,150,115,265
https://kawalpemilu.org#31404,"KALANGSARI, RENGASDENGKLOK, KARAWANG, JAWA BARAT",29,112,116,228
https://kawalpemilu.org#31266,"MARGASARI, PASAWAHAN, PURWAKARTA, JAWA BARAT",7,65,148,213
https://kawalpemilu.org#28142,"NEGLASARI, BL. LIMBANGAN, GARUT, JAWA BARAT",17,33,106,139
https://kawalpemilu.org#32515,"CIPAYUNG, CIPAYUNG, KOTA DEPOK, JAWA BARAT",17,0,0,0
https://kawalpemilu.org#31726,"SRIMUKTI, TAMBUN UTARA, BEKASI, JAWA BARAT",12,38,119,157
https://kawalpemilu.org#30793,"SITURAJA, GANTAR, INDRAMAYU, JAWA BARAT",29,48,148,196
https://kawalpemilu.org#31701,"BAHAGIA, BABELAN, BEKASI, JAWA BARAT",184,108,93,201
https://kawalpemilu.org#30876,"DANGDEUR, SUBANG, SUBANG, JAWA BARAT",31,111,73,184
https://kawalpemilu.org#26292,"KEDUNGWARINGIN, BOJONG GEDE, BOGOR, JAWA BARAT",48,49,124,173
https://kawalpemilu.org#26542,"CIBEUTEUNG UDIK, CISEENG, BOGOR, JAWA BARAT",9,54,188,242
https://kawalpemilu.org#26829,"WANASARI, SURADE, SUKABUMI, JAWA BARAT",3,24,156,180
https://kawalpemilu.org#27419,"MANDALAMEKAR, CIMENYAN, BANDUNG, JAWA BARAT",12,71,61,132
https://kawalpemilu.org#26388,"GOROWONG, PARUNG PANJANG, BOGOR, JAWA BARAT",15,89,111,200
https://kawalpemilu.org#28101,"PASIRLANGU, PAKENJENG, GARUT, JAWA BARAT",3,15,144,159
https://kawalpemilu.org#26834,"PASIR IPIS, SURADE, SUKABUMI, JAWA BARAT",12,45,138,183
https://kawalpemilu.org#30766,"ANJATAN, ANJATAN, INDRAMAYU, JAWA BARAT",8,153,64,217
https://kawalpemilu.org#26777,"KALAPANUNGGAL, KALAPA NUNGGAL, SUKABUMI, JAWA BARAT",9,10,113,123
https://kawalpemilu.org#29458,"CURUG, SUSUKAN LEBAK, CIREBON, JAWA BARAT",8,153,29,182
https://kawalpemilu.org#28027,"MEKARWANGI, CIHURIP, GARUT, JAWA BARAT",13,19,173,192
https://kawalpemilu.org#31488,"MEKARSARI, JATISARI, KARAWANG, JAWA BARAT",12,108,130,238
https://kawalpemilu.org#30394,"BAGINDA, SUMEDANG SELATAN, SUMEDANG, JAWA BARAT",4,60,192,252
https://kawalpemilu.org#31777,"KARANGANYAR, KARANG BAHAGIA, BEKASI, JAWA BARAT",16,61,181,242
https://kawalpemilu.org#30891,"CIHAMBULU, PABUARAN, SUBANG, JAWA BARAT",11,83,128,211
https://kawalpemilu.org#26312,"CIHIDEUNGUDIK, CIAMPEA, BOGOR, JAWA BARAT",44,87,99,186
https://kawalpemilu.org#32284,"SUKAPADA, CIBEUNYING KIDUL, KOTA BANDUNG, JAWA BARAT",29,89,110,199
https://kawalpemilu.org#31844,"JAYASAKTI, MUARAGEMBONG, BEKASI, JAWA BARAT",9,98,110,208
https://kawalpemilu.org#30945,"RANCADAKA, PUSAKANAGARA, SUBANG, JAWA BARAT",14,166,18,184
https://kawalpemilu.org#27758,"PANANJUNG, TAROGONG KALER, GARUT, JAWA BARAT",10,26,154,180
https://kawalpemilu.org#32436,"PEJUANG, MEDAN SATRIA, KOTA BEKASI, JAWA BARAT",58,70,84,154
https://kawalpemilu.org#32267,"KEBONWARU, BATUNUNGGAL, KOTA BANDUNG, JAWA BARAT",29,71,126,197
https://kawalpemilu.org#27880,"SUKAMAJU, KERSAMANAH, GARUT, JAWA BARAT",15,61,85,146
https://kawalpemilu.org#26359,"GOBANG, RUMPIN, BOGOR, JAWA BARAT",7,46,114,160
https://kawalpemilu.org#27029,"SAWAHGEDE, CIANJUR, CIANJUR, JAWA BARAT",19,27,96,123
https://kawalpemilu.org#27911,"SUKASONO, SUKAWENING, GARUT, JAWA BARAT",20,63,121,184
https://kawalpemilu.org#26760,"PURWASARI, CICURUG, SUKABUMI, JAWA BARAT",15,85,132,217
https://kawalpemilu.org#26453,"CIBEUREUM, CISARUA, BOGOR, JAWA BARAT",18,34,126,160
https://kawalpemilu.org#26163,"CICADAS, GUNUNG PUTRI, BOGOR, JAWA BARAT",38,42,126,168
https://kawalpemilu.org#28166,"CITANGTU, PANGATIKAN, GARUT, JAWA BARAT",8,48,121,169
https://kawalpemilu.org#30968,"MUARA, BLANAKAN, SUBANG, JAWA BARAT",15,138,63,201
https://kawalpemilu.org#31748,"CIBUNTU, CIBITUNG, BEKASI, JAWA BARAT",73,50,140,190
https://kawalpemilu.org#29761,"PABUARAN LOR, PABUARAN, CIREBON, JAWA BARAT",23,178,35,213
https://kawalpemilu.org#28195,"CIANDUM, CIPATUJAH, TASIKMALAYA, JAWA BARAT",13,66,67,133
https://kawalpemilu.org#26144,"PONDOK RAJEG, CIBINONG, BOGOR, JAWA BARAT",42,88,142,230
https://kawalpemilu.org#27934,"BANJARSARI, BAYONGBONG, GARUT, JAWA BARAT",4,25,164,189
https://kawalpemilu.org#27852,"KARANGTENGAH, KADUNGORA, GARUT, JAWA BARAT",16,29,203,232
https://kawalpemilu.org#27221,"GIRIMUKTI, CAMPAKA, CIANJUR, JAWA BARAT",5,15,99,114
https://kawalpemilu.org#32496,"MERUYUNG, LIMO, KOTA DEPOK, JAWA BARAT",43,109,63,172
https://kawalpemilu.org#31891,"KARANGINDAH, BOJONGMANGU, BEKASI, JAWA BARAT",2,65,189,254
https://kawalpemilu.org#32641,"SUKAMENAK, PURBARATU, KOTA TASIKMALAYA, JAWA BARAT",14,89,149,238
https://kawalpemilu.org#27275,"PANANGGAPAN, CIBINONG, CIANJUR, JAWA BARAT",12,74,129,203
https://kawalpemilu.org#27360,"CIPANAS, CIPANAS, CIANJUR, JAWA BARAT",28,45,163,208
https://kawalpemilu.org#31422,"TELUKBANGO, BATUJAYA, KARAWANG, JAWA BARAT",15,68,58,124
https://kawalpemilu.org#28251,"CISEMPUR, CIBALONG, TASIKMALAYA, JAWA BARAT",12,59,100,159
https://kawalpemilu.org#28020,"PANCASURA, SINGAJAYA, GARUT, JAWA BARAT",14,35,163,198
https://kawalpemilu.org#28881,"PANGKALAN, LANGKAPLANCAR, PANGANDARAN, JAWA BARAT",3,98,111,209
https://kawalpemilu.org#31493,"JATIBARU, JATISARI, KARAWANG, JAWA BARAT",10,109,125,234
https://kawalpemilu.org#31873,"SUKARAGAM, SERANG BARU, BEKASI, JAWA BARAT",55,93,157,250
https://kawalpemilu.org#32469,"JATIWARNA, PONDOK MELATI, KOTA BEKASI, JAWA BARAT",3,77,61,138
https://kawalpemilu.org#26263,"WARUJAYA, PARUNG, BOGOR, JAWA BARAT",13,79,114,193
https://kawalpemilu.org#30394,"BAGINDA, SUMEDANG SELATAN, SUMEDANG, JAWA BARAT",8,73,173,246
https://kawalpemilu.org#29289,"PATALA, CILEBAK, KUNINGAN, JAWA BARAT",7,114,33,147
https://kawalpemilu.org#31802,"SUMBERURIP, PEBAYURAN, BEKASI, JAWA BARAT",13,106,102,208
https://kawalpemilu.org#34266,"WONOHARJO, ROWOKELE, KEBUMEN, JAWA TENGAH",16,162,21,183
https://kawalpemilu.org#34895,"SUKOWUWUH, BENER, PURWOREJO, JAWA TENGAH",9,118,8,126
https://kawalpemilu.org#39769,"GEBANGAN, PAGERUYUNG, KENDAL, JAWA TENGAH",1,173,25,198
https://kawalpemilu.org#36807,"TLOBO, JATIYOSO, KARANGANYAR, JAWA TENGAH",11,85,6,91
https://kawalpemilu.org#37412,"PULOREJO, PURWODADI, GROBOGAN, JAWA TENGAH",5,174,34,208
https://kawalpemilu.org#33316,"TELUK, PURWOKERTO SELATAN, BANYUMAS, JAWA TENGAH",37,211,58,269
https://kawalpemilu.org#35527,"KEBONAGUNG, TEGALREJO, MAGELANG, JAWA TENGAH",3,131,9,140
https://kawalpemilu.org#34647,"BANDUNG, KUTOARJO, PURWOREJO, JAWA TENGAH",3,120,59,179
https://kawalpemilu.org#40704,"PURANA, BANTARBOLANG, PEMALANG, JAWA TENGAH",7,139,12,151
https://kawalpemilu.org#40190,"SIDOMULYO, LIMPUNG, BATANG, JAWA TENGAH",6,103,24,127
https://kawalpemilu.org#38805,"SUWAWAL, MLONGGO, JEPARA, JAWA TENGAH",14,157,22,179
https://kawalpemilu.org#33692,"SEMAMPIR, BANJARNEGARA, BANJARNEGARA, JAWA TENGAH",6,57,78,135
https://kawalpemilu.org#39224,"KENTENG, SUSUKAN, SEMARANG, JAWA TENGAH",6,164,36,200
https://kawalpemilu.org#34133,"KEMANGGUAN, ALIAN, KEBUMEN, JAWA TENGAH",7,155,20,175
https://kawalpemilu.org#84898,"SIKAMPUH, KROYA, CILACAP, JAWA TENGAH",15,144,82,226
https://kawalpemilu.org#33378,"BUKATEJA, BUKATEJA, PURBALINGGA, JAWA TENGAH",5,146,65,211
https://kawalpemilu.org#36989,"KALIMACAN, KALIJAMBE, SRAGEN, JAWA TENGAH",8,154,87,241
https://kawalpemilu.org#41379,"RANDUSARI, LOSARI, BREBES, JAWA TENGAH",18,140,50,190
https://kawalpemilu.org#36530,"SUKOHARJO, TIRTOMOYO, WONOGIRI, JAWA TENGAH",5,150,7,157
https://kawalpemilu.org#38620,"NGEMBAL KULON, JATI, KUDUS, JAWA TENGAH",8,103,88,191
https://kawalpemilu.org#34099,"SIDOGEDE, PREMBUN, KEBUMEN, JAWA TENGAH",1,153,25,178
https://kawalpemilu.org#33028,"TAMBAKNEGARA, RAWALO, BANYUMAS, JAWA TENGAH",19,135,36,171
https://kawalpemilu.org#40430,"NYAMOK, KAJEN, PEKALONGAN, JAWA TENGAH",3,139,76,215
https://kawalpemilu.org#40342,"SAWANGAN, PANINGGARAN, PEKALONGAN, JAWA TENGAH",7,154,5,159
https://kawalpemilu.org#34917,"NGALIAN, WADASLINTANG, WONOSOBO, JAWA TENGAH",19,123,6,129
https://kawalpemilu.org#87480,"SIDAMUKTI, PATIMUAN, CILACAP, JAWA TENGAH",24,164,27,191
https://kawalpemilu.org#35379,"BANJARAGUNG, KAJORAN, MAGELANG, JAWA TENGAH",3,167,29,196
https://kawalpemilu.org#41649,"TLOGOSARI KULON, PEDURUNGAN, KOTA SEMARANG, JAWA TENGAH",76,175,56,231
https://kawalpemilu.org#35541,"CANDIRETNO, SECANG, MAGELANG, JAWA TENGAH",4,113,100,213
https://kawalpemilu.org#34646,"SEMAWUNG DALEMAN, KUTOARJO, PURWOREJO, JAWA TENGAH",8,104,33,137
https://kawalpemilu.org#41583,"MANGUNSARI, SIDOMUKTI, KOTA SALATIGA, JAWA TENGAH",1,211,46,257
https://kawalpemilu.org#35828,"KEMUSU, KEMUSU, BOYOLALI, JAWA TENGAH",2,126,26,182
https://kawalpemilu.org#33880,"KARANGANYAR, KALIBENING, BANJARNEGARA, JAWA TENGAH",3,135,27,162
https://kawalpemilu.org#41527,"BALUWARTI, PASAR KLIWON, KOTA SURAKARTA, JAWA TENGAH",8,152,42,194
https://kawalpemilu.org#37301,"RANDUREJO, PULOKULON, GROBOGAN, JAWA TENGAH",14,141,3,144
https://kawalpemilu.org#34617,"SUCENJURU TENGAH, BAYAN, PURWOREJO, JAWA TENGAH",8,104,67,171
https://kawalpemilu.org#37094,"SINE, SRAGEN, SRAGEN, JAWA TENGAH",3,80,95,175
https://kawalpemilu.org#38988,"TIMBULSLOKO, SAYUNG, DEMAK, JAWA TENGAH",2,184,27,211
https://kawalpemilu.org#41325,"PEMARON, BREBES, BREBES, JAWA TENGAH",13,121,66,187
https://kawalpemilu.org#35214,"BOROBUDUR, BOROBUDUR, MAGELANG, JAWA TENGAH",26,128,96,224
https://kawalpemilu.org#41397,"TANJUNG, TANJUNG, BREBES, JAWA TENGAH",14,155,52,207
https://kawalpemilu.org#40136,"JLAMPRANG, BAWANG, BATANG, JAWA TENGAH",3,149,19,168
https://kawalpemilu.org#40392,"KUTOSARI, DORO, PEKALONGAN, JAWA TENGAH",6,181,32,213
https://kawalpemilu.org#40279,"SIJONO, WARUNGASEM, BATANG, JAWA TENGAH",4,0,0,0
https://kawalpemilu.org#41105,"KESAMIRAN, TARUB, TEGAL, JAWA TENGAH",1,107,75,182
https://kawalpemilu.org#41649,"TLOGOSARI KULON, PEDURUNGAN, KOTA SEMARANG, JAWA TENGAH",52,190,57,247
https://kawalpemilu.org#39336,"LEMAHIRENG, BAWEN, SEMARANG, JAWA TENGAH",23,183,7,190
https://kawalpemilu.org#40794,"KLAREYAN, PETARUKAN, PEMALANG, JAWA TENGAH",21,0,0,0
https://kawalpemilu.org#36820,"KADIPIRO, JUMAPOLO, KARANGANYAR, JAWA TENGAH",8,131,112,243
https://kawalpemilu.org#37535,"PILANG, RANDUBLATUNG, BLORA, JAWA TENGAH",10,184,13,197
https://kawalpemilu.org#40010,"SENDANGDAWUNG, KANGKUNG, KENDAL, JAWA TENGAH",2,151,14,165
https://kawalpemilu.org#41311,"GANDASULI, BREBES, BREBES, JAWA TENGAH",12,131,91,222
https://kawalpemilu.org#33663,"MAJALENGKA, BAWANG, BANJARNEGARA, JAWA TENGAH",10,112,33,145
https://kawalpemilu.org#33183,"CIBANGKONG, PEKUNCEN, BANYUMAS, JAWA TENGAH",2,167,19,186
https://kawalpemilu.org#35687,"TEGALREJO, SAWIT, BOYOLALI, JAWA TENGAH",8,209,10,219
https://kawalpemilu.org#41543,"MOJOSONGO, JEBRES, KOTA SURAKARTA, JAWA TENGAH",148,157,27,184
https://kawalpemilu.org#40491,"KETITANGKIDUL, BOJONG, PEKALONGAN, JAWA TENGAH",3,197,34,231
https://kawalpemilu.org#34085,"MANGUNRANAN, MIRIT, KEBUMEN, JAWA TENGAH",3,99,94,193
https://kawalpemilu.org#39150,"BUKO, WEDUNG, DEMAK, JAWA TENGAH",8,142,51,193
https://kawalpemilu.org#36807,"TLOBO, JATIYOSO, KARANGANYAR, JAWA TENGAH",13,69,4,73
https://kawalpemilu.org#41508,"SRIWEDARI, LAWEYAN, KOTA SURAKARTA, JAWA TENGAH",10,169,36,205
https://kawalpemilu.org#34569,"DOPLANG, PURWOREJO, PURWOREJO, JAWA TENGAH",5,114,65,179
https://kawalpemilu.org#38583,"SUNGGINGAN, KUDUS, KUDUS, JAWA TENGAH",7,111,66,177
https://kawalpemilu.org#37601,"BITING, SAMBONG, BLORA, JAWA TENGAH",8,145,62,207
https://kawalpemilu.org#36951,"SEWUREJO, MOJOGEDANG, KARANGANYAR, JAWA TENGAH",8,182,4,186
https://kawalpemilu.org#37371,"TEGALREJO, WIROSARI, GROBOGAN, JAWA TENGAH",29,175,8,183
https://kawalpemilu.org#35550,"PURWOSARI, SECANG, MAGELANG, JAWA TENGAH",9,84,41,125
https://kawalpemilu.org#41709,"PADANGSARI, BANYUMANIK, KOTA SEMARANG, JAWA TENGAH",13,146,64,210
https://kawalpemilu.org#39563,"WANUTENGAH, PARAKAN, TEMANGGUNG, JAWA TENGAH",7,128,54,182
https://kawalpemilu.org#32808,"BOJONG, KAWUNGANTEN, CILACAP, JAWA TENGAH",17,131,56,187
https://kawalpemilu.org#36770,"KARANGTENGAH, KARANGTENGAH, WONOGIRI, JAWA TENGAH",8,174,8,182
https://kawalpemilu.org#39738,"KEMIRIOMBO, GEMAWANG, TEMANGGUNG, JAWA TENGAH",5,175,19,194
https://kawalpemilu.org#41296,"KUPU, WANASARI, BREBES, JAWA TENGAH",6,139,39,178
https://kawalpemilu.org#41718,"NGIJO, GUNUNGPATI, KOTA SEMARANG, JAWA TENGAH",8,158,39,197
https://kawalpemilu.org#38446,"SUKOHARJO, WEDARIJAKSA, PATI, JAWA TENGAH",3,175,25,200
https://kawalpemilu.org#41765,"KALIPANCUR, NGALIYAN, KOTA SEMARANG, JAWA TENGAH",43,95,46,141
https://kawalpemilu.org#37258,"JIPANG, PENAWANGAN, GROBOGAN, JAWA TENGAH",2,86,17,103
https://kawalpemilu.org#40901,"BUNIWAH, BOJONG, TEGAL, JAWA TENGAH",6,170,50,220
https://kawalpemilu.org#38604,"KALIPUTU, KUDUS, KUDUS, JAWA TENGAH",11,115,55,170
https://kawalpemilu.org#37599,"POJOKWATU, SAMBONG, BLORA, JAWA TENGAH",6,114,72,186
https://kawalpemilu.org#41227,"KRETEK, PAGUYANGAN, BREBES, JAWA TENGAH",14,152,21,173
https://kawalpemilu.org#32995,"DERMAJI, LUMBIR, BANYUMAS, JAWA TENGAH",3,175,54,229
https://kawalpemilu.org#40741,"BANJARMULYA, PEMALANG, PEMALANG, JAWA TENGAH",6,176,31,207
https://kawalpemilu.org#34546,"KALIGONO, KALIGESING, PURWOREJO, JAWA TENGAH",4,120,21,141
https://kawalpemilu.org#34017,"BRECONG, BULUSPESANTREN, KEBUMEN, JAWA TENGAH",3,132,32,164
https://kawalpemilu.org#41150,"BANJARAGUNG, WARUREJA, TEGAL, JAWA TENGAH",10,134,77,211
https://kawalpemilu.org#36124,"BENTANGAN, WONOSARI, KLATEN, JAWA TENGAH",6,177,33,210
https://kawalpemilu.org#33649,"KARANGANYAR, PURWONEGORO, BANJARNEGARA, JAWA TENGAH",16,140,33,173
https://kawalpemilu.org#33770,"LUWUNG, RAKIT, BANJARNEGARA, JAWA TENGAH",3,110,91,201
https://kawalpemilu.org#32851,"SURUSUNDA, KARANGPUCUNG, CILACAP, JAWA TENGAH",22,77,67,144
https://kawalpemilu.org#38635,"WATES, UNDAAN, KUDUS, JAWA TENGAH",10,144,30,174
https://kawalpemilu.org#34265,"GIYANTI, ROWOKELE, KEBUMEN, JAWA TENGAH",3,139,25,164
https://kawalpemilu.org#40863,"DUKUH TENGAH, MARGASARI, TEGAL, JAWA TENGAH",9,117,47,164
https://kawalpemilu.org#36726,"TASIKHARGO, JATISRONO, WONOGIRI, JAWA TENGAH",4,178,10,188
https://kawalpemilu.org#39972,"SIJERUK, KENDAL, KENDAL, JAWA TENGAH",5,128,52,180
https://kawalpemilu.org#41543,"MOJOSONGO, JEBRES, KOTA SURAKARTA, JAWA TENGAH",46,166,25,191
https://kawalpemilu.org#41430,"WLAHAR, LARANGAN, BREBES, JAWA TENGAH",36,133,19,152
https://kawalpemilu.org#40336,"KRANDEGAN, PANINGGARAN, PEKALONGAN, JAWA TENGAH",3,131,40,171
https://kawalpemilu.org#41825,"KURIPAN KERTOHARJO, PEKALONGAN SELATAN, KOTA PEKALONGAN, JAWA TENGAH",13,221,23,244
https://kawalpemilu.org#39199,"SRUWEN, TENGARAN, SEMARANG, JAWA TENGAH",16,191,60,251
https://kawalpemilu.org#34620,"POGUNGREJO, BAYAN, PURWOREJO, JAWA TENGAH",4,112,21,133
https://kawalpemilu.org#35349,"TEMPUREJO, TEMPURAN, MAGELANG, JAWA TENGAH",26,110,45,155
https://kawalpemilu.org#33450,"MERI, KUTASARI, PURBALINGGA, JAWA TENGAH",1,132,35,167
https://kawalpemilu.org#34018,"BANJURPASAR, BULUSPESANTREN, KEBUMEN, JAWA TENGAH",11,90,38,128
https://kawalpemilu.org#33022,"GENTAWANGI, JATILAWANG, BANYUMAS, JAWA TENGAH",1,143,26,169
https://kawalpemilu.org#34890,"KETOSARI, BENER, PURWOREJO, JAWA TENGAH",7,110,23,133
https://kawalpemilu.org#33451,"KUTASARI, KUTASARI, PURBALINGGA, JAWA TENGAH",4,128,115,243
https://kawalpemilu.org#38207,"MINTORAHAYU, WINONG, PATI, JAWA TENGAH",5,127,12,139
https://kawalpemilu.org#40276,"LEBO, WARUNGASEM, BATANG, JAWA TENGAH",5,152,36,188
https://kawalpemilu.org#38472,"NGEMPLAK KIDUL, MARGOYOSO, PATI, JAWA TENGAH",5,190,28,218
https://kawalpemilu.org#40273,"KALIBELUK, WARUNGASEM, BATANG, JAWA TENGAH",15,152,40,192
https://kawalpemilu.org#35598,"URUTSEWU, AMPEL, BOYOLALI, JAWA TENGAH",19,200,18,218
https://kawalpemilu.org#37675,"ADIREJO, TUNJUNGAN, BLORA, JAWA TENGAH",1,124,78,202
https://kawalpemilu.org#40738,"PELUTAN, PEMALANG, PEMALANG, JAWA TENGAH",12,132,42,174
https://kawalpemilu.org#87442,"MUJUR, KROYA, CILACAP, JAWA TENGAH",20,105,63,168
https://kawalpemilu.org#36749,"KEMBANG, JATIPURNO, WONOGIRI, JAWA TENGAH",10,104,28,132
https://kawalpemilu.org#32875,"SALEBU, MAJENANG, CILACAP, JAWA TENGAH",31,161,61,222
https://kawalpemilu.org#38805,"SUWAWAL, MLONGGO, JEPARA, JAWA TENGAH",19,197,30,227
https://kawalpemilu.org#36251,"JIMBUNG, KALIKOTES, KLATEN, JAWA TENGAH",3,170,24,194
https://kawalpemilu.org#38760,"PELANG, MAYONG, JEPARA, JAWA TENGAH",15,153,49,202
https://kawalpemilu.org#36056,"BEJI, PEDAN, KLATEN, JAWA TENGAH",8,152,38,190
https://kawalpemilu.org#33643,"MANDIRAJAKULON, MANDIRAJA, BANJARNEGARA, JAWA TENGAH",15,171,55,226
https://kawalpemilu.org#33287,"PURWOSARI, BATURADEN, BANYUMAS, JAWA TENGAH",18,107,96,203
https://kawalpemilu.org#40140,"SIDOHARJO, BAWANG, BATANG, JAWA TENGAH",3,165,8,173
https://kawalpemilu.org#36086,"TEGALAMPEL, KARANGDOWO, KLATEN, JAWA TENGAH",1,130,34,164
https://kawalpemilu.org#40022,"RINGINARUM, RINGINARUM, KENDAL, JAWA TENGAH",14,127,22,149
https://kawalpemilu.org#39865,"KUTOHARJO, KALIWUNGU, KENDAL, JAWA TENGAH",6,172,38,210
https://kawalpemilu.org#38028,"PUNJULHARJO, REMBANG, REMBANG, JAWA TENGAH",2,147,32,179
https://kawalpemilu.org#40255,"KARANGASEM UTARA, BATANG, BATANG, JAWA TENGAH",23,174,47,221
https://kawalpemilu.org#40749,"WANAMULYA, PEMALANG, PEMALANG, JAWA TENGAH",12,111,42,153
https://kawalpemilu.org#40653,"GUNUNGJAYA, BELIK, PEMALANG, JAWA TENGAH",26,164,10,174
https://kawalpemilu.org#36993,"NGEBUNG, KALIJAMBE, SRAGEN, JAWA TENGAH",1,113,33,146
https://kawalpemilu.org#34073,"TLOGOPRAGOTO, MIRIT, KEBUMEN, JAWA TENGAH",7,96,21,117
https://kawalpemilu.org#32813,"KAWUNGANTEN LOR, KAWUNGANTEN, CILACAP, JAWA TENGAH",8,132,42,174
https://kawalpemilu.org#38258,"LUNDO, JAKEN, PATI, JAWA TENGAH",4,168,26,194
https://kawalpemilu.org#36982,"SELOROMO, JENAWI, KARANGANYAR, JAWA TENGAH",1,177,12,189
https://kawalpemilu.org#33959,"KEDALEMAN KULON, PURING, KEBUMEN, JAWA TENGAH",4,96,43,139
https://kawalpemilu.org#36266,"JEBUGAN, KLATEN UTARA, KLATEN, JAWA TENGAH",7,145,16,161
https://kawalpemilu.org#87442,"MUJUR, KROYA, CILACAP, JAWA TENGAH",19,123,86,209
https://kawalpemilu.org#39950,"TAMBAKREJO, PATEBON, KENDAL, JAWA TENGAH",9,129,38,167
https://kawalpemilu.org#33406,"PENARUBAN, KALIGONDANG, PURBALINGGA, JAWA TENGAH",9,158,88,246
https://kawalpemilu.org#84902,"GENTASARI, KROYA, CILACAP, JAWA TENGAH",22,132,67,199
https://kawalpemilu.org#35916,"KADIBOLO, WEDI, KLATEN, JAWA TENGAH",5,99,113,212
https://kawalpemilu.org#39801,"CURUGSEWU, PATEAN, KENDAL, JAWA TENGAH",7,103,20,123
https://kawalpemilu.org#41218,"LAREN, BUMIAYU, BREBES, JAWA TENGAH",15,143,49,192
https://kawalpemilu.org#39995,"TANJUNGANOM, ROWOSARI, KENDAL, JAWA TENGAH",3,96,53,149
https://kawalpemilu.org#36119,"WADUNGGETAS, WONOSARI, KLATEN, JAWA TENGAH",15,173,19,192
https://kawalpemilu.org#34991,"KALIMENDONG, LEKSONO, WONOSOBO, JAWA TENGAH",10,154,16,170
https://kawalpemilu.org#32711,"KARANGBENDA, ADIPALA, CILACAP, JAWA TENGAH",8,133,30,163
https://kawalpemilu.org#40448,"KESESI, KESESI, PEKALONGAN, JAWA TENGAH",26,108,80,188
https://kawalpemilu.org#34072,"MIRIT, MIRIT, KEBUMEN, JAWA TENGAH",6,117,28,145
https://kawalpemilu.org#34067,"DUKUHREJOSARI, AMBAL, KEBUMEN, JAWA TENGAH",5,132,58,190
https://kawalpemilu.org#35855,"KALIMATI, JUWANGI, BOYOLALI, JAWA TENGAH",7,148,35,183
https://kawalpemilu.org#37103,"BENTAK, SIDOHARJO, SRAGEN, JAWA TENGAH",5,46,110,156
https://kawalpemilu.org#37023,"JIRAPAN, MASARAN, SRAGEN, JAWA TENGAH",14,162,24,186
https://kawalpemilu.org#39837,"MARGOSARI, LIMBANGAN, KENDAL, JAWA TENGAH",1,134,52,186
https://kawalpemilu.org#34094,"PREMBUN, PREMBUN, KEBUMEN, JAWA TENGAH",8,122,96,218
https://kawalpemilu.org#37848,"SENDANGMULYO, BULU, REMBANG, JAWA TENGAH",7,183,11,194
https://kawalpemilu.org#36520,"SUMBEREJO, BATUWARNO, WONOGIRI, JAWA TENGAH",2,129,31,160
https://kawalpemilu.org#39796,"PLOSOSARI, PATEAN, KENDAL, JAWA TENGAH",4,202,16,218
https://kawalpemilu.org#33774,"DANAKERTA, PUNGGELAN, BANJARNEGARA, JAWA TENGAH",9,136,43,179
https://kawalpemilu.org#40578,"KEPATIHAN, WIRADESA, PEKALONGAN, JAWA TENGAH",10,131,78,209
https://kawalpemilu.org#39146,"WEDUNG, WEDUNG, DEMAK, JAWA TENGAH",3,145,31,176
https://kawalpemilu.org#37238,"SUMBERJOSARI, KARANGRAYUNG, GROBOGAN, JAWA TENGAH",30,174,16,190
https://kawalpemilu.org#33141,"GERDUREN, PURWOJATI, BANYUMAS, JAWA TENGAH",5,123,33,156
https://kawalpemilu.org#37355,"TANJUNGHARJO, NGARINGAN, GROBOGAN, JAWA TENGAH",19,128,20,148
https://kawalpemilu.org#37416,"JANGKUNGHARJO, BRATI, GROBOGAN, JAWA TENGAH",12,187,30,217
https://kawalpemilu.org#35226,"PAKUNDEN, NGLUWAR, MAGELANG, JAWA TENGAH",10,182,58,240
https://kawalpemilu.org#35440,"SONOREJO, CANDIMULYO, MAGELANG, JAWA TENGAH",8,127,1,128
https://kawalpemilu.org#41524,"SEMANGGI, PASAR KLIWON, KOTA SURAKARTA, JAWA TENGAH",33,155,49,204
https://kawalpemilu.org#37169,"NGARGOTIRTO, SUMBERLAWANG, SRAGEN, JAWA TENGAH",19,187,28,215
https://kawalpemilu.org#40951,"YAMANSARI, LEBAKSIU, TEGAL, JAWA TENGAH",29,134,50,184
https://kawalpemilu.org#39327,"BEJALEN, AMBARAWA, SEMARANG, JAWA TENGAH",4,210,32,7
https://kawalpemilu.org#37937,"SAMBONG, SEDAN, REMBANG, JAWA TENGAH",5,118,50,168
https://kawalpemilu.org#34963,"NGADISONO, KALIWIRO, WONOSOBO, JAWA TENGAH",17,130,15,145
https://kawalpemilu.org#32999,"RANDEGAN, WANGON, BANYUMAS, JAWA TENGAH",12,147,53,200
https://kawalpemilu.org#41423,"KEDUNGBOKOR, LARANGAN, BREBES, JAWA TENGAH",14,134,78,212
https://kawalpemilu.org#33096,"PIASA KULON, SOMAGEDE, BANYUMAS, JAWA TENGAH",8,116,40,156
https://kawalpemilu.org#38579,"KALIWUNGU, KALIWUNGU, KUDUS, JAWA TENGAH",5,166,31,197
https://kawalpemilu.org#38584,"PANJUNAN, KUDUS, KUDUS, JAWA TENGAH",3,154,21,175
https://kawalpemilu.org#84894,"BUMIREJA, KEDUNGREJA, CILACAP, JAWA TENGAH",10,154,32,186
https://kawalpemilu.org#36243,"PEPE, NGAWEN, KLATEN, JAWA TENGAH",4,120,62,182
https://kawalpemilu.org#41653,"PEDURUNGAN KIDUL, PEDURUNGAN, KOTA SEMARANG, JAWA TENGAH",9,133,101,234
https://kawalpemilu.org#33231,"KALIKIDANG, SOKARAJA, BANYUMAS, JAWA TENGAH",2,163,46,209
https://kawalpemilu.org#40792,"TEGALMLATI, PETARUKAN, PEMALANG, JAWA TENGAH",22,72,25,97
https://kawalpemilu.org#35286,"WONOLELO, SAWANGAN, MAGELANG, JAWA TENGAH",6,132,35,167
https://kawalpemilu.org#41776,"MANGKANG WETAN, TUGU, KOTA SEMARANG, JAWA TENGAH",11,131,43,174
https://kawalpemilu.org#35882,"KARANGTURI, GANTIWARNO, KLATEN, JAWA TENGAH",7,92,17,109
https://kawalpemilu.org#35720,"SAMBI, SAMBI, BOYOLALI, JAWA TENGAH",11,213,26,239
https://kawalpemilu.org#35869,"TLOGO, PRAMBANAN, KLATEN, JAWA TENGAH",12,157,73,230
https://kawalpemilu.org#35399,"BANJAREJO, KALIANGKRIK, MAGELANG, JAWA TENGAH",10,150,57,207
https://kawalpemilu.org#32888,"PADANGJAYA, MAJENANG, CILACAP, JAWA TENGAH",27,127,46,173
https://kawalpemilu.org#33634,"GLEMPANG, MANDIRAJA, BANJARNEGARA, JAWA TENGAH",12,138,39,177
https://kawalpemilu.org#37029,"PILANG, MASARAN, SRAGEN, JAWA TENGAH",10,75,156,231
https://kawalpemilu.org#40720,"RANDUDONGKAL, RANDUDONGKAL, PEMALANG, JAWA TENGAH",50,124,81,205
https://kawalpemilu.org#37109,"SINGOPADU, SIDOHARJO, SRAGEN, JAWA TENGAH",5,124,29,153
https://kawalpemilu.org#36172,"BRANGKAL, KARANGANOM, KLATEN, JAWA TENGAH",14,139,27,166
https://kawalpemilu.org#33420,"PURBALINGGA WETAN, PURBALINGGA, PURBALINGGA, JAWA TENGAH",11,144,84,228
https://kawalpemilu.org#40405,"KARANGSARI, KARANGANYAR, PEKALONGAN, JAWA TENGAH",2,115,63,178
https://kawalpemilu.org#37317,"BANJARDOWO, KRADENAN, GROBOGAN, JAWA TENGAH",12,184,14,198
https://kawalpemilu.org#40715,"KECEPIT, RANDUDONGKAL, PEMALANG, JAWA TENGAH",9,66,29,95
https://kawalpemilu.org#40782,"SERANG, PETARUKAN, PEMALANG, JAWA TENGAH",13,130,40,170
https://kawalpemilu.org#36967,"GANTEN, KERJO, KARANGANYAR, JAWA TENGAH",5,89,92,181
https://kawalpemilu.org#39266,"SRATEN, TUNTANG, SEMARANG, JAWA TENGAH",9,191,45,236
https://kawalpemilu.org#34331,"GIRITIRTO, KARANGGAYAM, KEBUMEN, JAWA TENGAH",9,134,33,167
https://kawalpemilu.org#38925,"BATURSARI, MRANGGEN, DEMAK, JAWA TENGAH",43,165,55,220
https://kawalpemilu.org#33219,"TAMANSARI, KARANG LEWAS, BANYUMAS, JAWA TENGAH",19,183,13,196
https://kawalpemilu.org#40750,"BOJONGNANGKA, PEMALANG, PEMALANG, JAWA TENGAH",20,117,33,150
https://kawalpemilu.org#40446,"KWASEN, KESESI, PEKALONGAN, JAWA TENGAH",11,109,23,132
https://kawalpemilu.org#38949,"SIDOREJO, KARANGAWEN, DEMAK, JAWA TENGAH",4,175,54,229
https://kawalpemilu.org#38644,"TEMULUS, MEJOBO, KUDUS, JAWA TENGAH",9,124,69,193
https://kawalpemilu.org#41376,"PRAPAG KIDUL, LOSARI, BREBES, JAWA TENGAH",29,169,57,226
https://kawalpemilu.org#40829,"WONOKROMO, COMAL, PEMALANG, JAWA TENGAH",10,148,30,178
https://kawalpemilu.org#40961,"DUKUHDAMU, LEBAKSIU, TEGAL, JAWA TENGAH",1,119,85,204
https://kawalpemilu.org#35757,"PELEM, SIMO, BOYOLALI, JAWA TENGAH",8,155,86,241
https://kawalpemilu.org#37838,"GRAWAN, SUMBER, REMBANG, JAWA TENGAH",1,239,19,258
https://kawalpemilu.org#35914,"SEMBUNG, WEDI, KLATEN, JAWA TENGAH",3,92,32,124
https://kawalpemilu.org#41705,"SRONDOL KULON, BANYUMANIK, KOTA SEMARANG, JAWA TENGAH",16,128,61,189
