https://kawalpemilu.org#51182,"JODIPAN, BLIMBING, KOTA MALANG, JAWA TIMUR",5,145,69,214
https://kawalpemilu.org#46812,"KAUMAN, MOJOSARI, MOJOKERTO, JAWA TIMUR",3,168,62,230
https://kawalpemilu.org#49044,"PUNGGULREJO, RENGEL, TUBAN, JAWA TIMUR",15,109,114,223
https://kawalpemilu.org#49336,"SEMAMPIREJO, SAMBENG, LAMONGAN, JAWA TIMUR",8,107,21,128
https://kawalpemilu.org#45150,"TEGALSARI, TEGALSARI, BANYUWANGI, JAWA TIMUR",11,156,32,188
https://kawalpemilu.org#44674,"PURWOASRI, GUMUKMAS, JEMBER, JAWA TIMUR",1,102,45,147
https://kawalpemilu.org#49103,"KEDUNGSOKO, PLUMPANG, TUBAN, JAWA TIMUR",8,128,32,160
https://kawalpemilu.org#46030,"KERTOSARI, PURWOSARI, PASURUAN, JAWA TIMUR",10,144,64,208
https://kawalpemilu.org#50418,"KOMIS, KEDUNGDUNG, SAMPANG, JAWA TIMUR",9,40,136,176
https://kawalpemilu.org#45556,"SELOWOGO, BUNGATAN, SITUBONDO, JAWA TIMUR",6,86,132,218
https://kawalpemilu.org#43917,"KEDUNGSARI, TAROKAN, KEDIRI, JAWA TIMUR",13,137,18,155
https://kawalpemilu.org#49402,"SENDANGDUWUR, PACIRAN, LAMONGAN, JAWA TIMUR",1,162,52,214
https://kawalpemilu.org#46237,"GRATI TUNON, GRATI, PASURUAN, JAWA TIMUR",9,177,39,216
https://kawalpemilu.org#51463,"SIDOTOPO, SEMAMPIR, KOTA SURABAYA, JAWA TIMUR",5,88,124,212
https://kawalpemilu.org#51231,"LOWOKWARU, LOWOKWARU, KOTA MALANG, JAWA TIMUR",28,152,69,221
https://kawalpemilu.org#45726,"PLAMPANG, PAITON, PROBOLINGGO, JAWA TIMUR",6,78,104,182
https://kawalpemilu.org#47059,"BANJARAGUNG, BARENG, JOMBANG, JAWA TIMUR",4,167,13,180
https://kawalpemilu.org#43729,"KUNJANG, NGANCAR, KEDIRI, JAWA TIMUR",14,147,13,160
https://kawalpemilu.org#48567,"SAMBONGREJO, SUMBEREJO, BOJONEGORO, JAWA TIMUR",3,84,61,145
https://kawalpemilu.org#46959,"MOJOREJO, JETIS, MOJOKERTO, JAWA TIMUR",10,132,46,178
https://kawalpemilu.org#46105,"WATUKOSEK, GEMPOL, PASURUAN, JAWA TIMUR",2,188,62,250
https://kawalpemilu.org#49817,"BANYUURIP, KEDAMEAN, GRESIK, JAWA TIMUR",8,225,17,242
https://kawalpemilu.org#51343,"WINONGO, MANGUHARJO, KOTA MADIUN, JAWA TIMUR",10,154,92,246
https://kawalpemilu.org#47128,"BALONGBESUK, DIWEK, JOMBANG, JAWA TIMUR",16,98,75,173
https://kawalpemilu.org#49818,"KEDAMEAN, KEDAMEAN, GRESIK, JAWA TIMUR",3,191,61,252
https://kawalpemilu.org#51178,"PURWANTORO, BLIMBING, KOTA MALANG, JAWA TIMUR",68,184,50,234
https://kawalpemilu.org#49324,"PARENGAN, MADURAN, LAMONGAN, JAWA TIMUR",2,101,74,175
https://kawalpemilu.org#50009,"SUNGAI TELUK, SANGKAPURA, GRESIK, JAWA TIMUR",3,72,114,186
https://kawalpemilu.org#46257,"NGULING, NGULING, PASURUAN, JAWA TIMUR",1,115,76,191
https://kawalpemilu.org#51546,"SAMBIKEREP, SAMBIKEREP, KOTA SURABAYA, JAWA TIMUR",25,153,32,185
https://kawalpemilu.org#49782,"SOOKO, WRINGINANOM, GRESIK, JAWA TIMUR",4,209,19,228
https://kawalpemilu.org#44939,"GRAJAGAN, PURWOHARJO, BANYUWANGI, JAWA TIMUR",17,184,38,222
https://kawalpemilu.org#42505,"BANDAR, BANDAR, PACITAN, JAWA TIMUR",15,88,126,214
https://kawalpemilu.org#44694,"SELODAKON, TANGGUL, JEMBER, JAWA TIMUR",3,41,87,128
https://kawalpemilu.org#44411,"KANIGORO, PAGELARAN, MALANG, JAWA TIMUR",25,122,64,186
https://kawalpemilu.org#87668,"JRAKAH, SAMBIT, PONOROGO, JAWA TIMUR",6,149,70,219
https://kawalpemilu.org#42707,"KARANGGEBANG, JETIS, PONOROGO, JAWA TIMUR",9,94,89,183
https://kawalpemilu.org#44306,"CANDIRENGGO, SINGOSARI, MALANG, JAWA TIMUR",44,71,56,127
https://kawalpemilu.org#48458,"DAYUKIDUL, KEDUNGADEM, BOJONEGORO, JAWA TIMUR",3,129,75,204
https://kawalpemilu.org#46869,"KINTELAN, PURI, MOJOKERTO, JAWA TIMUR",7,164,52,216
https://kawalpemilu.org#50886,"PRAGAAN LAOK, PRAGAAN, SUMENEP, JAWA TIMUR",13,118,96,214
https://kawalpemilu.org#50108,"TOGUBANG, GEGER, BANGKALAN, JAWA TIMUR",9,110,66,176
https://kawalpemilu.org#46154,"ORO-ORO OMBOWETAN, REMBANG, PASURUAN, JAWA TIMUR",9,74,161,235
https://kawalpemilu.org#47159,"TUGUSUMBERJO, PETERONGAN, JOMBANG, JAWA TIMUR",15,123,28,151
https://kawalpemilu.org#51209,"CIPTOMULYO, SUKUN, KOTA MALANG, JAWA TIMUR",19,144,51,195
https://kawalpemilu.org#47439,"KALIANYAR, NGRONGGOT, NGANJUK, JAWA TIMUR",9,174,26,200
https://kawalpemilu.org#47064,"GALENGDOWO, WONOSALAM, JOMBANG, JAWA TIMUR",11,181,33,214
https://kawalpemilu.org#47966,"TAPAK, PANEKAN, MAGETAN, JAWA TIMUR",7,177,14,191
https://kawalpemilu.org#51434,"BONGKARAN, PABEAN CANTIKAN, KOTA SURABAYA, JAWA TIMUR",6,106,92,198
https://kawalpemilu.org#44421,"PUROREJO, TEMPURSARI, LUMAJANG, JAWA TIMUR",14,133,17,150
https://kawalpemilu.org#44591,"ROJOPOLO, JATIROTO, LUMAJANG, JAWA TIMUR",21,69,87,156
https://kawalpemilu.org#50364,"DALPENANG, SAMPANG, SAMPANG, JAWA TIMUR",10,36,204,240
https://kawalpemilu.org#45968,"PETUNG, PASREPAN, PASURUAN, JAWA TIMUR",4,102,88,190
https://kawalpemilu.org#47482,"WARUJAYENG, TANJUNGANOM, NGANJUK, JAWA TIMUR",27,153,21,174
https://kawalpemilu.org#42603,"NGRAYUN, NGRAYUN, PONOROGO, JAWA TIMUR",4,136,102,238
https://kawalpemilu.org#43645,"JUGO, MOJO, KEDIRI, JAWA TIMUR",14,157,11,168
https://kawalpemilu.org#44597,"BANYUPUTIH LOR, RANDUAGUNG, LUMAJANG, JAWA TIMUR",13,60,134,194
https://kawalpemilu.org#46055,"CURAH REJO, SUKOREJO, PASURUAN, JAWA TIMUR",6,100,71,171
https://kawalpemilu.org#46675,"KEDUNGREJO, WARU, SIDOARJO, JAWA TIMUR",9,162,54,216
https://kawalpemilu.org#45432,"GUNUNG PUTRI, SUBOH, SITUBONDO, JAWA TIMUR",8,91,81,172
https://kawalpemilu.org#45830,"SEBAUNG, GENDING, PROBOLINGGO, JAWA TIMUR",20,140,22,162
https://kawalpemilu.org#42412,"PELEM, PRINGKUKU, PACITAN, JAWA TIMUR",5,40,129,169
https://kawalpemilu.org#43131,"NGANTRU, NGANTRU, TULUNGAGUNG, JAWA TIMUR",7,152,54,206
https://kawalpemilu.org#51149,"SENTUL, KEPANJENKIDUL, KOTA BLITAR, JAWA TIMUR",8,169,49,218
https://kawalpemilu.org#43273,"BUNTARAN, REJOTANGAN, TULUNGAGUNG, JAWA TIMUR",2,120,20,140
https://kawalpemilu.org#51059,"DUKO, ARJASA, SUMENEP, JAWA TIMUR",6,54,102,156
https://kawalpemilu.org#44970,"TAMPO, CLURING, BANYUWANGI, JAWA TIMUR",12,163,32,195
https://kawalpemilu.org#42541,"SIDOMULYO, NGADIROJO, PACITAN, JAWA TIMUR",11,29,158,187
https://kawalpemilu.org#45114,"BIMOREJO, WONGSOREJO, BANYUWANGI, JAWA TIMUR",3,154,51,205
https://kawalpemilu.org#47058,"MOJOTENGAH, BARENG, JOMBANG, JAWA TIMUR",12,127,14,141
https://kawalpemilu.org#50825,"POREH, LENTENG, SUMENEP, JAWA TIMUR",12,56,126,182
https://kawalpemilu.org#44997,"KEMBIRITAN, GENTENG, BANYUWANGI, JAWA TIMUR",22,128,57,185
https://kawalpemilu.org#50051,"JADDIH, SOCAH, BANGKALAN, JAWA TIMUR",24,124,102,226
https://kawalpemilu.org#44701,"SEMBORO, SEMBORO, JEMBER, JAWA TIMUR",13,118,61,179
https://kawalpemilu.org#44320,"RANDUANGUNG, SINGOSARI, MALANG, JAWA TIMUR",2,136,74,210
https://kawalpemilu.org#48449,"BULU, SUGIHWARAS, BOJONEGORO, JAWA TIMUR",4,120,70,190
https://kawalpemilu.org#48209,"LEGUNDI, KARANGJATI, NGAWI, JAWA TIMUR",11,184,17,201
https://kawalpemilu.org#44049,"PAMOTAN, DAMPIT, MALANG, JAWA TIMUR",26,184,13,197
https://kawalpemilu.org#50745,"PABERASAN, KOTA SUMENEP, SUMENEP, JAWA TIMUR",10,62,95,157
https://kawalpemilu.org#46665,"TROPODO, WARU, SIDOARJO, JAWA TIMUR",17,203,82,285
https://kawalpemilu.org#44236,"PAKISKEMBAR, PAKIS, MALANG, JAWA TIMUR",9,122,73,195
https://kawalpemilu.org#50513,"KETAPANG BARAT, KETAPANG, SAMPANG, JAWA TIMUR",4,149,45,194
https://kawalpemilu.org#43382,"SUKOREJO, UDANAWU, BLITAR, JAWA TIMUR",12,185,26,211
https://kawalpemilu.org#48190,"KWADUNGAN, KWADUNGAN, NGAWI, JAWA TIMUR",3,114,54,168
https://kawalpemilu.org#42969,"KARANGAN, KARANGAN, TRENGGALEK, JAWA TIMUR",6,183,25,208
https://kawalpemilu.org#48779,"DUYUNGAN, SUKOSEWU, BOJONEGORO, JAWA TIMUR",6,101,89,190
https://kawalpemilu.org#44244,"BUNUTWETAN, PAKIS, MALANG, JAWA TIMUR",4,170,55,225
https://kawalpemilu.org#47105,"SIDOKERTO, MOJOWARNO, JOMBANG, JAWA TIMUR",7,152,40,192
https://kawalpemilu.org#45203,"PECALONGAN, SUKOSARI, BONDOWOSO, JAWA TIMUR",9,37,90,127
https://kawalpemilu.org#46339,"KEDUNGSUGO, PRAMBON, SIDOARJO, JAWA TIMUR",13,155,55,210
https://kawalpemilu.org#59653,"CAPKALA, CAPKALA, BENGKAYANG, KALIMANTAN BARAT",9,129,29,158
https://kawalpemilu.org#58585,"SUNGAI ALAI, KAPUAS, SANGGAU, KALIMANTAN BARAT",2,122,5,127
https://kawalpemilu.org#58905,"JUNGKAL, TUMBANG TITI, KETAPANG, KALIMANTAN BARAT",1,123,6,129
https://kawalpemilu.org#60241,"SANGGAU KULOR, SINGKAWANG TIMUR, KOTA SINGKAWANG, KALIMANTAN BARAT",5,164,13,177
https://kawalpemilu.org#60201,"SUNGAI JAWI LUAR, PONTIANAK BARAT, KOTA PONTIANAK, KALIMANTAN BARAT",69,27,115,142
https://kawalpemilu.org#59844,"SEKAIS, JELIMPO, LANDAK, KALIMANTAN BARAT",7,143,9,152
https://kawalpemilu.org#60251,"SEDAU, SINGKAWANG SELATAN, KOTA SINGKAWANG, KALIMANTAN BARAT",67,95,22,117
https://kawalpemilu.org#59516,"TEKUDAK, KALIS, KAPUAS HULU, KALIMANTAN BARAT",4,106,65,171
https://kawalpemilu.org#58543,"PENITI DALAM II, SEGEDONG, MEMPAWAH, KALIMANTAN BARAT",7,28,141,169
https://kawalpemilu.org#60361,"JERUJU BESAR, SUNGAI KAKAP, KUBU RAYA, KALIMANTAN BARAT",6,42,163,205
https://kawalpemilu.org#59101,"SUNGAI DERAS, KETUNGAU HILIR, SINTANG, KALIMANTAN BARAT",2,132,8,140
https://kawalpemilu.org#58516,"PENIRAMAN, SUNGAI PINYUH, MEMPAWAH, KALIMANTAN BARAT",5,5,210,215
https://kawalpemilu.org#60213,"SUNGAI JAWI, PONTIANAK KOTA, KOTA PONTIANAK, KALIMANTAN BARAT",43,70,147,217
https://kawalpemilu.org#58842,"KUALAN TENGAH, SIMPANG HULU, KETAPANG, KALIMANTAN BARAT",6,127,9,136
https://kawalpemilu.org#59261,"BUNTUT PIMPIN, AMBALAU, SINTANG, KALIMANTAN BARAT",1,84,27,111
https://kawalpemilu.org#60188,"KOTA BARU, PONTIANAK SELATAN, KOTA PONTIANAK, KALIMANTAN BARAT",2,26,199,225
https://kawalpemilu.org#59291,"MERARAI DUA, SUNGAI TEBELIAN, SINTANG, KALIMANTAN BARAT",1,150,59,209
https://kawalpemilu.org#58574,"BUNUT, KAPUAS, SANGGAU, KALIMANTAN BARAT",24,74,122,196
https://kawalpemilu.org#60260,"KUALA DUA, SUNGAI RAYA, KUBU RAYA, KALIMANTAN BARAT",73,35,104,139
https://kawalpemilu.org#59127,"KAYU DUJUNG, KETUNGAU TENGAH, SINTANG, KALIMANTAN BARAT",2,161,5,166
https://kawalpemilu.org#931003,"LAMAN RAYA, SUNGAI TEBELIAN, SINTANG, KALIMANTAN BARAT",2,142,68,210
https://kawalpemilu.org#58497,"PASIR, MEMPAWAH HILIR, MEMPAWAH, KALIMANTAN BARAT",19,13,174,187
https://kawalpemilu.org#59809,"KERANJI MANCAL, SENGAH TEMILA, LANDAK, KALIMANTAN BARAT",8,169,18,187
https://kawalpemilu.org#85289,"RATU ELOK, MANIS MATA, KETAPANG, KALIMANTAN BARAT",8,74,69,143
https://kawalpemilu.org#59158,"PENGKADAN BARU, DEDAI, SINTANG, KALIMANTAN BARAT",1,166,76,242
https://kawalpemilu.org#59397,"PARANG, HULU GURUNG, KAPUAS HULU, KALIMANTAN BARAT",1,40,170,210
https://kawalpemilu.org#58614,"PISANG, JANGKANG, SANGGAU, KALIMANTAN BARAT",9,119,27,146
https://kawalpemilu.org#60213,"SUNGAI JAWI, PONTIANAK KOTA, KOTA PONTIANAK, KALIMANTAN BARAT",30,50,188,238
https://kawalpemilu.org#59933,"MERBANG, BELITANG HILIR, SEKADAU, KALIMANTAN BARAT",7,159,26,185
https://kawalpemilu.org#59790,"SIDAN, MENYUKE, LANDAK, KALIMANTAN BARAT",3,151,13,164
https://kawalpemilu.org#60225,"ROBAN, SINGKAWANG TENGAH, KOTA SINGKAWANG, KALIMANTAN BARAT",5,76,166,242
https://kawalpemilu.org#60251,"SEDAU, SINGKAWANG SELATAN, KOTA SINGKAWANG, KALIMANTAN BARAT",57,97,79,176
https://kawalpemilu.org#85358,"PARIT BARU, SUNGAI RAYA, KUBU RAYA, KALIMANTAN BARAT",93,77,49,119
https://kawalpemilu.org#58798,"MEKAR UTAMA, KENDAWANGAN, KETAPANG, KALIMANTAN BARAT",14,89,53,142
https://kawalpemilu.org#59560,"SUNGAI JAGA A, SUNGAI RAYA, BENGKAYANG, KALIMANTAN BARAT",6,25,136,161
https://kawalpemilu.org#59147,"MUAKAN PETINGGI, KETUNGAU HULU, SINTANG, KALIMANTAN BARAT",1,156,11,167
https://kawalpemilu.org#58294,"LORONG, SAMBAS, SAMBAS, KALIMANTAN BARAT",9,111,109,220
https://kawalpemilu.org#59559,"SUNGAI DURI, SUNGAI RAYA, BENGKAYANG, KALIMANTAN BARAT",13,69,57,126
https://kawalpemilu.org#59690,"PAPAN UDUK, LEMBAH BAWANG, BENGKAYANG, KALIMANTAN BARAT",1,148,7,155
https://kawalpemilu.org#58532,"SUNGAI KUNYIT HULU, SUNGAI KUNYIT, MEMPAWAH, KALIMANTAN BARAT",6,1,172,173
https://kawalpemilu.org#59903,"SENANGAK, NANGA TAMAN, SEKADAU, KALIMANTAN BARAT",1,231,13,244
https://kawalpemilu.org#64079,"SEBERANG MESJID, BANJARMASIN TENGAH, KOTA BANJARMASIN, KALIMANTAN SELATAN",1,54,190,244
https://kawalpemilu.org#63650,"SUPUT, HARUAI, TABALONG, KALIMANTAN SELATAN",2,31,149,180
https://kawalpemilu.org#63281,"KAPAR, BATANG ALAI SELATAN, HULU SUNGAI TENGAH, KALIMANTAN SELATAN",2,25,131,156
https://kawalpemilu.org#62814,"TINGGIRAN BARU, MEKARSARI, BARITO KUALA, KALIMANTAN SELATAN",7,63,124,187
https://kawalpemilu.org#62023,"SARIKANDI, KURAU, TANAH LAUT, KALIMANTAN SELATAN",2,65,81,146
https://kawalpemilu.org#62398,"SUNGAI PINANG BARU, SUNGAI TABUK, BANJAR, KALIMANTAN SELATAN",5,25,181,206
https://kawalpemilu.org#63622,"TANTA HULU, TANTA, TABALONG, KALIMANTAN SELATAN",8,61,154,215
https://kawalpemilu.org#62769,"SIMPANG NUNGKI, CERBON, BARITO KUALA, KALIMANTAN SELATAN",2,42,152,194
https://kawalpemilu.org#63850,"BAROKAH, SIMPANG EMPAT, TANAH BUMBU, KALIMANTAN SELATAN",28,75,35,110
https://kawalpemilu.org#62864,"RAYA BELANTI, BINUANG, TAPIN, KALIMANTAN SELATAN",14,180,93,273
https://kawalpemilu.org#62412,"SEKUMPUL, MARTAPURA, BANJAR, KALIMANTAN SELATAN",9,50,80,130
https://kawalpemilu.org#63495,"SUNGAI TURAK, AMUNTAI UTARA, HULU SUNGAI UTARA, KALIMANTAN SELATAN",2,39,177,216
https://kawalpemilu.org#62915,"ANTASARI HILIR, TAPIN UTARA, TAPIN, KALIMANTAN SELATAN",1,45,162,207
https://kawalpemilu.org#62183,"SEMAYAP, PULAULAUT UTARA, KOTABARU, KALIMANTAN SELATAN",10,82,55,137
https://kawalpemilu.org#63612,"WARUKIN, TANTA, TABALONG, KALIMANTAN SELATAN",2,173,24,197
https://kawalpemilu.org#63131,"PASUNGKAN, DAHA UTARA, HULU SUNGAI SELATAN, KALIMANTAN SELATAN",1,28,152,180
https://kawalpemilu.org#63784,"SATUI BARAT, SATUI, TANAH BUMBU, KALIMANTAN SELATAN",4,40,163,203
https://kawalpemilu.org#62751,"DANDA JAYA, RANTAU BADAUH, BARITO KUALA, KALIMANTAN SELATAN",3,87,129,216
https://kawalpemilu.org#62419,"TUNGGUL IRANG ILIR, MARTAPURA, BANJAR, KALIMANTAN SELATAN",2,42,95,137
https://kawalpemilu.org#62094,"TIRTA JAYA, BAJUIN, TANAH LAUT, KALIMANTAN SELATAN",4,95,138,233
https://kawalpemilu.org#62249,"SUKADANA, PAMUKAN SELATAN, KOTABARU, KALIMANTAN SELATAN",1,106,101,207
https://kawalpemilu.org#63476,"MUARA TAPUS, AMUNTAI TENGAH, HULU SUNGAI UTARA, KALIMANTAN SELATAN",2,39,103,142
https://kawalpemilu.org#63321,"HARUYAN DAYAK, HANTAKAN, HULU SUNGAI TENGAH, KALIMANTAN SELATAN",3,34,26,60
https://kawalpemilu.org#62045,"KURINGKIT, PANYIPATAN, TANAH LAUT, KALIMANTAN SELATAN",1,73,118,191
https://kawalpemilu.org#63260,"BARABAI DARAT, BARABAI, HULU SUNGAI TENGAH, KALIMANTAN SELATAN",25,17,95,112
https://kawalpemilu.org#62722,"SEMANGAT DALAM, ALALAK, BARITO KUALA, KALIMANTAN SELATAN",34,76,112,188
https://kawalpemilu.org#64100,"LANDASAN ULIN SELATAN, LIANG ANGGANG, KOTA BANJARBARU, KALIMANTAN SELATAN",3,76,98,174
https://kawalpemilu.org#63121,"PAKAN DALAM, DAHA UTARA, HULU SUNGAI SELATAN, KALIMANTAN SELATAN",1,59,160,219
https://kawalpemilu.org#62391,"PEMAKUAN, SUNGAI TABUK, BANJAR, KALIMANTAN SELATAN",7,71,164,235
https://kawalpemilu.org#62302,"SELARU, PULAULAUT TENGAH, KOTABARU, KALIMANTAN SELATAN",4,38,98,136
https://kawalpemilu.org#63644,"HALONG, HARUAI, TABALONG, KALIMANTAN SELATAN",6,31,153,184
https://kawalpemilu.org#64059,"KUIN CERUCUK, BANJARMASIN BARAT, KOTA BANJARMASIN, KALIMANTAN SELATAN",4,68,162,230
https://kawalpemilu.org#63586,"HABAU, BANUA LAWAS, TABALONG, KALIMANTAN SELATAN",6,31,105,136
https://kawalpemilu.org#60942,"BUNTOK KOTA, DUSUN SELATAN, BARITO SELATAN, KALIMANTAN TENGAH",11,164,66,230
https://kawalpemilu.org#61621,"TALIO MUARA, PANDIH BATU, PULANG PISAU, KALIMANTAN TENGAH",3,149,54,203
https://kawalpemilu.org#61932,"PANARUNG, PAHANDUT, KOTA PALANGKARAYA, KALIMANTAN TENGAH",70,62,140,202
https://kawalpemilu.org#61054,"LAHEI II, LAHEI, BARITO UTARA, KALIMANTAN TENGAH",8,68,143,211
https://kawalpemilu.org#85395,"HUJUNG PATA, RUNGAN BARAT, GUNUNG MAS, KALIMANTAN TENGAH",2,135,7,142
https://kawalpemilu.org#61947,"MENTENG, JEKAN RAYA, KOTA PALANGKARAYA, KALIMANTAN TENGAH",27,183,39,222
https://kawalpemilu.org#60852,"TUMBANG PUROH, KAPUAS HULU, KAPUAS, KALIMANTAN TENGAH",1,122,21,143
https://kawalpemilu.org#60787,"LAMUNTI, MANTANGAI, KAPUAS, KALIMANTAN TENGAH",1,133,68,201
https://kawalpemilu.org#60738,"DADAHUP, DADAHUP, KAPUAS, KALIMANTAN TENGAH",7,143,80,223
https://kawalpemilu.org#61082,"PARUPUK, KAMIPANG, KATINGAN, KALIMANTAN TENGAH",1,32,35,67
https://kawalpemilu.org#61947,"MENTENG, JEKAN RAYA, KOTA PALANGKARAYA, KALIMANTAN TENGAH",136,122,36,158
https://kawalpemilu.org#61244,"RANTAU PANDAN, BUKIT RAYA, KATINGAN, KALIMANTAN TENGAH",1,130,28,158
https://kawalpemilu.org#60700,"WARNA SARI, TAMBAN CATUR, KAPUAS, KALIMANTAN TENGAH",3,66,96,162
https://kawalpemilu.org#928325,"SUKA MAJU, MANTANGAI, KAPUAS, KALIMANTAN TENGAH",2,104,33,137
https://kawalpemilu.org#60393,"MENDAWAI, ARUT SELATAN, KOTAWARINGIN BARAT, KALIMANTAN TENGAH",20,83,145,228
https://kawalpemilu.org#61129,"SAMBA DANUM, KATINGAN TENGAH, KATINGAN, KALIMANTAN TENGAH",10,93,107,200
https://kawalpemilu.org#61946,"PALANGKA, JEKAN RAYA, KOTA PALANGKARAYA, KALIMANTAN TENGAH",126,135,30,165
https://kawalpemilu.org#61896,"NAGALEAH, PEMATANG KARAU, BARITO TIMUR, KALIMANTAN TENGAH",2,31,192,223
https://kawalpemilu.org#60937,"PALU REJO, GN. BINTANG AWAI, BARITO SELATAN, KALIMANTAN TENGAH",2,167,57,224
https://kawalpemilu.org#61933,"LANGKAI, PAHANDUT, KOTA PALANGKARAYA, KALIMANTAN TENGAH",20,74,46,120
https://kawalpemilu.org#64408,"SIDOMULYO, TABANG, KUTAI KARTANEGARA, KALIMANTAN TIMUR",1,67,48,115
https://kawalpemilu.org#65666,"BERBAS TENGAH, BONTANG SELATAN, KOTA BONTANG, KALIMANTAN TIMUR",13,108,106,214
https://kawalpemilu.org#65660,"LOK TUAN, BONTANG UTARA, KOTA BONTANG, KALIMANTAN TIMUR",51,121,124,245
https://kawalpemilu.org#65547,"GUNUNGSARI ULU, BALIKPAPAN TENGAH, KOTA BALIKPAPAN, KALIMANTAN TIMUR",45,77,80,157
https://kawalpemilu.org#65177,"LAMBING, MUARA LAWA, KUTAI BARAT, KALIMANTAN TIMUR",1,140,45,185
https://kawalpemilu.org#64550,"SUNGAI BEDUNGUN, TANJUNG REDEB, BERAU, KALIMANTAN TIMUR",10,100,95,195
https://kawalpemilu.org#85500,"AWAI, NYUATAN, KUTAI BARAT, KALIMANTAN TIMUR",1,195,18,213
https://kawalpemilu.org#65581,"AIR PUTIH, SAMARINDA ULU, KOTA SAMARINDA, KALIMANTAN TIMUR",42,45,114,159
https://kawalpemilu.org#64127,"SELENGOT, TANJUNG HARAPAN, PASER, KALIMANTAN TIMUR",3,58,160,218
https://kawalpemilu.org#65665,"TANJUNG LAUT, BONTANG SELATAN, KOTA BONTANG, KALIMANTAN TIMUR",23,75,44,119
https://kawalpemilu.org#65535,"BARU ILIR, BALIKPAPAN BARAT, KOTA BALIKPAPAN, KALIMANTAN TIMUR",27,72,39,111
https://kawalpemilu.org#65215,"MUARA GUSIK, BONGAN, KUTAI BARAT, KALIMANTAN TIMUR",2,144,28,172
https://kawalpemilu.org#64552,"BUGIS, TANJUNG REDEB, BERAU, KALIMANTAN TIMUR",31,82,85,167
https://kawalpemilu.org#65481,"PENAJAM, PENAJAM, PENAJAM PASER UTARA, KALIMANTAN TIMUR",2,65,161,226
https://kawalpemilu.org#64519,"SUKA MURYA, TALISAYAN, BERAU, KALIMANTAN TIMUR",2,142,31,173
https://kawalpemilu.org#65572,"SIMPANG PASIR, PALARAN, KOTA SAMARINDA, KALIMANTAN TIMUR",10,97,36,133
https://kawalpemilu.org#65581,"AIR PUTIH, SAMARINDA ULU, KOTA SAMARINDA, KALIMANTAN TIMUR",52,82,152,234
https://kawalpemilu.org#65322,"LONG TESAK, MUARA ANCALONG, KUTAI TIMUR, KALIMANTAN TIMUR",1,139,16,155
https://kawalpemilu.org#65551,"MEKAR SARI, BALIKPAPAN TENGAH, KOTA BALIKPAPAN, KALIMANTAN TIMUR",1,73,101,174
https://kawalpemilu.org#85501,"TANAH MEA, SILUQ NGURAI, KUTAI BARAT, KALIMANTAN TIMUR",1,112,12,124
https://kawalpemilu.org#65624,"SUNGAI PINANG LUAR, SAMARINDA KOTA, KOTA SAMARINDA, KALIMANTAN TIMUR",10,54,79,133
https://kawalpemilu.org#65530,"MANGGAR, BALIKPAPAN TIMUR, KOTA BALIKPAPAN, KALIMANTAN TIMUR",21,91,60,151
https://kawalpemilu.org#65097,"MEMAHAK BESAR, LONG BAGUN, MAHAKAM ULU, KALIMANTAN TIMUR",2,147,71,218
https://kawalpemilu.org#65579,"TELUK LERONG ILIR, SAMARINDA ULU, KOTA SAMARINDA, KALIMANTAN TIMUR",39,51,58,109
https://kawalpemilu.org#65390,"SEKERAT, BENGALON, KUTAI TIMUR, KALIMANTAN TIMUR",5,100,56,156
https://kawalpemilu.org#64470,"TELUK DALAM, TENGGARONG SEBERANG, KUTAI KARTANEGARA, KALIMANTAN TIMUR",2,94,117,211
https://kawalpemilu.org#65389,"SEPASO, BENGALON, KUTAI TIMUR, KALIMANTAN TIMUR",19,175,68,243
https://kawalpemilu.org#65612,"PULAU ATAS, SAMBUTAN, KOTA SAMARINDA, KALIMANTAN TIMUR",5,72,96,168
https://kawalpemilu.org#64725,"NUNUKAN BARAT, NUNUKAN, NUNUKAN, KALIMANTAN UTARA",44,92,46,138
https://kawalpemilu.org#64621,"TANJUNG PALAS HILIR, TANJUNG PALAS, BULUNGAN, KALIMANTAN UTARA",3,144,104,248
https://kawalpemilu.org#65017,"SETULANG, MALINAU SELATAN HILIR, MALINAU, KALIMANTAN UTARA",3,172,11,183
https://kawalpemilu.org#64652,"TANJUNG SELOR HILIR, TANJUNG SELOR, BULUNGAN, KALIMANTAN UTARA",5,118,65,183
https://kawalpemilu.org#85475,"SUNGAI LIMAU, SEBATIK TENGAH, NUNUKAN, KALIMANTAN UTARA",2,179,25,204
https://kawalpemilu.org#64661,"SALIMBATU, TANJUNG PALAS TENGAH, BULUNGAN, KALIMANTAN UTARA",4,125,87,212
https://kawalpemilu.org#25141,"AIR GEGAS, AIR GEGAS, BANGKA SELATAN, KEPULAUAN BANGKA BELITUNG",9,29,161,190
https://kawalpemilu.org#25083,"AIR SAGA, TANJUNG PANDAN, BELITUNG, KEPULAUAN BANGKA BELITUNG",10,134,87,221
https://kawalpemilu.org#25352,"SUKAMANDI, DAMAR, BELITUNG TIMUR, KEPULAUAN BANGKA BELITUNG",10,135,24,159
https://kawalpemilu.org#25272,"LIMBUNG, JEBUS, BANGKA BARAT, KEPULAUAN BANGKA BELITUNG",2,142,120,262
https://kawalpemilu.org#25116,"SUNGAI SAMAK, BADAU, BELITUNG, KEPULAUAN BANGKA BELITUNG",1,165,28,193
https://kawalpemilu.org#25031,"KEMUJA, MENDO BARAT, BANGKA, KEPULAUAN BANGKA BELITUNG",7,34,175,209
https://kawalpemilu.org#25209,"LAMPUR, SUNGAI SELAN, BANGKA TENGAH, KEPULAUAN BANGKA BELITUNG",7,162,61,223
https://kawalpemilu.org#24996,"SUNGAILIAT, SUNGAILIAT, BANGKA, KEPULAUAN BANGKA BELITUNG",16,162,30,192
https://kawalpemilu.org#25163,"PANGKAL BULUH, PAYUNG, BANGKA SELATAN, KEPULAUAN BANGKA BELITUNG",7,102,97,199
https://kawalpemilu.org#25392,"PASIR PUTIH, BUKITINTAN, KOTA PANGKALPINANG, KEPULAUAN BANGKA BELITUNG",8,220,23,243
https://kawalpemilu.org#25723,"TANJUNG KELIT, SENAYANG, LINGGA, KEPULAUAN RIAU",5,154,12,166
https://kawalpemilu.org#25485,"TANJUNG UBAN SELATAN, BINTAN UTARA, BINTAN, KEPULAUAN RIAU",3,106,99,205
https://kawalpemilu.org#25768,"KABIL, NONGSA, KOTA BATAM, KEPULAUAN RIAU",61,102,73,175
https://kawalpemilu.org#25599,"SABANG BARAT, MIDAI, NATUNA, KEPULAUAN RIAU",8,146,35,181
https://kawalpemilu.org#25786,"TANJUNG PIAYU, SEI BEDUK, KOTA BATAM, KEPULAUAN RIAU",44,81,66,147
https://kawalpemilu.org#25568,"PAMAK, TEBING, KARIMUN, KEPULAUAN RIAU",7,56,119,175
https://kawalpemilu.org#25516,"TOAPAYA SELATAN, TOAPAYA, BINTAN, KEPULAUAN RIAU",8,85,68,153
https://kawalpemilu.org#25557,"TULANG, KARIMUN, KARIMUN, KEPULAUAN RIAU",1,92,146,238
https://kawalpemilu.org#25685,"DABO, SINGKEP, LINGGA, KEPULAUAN RIAU",15,47,59,106
https://kawalpemilu.org#25566,"TELUK UMA, TEBING, KARIMUN, KEPULAUAN RIAU",5,82,111,193
https://kawalpemilu.org#25499,"KAMPUNG MELAYU, TAMBELAN, BINTAN, KEPULAUAN RIAU",1,129,71,200
https://kawalpemilu.org#25663,"CERUK, BUNGURAN TIMUR LAUT, NATUNA, KEPULAUAN RIAU",3,99,78,177
https://kawalpemilu.org#25817,"SUNGAI PELUNGGUT, SAGULUNG, KOTA BATAM, KEPULAUAN RIAU",22,167,16,183
https://kawalpemilu.org#25806,"TAMAN BALOI, BATAM KOTA, KOTA BATAM, KEPULAUAN RIAU",41,212,51,263
https://kawalpemilu.org#23200,"KOTABUMI UDIK, KOTABUMI, LAMPUNG UTARA, LAMPUNG",17,55,83,138
https://kawalpemilu.org#23016,"VARIA AGUNG, SEPUTIH MATARAM, LAMPUNG TENGAH, LAMPUNG",10,184,33,217
https://kawalpemilu.org#24365,"GUNUNG AGUNG, SEKAMPUNG UDIK, LAMPUNG TIMUR, LAMPUNG",12,146,12,158
https://kawalpemilu.org#23524,"SUKAJAYA, SUMBER JAYA, LAMPUNG BARAT, LAMPUNG",5,121,101,222
https://kawalpemilu.org#24781,"BAKUNG, TELUKBETUNG BARAT, KOTA BANDAR LAMPUNG, LAMPUNG",9,132,116,248
https://kawalpemilu.org#24075,"REJO SARI, ULU BELU, TANGGAMUS, LAMPUNG",2,199,26,225
https://kawalpemilu.org#24781,"BAKUNG, TELUKBETUNG BARAT, KOTA BANDAR LAMPUNG, LAMPUNG",10,98,139,237
https://kawalpemilu.org#22916,"HADUYANG RATU, PADANG RATU, LAMPUNG TENGAH, LAMPUNG",8,38,105,143
https://kawalpemilu.org#24711,"KAMPUNG BARU, LABUHAN RATU, KOTA BANDAR LAMPUNG, LAMPUNG",6,124,155,279
https://kawalpemilu.org#24840,"YOSODADI, METRO TIMUR, KOTA METRO, LAMPUNG",12,163,83,246
https://kawalpemilu.org#87255,"KOTA SEPANG, LABUHAN RATU, KOTA BANDAR LAMPUNG, LAMPUNG",5,70,89,159
https://kawalpemilu.org#24805,"PERUMNAS WAY KANDIS, TANJUNG SENANG, KOTA BANDAR LAMPUNG, LAMPUNG",19,49,116,165
https://kawalpemilu.org#84831,"PANGGUNG REJO UTARA, SUKOHARJO, PRINGSEWU, LAMPUNG",5,123,32,155
https://kawalpemilu.org#24222,"LABUHAN MARINGGAI, LABUHAN MARINGGAI, LAMPUNG TIMUR, LAMPUNG",30,189,26,215
https://kawalpemilu.org#23470,"WAY JAMBU, PESISIR SELATAN, PESISIR BARAT, LAMPUNG",2,103,52,155
https://kawalpemilu.org#87860,"CERINGIN SARI, WAY RATAI, PESAWARAN, LAMPUNG",2,165,39,204
https://kawalpemilu.org#23979,"AIR BAKOMAN, PULAU PANGGUNG, TANGGAMUS, LAMPUNG",2,84,98,182
https://kawalpemilu.org#23162,"SUKO BINANGUN, WAY SEPUTIH, LAMPUNG TENGAH, LAMPUNG",3,163,62,225
https://kawalpemilu.org#22965,"YUKUM JAYA, TERBANGGI BESAR, LAMPUNG TENGAH, LAMPUNG",46,81,88,169
https://kawalpemilu.org#24744,"KEBON JERUK, TANJUNGKARANG TIMUR, KOTA BANDAR LAMPUNG, LAMPUNG",4,91,115,206
https://kawalpemilu.org#24068,"PAGAR ALAM ULU BELU, ULU BELU, TANGGAMUS, LAMPUNG",5,81,77,158
https://kawalpemilu.org#24007,"SUMANDA, PUGUNG, TANGGAMUS, LAMPUNG",5,99,105,204
https://kawalpemilu.org#84003,"PAGAR BUKIT INDUK, BANGKUNAT, PESISIR BARAT, LAMPUNG",3,49,127,176
https://kawalpemilu.org#24035,"SIDODADI, SEMAKA, TANGGAMUS, LAMPUNG",2,120,89,209
https://kawalpemilu.org#23208,"KOTA GAPURA, KOTABUMI, LAMPUNG UTARA, LAMPUNG",119,26,100,126
https://kawalpemilu.org#22651,"TENGKUJUH, KALIANDA, LAMPUNG SELATAN, LAMPUNG",1,61,119,180
https://kawalpemilu.org#23275,"TRIMODADI, ABUNG SELATAN, LAMPUNG UTARA, LAMPUNG",66,131,85,216
https://kawalpemilu.org#24038,"KANOMAN, SEMAKA, TANGGAMUS, LAMPUNG",1,96,115,211
https://kawalpemilu.org#22401,"GEMAH RIPAH, PAGELARAN, PRINGSEWU, LAMPUNG",2,130,64,194
https://kawalpemilu.org#22774,"KARANG SARI, KETAPANG, LAMPUNG SELATAN, LAMPUNG",3,120,78,198
