https://kawalpemilu.org#44051,"REMBUN, DAMPIT, MALANG, JAWA TIMUR",6,118,65,183
https://kawalpemilu.org#48428,"MOJORANU, DANDER, BOJONEGORO, JAWA TIMUR",2,193,21,214
https://kawalpemilu.org#47798,"PAJARAN, SARADAN, MADIUN, JAWA TIMUR",2,151,40,191
https://kawalpemilu.org#47528,"KEDONDONG, BAGOR, NGANJUK, JAWA TIMUR",5,162,27,189
https://kawalpemilu.org#44240,"MANGLIAWAN, PAKIS, MALANG, JAWA TIMUR",9,207,61,268
https://kawalpemilu.org#46394,"KEDUNGPANDAN, JABON, SIDOARJO, JAWA TIMUR",8,170,49,219
https://kawalpemilu.org#51153,"KEPANJENLOR, KEPANJENKIDUL, KOTA BLITAR, JAWA TIMUR",6,142,52,194
https://kawalpemilu.org#51312,"PULOREJO, PRAJURIT KULON, KOTA MOJOKERTO, JAWA TIMUR",10,165,73,238
https://kawalpemilu.org#44260,"NGAJUM, NGAJUM, MALANG, JAWA TIMUR",7,183,34,217
https://kawalpemilu.org#51100,"POJOK, MOJOROTO, KOTA KEDIRI, JAWA TIMUR",1,147,46,193
https://kawalpemilu.org#44116,"TALANGSUKO, TUREN, MALANG, JAWA TIMUR",17,173,42,215
https://kawalpemilu.org#47216,"PULOREJO, TEMBELANG, JOMBANG, JAWA TIMUR",11,126,43,169
https://kawalpemilu.org#45618,"KLENANG KIDUL, BANYUANYAR, PROBOLINGGO, JAWA TIMUR",4,113,25,138
https://kawalpemilu.org#47243,"PLANDAAN, PLANDAAN, JOMBANG, JAWA TIMUR",5,127,45,172
https://kawalpemilu.org#49856,"MANYAR REJO, MANYAR, GRESIK, JAWA TIMUR",1,161,102,263
https://kawalpemilu.org#50427,"BATOPORO TIMUR, KEDUNGDUNG, SAMPANG, JAWA TIMUR",30,171,55,226
https://kawalpemilu.org#45022,"SINGOJURUH, SINGOJURUH, BANYUWANGI, JAWA TIMUR",21,170,44,214
https://kawalpemilu.org#46641,"SAWOTRATAP, GEDANGAN, SIDOARJO, JAWA TIMUR",9,123,67,190
https://kawalpemilu.org#42565,"KLEPU, SUDIMORO, PACITAN, JAWA TIMUR",6,93,77,170
https://kawalpemilu.org#44808,"JEMBERKIDUL, KALIWATES, JEMBER, JAWA TIMUR",29,116,62,178
https://kawalpemilu.org#44265,"KESAMBEN, NGAJUM, MALANG, JAWA TIMUR",13,112,55,167
https://kawalpemilu.org#46321,"SEBANI, TARIK, SIDOARJO, JAWA TIMUR",8,143,65,208
https://kawalpemilu.org#46995,"KENANTEN, PURI, MOJOKERTO, JAWA TIMUR",10,154,84,238
https://kawalpemilu.org#48145,"JATEN, JOGOROGO, NGAWI, JAWA TIMUR",7,134,35,169
https://kawalpemilu.org#50422,"BANJAR, KEDUNGDUNG, SAMPANG, JAWA TIMUR",2,70,144,214
https://kawalpemilu.org#44770,"SERUT, PANTI, JEMBER, JAWA TIMUR",19,121,55,176
https://kawalpemilu.org#47850,"WONOASRI, WONOASRI, MADIUN, JAWA TIMUR",7,137,44,181
https://kawalpemilu.org#47040,"NGORO, NGORO, JOMBANG, JAWA TIMUR",5,157,45,202
https://kawalpemilu.org#50051,"JADDIH, SOCAH, BANGKALAN, JAWA TIMUR",10,31,105,136
https://kawalpemilu.org#51554,"SISIR, BATU, KOTA BATU, JAWA TIMUR",9,172,62,234
https://kawalpemilu.org#43892,"SIMAN, KEPUNG, KEDIRI, JAWA TIMUR",17,122,53,175
https://kawalpemilu.org#51178,"PURWANTORO, BLIMBING, KOTA MALANG, JAWA TIMUR",36,153,93,246
https://kawalpemilu.org#44081,"BELUNG, PONCOKUSUMO, MALANG, JAWA TIMUR",6,194,26,220
https://kawalpemilu.org#47591,"SANGGRAHAN, GONDANG, NGANJUK, JAWA TIMUR",9,146,5,151
https://kawalpemilu.org#84966,"BUGUL LOR, PANGGUNGREJO, KOTA PASURUAN, JAWA TIMUR",7,119,90,209
https://kawalpemilu.org#45885,"POHSANGIT LOR, WONOMERTO, PROBOLINGGO, JAWA TIMUR",3,111,91,202
https://kawalpemilu.org#45116,"SONGGON, SONGGON, BANYUWANGI, JAWA TIMUR",24,174,43,217
https://kawalpemilu.org#48964,"PAKEL, MONTONG, TUBAN, JAWA TIMUR",12,122,68,190
https://kawalpemilu.org#44880,"LEMBENGAN, LEDOKOMBO, JEMBER, JAWA TIMUR",12,159,57,216
https://kawalpemilu.org#49573,"TAMBAKRIGADUNG, TIKUNG, LAMONGAN, JAWA TIMUR",18,106,63,169
https://kawalpemilu.org#44817,"JEMBERLOR, PATRANG, JEMBER, JAWA TIMUR",50,72,42,114
https://kawalpemilu.org#47808,"SAMBIREJO, SARADAN, MADIUN, JAWA TIMUR",2,124,51,175
https://kawalpemilu.org#43758,"WONOREJO TRISULO, PLOSOKLATEN, KEDIRI, JAWA TIMUR",4,139,16,155
https://kawalpemilu.org#44000,"DONOMULYO, DONOMULYO, MALANG, JAWA TIMUR",23,161,35,196
https://kawalpemilu.org#44788,"MANGARAN, AJUNG, JEMBER, JAWA TIMUR",35,151,35,186
https://kawalpemilu.org#45392,"SUMBERJERUK, JAMBESARI DARUS SHOLAH, BONDOWOSO, JAWA TIMUR",9,35,98,133
https://kawalpemilu.org#49637,"BAPUHBANDUNG, GLAGAH, LAMONGAN, JAWA TIMUR",1,132,67,199
https://kawalpemilu.org#44311,"BANJARARUM, SINGOSARI, MALANG, JAWA TIMUR",34,115,123,238
https://kawalpemilu.org#45107,"SUMBERKENCONO, WONGSOREJO, BANYUWANGI, JAWA TIMUR",6,173,60,233
https://kawalpemilu.org#46546,"WONOKUPANG, BALONGBENDO, SIDOARJO, JAWA TIMUR",4,156,35,191
https://kawalpemilu.org#46833,"KALEN, DLANGGU, MOJOKERTO, JAWA TIMUR",9,177,26,203
https://kawalpemilu.org#58473,"SIMPANG EMPAT, TANGARAN, SAMBAS, KALIMANTAN BARAT",2,100,77,177
https://kawalpemilu.org#58860,"BATU MAS, NANGA TAYAP, KETAPANG, KALIMANTAN BARAT",5,151,8,159
https://kawalpemilu.org#59053,"BALAI HARAPAN, TEMPUNAK, SINTANG, KALIMANTAN BARAT",2,191,54,245
https://kawalpemilu.org#58713,"BULU BALA, BALAI, SANGGAU, KALIMANTAN BARAT",3,163,16,179
https://kawalpemilu.org#60188,"KOTA BARU, PONTIANAK SELATAN, KOTA PONTIANAK, KALIMANTAN BARAT",54,80,124,204
https://kawalpemilu.org#58726,"MELIAU HULU, MELIAU, SANGGAU, KALIMANTAN BARAT",2,39,120,159
https://kawalpemilu.org#59246,"SAWANG SENGHIANG, SERAWAI, SINTANG, KALIMANTAN BARAT",3,82,10,92
https://kawalpemilu.org#60075,"MELANA, SOKAN, MELAWI, KALIMANTAN BARAT",3,19,180,199
https://kawalpemilu.org#58653,"TANJUNG MERPATI, KEMBAYAN, SANGGAU, KALIMANTAN BARAT",1,45,87,132
https://kawalpemilu.org#60152,"SUNGAI MATA-MATA, SIMPANG HILIR, KAYONG UTARA, KALIMANTAN BARAT",3,104,129,233
https://kawalpemilu.org#59731,"GARU, MEMPAWAH HULU, LANDAK, KALIMANTAN BARAT",6,128,16,144
https://kawalpemilu.org#60253,"SIJANGKUNG, SINGKAWANG SELATAN, KOTA SINGKAWANG, KALIMANTAN BARAT",13,163,10,173
https://kawalpemilu.org#59561,"SUNGAI JAGA B, SUNGAI RAYA, BENGKAYANG, KALIMANTAN BARAT",4,49,159,208
https://kawalpemilu.org#60225,"ROBAN, SINGKAWANG TENGAH, KOTA SINGKAWANG, KALIMANTAN BARAT",70,27,142,169
https://kawalpemilu.org#58360,"SERINDANG, TEBAS, SAMBAS, KALIMANTAN BARAT",6,87,88,175
https://kawalpemilu.org#59745,"NANGKA, MENJALIN, LANDAK, KALIMANTAN BARAT",1,123,4,127
https://kawalpemilu.org#60170,"DUSUN KECIL, PULAU MAYA, KAYONG UTARA, KALIMANTAN BARAT",2,60,90,150
https://kawalpemilu.org#60207,"BATU LAYANG, PONTIANAK UTARA, KOTA PONTIANAK, KALIMANTAN BARAT",23,14,107,121
https://kawalpemilu.org#60206,"SIANTAN HILIR, PONTIANAK UTARA, KOTA PONTIANAK, KALIMANTAN BARAT",83,130,53,183
https://kawalpemilu.org#60200,"SUNGAI JAWI DALAM, PONTIANAK BARAT, KOTA PONTIANAK, KALIMANTAN BARAT",28,77,148,225
https://kawalpemilu.org#58502,"PAK LAHENG, TOHO, MEMPAWAH, KALIMANTAN BARAT",1,151,6,157
https://kawalpemilu.org#62470,"SUNGAI TUAN ULU, ASTAMBUL, BANJAR, KALIMANTAN SELATAN",1,25,159,184
https://kawalpemilu.org#63033,"JAMBU HULU, PADANG BATUNG, HULU SUNGAI SELATAN, KALIMANTAN SELATAN",3,33,129,162
https://kawalpemilu.org#63842,"KAMPUNG BARU, SIMPANG EMPAT, TANAH BUMBU, KALIMANTAN SELATAN",19,67,80,147
https://kawalpemilu.org#62412,"SEKUMPUL, MARTAPURA, BANJAR, KALIMANTAN SELATAN",16,45,116,161
https://kawalpemilu.org#62615,"BALIANGIN, SAMBUNG MAKMUR, BANJAR, KALIMANTAN SELATAN",5,45,95,140
https://kawalpemilu.org#62406,"KERATON, MARTAPURA, BANJAR, KALIMANTAN SELATAN",29,74,104,178
https://kawalpemilu.org#62615,"BALIANGIN, SAMBUNG MAKMUR, BANJAR, KALIMANTAN SELATAN",2,66,109,175
https://kawalpemilu.org#64067,"SURGI MUFTI, BANJARMASIN UTARA, KOTA BANJARMASIN, KALIMANTAN SELATAN",41,72,155,227
https://kawalpemilu.org#63255,"HILIR BANUA, PANDAWAN, HULU SUNGAI TENGAH, KALIMANTAN SELATAN",4,26,146,172
https://kawalpemilu.org#62266,"BINTURUNG, PAMUKAN UTARA, KOTABARU, KALIMANTAN SELATAN",16,80,26,106
https://kawalpemilu.org#64030,"KELAYAN SELATAN, BANJARMASIN SELATAN, KOTA BANJARMASIN, KALIMANTAN SELATAN",33,34,52,86
https://kawalpemilu.org#62661,"PURWOSARI I, TAMBAN, BARITO KUALA, KALIMANTAN SELATAN",3,69,109,178
https://kawalpemilu.org#62539,"APUAI, ARANIO, BANJAR, KALIMANTAN SELATAN",1,75,94,169
https://kawalpemilu.org#64087,"LANDASAN ULIN TIMUR, LANDASAN ULIN, KOTA BANJARBARU, KALIMANTAN SELATAN",40,121,92,213
https://kawalpemilu.org#63787,"WONOREJO, SATUI, TANAH BUMBU, KALIMANTAN SELATAN",9,145,60,205
https://kawalpemilu.org#62608,"TAMBAK ANYAR ILIR, MARTAPURA TIMUR, BANJAR, KALIMANTAN SELATAN",2,59,112,171
https://kawalpemilu.org#63856,"DUKUH REJO, MANTEWE, TANAH BUMBU, KALIMANTAN SELATAN",3,96,87,183
https://kawalpemilu.org#61365,"PADANG, SUKAMARA, SUKAMARA, KALIMANTAN TENGAH",8,131,94,225
https://kawalpemilu.org#60657,"SELAT TENGAH, SELAT, KAPUAS, KALIMANTAN TENGAH",39,35,72,107
https://kawalpemilu.org#60607,"WARINGIN AGUNG, ANTANG KALANG, KOTAWARINGIN TIMUR, KALIMANTAN TENGAH",3,120,18,138
https://kawalpemilu.org#61960,"PETUK BARUNAI, RAKUMPIT, KOTA PALANGKARAYA, KALIMANTAN TENGAH",3,94,23,117
https://kawalpemilu.org#61947,"MENTENG, JEKAN RAYA, KOTA PALANGKARAYA, KALIMANTAN TENGAH",120,87,26,113
https://kawalpemilu.org#61666,"GOHA, BANAMA TINGANG, PULANG PISAU, KALIMANTAN TENGAH",2,246,10,256
https://kawalpemilu.org#61373,"KUALA JELAI, JELAI, SUKAMARA, KALIMANTAN TENGAH",3,146,90,236
https://kawalpemilu.org#60452,"SUNGAI MELAWEN, PANGKALAN LADA, KOTAWARINGIN BARAT, KALIMANTAN TENGAH",7,177,53,230
https://kawalpemilu.org#60955,"MUARA RIPUNG, DUSUN SELATAN, BARITO SELATAN, KALIMANTAN TENGAH",2,144,10,154
https://kawalpemilu.org#60574,"HANAUT, PULAU HANAUT, KOTAWARINGIN TIMUR, KALIMANTAN TENGAH",1,70,69,139
https://kawalpemilu.org#64571,"TANJUNG BATU, PULAU DERAWAN, BERAU, KALIMANTAN TIMUR",15,125,62,187
https://kawalpemilu.org#65506,"RAWA MULIA, BABULU, PENAJAM PASER UTARA, KALIMANTAN TIMUR",2,177,41,218
https://kawalpemilu.org#65575,"SUNGAI KELEDANG, SAMARINDA SEBERANG, KOTA SAMARINDA, KALIMANTAN TIMUR",44,40,69,109
https://kawalpemilu.org#64268,"LOH SUMBER, LOA KULU, KUTAI KARTANEGARA, KALIMANTAN TIMUR",5,109,126,235
https://kawalpemilu.org#65550,"KARANG JATI, BALIKPAPAN TENGAH, KOTA BALIKPAPAN, KALIMANTAN TIMUR",12,96,58,154
https://kawalpemilu.org#65615,"SUNGAI PINANG DALAM, SUNGAI PINANG, KOTA SAMARINDA, KALIMANTAN TIMUR",82,88,104,192
https://kawalpemilu.org#65660,"LOK TUAN, BONTANG UTARA, KOTA BONTANG, KALIMANTAN TIMUR",36,73,98,171
https://kawalpemilu.org#65473,"PETUNG, PENAJAM, PENAJAM PASER UTARA, KALIMANTAN TIMUR",1,112,125,237
https://kawalpemilu.org#65481,"PENAJAM, PENAJAM, PENAJAM PASER UTARA, KALIMANTAN TIMUR",9,52,166,218
https://kawalpemilu.org#65386,"KOMBENG INDAH, KOMBENG, KUTAI TIMUR, KALIMANTAN TIMUR",2,187,33,220
https://kawalpemilu.org#65243,"LINGGANG MELAPEH, LINGGANG BIGUNG, KUTAI BARAT, KALIMANTAN TIMUR",15,200,14,214
https://kawalpemilu.org#65381,"MAKMUR JAYA, KOMBENG, KUTAI TIMUR, KALIMANTAN TIMUR",6,170,26,196
https://kawalpemilu.org#65660,"LOK TUAN, BONTANG UTARA, KOTA BONTANG, KALIMANTAN TIMUR",58,122,161,283
https://kawalpemilu.org#65493,"GIRIPURWA, PENAJAM, PENAJAM PASER UTARA, KALIMANTAN TIMUR",4,146,88,234
https://kawalpemilu.org#64945,"SELISUN, NUNUKAN SELATAN, NUNUKAN, KALIMANTAN UTARA",14,153,51,204
https://kawalpemilu.org#64724,"NUNUKAN TIMUR, NUNUKAN, NUNUKAN, KALIMANTAN UTARA",29,87,40,127
https://kawalpemilu.org#64948,"TANJUNG HARAPAN, NUNUKAN SELATAN, NUNUKAN, KALIMANTAN UTARA",4,137,51,188
https://kawalpemilu.org#25195,"DUL, PANGKALAN BARU, BANGKA TENGAH, KEPULAUAN BANGKA BELITUNG",4,81,142,223
https://kawalpemilu.org#25030,"KACE, MENDO BARAT, BANGKA, KEPULAUAN BANGKA BELITUNG",6,106,83,189
https://kawalpemilu.org#25396,"PARIT LALANG, RANGKUI, KOTA PANGKALPINANG, KEPULAUAN BANGKA BELITUNG",13,145,128,273
https://kawalpemilu.org#25315,"TELUK LIMAU, PARITTIGA, BANGKA BARAT, KEPULAUAN BANGKA BELITUNG",7,151,48,199
https://kawalpemilu.org#25333,"BATU PENYU, GANTUNG, BELITUNG TIMUR, KEPULAUAN BANGKA BELITUNG",8,191,24,215
https://kawalpemilu.org#25788,"MANGSANG, SEI BEDUK, KOTA BATAM, KEPULAUAN RIAU",96,129,54,183
https://kawalpemilu.org#25809,"SUNGAI PANAS, BATAM KOTA, KOTA BATAM, KEPULAUAN RIAU",69,120,45,165
https://kawalpemilu.org#25783,"TANJUNG UMA, LUBUK BAJA, KOTA BATAM, KEPULAUAN RIAU",13,90,151,241
https://kawalpemilu.org#25812,"TEMBESI, SAGULUNG, KOTA BATAM, KEPULAUAN RIAU",21,72,154,226
https://kawalpemilu.org#25764,"SUNGAI HARAPAN, SEKUPANG, KOTA BATAM, KEPULAUAN RIAU",32,213,6,219
https://kawalpemilu.org#25817,"SUNGAI PELUNGGUT, SAGULUNG, KOTA BATAM, KEPULAUAN RIAU",9,94,32,126
https://kawalpemilu.org#25559,"MERAL KOTA, MERAL, KARIMUN, KEPULAUAN RIAU",9,121,37,158
https://kawalpemilu.org#24086,"BETUNG, PEMATANG SAWA, TANGGAMUS, LAMPUNG",2,25,141,166
https://kawalpemilu.org#22965,"YUKUM JAYA, TERBANGGI BESAR, LAMPUNG TENGAH, LAMPUNG",14,37,148,185
https://kawalpemilu.org#23055,"RENGAS, BEKRI, LAMPUNG TENGAH, LAMPUNG",9,119,78,197
https://kawalpemilu.org#24727,"SUKAJAWA, TANJUNGKARANG BARAT, KOTA BANDAR LAMPUNG, LAMPUNG",18,63,124,187
https://kawalpemilu.org#23735,"TEMBELANG, BANDAR NEGERI SUOH, LAMPUNG BARAT, LAMPUNG",2,113,37,150
https://kawalpemilu.org#84831,"PANGGUNG REJO UTARA, SUKOHARJO, PRINGSEWU, LAMPUNG",5,123,32,155
https://kawalpemilu.org#22984,"RAMA NIRWANA, SEPUTIH RAMAN, LAMPUNG TENGAH, LAMPUNG",1,157,54,211
https://kawalpemilu.org#23667,"ULU KRUI, WAY KRUI, PESISIR BARAT, LAMPUNG",2,96,126,222
https://kawalpemilu.org#22954,"BADRAN SARI, PUNGGUR, LAMPUNG TENGAH, LAMPUNG",2,97,55,152
https://kawalpemilu.org#22909,"BANDAR SARI, PADANG RATU, LAMPUNG TENGAH, LAMPUNG",9,98,80,178
https://kawalpemilu.org#87255,"KOTA SEPANG, LABUHAN RATU, KOTA BANDAR LAMPUNG, LAMPUNG",7,68,100,168
https://kawalpemilu.org#23220,"KOTA AGUNG, SUNGKAI SELATAN, LAMPUNG UTARA, LAMPUNG",6,0,0,0
https://kawalpemilu.org#22693,"PARDASUKA, KATIBUNG, LAMPUNG SELATAN, LAMPUNG",26,166,57,223
https://kawalpemilu.org#22945,"TEMPURAN, TRIMURJO, LAMPUNG TENGAH, LAMPUNG",8,129,132,261
https://kawalpemilu.org#24261,"SUMBERGEDE, SEKAMPUNG, LAMPUNG TIMUR, LAMPUNG",8,97,83,180
https://kawalpemilu.org#23135,"SENDANG MULYO, SENDANG AGUNG, LAMPUNG TENGAH, LAMPUNG",18,134,74,208
https://kawalpemilu.org#23574,"TANJUNGRAYA, SUKAU, LAMPUNG BARAT, LAMPUNG",4,71,114,185
https://kawalpemilu.org#23316,"KELAPA TUJUH, KOTABUMI SELATAN, LAMPUNG UTARA, LAMPUNG",139,41,133,174
https://kawalpemilu.org#23764,"MORIS JAYA, BANJAR AGUNG, TULANG BAWANG, LAMPUNG",5,211,12,223
https://kawalpemilu.org#23086,"MATARAM UDIK, BANDAR MATARAM, LAMPUNG TENGAH, LAMPUNG",81,158,69,227
https://kawalpemilu.org#23881,"PANCA KARSA PURNA JAYA, BANJAR BARU, TULANG BAWANG, LAMPUNG",4,84,139,223
https://kawalpemilu.org#24227,"KARYA TANI, LABUHAN MARINGGAI, LAMPUNG TIMUR, LAMPUNG",8,141,23,164
https://kawalpemilu.org#23802,"BOGATAMA, PENAWAR TAMA, TULANG BAWANG, LAMPUNG",2,115,43,158
https://kawalpemilu.org#23040,"GUNUNG AGUNG, TERUSAN NUNYAI, LAMPUNG TENGAH, LAMPUNG",24,147,57,204
https://kawalpemilu.org#22834,"BARU RANJI, MERBAU MATARAM, LAMPUNG SELATAN, LAMPUNG",7,63,64,127
https://kawalpemilu.org#23830,"AGUNG JAYA, BANJAR MARGO, TULANG BAWANG, LAMPUNG",9,179,46,225
https://kawalpemilu.org#24825,"HADIMULYO TIMUR, METRO PUSAT, KOTA METRO, LAMPUNG",2,84,136,220
https://kawalpemilu.org#22525,"PANARAGAN, TULANG BAWANG TENGAH, TULANG BAWANG BARAT, LAMPUNG",7,30,101,131
https://kawalpemilu.org#22607,"HAJIMENA, NATAR, LAMPUNG SELATAN, LAMPUNG",16,42,70,112
https://kawalpemilu.org#24420,"NEGERI AGUNG, GUNUNG PELINDUNG, LAMPUNG TIMUR, LAMPUNG",11,174,17,191
https://kawalpemilu.org#23769,"TRI TUNGGAL JAYA, BANJAR AGUNG, TULANG BAWANG, LAMPUNG",3,101,95,196
https://kawalpemilu.org#22744,"MEKAR MULYA, PALAS, LAMPUNG SELATAN, LAMPUNG",15,107,74,181
https://kawalpemilu.org#24648,"BANJAR SAKTI, GUNUNG LABUHAN, WAY KANAN, LAMPUNG",1,64,114,178
https://kawalpemilu.org#22943,"NOTO HARJO, TRIMURJO, LAMPUNG TENGAH, LAMPUNG",11,149,55,204
https://kawalpemilu.org#24227,"KARYA TANI, LABUHAN MARINGGAI, LAMPUNG TIMUR, LAMPUNG",15,121,54,175
https://kawalpemilu.org#-990474,"Kuwait City, Kuwait City, Kuwait, Luar Negeri",5,183,189,372
https://kawalpemilu.org#-991204,"Perth, Perth, Australia, Luar Negeri",18,63,13,76
https://kawalpemilu.org#-991304,"Taipei, Taipei, Taiwan, Luar Negeri",1002,922,148,1070
https://kawalpemilu.org#-990594,"New Delhi, New Delhi, India, Luar Negeri",1001,67,21,88
https://kawalpemilu.org#77631,"LEMO LEMO, GANE BARAT, HALMAHERA SELATAN, MALUKU UTARA",2,62,80,142
https://kawalpemilu.org#77313,"NUSLIKO, WEDA, HALMAHERA TENGAH, MALUKU UTARA",2,125,8,133
https://kawalpemilu.org#89622,"SAMA, SULABESI TIMUR, KEPULAUAN SULA, MALUKU UTARA",2,50,99,149
https://kawalpemilu.org#77289,"TOBELOS, IBU SELATAN, HALMAHERA BARAT, MALUKU UTARA",2,132,13,145
https://kawalpemilu.org#77515,"SOAKONORA, GALELA SELATAN, HALMAHERA UTARA, MALUKU UTARA",3,56,96,152
https://kawalpemilu.org#76391,"TUHAHA, SAPARUA TIMUR, MALUKU TENGAH, MALUKU",6,174,4,178
https://kawalpemilu.org#76787,"URAUR, KAIRATU, SERAM BAGIAN BARAT, MALUKU",1,217,10,227
https://kawalpemilu.org#77035,"HUNUTH/DURIAN PATAH, TELUK AMBON, KOTA AMBON, MALUKU",7,37,203,240
https://kawalpemilu.org#76257,"PASIR PUTIH, KEPALA MADAN, BURU SELATAN, MALUKU",7,103,42,145
https://kawalpemilu.org#77040,"HATIVE BESAR, TELUK AMBON, KOTA AMBON, MALUKU",7,168,4,172
https://kawalpemilu.org#76287,"TAMILOUW, AMAHAI, MALUKU TENGAH, MALUKU",19,156,52,208
https://kawalpemilu.org#76644,"LORWEMBUN, KORMOMOLIN, MALUKU TENGGARA BARAT, MALUKU",1,140,2,142
https://kawalpemilu.org#54213,"SEPAKEK, PRINGGARATA, LOMBOK TENGAH, NUSA TENGGARA BARAT",7,51,90,141
https://kawalpemilu.org#54960,"TANJUNG KARANG, SEKARBELA, KOTA MATARAM, NUSA TENGGARA BARAT",9,59,114,173
https://kawalpemilu.org#54424,"MOTONG, UTAN, SUMBAWA, NUSA TENGGARA BARAT",1,62,166,228
https://kawalpemilu.org#54717,"ROKA, BELO, BIMA, NUSA TENGGARA BARAT",5,14,173,187
https://kawalpemilu.org#85057,"LENEK RAMBAN BIAK, AIKMEL, LOMBOK TIMUR, NUSA TENGGARA BARAT",2,119,35,154
https://kawalpemilu.org#54249,"PANDAN INDAH, PRAYA BARAT DAYA, LOMBOK TENGAH, NUSA TENGGARA BARAT",16,65,78,143
https://kawalpemilu.org#54197,"GANTI, PRAYA TIMUR, LOMBOK TENGAH, NUSA TENGGARA BARAT",26,193,34,227
https://kawalpemilu.org#54959,"KARANG PULE, SEKARBELA, KOTA MATARAM, NUSA TENGGARA BARAT",40,102,101,203
https://kawalpemilu.org#54295,"LENDANG NANGKA, MASBAGIK, LOMBOK TIMUR, NUSA TENGGARA BARAT",30,54,109,163
https://kawalpemilu.org#54290,"PAOK MOTONG, MASBAGIK, LOMBOK TIMUR, NUSA TENGGARA BARAT",39,33,129,162
https://kawalpemilu.org#54083,"SESELA, GUNUNGSARI, LOMBOK BARAT, NUSA TENGGARA BARAT",32,42,147,189
https://kawalpemilu.org#54182,"MANGKUNG, PRAYA BARAT, LOMBOK TENGAH, NUSA TENGGARA BARAT",7,61,128,185
https://kawalpemilu.org#55000,"JATIWANGI, ASAKOTA, KOTA BIMA, NUSA TENGGARA BARAT",3,53,167,220
https://kawalpemilu.org#54719,"TARLAWI, WAWO, BIMA, NUSA TENGGARA BARAT",4,49,184,233
https://kawalpemilu.org#85077,"PRINGGASELA TIMUR, PRINGGASELA, LOMBOK TIMUR, NUSA TENGGARA BARAT",6,129,60,189
https://kawalpemilu.org#54147,"PUYUNG, JONGGAT, LOMBOK TENGAH, NUSA TENGGARA BARAT",34,30,122,152
https://kawalpemilu.org#54602,"DORE BARA, DOMPU, DOMPU, NUSA TENGGARA BARAT",7,48,147,195
https://kawalpemilu.org#54330,"KALIJAGA TIMUR, AIKMEL, LOMBOK TIMUR, NUSA TENGGARA BARAT",4,32,142,174
https://kawalpemilu.org#85010,"BATU PUTIK, KERUAK, LOMBOK TIMUR, NUSA TENGGARA BARAT",3,75,104,179
https://kawalpemilu.org#55062,"PEMENANG BARAT, PEMENANG, LOMBOK UTARA, NUSA TENGGARA BARAT",12,74,124,198
https://kawalpemilu.org#57151,"LIANG BUA, RAHONG UTARA, MANGGARAI, NUSA TENGGARA TIMUR",1,83,3,86
https://kawalpemilu.org#55123,"KEL. OESAO, KUPANG TIMUR, KUPANG, NUSA TENGGARA TIMUR",4,235,8,243
https://kawalpemilu.org#58058,"NAIMATA, MAULAFA, KOTA KUPANG, NUSA TENGGARA TIMUR",8,195,5,200
https://kawalpemilu.org#55554,"KIUFATU, KUALIN, TIMOR TENGAH SELATAN, NUSA TENGGARA TIMUR",6,193,9,202
https://kawalpemilu.org#56808,"MAUSAMBI, MAUROLE, ENDE, NUSA TENGGARA TIMUR",4,159,13,172
https://kawalpemilu.org#55533,"SE'I, KOLBANO, TIMOR TENGAH SELATAN, NUSA TENGGARA TIMUR",3,225,11,236
https://kawalpemilu.org#55688,"MOTADIK, BIBOKI ANLEU, TIMOR TENGAH UTARA, NUSA TENGGARA TIMUR",1,232,9,241
https://kawalpemilu.org#55136,"MANUSAK, KUPANG TIMUR, KUPANG, NUSA TENGGARA TIMUR",3,139,56,195
https://kawalpemilu.org#56767,"MAUTENDA, WEWARIA, ENDE, NUSA TENGGARA TIMUR",9,111,0,111
https://kawalpemilu.org#90894,"WAITARU, KODI UTARA, SUMBA BARAT DAYA, NUSA TENGGARA TIMUR",5,160,13,173
https://kawalpemilu.org#56743,"WOLOTOLO TENGAH, DETUSOKO, ENDE, NUSA TENGGARA TIMUR",1,193,2,195
https://kawalpemilu.org#58086,"FONTEIN, KOTA RAJA, KOTA KUPANG, NUSA TENGGARA TIMUR",6,221,6,227
https://kawalpemilu.org#57488,"PADA, NUBATUKAN, LEMBATA, NUSA TENGGARA TIMUR",1,192,37,229
https://kawalpemilu.org#56831,"DETUPERA, LIO TIMUR, ENDE, NUSA TENGGARA TIMUR",1,171,7,178
https://kawalpemilu.org#55889,"UMAKATAHAN, MALAKA TENGAH, MALAKA, NUSA TENGGARA TIMUR",8,123,1,124
https://kawalpemilu.org#91332,"TANA METE, KODI BANGEDO, SUMBA BARAT DAYA, NUSA TENGGARA TIMUR",1,219,9,228
https://kawalpemilu.org#55676,"MAUBELI, KOTA KEFAMENANU, TIMOR TENGAH UTARA, NUSA TENGGARA TIMUR",4,236,45,281
https://kawalpemilu.org#56612,"WURING, ALOK BARAT, SIKKA, NUSA TENGGARA TIMUR",5,153,54,207
https://kawalpemilu.org#57715,"GOLO NDARING, SANO NGGOANG, MANGGARAI BARAT, NUSA TENGGARA TIMUR",2,100,33,133
https://kawalpemilu.org#927830,"SRUMAKIT, AIFAT TIMUR SELATAN, MAYBRAT, PAPUA BARAT",1,50,0,50
https://kawalpemilu.org#82096,"MAKBUSUN, MAYAMUK, SORONG, PAPUA BARAT",15,74,86,160
https://kawalpemilu.org#82097,"MAKBALIM, MAYAMUK, SORONG, PAPUA BARAT",5,51,134,185
https://kawalpemilu.org#83126,"AISANDAMI, TELUK DUAIRI, TELUK WONDAMA, PAPUA BARAT",1,105,3,108
https://kawalpemilu.org#927665,"KOCUAS UTARA, AIFAT, MAYBRAT, PAPUA BARAT",1,210,0,210
https://kawalpemilu.org#79498,"PELANME, KELILA, MAMBERAMO TENGAH, PAPUA",1,300,0,300
https://kawalpemilu.org#79008,"ASIKI I, JAIR, BOVEN DIGOEL, PAPUA",55,53,15,68
https://kawalpemilu.org#79835,"SERINGGU JAYA, MERAUKE, MERAUKE, PAPUA",9,165,40,205
https://kawalpemilu.org#78572,"ALOPUR, KUARI, TOLIKARA, PAPUA",2,220,0,220
https://kawalpemilu.org#81354,"KAMEME, BIME, PEGUNUNGAN BINTANG, PAPUA",2,216,0,216
https://kawalpemilu.org#79835,"SERINGGU JAYA, MERAUKE, MERAUKE, PAPUA",12,75,13,88
https://kawalpemilu.org#81106,"MARARENA, SARMI, SARMI, PAPUA",9,80,40,120
https://kawalpemilu.org#930786,"KENEGI, EKADIDE, PANIAI, PAPUA",1,0,400,400
https://kawalpemilu.org#79832,"KELAPA LIMA, MERAUKE, MERAUKE, PAPUA",24,107,19,126
https://kawalpemilu.org#80010,"KOA, ANIMHA, MERAUKE, PAPUA",2,123,2,125
https://kawalpemilu.org#86794,"JUTA, GELOK BEAM, LANNY JAYA, PAPUA",2,210,0,210
https://kawalpemilu.org#79474,"LUARIMA, KOBAGMA, MAMBERAMO TENGAH, PAPUA",2,262,0,262
https://kawalpemilu.org#930635,"UTIKINI DUA, KUALA KENCANA, MIMIKA, PAPUA",1,300,0,300
https://kawalpemilu.org#86486,"LULIS WII, ABOY, PEGUNUNGAN BINTANG, PAPUA",1,202,0,202
https://kawalpemilu.org#86549,"OKBUMUL, OKLIP, PEGUNUNGAN BINTANG, PAPUA",1,114,0,114
https://kawalpemilu.org#79337,"RAYORI, KEPULAUAN ARURI, SUPIORI, PAPUA",6,193,4,197
https://kawalpemilu.org#79401,"BARAPASI, WAROPEN ATAS, MAMBERAMO RAYA, PAPUA",1,225,11,236
https://kawalpemilu.org#81028,"POUMAKO, MIMIKA TIMUR, MIMIKA, PAPUA",3,119,51,170
https://kawalpemilu.org#930777,"DIMIYA, YATAMO, PANIAI, PAPUA",1,291,0,291
https://kawalpemilu.org#14957,"UKUI I, UKUI, PELALAWAN, RIAU",8,133,92,225
https://kawalpemilu.org#15851,"BUKIT DATUK, DUMAI SELATAN, KOTA DUMAI, RIAU",11,106,48,154
https://kawalpemilu.org#15063,"SERAPUNG, KUALA KAMPAR, PELALAWAN, RIAU",7,55,73,128
https://kawalpemilu.org#15209,"BANGUN PURBA BARAT, BANGUN PURBA, ROKAN HULU, RIAU",1,70,167,237
https://kawalpemilu.org#14834,"Sencalang, Keritang, INDRAGIRI HILIR, RIAU",1,145,86,231
https://kawalpemilu.org#14095,"ALAH AIR TIMUR, TEBING TINGGI, KEPULAUAN MERANTI, RIAU",1,66,144,210
https://kawalpemilu.org#15493,"BUANTAN LESTARI, BUNGA RAYA, SIAK, RIAU",1,136,104,240
https://kawalpemilu.org#14504,"PANGKALAN KASAI, SIBERIDA, INDRAGIRI HULU, RIAU",11,72,90,162
https://kawalpemilu.org#15659,"SIKAKAK, CERENTI, KUANTAN SINGINGI, RIAU",4,24,171,195
https://kawalpemilu.org#14876,"SELENSEN, Kemuning, INDRAGIRI HILIR, RIAU",12,40,69,109
https://kawalpemilu.org#14170,"KUMANTAN, BANGKINANG KOTA, KAMPAR, RIAU",2,13,244,257
https://kawalpemilu.org#15511,"SIMPANG BELUTU, KANDIS, SIAK, RIAU",3,67,156,223
https://kawalpemilu.org#14992,"HARAPAN JAYA, PANGKALAN KURAS, PELALAWAN, RIAU",4,128,76,204
https://kawalpemilu.org#15854,"RATU SIMA, DUMAI SELATAN, KOTA DUMAI, RIAU",13,152,14,166
https://kawalpemilu.org#14970,"PANGKALAN KERINCI KOTA, PANGKALAN KERINCI, PELALAWAN, RIAU",81,29,134,163
https://kawalpemilu.org#15186,"RAMBAH, RAMBAH HILIR, ROKAN HULU, RIAU",19,90,41,131
https://kawalpemilu.org#931199,"TIRTASIAK, PAYUNG SEKAKI, KOTA PEKANBARU, RIAU",22,81,181,262
https://kawalpemilu.org#15214,"BONO TAPUNG, TANDUN, ROKAN HULU, RIAU",7,84,47,131
https://kawalpemilu.org#931187,"TOBEKGODANG, TAMPAN, KOTA PEKANBARU, RIAU",38,22,144,166
https://kawalpemilu.org#15872,"BAGAN BESAR, BUKIT KAPUR, KOTA DUMAI, RIAU",20,88,129,217
https://kawalpemilu.org#14769,"TANJUNGLAJAU, Kuala Indragiri, INDRAGIRI HILIR, RIAU",1,74,110,184
https://kawalpemilu.org#14763,"Suhada, Enok, INDRAGIRI HILIR, RIAU",4,78,142,220
https://kawalpemilu.org#76018,"PAPANDANGAN, ANREAPI, POLEWALI MANDAR, SULAWESI BARAT",2,154,68,222
https://kawalpemilu.org#76091,"BAURUNG, BANGGAE TIMUR, MAJENE, SULAWESI BARAT",4,134,97,231
https://kawalpemilu.org#75510,"TADUI, MAMUJU, MAMUJU, SULAWESI BARAT",7,180,79,259
https://kawalpemilu.org#76050,"BARU, BANGGAE, MAJENE, SULAWESI BARAT",3,114,106,220
https://kawalpemilu.org#75719,"OSANGO, MAMASA, MAMASA, SULAWESI BARAT",5,195,36,231
https://kawalpemilu.org#70848,"BONTO LANGKASA, MINASA TENE, PANGKAJENE DAN KEPULAUAN, SULAWESI SELATAN",7,64,141,205
https://kawalpemilu.org#72294,"MARGOMULYO, TOMONI TIMUR, LUWU TIMUR, SULAWESI SELATAN",6,146,84,230
https://kawalpemilu.org#71382,"LAMPA, DUAMPANUA, PINRANG, SULAWESI SELATAN",3,62,130,192
https://kawalpemilu.org#69667,"ANRANG, RILAUALE, BULUKUMBA, SULAWESI SELATAN",2,41,165,206
https://kawalpemilu.org#72081,"SALAMA, SABBANG, LUWU UTARA, SULAWESI SELATAN",2,104,84,188
https://kawalpemilu.org#90174,"WANASARI, ANGKONA, LUWU TIMUR, SULAWESI SELATAN",2,184,27,211
https://kawalpemilu.org#70611,"SADAR, TELLULIMPOE, BONE, SULAWESI SELATAN",2,220,22,242
