https://kawalpemilu.org#23530,"BEDUDU, BELALAU, LAMPUNG BARAT, LAMPUNG",2,37,165,202
https://kawalpemilu.org#23207,"SRI BASUKI, KOTABUMI, LAMPUNG UTARA, LAMPUNG",17,0,0,0
https://kawalpemilu.org#23191,"BUKIT KEMUNING, BUKIT KEMUNING, LAMPUNG UTARA, LAMPUNG",26,89,102,191
https://kawalpemilu.org#24395,"CATUR SWAKO, BUMI AGUNG, LAMPUNG TIMUR, LAMPUNG",6,116,38,154
https://kawalpemilu.org#22708,"PADAN, PENENGAHAN, LAMPUNG SELATAN, LAMPUNG",4,57,82,139
https://kawalpemilu.org#22635,"JATI BARU, TANJUNG BINTANG, LAMPUNG SELATAN, LAMPUNG",20,177,26,203
https://kawalpemilu.org#24410,"MANDALA SARI, MATARAM BARU, LAMPUNG TIMUR, LAMPUNG",7,147,41,188
https://kawalpemilu.org#23926,"SINGOSARI, TALANG PADANG, TANGGAMUS, LAMPUNG",5,63,75,138
https://kawalpemilu.org#22972,"PONCO WATI, TERBANGGI BESAR, LAMPUNG TENGAH, LAMPUNG",5,62,80,142
https://kawalpemilu.org#24220,"PUTRA AJI I, SUKADANA, LAMPUNG TIMUR, LAMPUNG",7,133,44,177
https://kawalpemilu.org#23303,"HANAKAU JAYA, SUNGKAI UTARA, LAMPUNG UTARA, LAMPUNG",1,0,0,0
https://kawalpemilu.org#24600,"SERUPA INDAH, PAKUAN RATU, WAY KANAN, LAMPUNG",11,89,36,125
https://kawalpemilu.org#23797,"TRI REJO MULYO, PENAWAR TAMA, TULANG BAWANG, LAMPUNG",3,127,41,168
https://kawalpemilu.org#23775,"GEDUNG MENENG, GEDUNG MENENG, TULANG BAWANG, LAMPUNG",16,133,91,224
https://kawalpemilu.org#22971,"TERBANGGI BESAR, TERBANGGI BESAR, LAMPUNG TENGAH, LAMPUNG",9,19,119,148
https://kawalpemilu.org#23979,"AIR BAKOMAN, PULAU PANGGUNG, TANGGAMUS, LAMPUNG",1,82,109,191
https://kawalpemilu.org#22907,"PURWO SARI, PADANG RATU, LAMPUNG TENGAH, LAMPUNG",4,125,107,232
https://kawalpemilu.org#23288,"KEMBANG GADING, ABUNG SELATAN, LAMPUNG UTARA, LAMPUNG",25,60,98,158
https://kawalpemilu.org#22665,"MERAK BELANTUNG, KALIANDA, LAMPUNG SELATAN, LAMPUNG",13,73,130,203
https://kawalpemilu.org#87418,"SUMUR TUJUH, WONOSOBO, TANGGAMUS, LAMPUNG",1,147,35,182
https://kawalpemilu.org#23282,"KALIBENING RAYA, ABUNG SELATAN, LAMPUNG UTARA, LAMPUNG",95,56,113,169
https://kawalpemilu.org#23445,"AJI KAGUNGAN, ABUNG KUNANG, LAMPUNG UTARA, LAMPUNG",9,13,74,87
https://kawalpemilu.org#22697,"TANJUNGAN, KATIBUNG, LAMPUNG SELATAN, LAMPUNG",6,139,55,294
https://kawalpemilu.org#24711,"KAMPUNG BARU, LABUHAN RATU, KOTA BANDAR LAMPUNG, LAMPUNG",10,68,138,206
https://kawalpemilu.org#23011,"REJO SARI MATARAM, SEPUTIH MATARAM, LAMPUNG TENGAH, LAMPUNG",1,101,79,180
https://kawalpemilu.org#22859,"KERTOSARI, TANJUNG SARI, LAMPUNG SELATAN, LAMPUNG",2,151,65,216
https://kawalpemilu.org#23408,"NEGERI CAMPANG JAYA, SUNGKAI TENGAH, LAMPUNG UTARA, LAMPUNG",6,98,58,156
https://kawalpemilu.org#23336,"SUBIK, ABUNG TENGAH, LAMPUNG UTARA, LAMPUNG",7,98,49,147
https://kawalpemilu.org#23219,"GEDUNG KETAPANG, SUNGKAI SELATAN, LAMPUNG UTARA, LAMPUNG",35,81,140,221
https://kawalpemilu.org#22430,"SUKOHARJO IV, SUKOHARJO, PRINGSEWU, LAMPUNG",1,139,44,183
https://kawalpemilu.org#24357,"GEDUNG WANI TIMUR, MARGA TIGA, LAMPUNG TIMUR, LAMPUNG",9,118,56,174
https://kawalpemilu.org#24177,"AIR KUBANG, AIR NANINGAN, TANGGAMUS, LAMPUNG",5,85,141,226
https://kawalpemilu.org#22518,"MUARA TENANG, TANJUNG RAYA, MESUJI, LAMPUNG",6,136,59,195
https://kawalpemilu.org#23387,"HADUYANG RATU, BUNGA MAYANG, LAMPUNG UTARA, LAMPUNG",36,104,32,136
https://kawalpemilu.org#23778,"GD. BANDAR RAHAYU, GEDUNG MENENG, TULANG BAWANG, LAMPUNG",11,79,26,105
https://kawalpemilu.org#24330,"REJO BINANGUN, RAMAN UTARA, LAMPUNG TIMUR, LAMPUNG",6,183,33,216
https://kawalpemilu.org#24556,"BAKTI NEGARA, BARADATU, WAY KANAN, LAMPUNG",3,148,57,205
https://kawalpemilu.org#-990354,"Doha, Doha, Qatar, Luar Negeri",13,56,140,196
https://kawalpemilu.org#-991084,"Johor Bahru, Johor Bahru, Malaysia, Luar Negeri",2231,109,37,146
https://kawalpemilu.org#-990634,"Paramaribo, Paramaribo, Suriname, Luar Negeri",2001,81,45,126
https://kawalpemilu.org#-990784,"Singapura, Singapura, Singapura, Luar Negeri",30,742,121,863
https://kawalpemilu.org#-991084,"Johor Bahru, Johor Bahru, Malaysia, Luar Negeri",2145,152,44,196
https://kawalpemilu.org#-990574,"Muscat, Muscat, Oman, Luar Negeri",2,118,87,205
https://kawalpemilu.org#-990994,"Dubai, Dubai, Uni Emirat Arab, Luar Negeri",6,155,102,257
https://kawalpemilu.org#-991044,"Hong Kong, Hong Kong, Republik Rakyat Tiongkok, Luar Negeri",1003,791,109,900
https://kawalpemilu.org#77930,"PARIGI, TALIABU TIMUR, PULAU TALIABU, MALUKU UTARA",2,34,149,183
https://kawalpemilu.org#77782,"WAYAKUBA, BACAN TIMUR SELATAN, HALMAHERA SELATAN, MALUKU UTARA",1,64,160,224
https://kawalpemilu.org#77953,"LEDE, LEDE, PULAU TALIABU, MALUKU UTARA",4,87,119,206
https://kawalpemilu.org#78096,"TAFAGA, PULAU MOTI, KOTA TERNATE, MALUKU UTARA",2,16,185,201
https://kawalpemilu.org#77366,"SOA-SIO, GALELA, HALMAHERA UTARA, MALUKU UTARA",1,20,119,139
https://kawalpemilu.org#77878,"ONA, SULABESI BARAT, KEPULAUAN SULA, MALUKU UTARA",2,32,201,233
https://kawalpemilu.org#87302,"BOBULA, MOROTAI SELATAN BARAT, PULAU MOROTAI, MALUKU UTARA",1,41,101,142
https://kawalpemilu.org#78163,"GURABATI, TIDORE SELATAN, KOTA TIDORE KEPULAUAN, MALUKU UTARA",9,67,90,157
https://kawalpemilu.org#77807,"GUMIRAH, GANE BARAT UTARA, HALMAHERA SELATAN, MALUKU UTARA",1,32,77,109
https://kawalpemilu.org#77370,"SIMAU, GALELA, HALMAHERA UTARA, MALUKU UTARA",3,21,174,195
https://kawalpemilu.org#76679,"GRANDENG, LOLONG GUBA, BURU, MALUKU",6,72,81,153
https://kawalpemilu.org#76271,"LEKSULA, LEKSULA, BURU SELATAN, MALUKU",5,84,56,140
https://kawalpemilu.org#77011,"PANDAN KASTURI, SIRIMAU, KOTA AMBON, MALUKU",17,26,142,168
https://kawalpemilu.org#77027,"PASSO, BAGUALA, KOTA AMBON, MALUKU",21,200,7,207
https://kawalpemilu.org#76438,"NAMAELO, KOTA MASOHI, MALUKU TENGAH, MALUKU",29,18,115,133
https://kawalpemilu.org#76459,"LIANG, TELUK ELPAPUTIH, MALUKU TENGAH, MALUKU",5,90,4,94
https://kawalpemilu.org#76379,"HAYA, TEHORU, MALUKU TENGAH, MALUKU",4,40,140,180
https://kawalpemilu.org#76434,"NALAHIA, NUSA LAUT, MALUKU TENGAH, MALUKU",2,118,9,127
https://kawalpemilu.org#86074,"JAKARTA BARU, BULA BARAT, SERAM BAGIAN TIMUR, MALUKU",1,110,36,146
https://kawalpemilu.org#76681,"PARBULU, WAELATA, BURU, MALUKU",3,104,82,186
https://kawalpemilu.org#76643,"ALUSI BATJASI, KORMOMOLIN, MALUKU TENGGARA BARAT, MALUKU",1,158,3,161
https://kawalpemilu.org#76385,"HARIA, SAPARUA, MALUKU TENGAH, MALUKU",14,123,8,131
https://kawalpemilu.org#76438,"NAMAELO, KOTA MASOHI, MALUKU TENGAH, MALUKU",33,100,155,255
https://kawalpemilu.org#76423,"HILA, LEIHITU, MALUKU TENGAH, MALUKU",20,65,101,166
https://kawalpemilu.org#55013,"RABADOMPU BARAT, RABA, KOTA BIMA, NUSA TENGGARA BARAT",15,19,172,191
https://kawalpemilu.org#54092,"MEKARSARI, GUNUNGSARI, LOMBOK BARAT, NUSA TENGGARA BARAT",2,163,26,189
https://kawalpemilu.org#54845,"BELO, PALIBELO, BIMA, NUSA TENGGARA BARAT",2,32,166,198
https://kawalpemilu.org#54130,"TIWUGALIH, PRAYA, LOMBOK TENGAH, NUSA TENGGARA BARAT",10,68,152,220
https://kawalpemilu.org#54347,"JURIT, PRINGGASELA, LOMBOK TIMUR, NUSA TENGGARA BARAT",5,35,113,148
https://kawalpemilu.org#84997,"GOLONG, NARMADA, LOMBOK BARAT, NUSA TENGGARA BARAT",9,42,134,176
https://kawalpemilu.org#87711,"BANJARSARI, LABUHAN HAJI, LOMBOK TIMUR, NUSA TENGGARA BARAT",13,69,106,175
https://kawalpemilu.org#85003,"JERINGGO, GUNUNGSARI, LOMBOK BARAT, NUSA TENGGARA BARAT",6,74,113,187
https://kawalpemilu.org#84996,"GIRI TEMBESI, GERUNG, LOMBOK BARAT, NUSA TENGGARA BARAT",4,167,18,185
https://kawalpemilu.org#54060,"KRAMA JAYA, NARMADA, LOMBOK BARAT, NUSA TENGGARA BARAT",3,95,103,198
https://kawalpemilu.org#85085,"WANASABA LAUK, WANASABA, LOMBOK TIMUR, NUSA TENGGARA BARAT",16,54,160,214
https://kawalpemilu.org#55055,"AKAR-AKAR, BAYAN, LOMBOK UTARA, NUSA TENGGARA BARAT",13,90,69,159
https://kawalpemilu.org#54192,"SEMOYANG, PRAYA TIMUR, LOMBOK TENGAH, NUSA TENGGARA BARAT",18,47,177,224
https://kawalpemilu.org#54038,"GELOGOR, KEDIRI, LOMBOK BARAT, NUSA TENGGARA BARAT",15,16,177,193
https://kawalpemilu.org#54054,"SELAT, NARMADA, LOMBOK BARAT, NUSA TENGGARA BARAT",14,85,60,145
https://kawalpemilu.org#54731,"JIA, SAPE, BIMA, NUSA TENGGARA BARAT",8,28,170,198
https://kawalpemilu.org#54638,"RIWO, WOJA, DOMPU, NUSA TENGGARA BARAT",3,20,230,250
https://kawalpemilu.org#54732,"BUGIS, SAPE, BIMA, NUSA TENGGARA BARAT",3,45,164,209
https://kawalpemilu.org#54897,"SAPUGARA BREE, BRANG REA, SUMBAWA BARAT, NUSA TENGGARA BARAT",6,41,121,162
https://kawalpemilu.org#54331,"KALIJAGA SELATAN, AIKMEL, LOMBOK TIMUR, NUSA TENGGARA BARAT",2,73,75,148
https://kawalpemilu.org#54501,"JOTANG BERU, EMPANG, SUMBAWA, NUSA TENGGARA BARAT",3,26,85,111
https://kawalpemilu.org#55005,"RONTU, RABA, KOTA BIMA, NUSA TENGGARA BARAT",10,60,121,181
https://kawalpemilu.org#54278,"SUKADANA, TERARA, LOMBOK TIMUR, NUSA TENGGARA BARAT",13,41,136,177
https://kawalpemilu.org#54808,"WORO, MADAPANGGA, BIMA, NUSA TENGGARA BARAT",5,26,116,142
https://kawalpemilu.org#54776,"TOLOWATA, AMBALAWI, BIMA, NUSA TENGGARA BARAT",4,19,136,155
https://kawalpemilu.org#54173,"PENGEMBUR, PUJUT, LOMBOK TENGAH, NUSA TENGGARA BARAT",20,39,168,207
https://kawalpemilu.org#54477,"DETE, LAPE, SUMBAWA, NUSA TENGGARA BARAT",10,94,73,167
https://kawalpemilu.org#84999,"CENDI MANIK, SEKOTONG, LOMBOK BARAT, NUSA TENGGARA BARAT",18,56,207,263
https://kawalpemilu.org#54119,"KURIPAN, KURIPAN, LOMBOK BARAT, NUSA TENGGARA BARAT",12,23,152,175
https://kawalpemilu.org#54154,"BUJAK, BATUKLIANG, LOMBOK TENGAH, NUSA TENGGARA BARAT",10,89,127,216
https://kawalpemilu.org#85002,"GELANGSAR, GUNUNGSARI, LOMBOK BARAT, NUSA TENGGARA BARAT",4,46,80,126
https://kawalpemilu.org#54631,"SIMPASAI, WOJA, DOMPU, NUSA TENGGARA BARAT",12,28,175,203
https://kawalpemilu.org#54861,"KUANG, TALIWANG, SUMBAWA BARAT, NUSA TENGGARA BARAT",7,74,131,205
https://kawalpemilu.org#54159,"TAMPAK SIRING, BATUKLIANG, LOMBOK TENGAH, NUSA TENGGARA BARAT",11,20,161,181
https://kawalpemilu.org#54029,"BABUSSALAM, GERUNG, LOMBOK BARAT, NUSA TENGGARA BARAT",12,23,213,236
https://kawalpemilu.org#54040,"BANYUMULEK, KEDIRI, LOMBOK BARAT, NUSA TENGGARA BARAT",9,12,191,203
https://kawalpemilu.org#54896,"BANGKAT MONTEH, BRANG REA, SUMBAWA BARAT, NUSA TENGGARA BARAT",3,86,127,213
https://kawalpemilu.org#55018,"SANTI, MPUNDA, KOTA BIMA, NUSA TENGGARA BARAT",5,37,156,193
https://kawalpemilu.org#54121,"KURIPAN UTARA, KURIPAN, LOMBOK BARAT, NUSA TENGGARA BARAT",4,25,222,222
https://kawalpemilu.org#55011,"RABADOMPU TIMUR, RABA, KOTA BIMA, NUSA TENGGARA BARAT",3,36,160,196
https://kawalpemilu.org#56240,"ALLUMANG, PANTAR BARAT LAUT, ALOR, NUSA TENGGARA TIMUR",1,168,5,173
https://kawalpemilu.org#56926,"TAKATUNGA, GOLEWA SELATAN, NGADA, NUSA TENGGARA TIMUR",4,146,7,153
https://kawalpemilu.org#57437,"LEWOGROMA, ATADEI, LEMBATA, NUSA TENGGARA TIMUR",1,100,2,102
https://kawalpemilu.org#56697,"RENDORATERUA, PULAU ENDE, ENDE, NUSA TENGGARA TIMUR",4,15,118,133
https://kawalpemilu.org#55629,"TUNTUN, MIOMAFO TIMUR, TIMOR TENGAH UTARA, NUSA TENGGARA TIMUR",2,207,4,211
https://kawalpemilu.org#57581,"NETENAEN, ROTE BARAT LAUT, ROTE NDAO, NUSA TENGGARA TIMUR",2,134,10,144
https://kawalpemilu.org#57999,"TANA TEKE, WEWEWA SELATAN, SUMBA BARAT DAYA, NUSA TENGGARA TIMUR",1,178,9,187
https://kawalpemilu.org#58282,"BOLUA, RAIJUA, SABU RAIJUA, NUSA TENGGARA TIMUR",2,189,5,194
https://kawalpemilu.org#56722,"TETANDARA, ENDE SELATAN, ENDE, NUSA TENGGARA TIMUR",22,96,41,137
https://kawalpemilu.org#58032,"KALENA RONGO, KODI UTARA, SUMBA BARAT DAYA, NUSA TENGGARA TIMUR",3,176,18,194
https://kawalpemilu.org#55541,"FATUAT, KOT OLIN, TIMOR TENGAH SELATAN, NUSA TENGGARA TIMUR",2,192,6,198
https://kawalpemilu.org#55178,"NAUNU, FATULEU, KUPANG, NUSA TENGGARA TIMUR",1,223,17,240
https://kawalpemilu.org#57049,"LUNGAR, SATAR MESE, MANGGARAI, NUSA TENGGARA TIMUR",2,198,7,205
https://kawalpemilu.org#55842,"HALIMODOK, TASIFETOTIMUR, BELU, NUSA TENGGARA TIMUR",1,124,2,126
https://kawalpemilu.org#58056,"MAULAFA, MAULAFA, KOTA KUPANG, NUSA TENGGARA TIMUR",21,145,8,153
https://kawalpemilu.org#57780,"DHAWE, AESESA, NAGEKEO, NUSA TENGGARA TIMUR",6,231,10,241
https://kawalpemilu.org#58045,"NUNHILA, ALAK, KOTA KUPANG, NUSA TENGGARA TIMUR",1,183,9,192
https://kawalpemilu.org#927913,"WAE MOWOL, LEMBOR, MANGGARAI BARAT, NUSA TENGGARA TIMUR",5,120,6,126
https://kawalpemilu.org#55212,"FATUNAUS, AMFOANG UTARA, KUPANG, NUSA TENGGARA TIMUR",2,120,6,126
https://kawalpemilu.org#56187,"PURA, PULAU PURA, ALOR, NUSA TENGGARA TIMUR",4,161,41,202
https://kawalpemilu.org#56280,"EKASAPTA, LARANTUKA, FLORES TIMUR, NUSA TENGGARA TIMUR",2,36,186,222
https://kawalpemilu.org#57907,"WENDEWA SELATAN, MAMBORO, SUMBA TENGAH, NUSA TENGGARA TIMUR",3,134,8,142
https://kawalpemilu.org#55888,"WEHALI, MALAKA TENGAH, MALAKA, NUSA TENGGARA TIMUR",17,54,24,78
https://kawalpemilu.org#56040,"FATUKBOT, ATAMBUA SELATAN, BELU, NUSA TENGGARA TIMUR",9,189,19,208
https://kawalpemilu.org#91087,"FATUKUSI, KI'E, TIMOR TENGAH SELATAN, NUSA TENGGARA TIMUR",1,95,3,98
https://kawalpemilu.org#55822,"FULUR, LAMAKNEN, BELU, NUSA TENGGARA TIMUR",5,140,4,144
https://kawalpemilu.org#55388,"MAULEUM, AMANUBAN TIMUR, TIMOR TENGAH SELATAN, NUSA TENGGARA TIMUR",2,152,54,206
https://kawalpemilu.org#55252,"SOBA, AMARASI BARAT, KUPANG, NUSA TENGGARA TIMUR",2,170,15,185
https://kawalpemilu.org#57520,"KAOHUA, BUYASURI, LEMBATA, NUSA TENGGARA TIMUR",3,70,105,175
https://kawalpemilu.org#58067,"LASIANA, KELAPA LIMA, KOTA KUPANG, NUSA TENGGARA TIMUR",14,91,14,105
https://kawalpemilu.org#56563,"NANGAHALE, TALIBURA, SIKKA, NUSA TENGGARA TIMUR",6,181,4,185
https://kawalpemilu.org#927934,"GOLO RU'A, NDOSO, MANGGARAI BARAT, NUSA TENGGARA TIMUR",3,183,21,204
https://kawalpemilu.org#58206,"RUAN, KOTA KOMBA, MANGGARAI TIMUR, NUSA TENGGARA TIMUR",5,122,5,127
https://kawalpemilu.org#58178,"COMPANG CONGKAR, SAMBI RAMPAS, MANGGARAI TIMUR, NUSA TENGGARA TIMUR",3,97,3,100
https://kawalpemilu.org#927487,"RAEKORE, SABU BARAT, SABU RAIJUA, NUSA TENGGARA TIMUR",2,165,4,169
https://kawalpemilu.org#927938,"LENDONG, LEMBOR SELATAN, MANGGARAI BARAT, NUSA TENGGARA TIMUR",1,193,22,215
https://kawalpemilu.org#57126,"HILIHINTIR, SATAR MESE BARAT, MANGGARAI, NUSA TENGGARA TIMUR",9,121,19,140
https://kawalpemilu.org#87114,"MIMPE, BUK, SORONG, PAPUA BARAT",1,220,5,225
https://kawalpemilu.org#81928,"AITINYO, AITINYO, MAYBRAT, PAPUA BARAT",1,144,15,159
https://kawalpemilu.org#83319,"SAWAGUMU, SORONG UTARA, KOTA SORONG, PAPUA BARAT",2,108,55,163
https://kawalpemilu.org#927765,"HASWEH, AITINYO BARAT, MAYBRAT, PAPUA BARAT",1,99,66,165
https://kawalpemilu.org#82134,"KLASULUK, MARIAT, SORONG, PAPUA BARAT",2,30,129,159
https://kawalpemilu.org#82046,"MAJARAN, SALAWATI, SORONG, PAPUA BARAT",6,103,97,200
https://kawalpemilu.org#82145,"SELEKOBO, SAENGKEDUK, SORONG, PAPUA BARAT",1,146,4,150
https://kawalpemilu.org#82930,"KURKAPA, MEOS MANSAR, RAJA AMPAT, PAPUA BARAT",1,55,3,58
https://kawalpemilu.org#82992,"KAMPUNG BARU, ARANDAY, TELUK BINTUNI, PAPUA BARAT",1,187,44,231
https://kawalpemilu.org#83170,"NANIMORI, KURI WAMESA, TELUK WONDAMA, PAPUA BARAT",1,134,5,139
https://kawalpemilu.org#999010,"WEYAUGI, BAYA BIRU, PANIAI, PAPUA",1,198,0,198
https://kawalpemilu.org#80925,"BOGOBAIDA, BOGABAIDA, PANIAI, PAPUA",2,214,0,214
https://kawalpemilu.org#78323,"KAPIRAYA-KOMAUTO, KAPIRAYA, DEIYAI, PAPUA",6,283,0,283
https://kawalpemilu.org#929731,"BEAM, GELOK BEAM, LANNY JAYA, PAPUA",1,193,0,193
https://kawalpemilu.org#79958,"KONDO, NAUKENJERAI, MERAUKE, PAPUA",2,101,6,107
https://kawalpemilu.org#930556,"DATAUWO, YAGAI, PANIAI, PAPUA",1,200,0,200
https://kawalpemilu.org#81521,"DUGUMHAD, HOGIO, YAHUKIMO, PAPUA",1,279,0,279
https://kawalpemilu.org#79871,"SABUDOM, KIMAAM, MERAUKE, PAPUA",2,102,4,106
https://kawalpemilu.org#929763,"WIRINGGAME, KELULOME, LANNY JAYA, PAPUA",1,390,0,390
https://kawalpemilu.org#86230,"YEGEUGI, MENOU, NABIRE, PAPUA",5,186,0,186
https://kawalpemilu.org#81216,"YATU RAHARJA, ARSO BARAT, KEEROM, PAPUA",4,93,126,219
https://kawalpemilu.org#86818,"POPOME, MOKONI, LANNY JAYA, PAPUA",1,245,0,245
https://kawalpemilu.org#79833,"RIMBA JAYA, MERAUKE, MERAUKE, PAPUA",30,109,47,156
https://kawalpemilu.org#929694,"NINDONAK, AYUMNATI, LANNY JAYA, PAPUA",2,154,0,154
https://kawalpemilu.org#81309,"KIRIMU, OKBAB, PEGUNUNGAN BINTANG, PAPUA",1,140,0,202
https://kawalpemilu.org#929600,"GAWIWARAK, GAMELIA, LANNY JAYA, PAPUA",1,240,0,240
https://kawalpemilu.org#79828,"KARANG INDAH, MERAUKE, MERAUKE, PAPUA",22,92,7,99
https://kawalpemilu.org#79489,"YALENGGOLO, KELILA, MAMBERAMO TENGAH, PAPUA",3,200,0,200
https://kawalpemilu.org#88575,"UJUNGKIA, KI, BOVEN DIGOEL, PAPUA",1,79,7,86
https://kawalpemilu.org#78975,"UPKIM, WAROPKO, BOVEN DIGOEL, PAPUA",1,119,1,120
https://kawalpemilu.org#929608,"MEWILANGUN, DIMBA, LANNY JAYA, PAPUA",1,199,0,199
https://kawalpemilu.org#929789,"GILO, MELAGI, LANNY JAYA, PAPUA",9,273,0,273
https://kawalpemilu.org#80531,"FANDOI, BIAK KOTA, BIAK NUMFOR, PAPUA",5,214,61,275
https://kawalpemilu.org#89153,"POGA, POGA, LANNY JAYA, PAPUA",2,221,0,221
https://kawalpemilu.org#80007,"DOMANDE, MALIND, MERAUKE, PAPUA",3,139,3,142
https://kawalpemilu.org#79008,"ASIKI I, JAIR, BOVEN DIGOEL, PAPUA",46,82,30,112
https://kawalpemilu.org#79351,"NAPISNDI, SUPIORI BARAT, SUPIORI, PAPUA",1,123,2,125
https://kawalpemilu.org#930475,"KAMUNDU, MERAUKE, MERAUKE, PAPUA",3,107,22,129
https://kawalpemilu.org#79462,"YABANSAI, HERAM, KOTA JAYAPURA, PAPUA",32,168,38,206
https://kawalpemilu.org#80897,"ABATADI, ARADIDE, PANIAI, PAPUA",1,0,187,187
https://kawalpemilu.org#79874,"WANINGGAP NANGGO, SEMANGGA, MERAUKE, PAPUA",2,124,7,131
https://kawalpemilu.org#80149,"SEREH, SENTANI, JAYAPURA, PAPUA",6,152,134,286
https://kawalpemilu.org#930479,"BUTI, MERAUKE, MERAUKE, PAPUA",3,200,31,231
https://kawalpemilu.org#79017,"YANIRUMA, YANIRUMA, BOVEN DIGOEL, PAPUA",4,51,0,51
https://kawalpemilu.org#79929,"BAIDUB, ULILIN, MERAUKE, PAPUA",1,95,33,128
https://kawalpemilu.org#86633,"KINKUN, HEREAPINI, YAHUKIMO, PAPUA",1,222,0,222
https://kawalpemilu.org#81379,"PARELA, KURIMA, YAHUKIMO, PAPUA",2,154,0,154
https://kawalpemilu.org#80676,"INSWAMBESI SUP, WARSA, BIAK NUMFOR, PAPUA",1,137,23,160
https://kawalpemilu.org#15854,"RATU SIMA, DUMAI SELATAN, KOTA DUMAI, RIAU",40,75,115,190
https://kawalpemilu.org#14743,"PULAUKIJANG, Reteh, INDRAGIRI HILIR, RIAU",4,67,139,206
https://kawalpemilu.org#15833,"REJO SARI, TENAYAN RAYA, KOTA PEKANBARU, RIAU",28,85,137,222
https://kawalpemilu.org#15838,"AIR HITAM, PAYUNG SEKAKI, KOTA PEKANBARU, RIAU",9,111,51,162
https://kawalpemilu.org#84526,"TELUKMEREMPAN, MEMPURA, SIAK, RIAU",2,45,196,241
https://kawalpemilu.org#14229,"PANDAU JAYA, SIAK HULU, KAMPAR, RIAU",25,46,116,162
https://kawalpemilu.org#90465,"BAGAN BATU KOTA, BAGAN SINEMBAH, ROKAN HILIR, RIAU",15,123,29,152
https://kawalpemilu.org#15442,"MANDI ANGIN, MINAS, SIAK, RIAU",4,106,31,137
https://kawalpemilu.org#14169,"LANGGINI, BANGKINANG KOTA, KAMPAR, RIAU",31,7,139,146
https://kawalpemilu.org#14627,"SUNGAI AUR, BATANG PERANAP, INDRAGIRI HULU, RIAU",3,150,57,207
https://kawalpemilu.org#15044,"BALAM MERAH, BUNUT, PELALAWAN, RIAU",5,39,171,210
https://kawalpemilu.org#15365,"MELAYU TENGAH, TANAH PUTIH TANJUNG MELAWAN, ROKAN HILIR, RIAU",3,55,89,144
https://kawalpemilu.org#15508,"KERANJI GUGUH, KOTO GASIB, SIAK, RIAU",5,110,62,172
https://kawalpemilu.org#14695,"BATU PANJANG, RUPAT, BENGKALIS, RIAU",14,97,65,162
https://kawalpemilu.org#14851,"SUNGAIRAYA, Batang Tuaka, INDRAGIRI HILIR, RIAU",2,60,159,219
https://kawalpemilu.org#14233,"KUBANG JAYA, SIAK HULU, KAMPAR, RIAU",33,34,135,169
https://kawalpemilu.org#14684,"DURI BARAT, MANDAU, BENGKALIS, RIAU",42,10,124,134
https://kawalpemilu.org#14634,"RIMBA SEKAMPUNG, BENGKALIS, BENGKALIS, RIAU",7,65,123,188
https://kawalpemilu.org#14382,"SAWAH, KAMPAR UTARA, KAMPAR, RIAU",9,7,160,167
https://kawalpemilu.org#15878,"BASILAM BARU, SUNGAI SEMBILAN, KOTA DUMAI, RIAU",28,159,22,181
https://kawalpemilu.org#14317,"KOTA  BANGUN, TAPUNG HILIR, KAMPAR, RIAU",10,133,106,239
https://kawalpemilu.org#14170,"KUMANTAN, BANGKINANG KOTA, KAMPAR, RIAU",14,12,120,132
https://kawalpemilu.org#15154,"SUNGAI KUTI, KUNTO DARUSSALAM, ROKAN HULU, RIAU",6,123,71,194
https://kawalpemilu.org#15814,"SIMPANG TIGA, BUKIT RAYA, KOTA PEKANBARU, RIAU",35,17,140,157
https://kawalpemilu.org#15072,"MUDA SETIA, BANDAR SEI KIJANG, PELALAWAN, RIAU",2,102,150,252
https://kawalpemilu.org#15856,"SIMPANG TETAP DARUL ICHSAN, DUMAI BARAT, KOTA DUMAI, RIAU",21,47,178,225
https://kawalpemilu.org#14304,"PELAMBAYAN, TAPUNG, KAMPAR, RIAU",4,119,55,174
https://kawalpemilu.org#15092,"UJUNG BATU TIMUR, UJUNG BATU, ROKAN HULU, RIAU",17,31,118,149
https://kawalpemilu.org#15793,"SUKAMULYA, SAIL, KOTA PEKANBARU, RIAU",19,60,202,262
https://kawalpemilu.org#14168,"BANGKINANG, BANGKINANG KOTA, KAMPAR, RIAU",31,20,127,147
https://kawalpemilu.org#14970,"PANGKALAN KERINCI KOTA, PANGKALAN KERINCI, PELALAWAN, RIAU",94,73,124,197
https://kawalpemilu.org#14180,"PULAU JAMBU, KAMPAR, KAMPAR, RIAU",4,23,216,239
https://kawalpemilu.org#14629,"KOTO TUO, BATANG PERANAP, INDRAGIRI HULU, RIAU",1,41,160,201
https://kawalpemilu.org#14174,"BATU BELAH, KAMPAR, KAMPAR, RIAU",1,9,204,213
https://kawalpemilu.org#14889,"PELANGIRAN, Pelangiran, INDRAGIRI HILIR, RIAU",10,27,95,122
https://kawalpemilu.org#15832,"TANGKERANG TIMUR, TENAYAN RAYA, KOTA PEKANBARU, RIAU",6,39,157,196
https://kawalpemilu.org#15727,"PULAU DERAS, PANGEAN, KUANTAN SINGINGI, RIAU",3,34,150,184
https://kawalpemilu.org#14684,"DURI BARAT, MANDAU, BENGKALIS, RIAU",5,10,119,129
https://kawalpemilu.org#15196,"PAGAR MAYANG, TAMBUSAI UTARA, ROKAN HULU, RIAU",2,108,44,152
https://kawalpemilu.org#15339,"PANIPAHAN, PASIR LIMAU KAPAS, ROKAN HILIR, RIAU",3,82,8,90
https://kawalpemilu.org#14205,"MUARA TAKUS, XIII KOTO KAMPAR, KAMPAR, RIAU",3,119,44,163
https://kawalpemilu.org#15274,"BAGAN BARAT, BANGKO, ROKAN HILIR, RIAU",14,37,110,147
https://kawalpemilu.org#14419,"SEKIP HULU, RENGAT, INDRAGIRI HULU, RIAU",13,24,137,161
https://kawalpemilu.org#15853,"PURNAMA, DUMAI BARAT, KOTA DUMAI, RIAU",9,61,125,186
https://kawalpemilu.org#75787,"MALANGKENA PADANG, SESENAPADANG, MAMASA, SULAWESI BARAT",3,66,6,72
https://kawalpemilu.org#75807,"MASUPU, TABANG, MAMASA, SULAWESI BARAT",3,136,6,142
https://kawalpemilu.org#75485,"BAMBAIRA, BAMBAIRA, MAMUJU UTARA, SULAWESI BARAT",7,150,94,244
https://kawalpemilu.org#75879,"SURUANG, CAMPALAGIAN, POLEWALI MANDAR, SULAWESI BARAT",7,73,54,127
https://kawalpemilu.org#76025,"TONROLIMA, MATAKALI, POLEWALI MANDAR, SULAWESI BARAT",3,121,84,205
https://kawalpemilu.org#87626,"LAMUNGANG BATU, MALUNDA, MAJENE, SULAWESI BARAT",4,88,79,167
https://kawalpemilu.org#75896,"BUMIAYU, WONOMULYO, POLEWALI MANDAR, SULAWESI BARAT",5,104,100,204
https://kawalpemilu.org#75937,"BATETANGNGA, BINUANG, POLEWALI MANDAR, SULAWESI BARAT",17,127,96,223
https://kawalpemilu.org#75526,"SONDOANG, KALUKKU, MAMUJU, SULAWESI BARAT",4,158,77,235
https://kawalpemilu.org#75910,"SULEWATANG, POLEWALI, POLEWALI MANDAR, SULAWESI BARAT",2,141,66,207
https://kawalpemilu.org#70201,"BALANGNIPA, SINJAI UTARA, SINJAI, SULAWESI SELATAN",23,49,170,219
https://kawalpemilu.org#69885,"BONTOMANAI, MANGARABOMBANG, TAKALAR, SULAWESI SELATAN",8,68,121,189
https://kawalpemilu.org#72071,"MALIMBU, SABBANG, LUWU UTARA, SULAWESI SELATAN",6,43,123,166
https://kawalpemilu.org#69694,"BARUA, EREMERASA, BANTAENG, SULAWESI SELATAN",7,45,145,190
https://kawalpemilu.org#69793,"BUNGENG, BATANG, JENEPONTO, SULAWESI SELATAN",3,18,130,148
https://kawalpemilu.org#69916,"BONTO KANANG, GALESONG SELATAN, TAKALAR, SULAWESI SELATAN",6,106,121,227
https://kawalpemilu.org#70214,"PASIR PUTIH, SINJAI BORONG, SINJAI, SULAWESI SELATAN",3,43,82,125
https://kawalpemilu.org#72342,"BARA BARAYA SELATAN, MAKASAR, KOTA MAKASSAR, SULAWESI SELATAN",17,68,132,200
https://kawalpemilu.org#70177,"SAUKANG, SINJAI TIMUR, SINJAI, SULAWESI SELATAN",2,63,159,222
https://kawalpemilu.org#69957,"PATTINOANG, GALESONG, TAKALAR, SULAWESI SELATAN",1,90,117,207
https://kawalpemilu.org#71273,"LAKESSI, MARITENGNGAE, SIDENRENG RAPPANG, SULAWESI SELATAN",7,62,149,211
https://kawalpemilu.org#72304,"KAWATA, WASUPONDA, LUWU TIMUR, SULAWESI SELATAN",4,57,54,111
https://kawalpemilu.org#69750,"BONTORANNU, BANGKALA, JENEPONTO, SULAWESI SELATAN",14,100,134,234
https://kawalpemilu.org#70046,"SUNGGUMINASA, SOMBA OPU, GOWA, SULAWESI SELATAN",6,95,164,259
https://kawalpemilu.org#71329,"LANGNGA, MATIRRO SOMPE, PINRANG, SULAWESI SELATAN",5,80,119,199
https://kawalpemilu.org#70265,"HULO, KAHU, BONE, SULAWESI SELATAN",7,112,65,177
https://kawalpemilu.org#90018,"BALANGDATU, MAPPAKASUNGGU, TAKALAR, SULAWESI SELATAN",1,139,22,161
https://kawalpemilu.org#72433,"TANJUNG MERDEKA, TAMALATE, KOTA MAKASSAR, SULAWESI SELATAN",24,108,107,215
https://kawalpemilu.org#69491,"KEMBANG RAGI, PASIMASUNGGU, KEPULAUAN SELAYAR, SULAWESI SELATAN",6,81,83,164
https://kawalpemilu.org#70537,"PADA CENGNGA, DUA BOCCOE, BONE, SULAWESI SELATAN",2,116,34,150
https://kawalpemilu.org#71544,"MEKKALA, CURIO, ENREKANG, SULAWESI SELATAN",1,50,145,195
https://kawalpemilu.org#69727,"BONTO RANNU, ULUERE, BANTAENG, SULAWESI SELATAN",1,18,127,145
https://kawalpemilu.org#70847,"BONTOA, MINASA TENE, PANGKAJENE DAN KEPULAUAN, SULAWESI SELATAN",4,74,145,219
https://kawalpemilu.org#72035,"PATOLOAN, BONE BONE, LUWU UTARA, SULAWESI SELATAN",11,44,117,161
https://kawalpemilu.org#70646,"BAJI MANGNGAI, MANDAI, MAROS, SULAWESI SELATAN",4,74,125,199
https://kawalpemilu.org#69286,"DERI, SESEAN, TORAJA UTARA, SULAWESI SELATAN",4,103,17,120
https://kawalpemilu.org#69896,"MONCONGKOMBA, POLOMBANGKENG SELATAN, TAKALAR, SULAWESI SELATAN",8,61,151,213
https://kawalpemilu.org#70966,"BARINGENG, LILIRILAU, SOPPENG, SULAWESI SELATAN",13,62,59,121
https://kawalpemilu.org#70341,"UJUNG TANAH, MARE, BONE, SULAWESI SELATAN",7,90,56,146
https://kawalpemilu.org#71274,"RIJANG PITTU, MARITENGNGAE, SIDENRENG RAPPANG, SULAWESI SELATAN",10,69,91,160
https://kawalpemilu.org#71311,"BETAO, PITU RIAWA, SIDENRENG RAPPANG, SULAWESI SELATAN",5,130,99,229
https://kawalpemilu.org#69397,"BARUPPU' PARODO, BARUPPU', TORAJA UTARA, SULAWESI SELATAN",5,107,20,127
https://kawalpemilu.org#72292,"ARGOMULYO, KALAENA, LUWU TIMUR, SULAWESI SELATAN",3,84,57,141
