https://kawalpemilu.org#27787,"SUKARATU, BANYURESMI, GARUT, JAWA BARAT",19,47,103,150
https://kawalpemilu.org#30362,"CIHANJUANG, CIMANGGUNG, SUMEDANG, JAWA BARAT",14,129,80,209
https://kawalpemilu.org#30564,"MALANGSARI, BANGODUA, INDRAMAYU, JAWA BARAT",11,133,47,180
https://kawalpemilu.org#27607,"MANGGAHANG, BALEENDAH, BANDUNG, JAWA BARAT",2,32,188,220
https://kawalpemilu.org#28901,"WANGUNJAYA, CISAGA, CIAMIS, JAWA BARAT",3,75,72,147
https://kawalpemilu.org#32251,"PANJUNAN, ASTANA ANYAR, KOTA BANDUNG, JAWA BARAT",18,121,112,233
https://kawalpemilu.org#32459,"JATIRANGGON, JATISAMPURNA, KOTA BEKASI, JAWA BARAT",36,116,111,227
https://kawalpemilu.org#32452,"JATIKRAMAT, JATIASIH, KOTA BEKASI, JAWA BARAT",46,78,116,194
https://kawalpemilu.org#31614,"GEMPOL, BANYUSARI, KARAWANG, JAWA BARAT",15,141,82,223
https://kawalpemilu.org#29426,"BABAKAN, BABAKAN, CIREBON, JAWA BARAT",3,134,64,198
https://kawalpemilu.org#26161,"BOJONG NANGKA, GUNUNG PUTRI, BOGOR, JAWA BARAT",52,5,128,133
https://kawalpemilu.org#27145,"CIHERANG, PACET, CIANJUR, JAWA BARAT",8,71,169,240
https://kawalpemilu.org#27121,"KADEMANGAN, MANDE, CIANJUR, JAWA BARAT",11,61,167,228
https://kawalpemilu.org#29717,"PRAJAWINANGUN WETAN, KALIWEDI, CIREBON, JAWA BARAT",3,109,99,208
https://kawalpemilu.org#26462,"KUTA, MEGAMENDUNG, BOGOR, JAWA BARAT",21,1,206,207
https://kawalpemilu.org#26921,"KEBONPEDES, KEBON PEDES, SUKABUMI, JAWA BARAT",18,64,158,222
https://kawalpemilu.org#29450,"CIPEUJEUH KULON, LEMAHABANG, CIREBON, JAWA BARAT",4,120,86,206
https://kawalpemilu.org#27253,"PASIRBARU, PAGELARAN, CIANJUR, JAWA BARAT",3,92,45,137
https://kawalpemilu.org#31005,"TANJUNGRASA, PATOKBEUSI, SUBANG, JAWA BARAT",4,97,104,201
https://kawalpemilu.org#31739,"MANGUNJAYA, TAMBUN SELATAN, BEKASI, JAWA BARAT",182,115,141,256
https://kawalpemilu.org#27442,"MARGAHAYU SELATAN, MARGAHAYU, BANDUNG, JAWA BARAT",87,129,61,190
https://kawalpemilu.org#32103,"GUDANG, BOGOR TENGAH, KOTA BOGOR, JAWA BARAT",11,98,77,175
https://kawalpemilu.org#31694,"PANTAI MAKMUR, TARUMAJAYA, BEKASI, JAWA BARAT",35,30,111,141
https://kawalpemilu.org#32598,"CIBEUTI, KAWALU, KOTA TASIKMALAYA, JAWA BARAT",28,45,214,259
https://kawalpemilu.org#31402,"KARYASARI, RENGASDENGKLOK, KARAWANG, JAWA BARAT",12,122,101,223
https://kawalpemilu.org#30450,"CIBEUREUM KULON, CIMALAKA, SUMEDANG, JAWA BARAT",5,88,82,170
https://kawalpemilu.org#26620,"CITARIK, PELABUHAN RATU, SUKABUMI, JAWA BARAT",45,50,109,159
https://kawalpemilu.org#27621,"PADAULUN, MAJALAYA, BANDUNG, JAWA BARAT",12,97,130,227
https://kawalpemilu.org#31433,"GEMPOLKARYA, TIRTAJAYA, KARAWANG, JAWA BARAT",2,99,109,208
https://kawalpemilu.org#27487,"PANGALENGAN, PANGALENGAN, BANDUNG, JAWA BARAT",10,82,105,187
https://kawalpemilu.org#31420,"BATUJAYA, BATUJAYA, KARAWANG, JAWA BARAT",19,94,108,202
https://kawalpemilu.org#27348,"SUKALUYU, CIKADU, CIANJUR, JAWA BARAT",1,77,96,173
https://kawalpemilu.org#27897,"SEKARWANGI, MALANGBONG, GARUT, JAWA BARAT",16,24,105,129
https://kawalpemilu.org#28818,"BANJARHARJA, KALIPUCANG, PANGANDARAN, JAWA BARAT",16,130,46,176
https://kawalpemilu.org#30897,"PRINGKASAP, PABUARAN, SUBANG, JAWA BARAT",6,92,113,205
https://kawalpemilu.org#29331,"MALEBER, MALEBER, KUNINGAN, JAWA BARAT",1,38,148,186
https://kawalpemilu.org#27597,"CIBEUREUM, KERTASARI, BANDUNG, JAWA BARAT",55,52,101,153
https://kawalpemilu.org#32410,"BINTARA, BEKASI BARAT, KOTA BEKASI, JAWA BARAT",9,91,143,234
https://kawalpemilu.org#30088,"PANJALIN KIDUL, SUMBERJAYA, MAJALENGKA, JAWA BARAT",14,115,76,191
https://kawalpemilu.org#30728,"TAWANGSARI, ARAHAN, INDRAMAYU, JAWA BARAT",5,121,15,136
https://kawalpemilu.org#28593,"KUJANG, CIKONENG, CIAMIS, JAWA BARAT",3,13,198,211
https://kawalpemilu.org#29071,"PURWAWINANGUN, KUNINGAN, KUNINGAN, JAWA BARAT",10,96,152,248
https://kawalpemilu.org#34266,"WONOHARJO, ROWOKELE, KEBUMEN, JAWA TENGAH",16,162,21,183
https://kawalpemilu.org#34895,"SUKOWUWUH, BENER, PURWOREJO, JAWA TENGAH",9,118,8,126
https://kawalpemilu.org#39769,"GEBANGAN, PAGERUYUNG, KENDAL, JAWA TENGAH",1,173,25,198
https://kawalpemilu.org#36807,"TLOBO, JATIYOSO, KARANGANYAR, JAWA TENGAH",11,85,6,91
https://kawalpemilu.org#37412,"PULOREJO, PURWODADI, GROBOGAN, JAWA TENGAH",5,174,34,208
https://kawalpemilu.org#33316,"TELUK, PURWOKERTO SELATAN, BANYUMAS, JAWA TENGAH",37,211,58,269
https://kawalpemilu.org#35527,"KEBONAGUNG, TEGALREJO, MAGELANG, JAWA TENGAH",3,131,9,140
https://kawalpemilu.org#34647,"BANDUNG, KUTOARJO, PURWOREJO, JAWA TENGAH",3,120,59,179
https://kawalpemilu.org#40704,"PURANA, BANTARBOLANG, PEMALANG, JAWA TENGAH",7,139,12,151
https://kawalpemilu.org#40190,"SIDOMULYO, LIMPUNG, BATANG, JAWA TENGAH",6,103,24,127
https://kawalpemilu.org#38805,"SUWAWAL, MLONGGO, JEPARA, JAWA TENGAH",14,157,22,179
https://kawalpemilu.org#33692,"SEMAMPIR, BANJARNEGARA, BANJARNEGARA, JAWA TENGAH",6,57,78,135
https://kawalpemilu.org#39224,"KENTENG, SUSUKAN, SEMARANG, JAWA TENGAH",6,164,36,200
https://kawalpemilu.org#34133,"KEMANGGUAN, ALIAN, KEBUMEN, JAWA TENGAH",7,155,20,175
https://kawalpemilu.org#84898,"SIKAMPUH, KROYA, CILACAP, JAWA TENGAH",15,144,82,226
https://kawalpemilu.org#33378,"BUKATEJA, BUKATEJA, PURBALINGGA, JAWA TENGAH",5,146,65,211
https://kawalpemilu.org#36989,"KALIMACAN, KALIJAMBE, SRAGEN, JAWA TENGAH",8,154,87,241
https://kawalpemilu.org#41379,"RANDUSARI, LOSARI, BREBES, JAWA TENGAH",18,140,50,190
https://kawalpemilu.org#36530,"SUKOHARJO, TIRTOMOYO, WONOGIRI, JAWA TENGAH",5,150,7,157
https://kawalpemilu.org#38620,"NGEMBAL KULON, JATI, KUDUS, JAWA TENGAH",8,103,88,191
https://kawalpemilu.org#34099,"SIDOGEDE, PREMBUN, KEBUMEN, JAWA TENGAH",1,153,25,178
https://kawalpemilu.org#33028,"TAMBAKNEGARA, RAWALO, BANYUMAS, JAWA TENGAH",19,135,36,171
https://kawalpemilu.org#40430,"NYAMOK, KAJEN, PEKALONGAN, JAWA TENGAH",3,139,76,215
https://kawalpemilu.org#40342,"SAWANGAN, PANINGGARAN, PEKALONGAN, JAWA TENGAH",7,154,5,159
https://kawalpemilu.org#34917,"NGALIAN, WADASLINTANG, WONOSOBO, JAWA TENGAH",19,123,6,129
https://kawalpemilu.org#87480,"SIDAMUKTI, PATIMUAN, CILACAP, JAWA TENGAH",24,164,27,191
https://kawalpemilu.org#35379,"BANJARAGUNG, KAJORAN, MAGELANG, JAWA TENGAH",3,167,29,196
https://kawalpemilu.org#41649,"TLOGOSARI KULON, PEDURUNGAN, KOTA SEMARANG, JAWA TENGAH",76,175,56,231
https://kawalpemilu.org#35541,"CANDIRETNO, SECANG, MAGELANG, JAWA TENGAH",4,113,100,213
https://kawalpemilu.org#34646,"SEMAWUNG DALEMAN, KUTOARJO, PURWOREJO, JAWA TENGAH",8,104,33,137
https://kawalpemilu.org#41583,"MANGUNSARI, SIDOMUKTI, KOTA SALATIGA, JAWA TENGAH",1,211,46,257
https://kawalpemilu.org#35828,"KEMUSU, KEMUSU, BOYOLALI, JAWA TENGAH",2,126,26,182
https://kawalpemilu.org#33880,"KARANGANYAR, KALIBENING, BANJARNEGARA, JAWA TENGAH",3,135,27,162
https://kawalpemilu.org#41527,"BALUWARTI, PASAR KLIWON, KOTA SURAKARTA, JAWA TENGAH",8,152,42,194
https://kawalpemilu.org#37301,"RANDUREJO, PULOKULON, GROBOGAN, JAWA TENGAH",14,141,3,144
https://kawalpemilu.org#34617,"SUCENJURU TENGAH, BAYAN, PURWOREJO, JAWA TENGAH",8,104,67,171
https://kawalpemilu.org#37094,"SINE, SRAGEN, SRAGEN, JAWA TENGAH",3,80,95,175
https://kawalpemilu.org#38988,"TIMBULSLOKO, SAYUNG, DEMAK, JAWA TENGAH",2,184,27,211
https://kawalpemilu.org#41325,"PEMARON, BREBES, BREBES, JAWA TENGAH",13,121,66,187
https://kawalpemilu.org#35214,"BOROBUDUR, BOROBUDUR, MAGELANG, JAWA TENGAH",26,128,96,224
https://kawalpemilu.org#41397,"TANJUNG, TANJUNG, BREBES, JAWA TENGAH",14,155,52,207
https://kawalpemilu.org#40136,"JLAMPRANG, BAWANG, BATANG, JAWA TENGAH",3,149,19,168
https://kawalpemilu.org#40392,"KUTOSARI, DORO, PEKALONGAN, JAWA TENGAH",6,181,32,213
https://kawalpemilu.org#40279,"SIJONO, WARUNGASEM, BATANG, JAWA TENGAH",4,0,0,0
https://kawalpemilu.org#41105,"KESAMIRAN, TARUB, TEGAL, JAWA TENGAH",1,107,75,182
https://kawalpemilu.org#41649,"TLOGOSARI KULON, PEDURUNGAN, KOTA SEMARANG, JAWA TENGAH",52,190,57,247
https://kawalpemilu.org#39336,"LEMAHIRENG, BAWEN, SEMARANG, JAWA TENGAH",23,183,7,190
https://kawalpemilu.org#40794,"KLAREYAN, PETARUKAN, PEMALANG, JAWA TENGAH",21,0,0,0
https://kawalpemilu.org#36820,"KADIPIRO, JUMAPOLO, KARANGANYAR, JAWA TENGAH",8,131,112,243
https://kawalpemilu.org#37535,"PILANG, RANDUBLATUNG, BLORA, JAWA TENGAH",10,184,13,197
https://kawalpemilu.org#40010,"SENDANGDAWUNG, KANGKUNG, KENDAL, JAWA TENGAH",2,151,14,165
https://kawalpemilu.org#41311,"GANDASULI, BREBES, BREBES, JAWA TENGAH",12,131,91,222
https://kawalpemilu.org#33663,"MAJALENGKA, BAWANG, BANJARNEGARA, JAWA TENGAH",10,112,33,145
https://kawalpemilu.org#33183,"CIBANGKONG, PEKUNCEN, BANYUMAS, JAWA TENGAH",2,167,19,186
https://kawalpemilu.org#35687,"TEGALREJO, SAWIT, BOYOLALI, JAWA TENGAH",8,209,10,219
https://kawalpemilu.org#41543,"MOJOSONGO, JEBRES, KOTA SURAKARTA, JAWA TENGAH",148,157,27,184
https://kawalpemilu.org#40491,"KETITANGKIDUL, BOJONG, PEKALONGAN, JAWA TENGAH",3,197,34,231
https://kawalpemilu.org#34085,"MANGUNRANAN, MIRIT, KEBUMEN, JAWA TENGAH",3,99,94,193
https://kawalpemilu.org#39150,"BUKO, WEDUNG, DEMAK, JAWA TENGAH",8,142,51,193
https://kawalpemilu.org#36807,"TLOBO, JATIYOSO, KARANGANYAR, JAWA TENGAH",13,69,4,73
https://kawalpemilu.org#41508,"SRIWEDARI, LAWEYAN, KOTA SURAKARTA, JAWA TENGAH",10,169,36,205
https://kawalpemilu.org#34569,"DOPLANG, PURWOREJO, PURWOREJO, JAWA TENGAH",5,114,65,179
https://kawalpemilu.org#38583,"SUNGGINGAN, KUDUS, KUDUS, JAWA TENGAH",7,111,66,177
https://kawalpemilu.org#37601,"BITING, SAMBONG, BLORA, JAWA TENGAH",8,145,62,207
https://kawalpemilu.org#36951,"SEWUREJO, MOJOGEDANG, KARANGANYAR, JAWA TENGAH",8,182,4,186
https://kawalpemilu.org#37371,"TEGALREJO, WIROSARI, GROBOGAN, JAWA TENGAH",29,175,8,183
https://kawalpemilu.org#35550,"PURWOSARI, SECANG, MAGELANG, JAWA TENGAH",9,84,41,125
https://kawalpemilu.org#41709,"PADANGSARI, BANYUMANIK, KOTA SEMARANG, JAWA TENGAH",13,146,64,210
https://kawalpemilu.org#39563,"WANUTENGAH, PARAKAN, TEMANGGUNG, JAWA TENGAH",7,128,54,182
https://kawalpemilu.org#32808,"BOJONG, KAWUNGANTEN, CILACAP, JAWA TENGAH",17,131,56,187
https://kawalpemilu.org#36770,"KARANGTENGAH, KARANGTENGAH, WONOGIRI, JAWA TENGAH",8,174,8,182
https://kawalpemilu.org#39738,"KEMIRIOMBO, GEMAWANG, TEMANGGUNG, JAWA TENGAH",5,175,19,194
https://kawalpemilu.org#41296,"KUPU, WANASARI, BREBES, JAWA TENGAH",6,139,39,178
https://kawalpemilu.org#41718,"NGIJO, GUNUNGPATI, KOTA SEMARANG, JAWA TENGAH",8,158,39,197
https://kawalpemilu.org#38446,"SUKOHARJO, WEDARIJAKSA, PATI, JAWA TENGAH",3,175,25,200
https://kawalpemilu.org#41765,"KALIPANCUR, NGALIYAN, KOTA SEMARANG, JAWA TENGAH",43,95,46,141
https://kawalpemilu.org#37258,"JIPANG, PENAWANGAN, GROBOGAN, JAWA TENGAH",2,86,17,103
https://kawalpemilu.org#40901,"BUNIWAH, BOJONG, TEGAL, JAWA TENGAH",6,170,50,220
https://kawalpemilu.org#38604,"KALIPUTU, KUDUS, KUDUS, JAWA TENGAH",11,115,55,170
https://kawalpemilu.org#37599,"POJOKWATU, SAMBONG, BLORA, JAWA TENGAH",6,114,72,186
https://kawalpemilu.org#41227,"KRETEK, PAGUYANGAN, BREBES, JAWA TENGAH",14,152,21,173
https://kawalpemilu.org#32995,"DERMAJI, LUMBIR, BANYUMAS, JAWA TENGAH",3,175,54,229
https://kawalpemilu.org#40741,"BANJARMULYA, PEMALANG, PEMALANG, JAWA TENGAH",6,176,31,207
https://kawalpemilu.org#34546,"KALIGONO, KALIGESING, PURWOREJO, JAWA TENGAH",4,120,21,141
https://kawalpemilu.org#34017,"BRECONG, BULUSPESANTREN, KEBUMEN, JAWA TENGAH",3,132,32,164
https://kawalpemilu.org#41150,"BANJARAGUNG, WARUREJA, TEGAL, JAWA TENGAH",10,134,77,211
https://kawalpemilu.org#36124,"BENTANGAN, WONOSARI, KLATEN, JAWA TENGAH",6,177,33,210
https://kawalpemilu.org#33649,"KARANGANYAR, PURWONEGORO, BANJARNEGARA, JAWA TENGAH",16,140,33,173
https://kawalpemilu.org#33770,"LUWUNG, RAKIT, BANJARNEGARA, JAWA TENGAH",3,110,91,201
https://kawalpemilu.org#32851,"SURUSUNDA, KARANGPUCUNG, CILACAP, JAWA TENGAH",22,77,67,144
https://kawalpemilu.org#38635,"WATES, UNDAAN, KUDUS, JAWA TENGAH",10,144,30,174
https://kawalpemilu.org#34265,"GIYANTI, ROWOKELE, KEBUMEN, JAWA TENGAH",3,139,25,164
https://kawalpemilu.org#40863,"DUKUH TENGAH, MARGASARI, TEGAL, JAWA TENGAH",9,117,47,164
https://kawalpemilu.org#36726,"TASIKHARGO, JATISRONO, WONOGIRI, JAWA TENGAH",4,178,10,188
https://kawalpemilu.org#39972,"SIJERUK, KENDAL, KENDAL, JAWA TENGAH",5,128,52,180
https://kawalpemilu.org#41543,"MOJOSONGO, JEBRES, KOTA SURAKARTA, JAWA TENGAH",46,166,25,191
https://kawalpemilu.org#41430,"WLAHAR, LARANGAN, BREBES, JAWA TENGAH",36,133,19,152
https://kawalpemilu.org#40336,"KRANDEGAN, PANINGGARAN, PEKALONGAN, JAWA TENGAH",3,131,40,171
https://kawalpemilu.org#41825,"KURIPAN KERTOHARJO, PEKALONGAN SELATAN, KOTA PEKALONGAN, JAWA TENGAH",13,221,23,244
https://kawalpemilu.org#39199,"SRUWEN, TENGARAN, SEMARANG, JAWA TENGAH",16,191,60,251
https://kawalpemilu.org#34620,"POGUNGREJO, BAYAN, PURWOREJO, JAWA TENGAH",4,112,21,133
https://kawalpemilu.org#35349,"TEMPUREJO, TEMPURAN, MAGELANG, JAWA TENGAH",26,110,45,155
https://kawalpemilu.org#33450,"MERI, KUTASARI, PURBALINGGA, JAWA TENGAH",1,132,35,167
https://kawalpemilu.org#34018,"BANJURPASAR, BULUSPESANTREN, KEBUMEN, JAWA TENGAH",11,90,38,128
https://kawalpemilu.org#33022,"GENTAWANGI, JATILAWANG, BANYUMAS, JAWA TENGAH",1,143,26,169
https://kawalpemilu.org#34890,"KETOSARI, BENER, PURWOREJO, JAWA TENGAH",7,110,23,133
https://kawalpemilu.org#33451,"KUTASARI, KUTASARI, PURBALINGGA, JAWA TENGAH",4,128,115,243
https://kawalpemilu.org#38207,"MINTORAHAYU, WINONG, PATI, JAWA TENGAH",5,127,12,139
https://kawalpemilu.org#40276,"LEBO, WARUNGASEM, BATANG, JAWA TENGAH",5,152,36,188
https://kawalpemilu.org#38472,"NGEMPLAK KIDUL, MARGOYOSO, PATI, JAWA TENGAH",5,190,28,218
https://kawalpemilu.org#40273,"KALIBELUK, WARUNGASEM, BATANG, JAWA TENGAH",15,152,40,192
https://kawalpemilu.org#35598,"URUTSEWU, AMPEL, BOYOLALI, JAWA TENGAH",19,200,18,218
https://kawalpemilu.org#37675,"ADIREJO, TUNJUNGAN, BLORA, JAWA TENGAH",1,124,78,202
https://kawalpemilu.org#40738,"PELUTAN, PEMALANG, PEMALANG, JAWA TENGAH",12,132,42,174
https://kawalpemilu.org#87442,"MUJUR, KROYA, CILACAP, JAWA TENGAH",20,105,63,168
https://kawalpemilu.org#36749,"KEMBANG, JATIPURNO, WONOGIRI, JAWA TENGAH",10,104,28,132
https://kawalpemilu.org#32875,"SALEBU, MAJENANG, CILACAP, JAWA TENGAH",31,161,61,222
https://kawalpemilu.org#38805,"SUWAWAL, MLONGGO, JEPARA, JAWA TENGAH",19,197,30,227
https://kawalpemilu.org#36251,"JIMBUNG, KALIKOTES, KLATEN, JAWA TENGAH",3,170,24,194
https://kawalpemilu.org#38760,"PELANG, MAYONG, JEPARA, JAWA TENGAH",15,153,49,202
https://kawalpemilu.org#36056,"BEJI, PEDAN, KLATEN, JAWA TENGAH",8,152,38,190
https://kawalpemilu.org#33643,"MANDIRAJAKULON, MANDIRAJA, BANJARNEGARA, JAWA TENGAH",15,171,55,226
https://kawalpemilu.org#33287,"PURWOSARI, BATURADEN, BANYUMAS, JAWA TENGAH",18,107,96,203
https://kawalpemilu.org#40140,"SIDOHARJO, BAWANG, BATANG, JAWA TENGAH",3,165,8,173
https://kawalpemilu.org#36086,"TEGALAMPEL, KARANGDOWO, KLATEN, JAWA TENGAH",1,130,34,164
https://kawalpemilu.org#40022,"RINGINARUM, RINGINARUM, KENDAL, JAWA TENGAH",14,127,22,149
https://kawalpemilu.org#39865,"KUTOHARJO, KALIWUNGU, KENDAL, JAWA TENGAH",6,172,38,210
https://kawalpemilu.org#38028,"PUNJULHARJO, REMBANG, REMBANG, JAWA TENGAH",2,147,32,179
https://kawalpemilu.org#40255,"KARANGASEM UTARA, BATANG, BATANG, JAWA TENGAH",23,174,47,221
https://kawalpemilu.org#40749,"WANAMULYA, PEMALANG, PEMALANG, JAWA TENGAH",12,111,42,153
https://kawalpemilu.org#40653,"GUNUNGJAYA, BELIK, PEMALANG, JAWA TENGAH",26,164,10,174
https://kawalpemilu.org#36993,"NGEBUNG, KALIJAMBE, SRAGEN, JAWA TENGAH",1,113,33,146
https://kawalpemilu.org#34073,"TLOGOPRAGOTO, MIRIT, KEBUMEN, JAWA TENGAH",7,96,21,117
https://kawalpemilu.org#32813,"KAWUNGANTEN LOR, KAWUNGANTEN, CILACAP, JAWA TENGAH",8,132,42,174
https://kawalpemilu.org#38258,"LUNDO, JAKEN, PATI, JAWA TENGAH",4,168,26,194
https://kawalpemilu.org#36982,"SELOROMO, JENAWI, KARANGANYAR, JAWA TENGAH",1,177,12,189
https://kawalpemilu.org#33959,"KEDALEMAN KULON, PURING, KEBUMEN, JAWA TENGAH",4,96,43,139
https://kawalpemilu.org#36266,"JEBUGAN, KLATEN UTARA, KLATEN, JAWA TENGAH",7,145,16,161
https://kawalpemilu.org#87442,"MUJUR, KROYA, CILACAP, JAWA TENGAH",19,123,86,209
https://kawalpemilu.org#39950,"TAMBAKREJO, PATEBON, KENDAL, JAWA TENGAH",9,129,38,167
https://kawalpemilu.org#33406,"PENARUBAN, KALIGONDANG, PURBALINGGA, JAWA TENGAH",9,158,88,246
https://kawalpemilu.org#84902,"GENTASARI, KROYA, CILACAP, JAWA TENGAH",22,132,67,199
https://kawalpemilu.org#42498,"JETIS LOR, NAWANGAN, PACITAN, JAWA TIMUR",7,93,108,201
https://kawalpemilu.org#46821,"MOJOSULUR, MOJOSARI, MOJOKERTO, JAWA TIMUR",13,105,89,194
https://kawalpemilu.org#48879,"BANYUURIP, SENORI, TUBAN, JAWA TIMUR",7,121,26,147
https://kawalpemilu.org#49791,"PANGKAHKULON, UJUNGPANGKAH, GRESIK, JAWA TIMUR",3,153,49,202
https://kawalpemilu.org#49936,"PENGALANGAN, MENGANTI, GRESIK, JAWA TIMUR",12,123,33,156
https://kawalpemilu.org#45049,"BARENG, KABAT, BANYUWANGI, JAWA TIMUR",3,154,32,186
https://kawalpemilu.org#50850,"PAYUDAN DUNDANG, GULUK-GULUK, SUMENEP, JAWA TIMUR",3,12,183,195
https://kawalpemilu.org#46635,"KETAJEN, GEDANGAN, SIDOARJO, JAWA TIMUR",9,177,48,225
https://kawalpemilu.org#42787,"TULUNG, SAMPUNG, PONOROGO, JAWA TIMUR",4,204,29,233
https://kawalpemilu.org#50638,"PANAAN, PALENGAAN, PAMEKASAN, JAWA TIMUR",13,0,280,280
https://kawalpemilu.org#45239,"SELOLEMBU, CURAHDAMI, BONDOWOSO, JAWA TIMUR",2,104,50,154
https://kawalpemilu.org#47882,"KEDIREN, LEMBEYAN, MAGETAN, JAWA TIMUR",9,111,57,168
https://kawalpemilu.org#44791,"KLOMPANGAN, AJUNG, JEMBER, JAWA TIMUR",1,123,52,175
https://kawalpemilu.org#43967,"PADANGAN, KAYEN KIDUL, KEDIRI, JAWA TIMUR",5,158,19,177
https://kawalpemilu.org#44570,"KUTORENON, SUKODONO, LUMAJANG, JAWA TIMUR",15,103,113,216
https://kawalpemilu.org#45204,"KERANG, SUKOSARI, BONDOWOSO, JAWA TIMUR",6,33,158,191
https://kawalpemilu.org#44035,"HARJOKUNCARAN, SUMBERMANJING WETAN, MALANG, JAWA TIMUR",11,120,38,158
https://kawalpemilu.org#48189,"WARUK KALONG, KWADUNGAN, NGAWI, JAWA TIMUR",8,193,40,233
https://kawalpemilu.org#44878,"SEBANEN, KALISAT, JEMBER, JAWA TIMUR",3,155,107,262
https://kawalpemilu.org#43486,"GAPRANG, KANIGORO, BLITAR, JAWA TIMUR",2,154,23,177
https://kawalpemilu.org#48279,"WIDODAREN, WIDODAREN, NGAWI, JAWA TIMUR",11,135,31,166
https://kawalpemilu.org#50049,"BILAPORAH, SOCAH, BANGKALAN, JAWA TIMUR",15,100,86,186
https://kawalpemilu.org#48522,"KAUMAN, BAURENO, BOJONEGORO, JAWA TIMUR",10,146,58,204
https://kawalpemilu.org#43256,"DEMUK, PUCANGLABAN, TULUNGAGUNG, JAWA TIMUR",20,134,49,183
https://kawalpemilu.org#49134,"WIDANG, WIDANG, TUBAN, JAWA TIMUR",18,143,73,216
https://kawalpemilu.org#44696,"KLATAKAN, TANGGUL, JEMBER, JAWA TIMUR",29,101,90,191
https://kawalpemilu.org#51185,"RAMPAL CELAKET, KLOJEN, KOTA MALANG, JAWA TIMUR",19,168,50,218
https://kawalpemilu.org#45611,"KERPANGAN, LECES, PROBOLINGGO, JAWA TIMUR",13,61,135,196
https://kawalpemilu.org#50730,"TLONTO RAJA, PASEAN, PAMEKASAN, JAWA TIMUR",29,26,151,177
https://kawalpemilu.org#50025,"GREJEG, TAMBAK, GRESIK, JAWA TIMUR",1,73,18,91
https://kawalpemilu.org#48830,"KEDUNGMAKAM, JATIROGO, TUBAN, JAWA TIMUR",7,138,20,158
https://kawalpemilu.org#44013,"SUMBEREJO, PAGAK, MALANG, JAWA TIMUR",6,167,23,190
https://kawalpemilu.org#51006,"BANJAR BARAT, GAPURA, SUMENEP, JAWA TIMUR",7,131,25,156
https://kawalpemilu.org#47791,"KALIGUNTING, MEJAYAN, MADIUN, JAWA TIMUR",5,115,23,138
https://kawalpemilu.org#51421,"GADING, TAMBAKSARI, KOTA SURABAYA, JAWA TIMUR",3,133,45,178
https://kawalpemilu.org#50709,"BATU BINTANG, BATUMARMAR, PAMEKASAN, JAWA TIMUR",7,50,77,127
https://kawalpemilu.org#43592,"KESAMBEN, KESAMBEN, BLITAR, JAWA TIMUR",25,164,20,184
https://kawalpemilu.org#50726,"SANA TENGAH, PASEAN, PAMEKASAN, JAWA TIMUR",22,26,196,222
https://kawalpemilu.org#47148,"BANJARDOWO, JOMBANG, JOMBANG, JAWA TIMUR",13,199,53,252
https://kawalpemilu.org#51538,"SUKOLILO BARU, BULAK, KOTA SURABAYA, JAWA TIMUR",11,108,101,209
https://kawalpemilu.org#50298,"GENTENG, KONANG, BANGKALAN, JAWA TIMUR",13,26,231,257
https://kawalpemilu.org#44973,"BENCULUK, CLURING, BANYUWANGI, JAWA TIMUR",13,154,33,187
https://kawalpemilu.org#44124,"BULUPITU, GONDANGLEGI, MALANG, JAWA TIMUR",9,62,75,137
https://kawalpemilu.org#47487,"GETAS, TANJUNGANOM, NGANJUK, JAWA TIMUR",9,184,16,200
https://kawalpemilu.org#43072,"TERTEK, TULUNGAGUNG, TULUNGAGUNG, JAWA TIMUR",16,162,48,210
https://kawalpemilu.org#49190,"NGUWOK, MODO, LAMONGAN, JAWA TIMUR",2,112,91,203
https://kawalpemilu.org#43623,"JATITENGAH, SELOPURO, BLITAR, JAWA TIMUR",4,129,17,146
https://kawalpemilu.org#44497,"SIDOREJO, ROWOKANGKUNG, LUMAJANG, JAWA TIMUR",7,141,86,227
https://kawalpemilu.org#51459,"AMPEL, SEMAMPIR, KOTA SURABAYA, JAWA TIMUR",41,77,133,210
https://kawalpemilu.org#51371,"KALIRUNGKUT, RUNGKUT, KOTA SURABAYA, JAWA TIMUR",45,138,67,205
https://kawalpemilu.org#45792,"SELOGUDIG WETAN, PAJARAKAN, PROBOLINGGO, JAWA TIMUR",9,140,80,220
https://kawalpemilu.org#47713,"WINONG, GEMARANG, MADIUN, JAWA TIMUR",10,164,27,191
https://kawalpemilu.org#45194,"SULEK, TLOGOSARI, BONDOWOSO, JAWA TIMUR",8,35,195,230
https://kawalpemilu.org#44926,"PESANGGARAN, PESANGGARAN, BANYUWANGI, JAWA TIMUR",25,152,43,195
https://kawalpemilu.org#50883,"PAKAMBAN DAYA, PRAGAAN, SUMENEP, JAWA TIMUR",2,33,162,195
https://kawalpemilu.org#44933,"TEMUREJO, BANGOREJO, BANYUWANGI, JAWA TIMUR",2,170,19,189
https://kawalpemilu.org#43040,"NGULANKULON, POGALAN, TRENGGALEK, JAWA TIMUR",9,148,27,175
https://kawalpemilu.org#50669,"MONTOK, LARANGAN, PAMEKASAN, JAWA TIMUR",7,82,114,196
https://kawalpemilu.org#43081,"KUTOANYAR, TULUNGAGUNG, TULUNGAGUNG, JAWA TIMUR",3,153,16,169
https://kawalpemilu.org#45085,"PANDEREJO, BANYUWANGI, BANYUWANGI, JAWA TIMUR",3,139,68,207
https://kawalpemilu.org#47587,"JAAN, GONDANG, NGANJUK, JAWA TIMUR",13,156,18,174
https://kawalpemilu.org#42933,"PAKEL, PULE, TRENGGALEK, JAWA TIMUR",7,153,25,178
https://kawalpemilu.org#48268,"WONOKERTO, KEDUNGGALAR, NGAWI, JAWA TIMUR",2,151,28,179
https://kawalpemilu.org#43595,"PAGERGUNUNG, KESAMBEN, BLITAR, JAWA TIMUR",7,127,5,132
https://kawalpemilu.org#44156,"KEMIRI, KEPANJEN, MALANG, JAWA TIMUR",12,155,46,201
https://kawalpemilu.org#47922,"KARANGREJO, KAWEDANAN, MAGETAN, JAWA TIMUR",8,167,43,210
https://kawalpemilu.org#43356,"TANGGUNG GUNUNG, TANGGUNGGUNUNG, TULUNGAGUNG, JAWA TIMUR",1,163,13,176
https://kawalpemilu.org#50620,"RANGPERANG DAJA, PROPPO, PAMEKASAN, JAWA TIMUR",2,18,119,137
https://kawalpemilu.org#47730,"NGLANDUK, WUNGU, MADIUN, JAWA TIMUR",1,94,62,156
https://kawalpemilu.org#48335,"GERIH, GERIH, NGAWI, JAWA TIMUR",38,181,38,219
https://kawalpemilu.org#46903,"BRANGKAL, SOOKO, MOJOKERTO, JAWA TIMUR",1,174,25,199
https://kawalpemilu.org#46145,"PAJARAN, REMBANG, PASURUAN, JAWA TIMUR",5,116,148,264
https://kawalpemilu.org#45829,"PIKATAN, GENDING, PROBOLINGGO, JAWA TIMUR",5,104,66,170
https://kawalpemilu.org#48551,"TEMU, KANOR, BOJONEGORO, JAWA TIMUR",2,98,105,203
https://kawalpemilu.org#45106,"WONGSOREJO, WONGSOREJO, BANYUWANGI, JAWA TIMUR",10,123,87,210
https://kawalpemilu.org#44330,"SUMBERPORONG, LAWANG, MALANG, JAWA TIMUR",6,123,70,193
https://kawalpemilu.org#43742,"WONOREJO, PUNCU, KEDIRI, JAWA TIMUR",9,179,26,205
https://kawalpemilu.org#48219,"SUKOWIYONO, PADAS, NGAWI, JAWA TIMUR",4,175,48,223
https://kawalpemilu.org#43387,"TOGOGAN, SRENGAT, BLITAR, JAWA TIMUR",11,196,12,208
https://kawalpemilu.org#43571,"BABADAN, WLINGI, BLITAR, JAWA TIMUR",19,81,45,126
https://kawalpemilu.org#50072,"KAMAL, KAMAL, BANGKALAN, JAWA TIMUR",8,87,97,184
https://kawalpemilu.org#47074,"KEDUNGLUMPANG, MOJOAGUNG, JOMBANG, JAWA TIMUR",6,185,12,197
https://kawalpemilu.org#46930,"BERATWETAN, GEDEG, MOJOKERTO, JAWA TIMUR",4,124,29,153
https://kawalpemilu.org#44597,"BANYUPUTIH LOR, RANDUAGUNG, LUMAJANG, JAWA TIMUR",3,114,136,250
https://kawalpemilu.org#47353,"MAGUAN, BERBEK, NGANJUK, JAWA TIMUR",1,146,24,170
https://kawalpemilu.org#43895,"KRENCENG, KEPUNG, KEDIRI, JAWA TIMUR",5,114,44,158
https://kawalpemilu.org#51353,"MANISREJO, TAMAN, KOTA MADIUN, JAWA TIMUR",34,81,75,156
https://kawalpemilu.org#51391,"PETEMON, SAWAHAN, KOTA SURABAYA, JAWA TIMUR",50,136,32,168
https://kawalpemilu.org#43820,"KWARON, PAPAR, KEDIRI, JAWA TIMUR",1,164,40,204
https://kawalpemilu.org#47157,"KEPUHKEMBENG, PETERONGAN, JOMBANG, JAWA TIMUR",7,135,31,166
https://kawalpemilu.org#43024,"KELUTAN, TRENGGALEK, TRENGGALEK, JAWA TIMUR",12,135,64,199
https://kawalpemilu.org#43506,"KALIPANG, SUTOJAYAN, BLITAR, JAWA TIMUR",30,96,14,110
https://kawalpemilu.org#43974,"PARON, NGASEM, KEDIRI, JAWA TIMUR",10,166,28,194
https://kawalpemilu.org#50766,"GADDING, MANDING, SUMENEP, JAWA TIMUR",7,18,143,161
https://kawalpemilu.org#44106,"UNDAAN, TUREN, MALANG, JAWA TIMUR",7,174,42,216
https://kawalpemilu.org#44650,"SARIMULYO, JOMBANG, JEMBER, JAWA TIMUR",4,97,84,181
https://kawalpemilu.org#43101,"SOBONTORO, BOYOLANGU, TULUNGAGUNG, JAWA TIMUR",11,146,69,215
https://kawalpemilu.org#48834,"DINGIL, JATIROGO, TUBAN, JAWA TIMUR",6,126,26,152
https://kawalpemilu.org#49001,"SUMURGENENG, JENU, TUBAN, JAWA TIMUR",6,145,41,186
https://kawalpemilu.org#42696,"SERANGAN, MLARAK, PONOROGO, JAWA TIMUR",1,144,87,231
https://kawalpemilu.org#50558,"JARIN, PADEMAWU, PAMEKASAN, JAWA TIMUR",8,61,150,211
https://kawalpemilu.org#51449,"MANUKAN KULON, TANDES, KOTA SURABAYA, JAWA TIMUR",28,128,93,221
https://kawalpemilu.org#48119,"SINE, SINE, NGAWI, JAWA TIMUR",10,124,64,188
https://kawalpemilu.org#45715,"JABUNG SISIR, PAITON, PROBOLINGGO, JAWA TIMUR",9,78,170,248
https://kawalpemilu.org#44770,"SERUT, PANTI, JEMBER, JAWA TIMUR",28,113,60,173
https://kawalpemilu.org#50051,"JADDIH, SOCAH, BANGKALAN, JAWA TIMUR",21,175,65,240
https://kawalpemilu.org#48552,"SIMOREJO, KANOR, BOJONEGORO, JAWA TIMUR",5,94,132,226
https://kawalpemilu.org#43957,"JEMEKAN, RINGINREJO, KEDIRI, JAWA TIMUR",4,163,31,194
https://kawalpemilu.org#48252,"TEGUHAN, PARON, NGAWI, JAWA TIMUR",1,218,35,253
https://kawalpemilu.org#43043,"NGADIREJO, POGALAN, TRENGGALEK, JAWA TIMUR",1,175,41,216
https://kawalpemilu.org#51357,"TAMAN, TAMAN, KOTA MADIUN, JAWA TIMUR",8,132,62,194
https://kawalpemilu.org#44671,"GUMUKMAS, GUMUKMAS, JEMBER, JAWA TIMUR",23,146,51,197
https://kawalpemilu.org#49132,"NGADIREJO, WIDANG, TUBAN, JAWA TIMUR",10,136,21,157
