https://kawalpemilu.org#28156,"CIRAPUHAN, SELAAWI, GARUT, JAWA BARAT",14,27,142,169
https://kawalpemilu.org#32416,"KALIABANG TENGAH, BEKASI UTARA, KOTA BEKASI, JAWA BARAT",131,84,154,238
https://kawalpemilu.org#30725,"SUKADADI, ARAHAN, INDRAMAYU, JAWA BARAT",9,122,35,157
https://kawalpemilu.org#30991,"SUKATANI, COMPRENG, SUBANG, JAWA BARAT",10,178,26,204
https://kawalpemilu.org#27410,"CILEUNYI WETAN, CILEUNYI, BANDUNG, JAWA BARAT",38,64,133,197
https://kawalpemilu.org#32337,"MAJAHLEGA, RANCASARI, KOTA BANDUNG, JAWA BARAT",15,67,102,169
https://kawalpemilu.org#30555,"TEMPEL KULON, LELEA, INDRAMAYU, JAWA BARAT",7,155,39,194
https://kawalpemilu.org#26429,"BABAKAN, TENJO, BOGOR, JAWA BARAT",13,74,123,197
https://kawalpemilu.org#28547,"KADIPATEN, KADIPATEN, TASIKMALAYA, JAWA BARAT",7,32,107,139
https://kawalpemilu.org#27475,"MEKARJAYA, BANJARAN, BANDUNG, JAWA BARAT",25,142,98,240
https://kawalpemilu.org#29213,"PUNCAK, CIGUGUR, KUNINGAN, JAWA BARAT",5,39,166,205
https://kawalpemilu.org#26823,"BALEKAMBANG, KALIBUNDER, SUKABUMI, JAWA BARAT",11,14,171,185
https://kawalpemilu.org#30502,"KADU, JATIGEDE, SUMEDANG, JAWA BARAT",6,191,24,215
https://kawalpemilu.org#29018,"WALAHARCAGEUR, LURAGUNG, KUNINGAN, JAWA BARAT",6,81,48,129
https://kawalpemilu.org#31438,"SRIJAYA, TIRTAJAYA, KARAWANG, JAWA BARAT",13,107,57,164
https://kawalpemilu.org#29844,"KALAPADUA, LEMAHSUGIH, MAJALENGKA, JAWA BARAT",7,53,94,147
https://kawalpemilu.org#31764,"KARANGASIH, CIKARANG UTARA, BEKASI, JAWA BARAT",55,63,110,173
https://kawalpemilu.org#32098,"KATULAMPA, BOGOR TIMUR, KOTA BOGOR, JAWA BARAT",73,217,36,253
https://kawalpemilu.org#32496,"MERUYUNG, LIMO, KOTA DEPOK, JAWA BARAT",37,166,62,228
https://kawalpemilu.org#32475,"DEPOK JAYA, PANCORAN MAS, KOTA DEPOK, JAWA BARAT",3,90,93,183
https://kawalpemilu.org#27281,"PAMOYANAN, CIBINONG, CIANJUR, JAWA BARAT",16,75,128,203
https://kawalpemilu.org#28253,"EUREUNPALAY, CIBALONG, TASIKMALAYA, JAWA BARAT",7,126,89,215
https://kawalpemilu.org#32224,"GARUDA, ANDIR, KOTA BANDUNG, JAWA BARAT",29,95,150,245
https://kawalpemilu.org#32186,"CIKUNDUL, LEMBURSITU, KOTA SUKABUMI, JAWA BARAT",13,36,177,213
https://kawalpemilu.org#28771,"KALIJAYA, BANJARANYAR, CIAMIS, JAWA BARAT",12,118,52,170
https://kawalpemilu.org#27687,"SUKAWENING, CIWIDEY, BANDUNG, JAWA BARAT",3,55,109,164
https://kawalpemilu.org#32310,"CIHAUR GEULIS, CIBEUNYING KALER, KOTA BANDUNG, JAWA BARAT",27,141,106,247
https://kawalpemilu.org#28733,"SITUMANDALA, RANCAH, CIAMIS, JAWA BARAT",4,72,141,213
https://kawalpemilu.org#32347,"PALASARI, CIBIRU, KOTA BANDUNG, JAWA BARAT",31,76,129,205
https://kawalpemilu.org#32086,"CIKARET, BOGOR SELATAN, KOTA BOGOR, JAWA BARAT",51,60,99,159
https://kawalpemilu.org#31738,"TRIDAYA SAKTI, TAMBUN SELATAN, BEKASI, JAWA BARAT",18,69,129,198
https://kawalpemilu.org#27763,"SUKAWANGI, TAROGONG KALER, GARUT, JAWA BARAT",11,67,164,231
https://kawalpemilu.org#29256,"SINDANGKEMPENG, PANCALANG, KUNINGAN, JAWA BARAT",2,48,91,139
https://kawalpemilu.org#30049,"JATITENGAH, JATITUJUH, MAJALENGKA, JAWA BARAT",2,95,96,191
https://kawalpemilu.org#30872,"PASIRKAREUMBI, SUBANG, SUBANG, JAWA BARAT",35,76,52,128
https://kawalpemilu.org#32347,"PALASARI, CIBIRU, KOTA BANDUNG, JAWA BARAT",14,93,135,228
https://kawalpemilu.org#31432,"PISANGSAMBO, TIRTAJAYA, KARAWANG, JAWA BARAT",10,139,77,216
https://kawalpemilu.org#26787,"CIHAMERANG, KABANDUNGAN, SUKABUMI, JAWA BARAT",20,52,103,155
https://kawalpemilu.org#28920,"SAGULING, BAREGBEG, CIAMIS, JAWA BARAT",4,50,110,160
https://kawalpemilu.org#26310,"CIAMPEA, CIAMPEA, BOGOR, JAWA BARAT",26,76,86,162
https://kawalpemilu.org#31602,"LANGENSARI, CILAMAYA KULON, KARAWANG, JAWA BARAT",10,83,118,201
https://kawalpemilu.org#28511,"SUKAHENING, SUKAHENING, TASIKMALAYA, JAWA BARAT",15,23,123,146
https://kawalpemilu.org#30682,"SINGARAJA, INDRAMAYU, INDRAMAYU, JAWA BARAT",5,161,62,223
https://kawalpemilu.org#27286,"WARGALUYU, CIBINONG, CIANJUR, JAWA BARAT",1,93,51,144
https://kawalpemilu.org#28216,"KALAPAGENEP, CIKALONG, TASIKMALAYA, JAWA BARAT",11,78,124,202
https://kawalpemilu.org#29323,"MARGACINA, KARANG KANCANA, KUNINGAN, JAWA BARAT",2,74,91,165
https://kawalpemilu.org#30749,"PAREAN GIRANG, KANDANGHAUR, INDRAMAYU, JAWA BARAT",17,128,73,201
https://kawalpemilu.org#28356,"MEKARJAYA, SUKARAJA, TASIKMALAYA, JAWA BARAT",14,24,191,215
https://kawalpemilu.org#32225,"CAMPAKA, ANDIR, KOTA BANDUNG, JAWA BARAT",27,90,98,188
https://kawalpemilu.org#26512,"PETIR, DRAMAGA, BOGOR, JAWA BARAT",11,76,181,257
https://kawalpemilu.org#31434,"MEDANKARYA, TIRTAJAYA, KARAWANG, JAWA BARAT",17,88,28,116
https://kawalpemilu.org#30850,"SUKAHAJI, PATROL, INDRAMAYU, JAWA BARAT",6,105,39,144
https://kawalpemilu.org#30159,"CIMANGGU GIRANG, CINGAMBUL, MAJALENGKA, JAWA BARAT",7,61,78,139
https://kawalpemilu.org#26650,"CARINGIN, CISOLOK, SUKABUMI, JAWA BARAT",6,55,75,130
https://kawalpemilu.org#27329,"WANASARI, NARINGGUL, CIANJUR, JAWA BARAT",11,112,35,147
https://kawalpemilu.org#32214,"KOPO, BOJONGLOA KALER, KOTA BANDUNG, JAWA BARAT",61,93,132,225
https://kawalpemilu.org#27614,"WANGISAGARA, MAJALAYA, BANDUNG, JAWA BARAT",33,73,142,215
https://kawalpemilu.org#30983,"TANJUNGSIANG, TANJUNGSIANG, SUBANG, JAWA BARAT",3,91,142,233
https://kawalpemilu.org#31736,"SETIAMEKAR, TAMBUN SELATAN, BEKASI, JAWA BARAT",145,73,60,133
https://kawalpemilu.org#32519,"PONDOK JAYA, CIPAYUNG, KOTA DEPOK, JAWA BARAT",77,79,87,166
https://kawalpemilu.org#28969,"BAYUNING, KADUGEDE, KUNINGAN, JAWA BARAT",10,68,117,185
https://kawalpemilu.org#27145,"CIHERANG, PACET, CIANJUR, JAWA BARAT",26,63,170,233
https://kawalpemilu.org#31459,"SUKASARI, CIBUAYA, KARAWANG, JAWA BARAT",9,107,95,200
https://kawalpemilu.org#31736,"SETIAMEKAR, TAMBUN SELATAN, BEKASI, JAWA BARAT",150,41,50,91
https://kawalpemilu.org#28938,"LUMBUNG, LUMBUNG, CIAMIS, JAWA BARAT",7,24,143,167
https://kawalpemilu.org#31999,"CANGKORAH, BATUJAJAR, BANDUNG BARAT, JAWA BARAT",14,92,155,247
https://kawalpemilu.org#28472,"RANCAPAKU, PADAKEMBANG, TASIKMALAYA, JAWA BARAT",27,61,143,204
https://kawalpemilu.org#29531,"SAMPIRAN, TALUN, CIREBON, JAWA BARAT",3,115,65,180
https://kawalpemilu.org#26897,"SEUSEUPAN, CARINGIN, SUKABUMI, JAWA BARAT",5,47,162,209
https://kawalpemilu.org#30972,"RAWAMEKAR, BLANAKAN, SUBANG, JAWA BARAT",10,165,39,204
https://kawalpemilu.org#27362,"CILOTO, CIPANAS, CIANJUR, JAWA BARAT",17,71,170,241
https://kawalpemilu.org#29688,"KEJIWAN, SUSUKAN, CIREBON, JAWA BARAT",11,108,37,145
https://kawalpemilu.org#27868,"KERTAJAYA, CIBATU, GARUT, JAWA BARAT",6,36,118,154
https://kawalpemilu.org#32336,"DERWATI, RANCASARI, KOTA BANDUNG, JAWA BARAT",28,57,165,222
https://kawalpemilu.org#26280,"PARAKANJAYA, KEMANG, BOGOR, JAWA BARAT",6,69,186,255
https://kawalpemilu.org#32015,"SITUWANGI, CIHAMPELAS, BANDUNG BARAT, JAWA BARAT",23,49,101,150
https://kawalpemilu.org#29375,"AMBIT, WALED, CIREBON, JAWA BARAT",6,130,71,201
https://kawalpemilu.org#26590,"CISALADA, CIGOMBONG, BOGOR, JAWA BARAT",13,50,153,203
https://kawalpemilu.org#30649,"KEBULEN, JATIBARANG, INDRAMAYU, JAWA BARAT",1,170,52,222
https://kawalpemilu.org#31904,"GUDANGKAHURIPAN, LEMBANG, BANDUNG BARAT, JAWA BARAT",22,68,162,230
https://kawalpemilu.org#38539,"KENANTI, DUKUHSETI, PATI, JAWA TENGAH",3,182,14,196
https://kawalpemilu.org#36107,"CARIKAN, JUWIRING, KLATEN, JAWA TENGAH",7,196,20,216
https://kawalpemilu.org#40778,"KENDALSARI, PETARUKAN, PEMALANG, JAWA TENGAH",7,138,56,194
https://kawalpemilu.org#38926,"BANDUNGREJO, MRANGGEN, DEMAK, JAWA TENGAH",2,126,84,210
https://kawalpemilu.org#40636,"BATURSARI, PULOSARI, PEMALANG, JAWA TENGAH",5,103,4,107
https://kawalpemilu.org#84918,"TRITIH LOR, JERUKLEGI, CILACAP, JAWA TENGAH",18,155,41,196
https://kawalpemilu.org#32877,"JENANG, MAJENANG, CILACAP, JAWA TENGAH",20,157,83,240
https://kawalpemilu.org#40929,"BALAPULANG WETAN, BALAPULANG, TEGAL, JAWA TENGAH",27,161,49,210
https://kawalpemilu.org#38025,"PADARAN, REMBANG, REMBANG, JAWA TENGAH",6,214,22,236
https://kawalpemilu.org#39052,"JATISONO, GAJAH, DEMAK, JAWA TENGAH",6,129,53,182
https://kawalpemilu.org#40580,"PEKUNCEN, WIRADESA, PEKALONGAN, JAWA TENGAH",13,133,114,247
https://kawalpemilu.org#41303,"SIGENTONG, WANASARI, BREBES, JAWA TENGAH",15,155,42,197
https://kawalpemilu.org#39508,"SOBOREJO, PRINGSURAT, TEMANGGUNG, JAWA TENGAH",4,196,34,230
https://kawalpemilu.org#37321,"SIMO, KRADENAN, GROBOGAN, JAWA TENGAH",12,237,8,245
https://kawalpemilu.org#39609,"SUKOMARTO, JUMO, TEMANGGUNG, JAWA TENGAH",4,219,15,234
https://kawalpemilu.org#41763,"BRINGIN, NGALIYAN, KOTA SEMARANG, JAWA TENGAH",30,166,83,249
https://kawalpemilu.org#34232,"SIDOMUKTI, ADIMULYO, KEBUMEN, JAWA TENGAH",2,142,62,204
https://kawalpemilu.org#36395,"GENENGSARI, POLOKARTO, SUKOHARJO, JAWA TENGAH",4,167,79,246
https://kawalpemilu.org#36914,"NGASEM, COLOMADU, KARANGANYAR, JAWA TENGAH",12,186,13,199
https://kawalpemilu.org#38822,"JERUKWANGI, BANGSRI, JEPARA, JAWA TENGAH",6,174,35,209
https://kawalpemilu.org#36414,"TELUKAN, GROGOL, SUKOHARJO, JAWA TENGAH",12,166,92,258
https://kawalpemilu.org#36366,"MULUR, BENDOSARI, SUKOHARJO, JAWA TENGAH",12,157,87,244
https://kawalpemilu.org#34904,"SUMBEREJO, WADASLINTANG, WONOSOBO, JAWA TENGAH",6,113,27,140
https://kawalpemilu.org#41626,"SAWAH BESAR, GAYAM SARI, KOTA SEMARANG, JAWA TENGAH",16,186,16,202
https://kawalpemilu.org#33347,"KEDUNGBENDA, KEMANGKON, PURBALINGGA, JAWA TENGAH",11,163,5,168
https://kawalpemilu.org#33135,"KEDUNGRANDU, PATIKRAJA, BANYUMAS, JAWA TENGAH",14,160,34,194
https://kawalpemilu.org#87452,"TARISI, WANAREJA, CILACAP, JAWA TENGAH",20,156,26,182
https://kawalpemilu.org#38356,"DENGKEK, PATI, PATI, JAWA TENGAH",7,151,40,191
https://kawalpemilu.org#33457,"CANDIWULAN, KUTASARI, PURBALINGGA, JAWA TENGAH",4,154,36,190
https://kawalpemilu.org#40080,"BANDAR, BANDAR, BATANG, JAWA TENGAH",6,137,67,204
https://kawalpemilu.org#39991,"TAMBAKSARI, ROWOSARI, KENDAL, JAWA TENGAH",8,194,11,205
https://kawalpemilu.org#36556,"BATURETNO, BATURETNO, WONOGIRI, JAWA TENGAH",13,130,58,188
https://kawalpemilu.org#35390,"NGAWONGGO, KALIANGKRIK, MAGELANG, JAWA TENGAH",3,165,42,207
https://kawalpemilu.org#41836,"PEKAUMAN, TEGAL BARAT, KOTA TEGAL, JAWA TENGAH",20,133,114,247
https://kawalpemilu.org#37342,"KARANGREJO, GABUS, GROBOGAN, JAWA TENGAH",7,177,12,189
https://kawalpemilu.org#36141,"DELANGGU, DELANGGU, KLATEN, JAWA TENGAH",19,129,21,150
https://kawalpemilu.org#35387,"SUKOMAKMUR, KAJORAN, MAGELANG, JAWA TENGAH",3,133,11,144
https://kawalpemilu.org#37007,"MANYARREJO, PLUPUH, SRAGEN, JAWA TENGAH",5,144,25,169
https://kawalpemilu.org#39269,"KESONGO, TUNTANG, SEMARANG, JAWA TENGAH",8,168,63,231
https://kawalpemilu.org#35569,"GIRIMULYO, WINDUSARI, MAGELANG, JAWA TENGAH",4,170,63,233
https://kawalpemilu.org#41682,"GAJAHMUNGKUR, GAJAH MUNGKUR, KOTA SEMARANG, JAWA TENGAH",12,197,34,231
https://kawalpemilu.org#40851,"PESANTREN, ULUJAMI, PEMALANG, JAWA TENGAH",25,163,39,202
https://kawalpemilu.org#37487,"TLOGOREJO, TEGOWANU, GROBOGAN, JAWA TENGAH",12,181,29,210
https://kawalpemilu.org#41424,"LARANGAN, LARANGAN, BREBES, JAWA TENGAH",68,125,44,169
https://kawalpemilu.org#34949,"SAPURAN, SAPURAN, WONOSOBO, JAWA TENGAH",17,163,26,189
https://kawalpemilu.org#38493,"GUNUNGWUNGKAL, GUNUNGWUNGKAL, PATI, JAWA TENGAH",7,130,30,160
https://kawalpemilu.org#41163,"DUKUHWARU, DUKUHWARU, TEGAL, JAWA TENGAH",22,97,91,188
https://kawalpemilu.org#36844,"PABLENGAN, MATESIH, KARANGANYAR, JAWA TENGAH",4,103,21,124
https://kawalpemilu.org#39399,"ROGOMULYO, KALIWUNGU, SEMARANG, JAWA TENGAH",3,198,28,226
https://kawalpemilu.org#37067,"BEDORO, SAMBUNGMACAN, SRAGEN, JAWA TENGAH",17,135,22,157
https://kawalpemilu.org#35256,"SRUMBUNG, SRUMBUNG, MAGELANG, JAWA TENGAH",11,117,65,182
https://kawalpemilu.org#33978,"GROGOLBENINGSARI, PETANAHAN, KEBUMEN, JAWA TENGAH",4,156,59,215
https://kawalpemilu.org#39994,"TANJUNGSARI, ROWOSARI, KENDAL, JAWA TENGAH",10,182,26,208
https://kawalpemilu.org#41823,"JENGGOT, PEKALONGAN SELATAN, KOTA PEKALONGAN, JAWA TENGAH",22,121,116,237
https://kawalpemilu.org#41200,"PANGEBATAN, BANTARKAWUNG, BREBES, JAWA TENGAH",37,38,88,126
https://kawalpemilu.org#39272,"TUNTANG, TUNTANG, SEMARANG, JAWA TENGAH",15,203,35,238
https://kawalpemilu.org#36252,"NGEMPLAK, KALIKOTES, KLATEN, JAWA TENGAH",10,125,59,184
https://kawalpemilu.org#33683,"KRANDEGAN, BANJARNEGARA, BANJARNEGARA, JAWA TENGAH",21,70,57,127
https://kawalpemilu.org#36695,"BULUKERTO, BULUKERTO, WONOGIRI, JAWA TENGAH",8,157,21,178
https://kawalpemilu.org#36214,"KAYUMAS, JATINOM, KLATEN, JAWA TENGAH",3,230,20,250
https://kawalpemilu.org#38579,"KALIWUNGU, KALIWUNGU, KUDUS, JAWA TENGAH",10,153,22,175
https://kawalpemilu.org#34851,"TRIREJO, LOANO, PURWOREJO, JAWA TENGAH",1,94,28,122
https://kawalpemilu.org#33052,"KECILA, KEMRANJEN, BANYUMAS, JAWA TENGAH",17,125,74,199
https://kawalpemilu.org#41023,"DUKUHSALAM, SLAWI, TEGAL, JAWA TENGAH",8,111,86,197
https://kawalpemilu.org#40181,"KEBONDALEM, GRINGSING, BATANG, JAWA TENGAH",15,138,29,167
https://kawalpemilu.org#33031,"TIPAR, RAWALO, BANYUMAS, JAWA TENGAH",6,148,32,180
https://kawalpemilu.org#40591,"REMBUN, SIWALAN, PEKALONGAN, JAWA TENGAH",1,170,15,185
https://kawalpemilu.org#35088,"KURIPAN, WATUMALANG, WONOSOBO, JAWA TENGAH",4,165,13,178
https://kawalpemilu.org#35893,"GESIKAN, GANTIWARNO, KLATEN, JAWA TENGAH",1,115,43,158
https://kawalpemilu.org#32863,"NEGARAJATI, CIMANGGU, CILACAP, JAWA TENGAH",6,105,43,148
https://kawalpemilu.org#39027,"GETAS, WONOSALAM, DEMAK, JAWA TENGAH",12,147,54,201
https://kawalpemilu.org#37964,"RINGIN, PAMOTAN, REMBANG, JAWA TENGAH",1,98,68,166
https://kawalpemilu.org#41665,"PETERONGAN, SEMARANG SELATAN, KOTA SEMARANG, JAWA TENGAH",9,216,44,183
https://kawalpemilu.org#36999,"DONOYUDAN, KALIJAMBE, SRAGEN, JAWA TENGAH",14,150,60,210
https://kawalpemilu.org#40984,"KEDUNGBANTENG, KEDUNGBANTENG, TEGAL, JAWA TENGAH",15,141,53,194
https://kawalpemilu.org#41135,"JATIMULYA, SURADADI, TEGAL, JAWA TENGAH",9,160,33,193
https://kawalpemilu.org#40794,"KLAREYAN, PETARUKAN, PEMALANG, JAWA TENGAH",39,0,0,0
https://kawalpemilu.org#33025,"MENGANTI, RAWALO, BANYUMAS, JAWA TENGAH",8,128,34,162
https://kawalpemilu.org#40291,"KARANGGENENG, KANDEMAN, BATANG, JAWA TENGAH",6,176,38,214
https://kawalpemilu.org#38122,"GEDONGMULYO, LASEM, REMBANG, JAWA TENGAH",11,146,43,189
https://kawalpemilu.org#41325,"PEMARON, BREBES, BREBES, JAWA TENGAH",1,79,96,175
https://kawalpemilu.org#41295,"KLAMPOK, WANASARI, BREBES, JAWA TENGAH",14,185,18,203
https://kawalpemilu.org#39200,"TEGALREJO, TENGARAN, SEMARANG, JAWA TENGAH",4,138,75,213
https://kawalpemilu.org#41833,"PESURUNGAN KIDUL, TEGAL BARAT, KOTA TEGAL, JAWA TENGAH",3,134,56,190
https://kawalpemilu.org#33493,"TLAGAYASA, BOBOTSARI, PURBALINGGA, JAWA TENGAH",6,140,66,206
https://kawalpemilu.org#40929,"BALAPULANG WETAN, BALAPULANG, TEGAL, JAWA TENGAH",7,162,66,228
https://kawalpemilu.org#33250,"LEDUG, KEMBARAN, BANYUMAS, JAWA TENGAH",7,150,57,207
https://kawalpemilu.org#34677,"SUMBERSARI, BUTUH, PURWOREJO, JAWA TENGAH",1,65,39,104
https://kawalpemilu.org#41673,"JOMBLANG, CANDISARI, KOTA SEMARANG, JAWA TENGAH",45,195,39,234
https://kawalpemilu.org#37247,"MOJOAGUNG, KARANGRAYUNG, GROBOGAN, JAWA TENGAH",17,168,18,186
https://kawalpemilu.org#36729,"GONDANGSARI, JATISRONO, WONOGIRI, JAWA TENGAH",13,146,21,167
https://kawalpemilu.org#40283,"BAKALAN, KANDEMAN, BATANG, JAWA TENGAH",6,219,20,239
https://kawalpemilu.org#39532,"SAMIRANAN, KANDANGAN, TEMANGGUNG, JAWA TENGAH",7,182,25,207
https://kawalpemilu.org#40020,"KEDUNGSARI, RINGINARUM, KENDAL, JAWA TENGAH",4,192,17,209
https://kawalpemilu.org#41230,"PAKUJATI, PAGUYANGAN, BREBES, JAWA TENGAH",10,128,57,185
https://kawalpemilu.org#34326,"GUNUNGSARI, KARANGGAYAM, KEBUMEN, JAWA TENGAH",11,85,27,112
https://kawalpemilu.org#35187,"NGADIREJO, SALAMAN, MAGELANG, JAWA TENGAH",9,152,43,195
https://kawalpemilu.org#40049,"MAGELUNG, KALIWUNGU SELATAN, KENDAL, JAWA TENGAH",10,175,24,199
https://kawalpemilu.org#34055,"SINGOSARI, AMBAL, KEBUMEN, JAWA TENGAH",3,153,58,211
https://kawalpemilu.org#39159,"MUTIH WETAN, WEDUNG, DEMAK, JAWA TENGAH",4,101,44,145
https://kawalpemilu.org#33028,"TAMBAKNEGARA, RAWALO, BANYUMAS, JAWA TENGAH",14,145,45,190
https://kawalpemilu.org#35940,"BENDUNGAN, CAWAS, KLATEN, JAWA TENGAH",3,109,35,144
https://kawalpemilu.org#32741,"PAGUBUGAN KULON, BINANGUN, CILACAP, JAWA TENGAH",8,154,44,198
https://kawalpemilu.org#32874,"PAHONJEAN, MAJENANG, CILACAP, JAWA TENGAH",25,123,61,184
https://kawalpemilu.org#34573,"MRANTI, PURWOREJO, PURWOREJO, JAWA TENGAH",4,142,34,176
https://kawalpemilu.org#39137,"TRIDONOREJO, BONANG, DEMAK, JAWA TENGAH",16,0,0,0
https://kawalpemilu.org#37676,"TAMANREJO, TUNJUNGAN, BLORA, JAWA TENGAH",1,121,74,195
https://kawalpemilu.org#34402,"BAKUREJO, GRABAG, PURWOREJO, JAWA TENGAH",2,102,14,116
https://kawalpemilu.org#38833,"KELING, KELING, JEPARA, JAWA TENGAH",19,159,8,167
https://kawalpemilu.org#34920,"GONDOWULAN, KEPIL, WONOSOBO, JAWA TENGAH",1,75,53,128
https://kawalpemilu.org#38854,"TAHUNAN, TAHUNAN, JEPARA, JAWA TENGAH",31,205,28,233
https://kawalpemilu.org#38984,"BEDONO, SAYUNG, DEMAK, JAWA TENGAH",8,197,29,226
https://kawalpemilu.org#38475,"NGEMPLAK LOR, MARGOYOSO, PATI, JAWA TENGAH",4,108,41,149
https://kawalpemilu.org#34836,"SALAM, GEBANG, PURWOREJO, JAWA TENGAH",2,95,16,111
https://kawalpemilu.org#37060,"PLOSOREJO, GONDANG, SRAGEN, JAWA TENGAH",10,141,16,157
https://kawalpemilu.org#38735,"LEBUAWU, PECANGAAN, JEPARA, JAWA TENGAH",5,137,56,193
https://kawalpemilu.org#41021,"KALISAPU, SLAWI, TEGAL, JAWA TENGAH",3,94,124,218
https://kawalpemilu.org#39485,"PURWOREJO, TEMANGGUNG, TEMANGGUNG, JAWA TENGAH",6,147,35,182
https://kawalpemilu.org#39009,"WONOAGUNG, KARANGTENGAH, DEMAK, JAWA TENGAH",1,158,41,199
https://kawalpemilu.org#33756,"KANDANGWANGI, WANADADI, BANJARNEGARA, JAWA TENGAH",11,162,47,209
https://kawalpemilu.org#41576,"TEGALREJO, ARGOMULYO, KOTA SALATIGA, JAWA TENGAH",35,143,90,233
https://kawalpemilu.org#33053,"NUSAMANGIR, KEMRANJEN, BANYUMAS, JAWA TENGAH",4,119,47,166
https://kawalpemilu.org#84931,"PANULISAN TIMUR, DAYEUHLUHUR, CILACAP, JAWA TENGAH",11,119,22,141
https://kawalpemilu.org#33684,"KUTABANJARNEGARA, BANJARNEGARA, BANJARNEGARA, JAWA TENGAH",24,96,124,220
https://kawalpemilu.org#33511,"LUMPANG, KARANGANYAR, PURBALINGGA, JAWA TENGAH",5,130,53,183
https://kawalpemilu.org#35965,"SAJEN, TRUCUK, KLATEN, JAWA TENGAH",1,153,37,190
https://kawalpemilu.org#87464,"DAYEUHLUHUR, DAYEUHLUHUR, CILACAP, JAWA TENGAH",17,136,53,189
https://kawalpemilu.org#33537,"LOSARI, REMBANG, PURBALINGGA, JAWA TENGAH",20,82,48,130
https://kawalpemilu.org#37848,"SENDANGMULYO, BULU, REMBANG, JAWA TENGAH",6,175,7,182
https://kawalpemilu.org#87453,"BANTAR, WANAREJA, CILACAP, JAWA TENGAH",4,114,88,202
https://kawalpemilu.org#37903,"BABAKTULUNG, SARANG, REMBANG, JAWA TENGAH",8,102,54,156
https://kawalpemilu.org#39362,"GONDORIYO, BERGAS, SEMARANG, JAWA TENGAH",4,203,23,226
https://kawalpemilu.org#35592,"NGARGOSARI, AMPEL, BOYOLALI, JAWA TENGAH",5,159,26,185
https://kawalpemilu.org#36440,"GENTAN, BAKI, SUKOHARJO, JAWA TENGAH",17,177,69,246
https://kawalpemilu.org#36945,"KEBAK, KEBAKKRAMAT, KARANGANYAR, JAWA TENGAH",8,77,33,110
https://kawalpemilu.org#33681,"PARAKANCANGGAH, BANJARNEGARA, BANJARNEGARA, JAWA TENGAH",19,163,89,252
https://kawalpemilu.org#35967,"KRADENAN, TRUCUK, KLATEN, JAWA TENGAH",11,139,65,204
https://kawalpemilu.org#41769,"WONOSARI, NGALIYAN, KOTA SEMARANG, JAWA TENGAH",37,112,76,188
https://kawalpemilu.org#87476,"SERANG, CIPARI, CILACAP, JAWA TENGAH",3,118,58,176
https://kawalpemilu.org#35132,"MENJER, GARUNG, WONOSOBO, JAWA TENGAH",3,167,36,203
https://kawalpemilu.org#41524,"SEMANGGI, PASAR KLIWON, KOTA SURAKARTA, JAWA TENGAH",61,181,54,235
https://kawalpemilu.org#41620,"REJOSARI, SEMARANG TIMUR, KOTA SEMARANG, JAWA TENGAH",19,165,45,210
https://kawalpemilu.org#39075,"TUWANG, KARANGANYAR, DEMAK, JAWA TENGAH",3,162,23,185
https://kawalpemilu.org#36266,"JEBUGAN, KLATEN UTARA, KLATEN, JAWA TENGAH",5,200,24,224
https://kawalpemilu.org#40806,"KARANGTENGAH, AMPELGADING, PEMALANG, JAWA TENGAH",5,144,42,186
https://kawalpemilu.org#36075,"KARANGJOHO, KARANGDOWO, KLATEN, JAWA TENGAH",2,173,14,187
https://kawalpemilu.org#91441,"TAMBAKREJA, CILACAP SELATAN, CILACAP, JAWA TENGAH",56,153,56,209
https://kawalpemilu.org#37401,"CANDISARI, PURWODADI, GROBOGAN, JAWA TENGAH",1,157,31,188
https://kawalpemilu.org#36906,"JATI, JATEN, KARANGANYAR, JAWA TENGAH",24,129,84,213
https://kawalpemilu.org#40228,"TULIS, TULIS, BATANG, JAWA TENGAH",7,168,44,212
https://kawalpemilu.org#35589,"TANDUK, AMPEL, BOYOLALI, JAWA TENGAH",21,152,25,177
https://kawalpemilu.org#37427,"TARUMAN, KLAMBU, GROBOGAN, JAWA TENGAH",9,151,27,178
https://kawalpemilu.org#41738,"SALAMAN MLOYO, SEMARANG BARAT, KOTA SEMARANG, JAWA TENGAH",2,169,77,246
https://kawalpemilu.org#37163,"MOJOPURO, SUMBERLAWANG, SRAGEN, JAWA TENGAH",15,139,50,189
https://kawalpemilu.org#33335,"MERSI, PURWOKERTO TIMUR, BANYUMAS, JAWA TENGAH",20,154,71,225
https://kawalpemilu.org#39343,"REMBES, BRINGIN, SEMARANG, JAWA TENGAH",7,150,14,164
https://kawalpemilu.org#36170,"BLANCERAN, KARANGANOM, KLATEN, JAWA TENGAH",12,189,34,223
https://kawalpemilu.org#39416,"KALIREJO, UNGARAN TIMUR, SEMARANG, JAWA TENGAH",4,165,87,252
https://kawalpemilu.org#34670,"TURSINO, KUTOARJO, PURWOREJO, JAWA TENGAH",6,123,20,143
https://kawalpemilu.org#33376,"PENARUBAN, BUKATEJA, PURBALINGGA, JAWA TENGAH",6,145,33,178
https://kawalpemilu.org#36134,"SRIBIT, DELANGGU, KLATEN, JAWA TENGAH",6,108,60,168
https://kawalpemilu.org#35177,"TEMPUREJO, KALIBAWANG, WONOSOBO, JAWA TENGAH",11,147,26,147
https://kawalpemilu.org#39585,"TEGALREJO, NGADIREJO, TEMANGGUNG, JAWA TENGAH",8,163,8,171
https://kawalpemilu.org#37965,"SUMBANGREJO, PAMOTAN, REMBANG, JAWA TENGAH",3,168,14,182
https://kawalpemilu.org#34379,"KALIGENDING, KARANGSAMBUNG, KEBUMEN, JAWA TENGAH",2,111,45,156
https://kawalpemilu.org#34477,"PIYONO, NGOMBOL, PURWOREJO, JAWA TENGAH",2,92,71,163
https://kawalpemilu.org#35120,"KEBRENGAN, MOJOTENGAH, WONOSOBO, JAWA TENGAH",4,144,19,163
https://kawalpemilu.org#33575,"PANUNGGALAN, PENGADEGAN, PURBALINGGA, JAWA TENGAH",4,120,32,152
https://kawalpemilu.org#34445,"WASIAT, NGOMBOL, PURWOREJO, JAWA TENGAH",4,102,53,155
https://kawalpemilu.org#41812,"PANJANG WETAN, PEKALONGAN UTARA, KOTA PEKALONGAN, JAWA TENGAH",15,146,71,217
https://kawalpemilu.org#36098,"BOLOPLERET, JUWIRING, KLATEN, JAWA TENGAH",8,183,25,208
https://kawalpemilu.org#41641,"BANGETAYU KULON, GENUK, KOTA SEMARANG, JAWA TENGAH",31,171,33,204
https://kawalpemilu.org#34715,"KALIMATI, PITURUH, PURWOREJO, JAWA TENGAH",3,105,11,116
https://kawalpemilu.org#38572,"BLIMBING KIDUL, KALIWUNGU, KUDUS, JAWA TENGAH",15,128,31,159
https://kawalpemilu.org#39626,"CANGGAL, CANDIROTO, TEMANGGUNG, JAWA TENGAH",9,169,12,181
https://kawalpemilu.org#33394,"PANGEMPON, KEJOBONG, PURBALINGGA, JAWA TENGAH",5,170,43,213
https://kawalpemilu.org#38098,"SUMURTAWANG, KRAGAN, REMBANG, JAWA TENGAH",3,204,12,216
https://kawalpemilu.org#40607,"KEBONROWOPUCANG, KARANGDADAP, PEKALONGAN, JAWA TENGAH",13,186,12,198
https://kawalpemilu.org#39915,"BUMIAYU, WELERI, KENDAL, JAWA TENGAH",4,145,36,181
https://kawalpemilu.org#33557,"METENGGENG, BOJONGSARI, PURBALINGGA, JAWA TENGAH",2,97,95,192
https://kawalpemilu.org#32858,"PANIMBANG, CIMANGGU, CILACAP, JAWA TENGAH",10,94,135,229
https://kawalpemilu.org#36474,"JOHO, PRACIMANTORO, WONOGIRI, JAWA TENGAH",13,157,7,164
https://kawalpemilu.org#38357,"SUGIHARJO, PATI, PATI, JAWA TENGAH",1,118,47,165
https://kawalpemilu.org#37339,"TAHUNAN, GABUS, GROBOGAN, JAWA TENGAH",2,177,20,197
https://kawalpemilu.org#35737,"KISMOYOSO, NGEMPLAK, BOYOLALI, JAWA TENGAH",9,229,15,244
https://kawalpemilu.org#33370,"CIPAWON, BUKATEJA, PURBALINGGA, JAWA TENGAH",7,170,53,223
https://kawalpemilu.org#41680,"BENDAN NGISOR, GAJAH MUNGKUR, KOTA SEMARANG, JAWA TENGAH",14,185,58,243
https://kawalpemilu.org#37921,"NGULAHAN, SEDAN, REMBANG, JAWA TENGAH",1,142,54,196
https://kawalpemilu.org#35059,"PURBOSONO, KERTEK, WONOSOBO, JAWA TENGAH",4,191,8,199
https://kawalpemilu.org#37474,"KUNJENG, GUBUG, GROBOGAN, JAWA TENGAH",2,165,53,218
https://kawalpemilu.org#33769,"TANJUNGANOM, RAKIT, BANJARNEGARA, JAWA TENGAH",11,154,58,212
https://kawalpemilu.org#34627,"TANGKISAN, BAYAN, PURWOREJO, JAWA TENGAH",3,73,111,184
https://kawalpemilu.org#38400,"MARGOREJO, MARGOREJO, PATI, JAWA TENGAH",7,143,73,216
https://kawalpemilu.org#39797,"MLATIHARJO, PATEAN, KENDAL, JAWA TENGAH",3,211,15,226
https://kawalpemilu.org#34278,"SEMPOR, SEMPOR, KEBUMEN, JAWA TENGAH",9,125,12,137
https://kawalpemilu.org#36923,"BATURAN, COLOMADU, KARANGANYAR, JAWA TENGAH",5,140,49,189
https://kawalpemilu.org#41021,"KALISAPU, SLAWI, TEGAL, JAWA TENGAH",2,102,115,217
https://kawalpemilu.org#34033,"SIDOMORO, BULUSPESANTREN, KEBUMEN, JAWA TENGAH",4,132,28,160
https://kawalpemilu.org#39407,"LANGENSARI, UNGARAN BARAT, SEMARANG, JAWA TENGAH",24,167,32,199
https://kawalpemilu.org#33390,"LANGGAR, KEJOBONG, PURBALINGGA, JAWA TENGAH",13,137,31,168
https://kawalpemilu.org#41731,"KRAPYAK, SEMARANG BARAT, KOTA SEMARANG, JAWA TENGAH",9,207,39,246
https://kawalpemilu.org#38305,"GROWONG KIDUL, JUWANA, PATI, JAWA TENGAH",12,254,9,263
https://kawalpemilu.org#84897,"BANGUNREJA, KEDUNGREJA, CILACAP, JAWA TENGAH",7,136,62,198
https://kawalpemilu.org#41401,"BANGSRI, BULAKAMBA, BREBES, JAWA TENGAH",33,174,11,185
https://kawalpemilu.org#32714,"WLAHAR, ADIPALA, CILACAP, JAWA TENGAH",5,219,13,232
https://kawalpemilu.org#41210,"DUKUHTURI, BUMIAYU, BREBES, JAWA TENGAH",10,103,66,169
https://kawalpemilu.org#32721,"KALIKUDI, ADIPALA, CILACAP, JAWA TENGAH",3,116,68,184
https://kawalpemilu.org#35737,"KISMOYOSO, NGEMPLAK, BOYOLALI, JAWA TENGAH",23,188,27,215
https://kawalpemilu.org#33825,"GROGOL, PEJAWARAN, BANJARNEGARA, JAWA TENGAH",6,78,41,119
https://kawalpemilu.org#41782,"MEDONO, PEKALONGAN BARAT, KOTA PEKALONGAN, JAWA TENGAH",36,123,41,164
https://kawalpemilu.org#38433,"GUWO, TLOGOWUNGU, PATI, JAWA TENGAH",5,204,16,220
https://kawalpemilu.org#39896,"SEDAYU, GEMUH, KENDAL, JAWA TENGAH",7,167,10,177
https://kawalpemilu.org#41407,"CIPELEM, BULAKAMBA, BREBES, JAWA TENGAH",2,114,45,159
