Link KawalPemilu,Nama Kelurahan,Nomor TPS,Suara 01,Suara 02,Suara Sah
https://kawalpemilu.org#748,"BUKIT DINDENG, JULOK, ACEH TIMUR, ACEH",2,13,130,143
https://kawalpemilu.org#6514,"GAMPONG COT BA' U, SUKAJAYA, KOTA SABANG, ACEH",20,7,88,95
https://kawalpemilu.org#3923,"MATANG PANYANG, BAKTIYA BARAT, ACEH UTARA, ACEH",2,0,0,0
https://kawalpemilu.org#2535,"KRUENG JANGKO, GEULUMPANG TIGA, PIDIE, ACEH",1,15,159,174
https://kawalpemilu.org#2304,"CUCUM, KOTA JANTHO, ACEH BESAR, ACEH",1,25,130,155
https://kawalpemilu.org#929299,"BABAH LHUNG, BLANG PIDIE, ACEH BARAT DAYA, ACEH",2,11,222,233
https://kawalpemilu.org#295,"PULO GADUNG, LAWE ALAS, ACEH TENGGARA, ACEH",1,11,204,215
https://kawalpemilu.org#3912,"BUKET LINTEUNG, LANGKAHAN, ACEH UTARA, ACEH",55,32,115,147
https://kawalpemilu.org#3408,"TEUNGOH GLUMPANG VII, MATANGKULI, ACEH UTARA, ACEH",33,15,201,216
https://kawalpemilu.org#3627,"MEUCAT, SYAMTALIRA ARON, ACEH UTARA, ACEH",17,10,176,186
https://kawalpemilu.org#5638,"SUAK BILIE, SUKA MAKMUE, NAGAN RAYA, ACEH",1,4,175,179
https://kawalpemilu.org#3383,"BULOH, LHOKSUKON, ACEH UTARA, ACEH",1,4,112,116
https://kawalpemilu.org#6086,"KERLANG, SYIAH UTAMA, BENER MERIAH, ACEH",1,31,34,65
https://kawalpemilu.org#307,"SUKA DAMAI, LAWE SIGALA-GALA, ACEH TENGGARA, ACEH",1,18,171,189
https://kawalpemilu.org#3460,"PALOH RAYA, MUARA BATU, ACEH UTARA, ACEH",70,7,189,196
https://kawalpemilu.org#3817,"PAYA GABOH, SAWANG, ACEH UTARA, ACEH",54,8,164,172
https://kawalpemilu.org#802,"ALUE TEH, BIREM BAYEUN, ACEH TIMUR, ACEH",2,17,157,174
https://kawalpemilu.org#4480,"BLANG MATANG, PEUDADA, BIREUEN, ACEH",1,15,198,213
https://kawalpemilu.org#1498,"UJONG BAROH, JOHAN PAHWALAN, ACEH BARAT, ACEH",8,26,202,228
https://kawalpemilu.org#6523,"MEUNASAH MEE, MUARA DUA, KOTA LHOKSEUMAWE, ACEH",3,17,174,191
https://kawalpemilu.org#3122,"DAYAH KUMBA, MUTIARA TIMUR, PIDIE, ACEH",1,6,173,179
https://kawalpemilu.org#6493,"CEURIH, ULEE KARENG, KOTA BANDA ACEH, ACEH",2,21,160,181
https://kawalpemilu.org#910,"BAYEUN, RANTAU SELAMAT, ACEH TIMUR, ACEH",4,21,174,195
https://kawalpemilu.org#241,"AUR PEULUMAT, LABUHAN HAJI TIMUR, ACEH SELATAN, ACEH",2,2,145,147
https://kawalpemilu.org#169,"MATA IE, PASIE RAJA, ACEH SELATAN, ACEH",2,14,161,175
https://kawalpemilu.org#3914,"SEUREUKE, LANGKAHAN, ACEH UTARA, ACEH",61,55,165,220
https://kawalpemilu.org#6641,"ALUE DUA, LANGSA BARO, KOTA LANGSA, ACEH",9,25,196,221
https://kawalpemilu.org#757,"GAMPONG JAWA, IDI RAYEUK, ACEH TIMUR, ACEH",3,23,197,220
https://kawalpemilu.org#5900,"SELAMAT, TENGGULUN, ACEH TAMIANG, ACEH",14,20,118,138
https://kawalpemilu.org#5544,"IE BEUDOH, SEUNAGAN TIMUR, NAGAN RAYA, ACEH",2,8,170,178
https://kawalpemilu.org#1504,"PADANG SEURAHET, JOHAN PAHWALAN, ACEH BARAT, ACEH",3,25,216,241
https://kawalpemilu.org#1198,"MATANG BUNGONG, IDI TIMUR, ACEH TIMUR, ACEH",1,13,182,195
https://kawalpemilu.org#951,"SEUNEUBOK BARO, RANTAU PEUREULAK, ACEH TIMUR, ACEH",2,11,142,153
https://kawalpemilu.org#6541,"KAMPUNG JAWA, BANDA SAKTI, KOTA LHOKSEUMAWE, ACEH",7,23,171,194
https://kawalpemilu.org#5396,"KUALA, INDRA JAYA, ACEH JAYA, ACEH",1,9,242,251
https://kawalpemilu.org#5869,"SUKA RAKYAT, RANTAU, ACEH TAMIANG, ACEH",4,6,108,114
https://kawalpemilu.org#5621,"SERBA JADI, DARUL MAKMUR, NAGAN RAYA, ACEH",5,31,152,183
https://kawalpemilu.org#6414,"KOTA BARU, KUTA ALAM, KOTA BANDA ACEH, ACEH",1,47,168,215
https://kawalpemilu.org#4072,"ULEE NYEUE, BANDA BARO, ACEH UTARA, ACEH",13,11,230,241
https://kawalpemilu.org#1619,"BAKAT, WOYLA, ACEH BARAT, ACEH",2,13,163,176
https://kawalpemilu.org#5945,"GUNUNG TUNYANG, TIMANG GAJAH, BENER MERIAH, ACEH",2,32,121,153
https://kawalpemilu.org#6412,"LAKSANA, KUTA ALAM, KOTA BANDA ACEH, ACEH",11,42,111,153
https://kawalpemilu.org#4939,"MATA IE, PEUSANGAN SELATAN, BIREUEN, ACEH",1,18,151,169
https://kawalpemilu.org#53910,"BANYUNING, BULELENG, BULELENG, BALI",43,140,17,157
https://kawalpemilu.org#54001,"DAUH PURI, DENPASAR BARAT, KOTA DENPASAR, BALI",2,86,119,205
https://kawalpemilu.org#53667,"TAMANBALI, BANGLI, BANGLI, BALI",26,159,10,169
https://kawalpemilu.org#54006,"PADANGSAMBIAN, DENPASAR BARAT, KOTA DENPASAR, BALI",1,238,4,242
https://kawalpemilu.org#54006,"PADANGSAMBIAN, DENPASAR BARAT, KOTA DENPASAR, BALI",24,147,10,157
https://kawalpemilu.org#53811,"TULAMBEN, KUBU, KARANGASEM, BALI",26,117,3,120
https://kawalpemilu.org#53975,"PEDUNGAN, DENPASAR SELATAN, KOTA DENPASAR, BALI",15,183,19,202
https://kawalpemilu.org#53534,"ABIANBASE, GIANYAR, GIANYAR, BALI",16,206,18,224
https://kawalpemilu.org#53285,"TUWED, MELAYA, JEMBRANA, BALI",9,134,42,176
https://kawalpemilu.org#53575,"TARO, TEGALALLANG, GIANYAR, BALI",27,163,5,168
https://kawalpemilu.org#53813,"SUKADANA, KUBU, KARANGASEM, BALI",14,129,7,5
https://kawalpemilu.org#53384,"SELANBAWAK, MARGA, TABANAN, BALI",7,237,11,248
https://kawalpemilu.org#53366,"BUWIT, KEDIRI, TABANAN, BALI",5,171,20,191
https://kawalpemilu.org#53531,"BONA, BLAHBATUH, GIANYAR, BALI",10,222,15,237
https://kawalpemilu.org#53497,"JIMBARAN, KUTA SELATAN, BADUNG, BALI",81,176,17,193
https://kawalpemilu.org#53269,"MEDEWI, PEKUTATAN, JEMBRANA, BALI",13,169,18,187
https://kawalpemilu.org#53989,"DANGIN PURI KELOD, DENPASAR TIMUR, KOTA DENPASAR, BALI",5,175,24,199
https://kawalpemilu.org#53622,"SEMARAPURA KANGIN, KLUNGKUNG, KLUNGKUNG, BALI",3,166,26,192
https://kawalpemilu.org#53372,"NYITDAH, KEDIRI, TABANAN, BALI",6,283,2,285
https://kawalpemilu.org#53654,"ABUAN, SUSUT, BANGLI, BALI",10,160,7,167
https://kawalpemilu.org#53527,"BLAHBATUH, BLAHBATUH, GIANYAR, BALI",15,211,11,222
https://kawalpemilu.org#53975,"PEDUNGAN, DENPASAR SELATAN, KOTA DENPASAR, BALI",36,208,11,219
https://kawalpemilu.org#53496,"TANJUNG BENOA, KUTA SELATAN, BADUNG, BALI",5,221,21,242
https://kawalpemilu.org#53458,"MENGWI, MENGWI, BADUNG, BALI",4,238,6,244
https://kawalpemilu.org#53888,"PANCASARI, SUKASADA, BULELENG, BALI",1,226,6,232
https://kawalpemilu.org#53704,"BATUR SELATAN, KINTAMANI, BANGLI, BALI",24,167,16,183
https://kawalpemilu.org#53903,"BANYUASRI, BULELENG, BULELENG, BALI",15,229,23,252
https://kawalpemilu.org#53760,"SUBAGAN, KARANGASEM, KARANGASEM, BALI",39,20,166,186
https://kawalpemilu.org#53738,"SIDEMEN, SIDEMEN, KARANGASEM, BALI",9,221,11,232
https://kawalpemilu.org#53530,"MEDAHAN, BLAHBATUH, GIANYAR, BALI",14,189,14,203
https://kawalpemilu.org#53778,"DATAH, ABANG, KARANGASEM, BALI",14,99,5,104
https://kawalpemilu.org#53012,"CIBODASARI, CIBODAS, KOTA TANGERANG, BANTEN",55,122,154,276
https://kawalpemilu.org#52473,"BINONG, CURUG, TANGERANG, BANTEN",54,62,58,120
https://kawalpemilu.org#52781,"BOJONG PANDAN, TUNJUNG TEJA, SERANG, BANTEN",12,67,127,194
https://kawalpemilu.org#52548,"CURUG SANGERENG, KELAPA DUA, TANGERANG, BANTEN",33,227,13,240
https://kawalpemilu.org#53114,"UNYUR, SERANG, KOTA SERANG, BANTEN",8,60,167,227
https://kawalpemilu.org#52963,"JURUMUDI, BENDA, KOTA TANGERANG, BANTEN",39,39,150,189
https://kawalpemilu.org#53012,"CIBODASARI, CIBODAS, KOTA TANGERANG, BANTEN",13,68,117,185
https://kawalpemilu.org#52690,"KENCANA HARAPAN, LEBAK WANGI, SERANG, BANTEN",4,26,144,170
https://kawalpemilu.org#51701,"CIGONDANG, LABUAN, PANDEGLANG, BANTEN",6,74,121,195
https://kawalpemilu.org#51654,"PASANGGRAHAN, MUNJUL, PANDEGLANG, BANTEN",7,81,138,219
https://kawalpemilu.org#53034,"PANUNGGANGAN, PINANG, KOTA TANGERANG, BANTEN",2,129,100,229
https://kawalpemilu.org#51830,"CISEREH, CISATA, PANDEGLANG, BANTEN",4,60,111,171
https://kawalpemilu.org#51649,"SUMURLABAN, ANGSANA, PANDEGLANG, BANTEN",5,66,130,196
https://kawalpemilu.org#52204,"GUNUNGBATU, CILOGRANG, LEBAK, BANTEN",2,31,168,199
https://kawalpemilu.org#52623,"BOJONEGARA, BOJONEGARA, SERANG, BANTEN",1,31,205,236
https://kawalpemilu.org#53238,"KADEMANGAN, SETU, KOTA TANGERANG SELATAN, BANTEN",13,91,125,216
https://kawalpemilu.org#52858,"PABUARAN, PABUARAN, SERANG, BANTEN",1,20,202,222
https://kawalpemilu.org#52875,"KALUMPANG, PADARINCANG, SERANG, BANTEN",7,77,188,265
https://kawalpemilu.org#53071,"MEKARSARI, PULOMERAK, KOTA CILEGON, BANTEN",19,72,148,220
https://kawalpemilu.org#52831,"CARENANG UDIK, KOPO, SERANG, BANTEN",4,80,130,210
https://kawalpemilu.org#52823,"PASIRLIMUS, PAMARAYAN, SERANG, BANTEN",16,116,86,202
https://kawalpemilu.org#52419,"GELAM JAYA, PASAR KEMIS, TANGERANG, BANTEN",33,0,0,0
https://kawalpemilu.org#53208,"JURANGMANGU TIMUR, PONDOK AREN, KOTA TANGERANG SELATAN, BANTEN",51,49,171,220
https://kawalpemilu.org#52473,"BINONG, CURUG, TANGERANG, BANTEN",158,134,13,147
https://kawalpemilu.org#53013,"CIBODAS BARU, CIBODAS, KOTA TANGERANG, BANTEN",6,80,94,174
https://kawalpemilu.org#52071,"SAJIRA, SAJIRA, LEBAK, BANTEN",7,16,190,206
https://kawalpemilu.org#52511,"RANCAGONG, LEGOK, TANGERANG, BANTEN",22,97,107,204
https://kawalpemilu.org#52427,"KAMPUNG MELAYU TIMUR, TELUKNAGA, TANGERANG, BANTEN",9,66,152,218
https://kawalpemilu.org#52957,"PORIS GAGA BARU, BATUCEPER, KOTA TANGERANG, BANTEN",11,80,126,206
https://kawalpemilu.org#52418,"PANGADEGAN, PASAR KEMIS, TANGERANG, BANTEN",18,50,59,109
https://kawalpemilu.org#52968,"CIPONDOH, CIPONDOH, KOTA TANGERANG, BANTEN",38,98,71,169
https://kawalpemilu.org#52617,"SUKABARES, WARINGINKURUNG, SERANG, BANTEN",9,43,106,149
https://kawalpemilu.org#53178,"TAMAN BARU, TAKTAKAN, KOTA SERANG, BANTEN",11,87,153,240
https://kawalpemilu.org#53162,"BANJAR SARI, CIPOCOK JAYA, KOTA SERANG, BANTEN",36,39,130,169
https://kawalpemilu.org#53002,"PASAR BARU, KARAWACI, KOTA TANGERANG, BANTEN",6,105,114,219
https://kawalpemilu.org#51607,"MAHENDRA, CIBALIUNG, PANDEGLANG, BANTEN",2,105,120,225
https://kawalpemilu.org#52968,"CIPONDOH, CIPONDOH, KOTA TANGERANG, BANTEN",61,132,134,266
https://kawalpemilu.org#52391,"RAWA KIDANG, SUKADIRI, TANGERANG, BANTEN",7,35,152,187
https://kawalpemilu.org#52412,"SINDANGSARI, PASAR KEMIS, TANGERANG, BANTEN",21,62,128,190
https://kawalpemilu.org#52966,"JURUMUDI BARU, BENDA, KOTA TANGERANG, BANTEN",2,40,132,172
https://kawalpemilu.org#51586,"TAMANJAYA, SUMUR, PANDEGLANG, BANTEN",8,116,16,132
https://kawalpemilu.org#51596,"CIMANGGU, CIMANGGU, PANDEGLANG, BANTEN",2,112,77,189
https://kawalpemilu.org#52066,"SANGKANMANIK, CIMARGA, LEBAK, BANTEN",3,40,158,198
https://kawalpemilu.org#51979,"MEKARWANGI, MUNCANG, LEBAK, BANTEN",2,20,144,164
https://kawalpemilu.org#52176,"KUJANGSARI, CIBEBER, LEBAK, BANTEN",1,121,119,240
https://kawalpemilu.org#52536,"KALIASIN, SUKAMULYA, TANGERANG, BANTEN",21,91,150,241
https://kawalpemilu.org#52105,"MUARA CIUJUNG TIMUR, RANGKASBITUNG, LEBAK, BANTEN",17,83,114,197
https://kawalpemilu.org#53048,"CIPADU, LARANGAN, KOTA TANGERANG, BANTEN",16,93,132,225
https://kawalpemilu.org#52311,"MATAGARA, TIGARAKSA, TANGERANG, BANTEN",28,111,130,241
https://kawalpemilu.org#52951,"MANIS JAYA, JATIUWUNG, KOTA TANGERANG, BANTEN",18,50,74,124
https://kawalpemilu.org#53227,"BENDA BARU, PAMULANG, KOTA TANGERANG SELATAN, BANTEN",26,124,68,192
https://kawalpemilu.org#52665,"DUKUH, KRAGILAN, SERANG, BANTEN",14,42,101,143
https://kawalpemilu.org#53027,"SUDIMARA PINANG, PINANG, KOTA TANGERANG, BANTEN",8,87,60,147
https://kawalpemilu.org#53113,"CIMUNCANG, SERANG, KOTA SERANG, BANTEN",28,77,152,229
https://kawalpemilu.org#51959,"LUHURJAYA, CIPANAS, LEBAK, BANTEN",8,108,120,228
https://kawalpemilu.org#52398,"SUKATANI, RAJEG, TANGERANG, BANTEN",54,99,124,223
https://kawalpemilu.org#53230,"PONDOK CABE ILIR, PAMULANG, KOTA TANGERANG SELATAN, BANTEN",24,80,141,221
https://kawalpemilu.org#52410,"MEKARSARI, RAJEG, TANGERANG, BANTEN",32,49,171,220
https://kawalpemilu.org#53230,"PONDOK CABE ILIR, PAMULANG, KOTA TANGERANG SELATAN, BANTEN",13,82,159,241
https://kawalpemilu.org#53142,"PASULUHAN, WALANTAKA, KOTA SERANG, BANTEN",10,66,166,232
https://kawalpemilu.org#53214,"SAWAH, CIPUTAT, KOTA TANGERANG SELATAN, BANTEN",24,101,105,206
https://kawalpemilu.org#52215,"SUKATANI, WANASALAM, LEBAK, BANTEN",6,65,125,190
https://kawalpemilu.org#52548,"CURUG SANGERENG, KELAPA DUA, TANGERANG, BANTEN",41,196,7,203
https://kawalpemilu.org#51694,"KADUBERA, PICUNG, PANDEGLANG, BANTEN",10,134,87,221
https://kawalpemilu.org#52489,"SUKADAMAI, CIKUPA, TANGERANG, BANTEN",42,33,113,146
https://kawalpemilu.org#53203,"PONDOK AREN, PONDOK AREN, KOTA TANGERANG SELATAN, BANTEN",58,74,125,199
https://kawalpemilu.org#51879,"SUKARAME, CARITA, PANDEGLANG, BANTEN",13,81,135,216
https://kawalpemilu.org#52042,"CIKAREO, CILELES, LEBAK, BANTEN",7,16,76,92
https://kawalpemilu.org#52546,"PAKULONAN BARAT, KELAPA DUA, TANGERANG, BANTEN",12,48,157,205
https://kawalpemilu.org#53216,"JOMBANG, CIPUTAT, KOTA TANGERANG SELATAN, BANTEN",75,113,115,228
https://kawalpemilu.org#53134,"NYAPAH, WALANTAKA, KOTA SERANG, BANTEN",11,61,177,238
https://kawalpemilu.org#52074,"PARUNGSARI, SAJIRA, LEBAK, BANTEN",2,20,197,217
https://kawalpemilu.org#52412,"SINDANGSARI, PASAR KEMIS, TANGERANG, BANTEN",12,42,106,148
https://kawalpemilu.org#52474,"CURUG WETAN, CURUG, TANGERANG, BANTEN",41,126,75,201
https://kawalpemilu.org#52969,"CIPONDOH MAKMUR, CIPONDOH, KOTA TANGERANG, BANTEN",44,88,125,213
https://kawalpemilu.org#52302,"SUMUR BANDUNG, JAYANTI, TANGERANG, BANTEN",9,44,112,156
https://kawalpemilu.org#51594,"CIBURIAL, CIMANGGU, PANDEGLANG, BANTEN",12,93,123,216
https://kawalpemilu.org#52479,"SUKAMULYA, CIKUPA, TANGERANG, BANTEN",44,37,126,163
https://kawalpemilu.org#52193,"CIHERANG, CIBEBER, LEBAK, BANTEN",6,61,111,172
https://kawalpemilu.org#52104,"CIJORO PASIR, RANGKASBITUNG, LEBAK, BANTEN",8,49,142,191
https://kawalpemilu.org#52246,"SANGIANGTANJUNG, KALANGANYAR, LEBAK, BANTEN",11,54,80,134
https://kawalpemilu.org#52495,"RANCA IYUH, PANONGAN, TANGERANG, BANTEN",23,0,0,0
https://kawalpemilu.org#53108,"SERANG, SERANG, KOTA SERANG, BANTEN",57,83,109,192
https://kawalpemilu.org#21287,"PADANG BENDAR, HULU PALIK, BENGKULU UTARA, BENGKULU",4,83,59,142
https://kawalpemilu.org#21322,"DATAR RUYUNG, ARGA MAKMUR, BENGKULU UTARA, BENGKULU",1,98,139,237
https://kawalpemilu.org#22282,"BAJAK, TELUK SEGARA, KOTA BENGKULU, BENGKULU",5,48,90,138
https://kawalpemilu.org#21192,"DUKU ULU, CURUP TIMUR, REJANG LEBONG, BENGKULU",3,78,118,196
https://kawalpemilu.org#22054,"BIOA SENGOK, RIMBO PENGADANG, LEBONG, BENGKULU",4,134,63,197
https://kawalpemilu.org#22259,"SUMUR DEWA, SELEBAR, KOTA BENGKULU, BENGKULU",23,66,160,226
https://kawalpemilu.org#87341,"TANJUNG MUARA, PINANG RAYA, BENGKULU UTARA, BENGKULU",2,75,51,126
https://kawalpemilu.org#21294,"TALANG RENDAH, HULU PALIK, BENGKULU UTARA, BENGKULU",2,168,81,249
https://kawalpemilu.org#21048,"AIR SULAU, KEDURANG ILIR, BENGKULU SELATAN, BENGKULU",8,101,48,149
https://kawalpemilu.org#22190,"PASAR UJUNG, KEPAHIANG, KEPAHIANG, BENGKULU",7,42,86,128
https://kawalpemilu.org#22264,"JALAN GEDANG, GADING CEMPAKA, KOTA BENGKULU, BENGKULU",7,80,144,224
https://kawalpemilu.org#21819,"LUNJUK, SELUMA BARAT, SELUMA, BENGKULU",2,106,142,248
https://kawalpemilu.org#21118,"KASIE KASUBUN, PADANG ULAK TANDING, REJANG LEBONG, BENGKULU",1,54,184,238
https://kawalpemilu.org#21629,"SUKARAMI, KELAM TENGAH, KAUR, BENGKULU",1,62,71,133
https://kawalpemilu.org#22137,"KEBAN AGUNG, BERMANI ILIR, KEPAHIANG, BENGKULU",2,48,72,120
https://kawalpemilu.org#21142,"TALANG BENIH, CURUP, REJANG LEBONG, BENGKULU",17,87,121,208
https://kawalpemilu.org#42110,"PAMPANG, PALIYAN, GUNUNGKIDUL, DAERAH ISTIMEWA YOGYAKARTA",3,98,45,143
https://kawalpemilu.org#42303,"PONDOKREJO, TEMPEL, SLEMAN, DAERAH ISTIMEWA YOGYAKARTA",2,156,89,245
https://kawalpemilu.org#42018,"MANGUNAN, DLINGO, BANTUL, DAERAH ISTIMEWA YOGYAKARTA",1,161,12,173
https://kawalpemilu.org#42046,"BANGUNHARJO, SEWON, BANTUL, DAERAH ISTIMEWA YOGYAKARTA",70,177,34,211
https://kawalpemilu.org#42274,"BOKOHARJO, PRAMBANAN, SLEMAN, DAERAH ISTIMEWA YOGYAKARTA",30,139,81,220
https://kawalpemilu.org#42140,"NGIPAK, KARANGMOJO, GUNUNGKIDUL, DAERAH ISTIMEWA YOGYAKARTA",6,150,75,225
https://kawalpemilu.org#41903,"BANARAN, GALUR, KULON PROGO, DAERAH ISTIMEWA YOGYAKARTA",12,90,145,235
https://kawalpemilu.org#41922,"SUKORENO, SENTOLO, KULON PROGO, DAERAH ISTIMEWA YOGYAKARTA",19,207,47,254
https://kawalpemilu.org#42284,"WEDOMARTANI, NGEMPLAK, SLEMAN, DAERAH ISTIMEWA YOGYAKARTA",82,97,48,145
https://kawalpemilu.org#42164,"MELIKAN, RONGKOP, GUNUNGKIDUL, DAERAH ISTIMEWA YOGYAKARTA",5,176,49,225
https://kawalpemilu.org#41972,"SRIGADING, SANDEN, BANTUL, DAERAH ISTIMEWA YOGYAKARTA",36,156,34,190
https://kawalpemilu.org#42370,"KEPARAKAN, MERGANGSAN, KOTA YOGYAKARTA, DAERAH ISTIMEWA YOGYAKARTA",1,149,53,202
https://kawalpemilu.org#42312,"WONOKERTO, TURI, SLEMAN, DAERAH ISTIMEWA YOGYAKARTA",20,131,58,189
https://kawalpemilu.org#42231,"SIDOMULYO, GODEAN, SLEMAN, DAERAH ISTIMEWA YOGYAKARTA",1,145,73,218
https://kawalpemilu.org#42310,"DONOKERTO, TURI, SLEMAN, DAERAH ISTIMEWA YOGYAKARTA",18,105,114,219
https://kawalpemilu.org#41991,"GILANGHARJO, PANDAK, BANTUL, DAERAH ISTIMEWA YOGYAKARTA",51,154,36,190
https://kawalpemilu.org#42031,"TAMANAN, BANGUNTAPAN, BANTUL, DAERAH ISTIMEWA YOGYAKARTA",37,138,63,201
https://kawalpemilu.org#42126,"SIDOHARJO, TEPUS, GUNUNGKIDUL, DAERAH ISTIMEWA YOGYAKARTA",13,100,139,239
https://kawalpemilu.org#42011,"WUKIRSARI, IMOGIRI, BANTUL, DAERAH ISTIMEWA YOGYAKARTA",3,185,62,247
https://kawalpemilu.org#42327,"KRICAK, TEGALREJO, KOTA YOGYAKARTA, DAERAH ISTIMEWA YOGYAKARTA",38,151,75,226
https://kawalpemilu.org#42296,"TRIDADI, SLEMAN, SLEMAN, DAERAH ISTIMEWA YOGYAKARTA",28,108,81,189
https://kawalpemilu.org#42282,"BIMOMARTANI, NGEMPLAK, SLEMAN, DAERAH ISTIMEWA YOGYAKARTA",13,107,100,207
https://kawalpemilu.org#42102,"PATUK, PATUK, GUNUNGKIDUL, DAERAH ISTIMEWA YOGYAKARTA",8,163,81,244
https://kawalpemilu.org#41964,"BANJAROYO, KALIBAWANG, KULON PROGO, DAERAH ISTIMEWA YOGYAKARTA",13,188,47,235
https://kawalpemilu.org#42027,"JAGALAN, BANGUNTAPAN, BANTUL, DAERAH ISTIMEWA YOGYAKARTA",8,89,163,252
https://kawalpemilu.org#42358,"MANTRIJERON, MANTRIJERON, KOTA YOGYAKARTA, DAERAH ISTIMEWA YOGYAKARTA",8,141,108,249
https://kawalpemilu.org#42290,"SUKOHARJO, NGAGLIK, SLEMAN, DAERAH ISTIMEWA YOGYAKARTA",14,132,62,194
https://kawalpemilu.org#42142,"GEDANGREJO, KARANGMOJO, GUNUNGKIDUL, DAERAH ISTIMEWA YOGYAKARTA",10,130,60,190
https://kawalpemilu.org#42034,"WONOKROMO, PLERET, BANTUL, DAERAH ISTIMEWA YOGYAKARTA",40,139,96,235
https://kawalpemilu.org#25970,"KALIDERES, KALIDERES, JAKARTA BARAT, DKI JAKARTA",137,85,116,201
https://kawalpemilu.org#26061,"BINTARO, PESANGGRAHAN, JAKARTA SELATAN, DKI JAKARTA",37,106,65,171
https://kawalpemilu.org#26014,"PASAR MINGGU, PASAR MINGGU, JAKARTA SELATAN, DKI JAKARTA",48,163,78,241
https://kawalpemilu.org#26109,"PULO GEBANG, CAKUNG, JAKARTA TIMUR, DKI JAKARTA",107,92,85,177
https://kawalpemilu.org#26115,"KLENDER, DUREN SAWIT, JAKARTA TIMUR, DKI JAKARTA",174,57,181,238
https://kawalpemilu.org#26057,"TANJUNG BARAT, JAGAKARSA, JAKARTA SELATAN, DKI JAKARTA",29,123,55,178
https://kawalpemilu.org#26006,"KUNINGAN TIMUR, SETIABUDI, JAKARTA SELATAN, DKI JAKARTA",9,103,156,259
https://kawalpemilu.org#25840,"DURI PULO, GAMBIR, JAKARTA PUSAT, DKI JAKARTA",27,84,153,237
https://kawalpemilu.org#25931,"CENGKARENG TIMUR, CENGKARENG, JAKARTA BARAT, DKI JAKARTA",60,123,112,235
https://kawalpemilu.org#26058,"CIPEDAK, JAGAKARSA, JAKARTA SELATAN, DKI JAKARTA",33,91,111,202
https://kawalpemilu.org#26100,"KALISARI, PASAR REBO, JAKARTA TIMUR, DKI JAKARTA",31,88,158,246
https://kawalpemilu.org#25978,"KOTA BAMBU UTARA, PALMERAH, JAKARTA BARAT, DKI JAKARTA",38,68,131,199
https://kawalpemilu.org#25948,"PINANGSIA, TAMAN SARI, JAKARTA BARAT, DKI JAKARTA",18,104,84,188
https://kawalpemilu.org#26033,"CIPETE SELATAN, CILANDAK, JAKARTA SELATAN, DKI JAKARTA",45,113,120,233
https://kawalpemilu.org#25972,"TEGAL ALUR, KALIDERES, JAKARTA BARAT, DKI JAKARTA",275,106,80,186
https://kawalpemilu.org#25930,"KAPUK, CENGKARENG, JAKARTA BARAT, DKI JAKARTA",82,144,105,249
https://kawalpemilu.org#26004,"PASAR MANGGIS, SETIABUDI, JAKARTA SELATAN, DKI JAKARTA",34,74,116,190
https://kawalpemilu.org#26139,"LUBANG BUAYA, CIPAYUNG, JAKARTA TIMUR, DKI JAKARTA",83,114,145,259
https://kawalpemilu.org#26128,"CIBUBUR, CIRACAS, JAKARTA TIMUR, DKI JAKARTA",187,113,144,257
https://kawalpemilu.org#25913,"SEMPER TIMUR, CILINCING, JAKARTA UTARA, DKI JAKARTA",91,113,114,227
https://kawalpemilu.org#25993,"MENTENG DALAM, TEBET, JAKARTA SELATAN, DKI JAKARTA",43,88,137,225
https://kawalpemilu.org#26109,"PULO GEBANG, CAKUNG, JAKARTA TIMUR, DKI JAKARTA",82,100,120,220
https://kawalpemilu.org#26018,"PEJATEN TIMUR, PASAR MINGGU, JAKARTA SELATAN, DKI JAKARTA",112,59,133,192
https://kawalpemilu.org#26087,"CIPINANG MUARA, JATINEGARA, JAKARTA TIMUR, DKI JAKARTA",9,107,115,1
https://kawalpemilu.org#26032,"GANDARIA SELATAN, CILANDAK, JAKARTA SELATAN, DKI JAKARTA",23,102,71,173
https://kawalpemilu.org#25851,"SERDANG, KEMAYORAN, JAKARTA PUSAT, DKI JAKARTA",85,126,121,247
https://kawalpemilu.org#26094,"BATU AMPAR, KRAMATJATI, JAKARTA TIMUR, DKI JAKARTA",54,75,156,231
https://kawalpemilu.org#26062,"PETUKANGAN UTARA, PESANGGRAHAN, JAKARTA SELATAN, DKI JAKARTA",14,101,129,230
https://kawalpemilu.org#25915,"SEMPER BARAT, CILINCING, JAKARTA UTARA, DKI JAKARTA",211,47,139,186
https://kawalpemilu.org#25836,"CIDENG, GAMBIR, JAKARTA PUSAT, DKI JAKARTA",20,187,46,233
https://kawalpemilu.org#25926,"CENGKARENG BARAT, CENGKARENG, JAKARTA BARAT, DKI JAKARTA",102,148,52,200
https://kawalpemilu.org#25993,"MENTENG DALAM, TEBET, JAKARTA SELATAN, DKI JAKARTA",77,68,171,239
https://kawalpemilu.org#26075,"PISANGAN TIMUR, PULOGADUNG, JAKARTA TIMUR, DKI JAKARTA",103,88,166,254
https://kawalpemilu.org#25927,"DURI KOSAMBI, CENGKARENG, JAKARTA BARAT, DKI JAKARTA",85,108,132,240
https://kawalpemilu.org#25992,"TEBET BARAT, TEBET, JAKARTA SELATAN, DKI JAKARTA",35,84,100,184
https://kawalpemilu.org#25995,"BUKIT DURI, TEBET, JAKARTA SELATAN, DKI JAKARTA",58,72,148,220
https://kawalpemilu.org#25909,"CILINCING, CILINCING, JAKARTA UTARA, DKI JAKARTA",63,138,98,236
https://kawalpemilu.org#25915,"SEMPER BARAT, CILINCING, JAKARTA UTARA, DKI JAKARTA",97,98,174,272
https://kawalpemilu.org#25915,"SEMPER BARAT, CILINCING, JAKARTA UTARA, DKI JAKARTA",182,142,117,259
https://kawalpemilu.org#25948,"PINANGSIA, TAMAN SARI, JAKARTA BARAT, DKI JAKARTA",21,160,26,186
https://kawalpemilu.org#26023,"PONDOK PINANG, KEBAYORAN LAMA, JAKARTA SELATAN, DKI JAKARTA",83,100,111,211
https://kawalpemilu.org#26024,"CIPULIR, KEBAYORAN LAMA, JAKARTA SELATAN, DKI JAKARTA",97,90,146,236
https://kawalpemilu.org#25859,"PASEBAN, SENEN, JAKARTA PUSAT, DKI JAKARTA",47,170,85,255
https://kawalpemilu.org#25923,"KELAPA GADING BARAT, KELAPA GADING, JAKARTA UTARA, DKI JAKARTA",103,204,62,266
https://kawalpemilu.org#26114,"PONDOK BAMBU, DUREN SAWIT, JAKARTA TIMUR, DKI JAKARTA",148,135,86,221
https://kawalpemilu.org#26108,"PENGGILINGAN, CAKUNG, JAKARTA TIMUR, DKI JAKARTA",253,92,101,193
https://kawalpemilu.org#26109,"PULO GEBANG, CAKUNG, JAKARTA TIMUR, DKI JAKARTA",26,126,142,268
https://kawalpemilu.org#26015,"JATI PADANG, PASAR MINGGU, JAKARTA SELATAN, DKI JAKARTA",79,87,137,224
https://kawalpemilu.org#26118,"MALAKA JAYA, DUREN SAWIT, JAKARTA TIMUR, DKI JAKARTA",16,91,133,224
https://kawalpemilu.org#26105,"CAKUNG TIMUR, CAKUNG, JAKARTA TIMUR, DKI JAKARTA",9,71,174,245
https://kawalpemilu.org#26019,"PEJATEN BARAT, PASAR MINGGU, JAKARTA SELATAN, DKI JAKARTA",68,83,101,184
https://kawalpemilu.org#25857,"SENEN, SENEN, JAKARTA PUSAT, DKI JAKARTA",21,137,51,188
https://kawalpemilu.org#26116,"PONDOK KELAPA, DUREN SAWIT, JAKARTA TIMUR, DKI JAKARTA",86,80,75,155
https://kawalpemilu.org#26129,"KELAPA DUA WETAN, CIRACAS, JAKARTA TIMUR, DKI JAKARTA",129,127,108,235
https://kawalpemilu.org#26083,"BIDARA CINA, JATINEGARA, JAKARTA TIMUR, DKI JAKARTA",90,77,174,251
https://kawalpemilu.org#26009,"BANGKA, MAMPANG PRAPATAN, JAKARTA SELATAN, DKI JAKARTA",36,80,94,174
https://kawalpemilu.org#26062,"PETUKANGAN UTARA, PESANGGRAHAN, JAKARTA SELATAN, DKI JAKARTA",171,77,97,174
https://kawalpemilu.org#25986,"SRENGSENG, KEMBANGAN, JAKARTA BARAT, DKI JAKARTA",54,87,151,238
https://kawalpemilu.org#26002,"KARET, SETIABUDI, JAKARTA SELATAN, DKI JAKARTA",4,119,109,228
https://kawalpemilu.org#25977,"SLIPI, PALMERAH, JAKARTA BARAT, DKI JAKARTA",1,93,46,139
https://kawalpemilu.org#26009,"BANGKA, MAMPANG PRAPATAN, JAKARTA SELATAN, DKI JAKARTA",39,84,163,247
https://kawalpemilu.org#25986,"SRENGSENG, KEMBANGAN, JAKARTA BARAT, DKI JAKARTA",44,128,87,215
https://kawalpemilu.org#25840,"DURI PULO, GAMBIR, JAKARTA PUSAT, DKI JAKARTA",28,73,140,213
https://kawalpemilu.org#26024,"CIPULIR, KEBAYORAN LAMA, JAKARTA SELATAN, DKI JAKARTA",30,107,117,224
https://kawalpemilu.org#26039,"RAWA BARAT, KEBAYORAN BARU, JAKARTA SELATAN, DKI JAKARTA",12,134,70,204
https://kawalpemilu.org#25864,"CEMPAKA PUTIH TIMUR, CEMPAKA PUTIH, JAKARTA PUSAT, DKI JAKARTA",65,145,64,209
https://kawalpemilu.org#25929,"KEDAUNG KALI ANGKE, CENGKARENG, JAKARTA BARAT, DKI JAKARTA",40,142,114,256
https://kawalpemilu.org#25931,"CENGKARENG TIMUR, CENGKARENG, JAKARTA BARAT, DKI JAKARTA",164,126,79,205
https://kawalpemilu.org#25984,"MERUYA UTARA, KEMBANGAN, JAKARTA BARAT, DKI JAKARTA",115,186,10,196
https://kawalpemilu.org#26050,"PENGADEGAN, PANCORAN, JAKARTA SELATAN, DKI JAKARTA",37,83,72,155
https://kawalpemilu.org#25987,"JOGLO, KEMBANGAN, JAKARTA BARAT, DKI JAKARTA",115,96,93,189
https://kawalpemilu.org#25974,"PEGADUNGAN, KALIDERES, JAKARTA BARAT, DKI JAKARTA",38,94,108,202
https://kawalpemilu.org#85905,"BOTUWOMBATA, KWANDANG, GORONTALO UTARA, GORONTALO",1,104,83,187
https://kawalpemilu.org#74772,"KAYUBULAN, BATUDAA PANTAI, GORONTALO, GORONTALO",5,116,134,250
https://kawalpemilu.org#75394,"HELEDULAA UTARA, KOTA TIMUR, KOTA GORONTALO, GORONTALO",3,66,81,147
https://kawalpemilu.org#75423,"DONGGALA, HULONTHALANGI, KOTA GORONTALO, GORONTALO",9,25,90,115
https://kawalpemilu.org#85910,"TUTUWOTO, ANGGREK, GORONTALO UTARA, GORONTALO",2,79,69,148
https://kawalpemilu.org#75229,"PENTADU, PAGUAT, PAHUWATO, GORONTALO",5,156,85,241
https://kawalpemilu.org#74960,"PERMATA, PAGUYAMAN, BOALEMO, GORONTALO",1,132,139,271
https://kawalpemilu.org#74782,"DILONIYOHU, BOLIYOHUTO, GORONTALO, GORONTALO",2,84,149,233
https://kawalpemilu.org#74861,"HUYULA, MOOTILANGO, GORONTALO, GORONTALO",6,159,75,234
