Link KawalPemilu,Nama Kelurahan,Nomor TPS,Suara 01,Suara 02,Suara Sah
https://kawalpemilu.org#6370,"SAGOE, TRIENGGADENG, PIDIE JAYA, ACEH",3,6,170,176
https://kawalpemilu.org#3291,"LHOK JOK, KUTA MAKMUR, ACEH UTARA, ACEH",12,24,146,170
https://kawalpemilu.org#3084,"SAGOE, KEUMALA, PIDIE, ACEH",1,14,212,226
https://kawalpemilu.org#4349,"SINGKOHOR, SINGKOHOR, ACEH SINGKIL, ACEH",2,92,153,245
https://kawalpemilu.org#1113,"ALUE BU ALUE NIREH, PEUREULAK TIMUR, ACEH TIMUR, ACEH",1,21,58,79
https://kawalpemilu.org#4409,"GLUMPANG PAYONG, SAMALANGA, BIREUEN, ACEH",1,17,131,148
https://kawalpemilu.org#6174,"MANYANG CUT, MEUREUDU, PIDIE JAYA, ACEH",2,6,193,199
https://kawalpemilu.org#2457,"PULO TUKOK, BATEE, PIDIE, ACEH",2,22,123,145
https://kawalpemilu.org#2342,"LAMBARO SAMAHANI, KUTA MALAKA, ACEH BESAR, ACEH",1,11,239,250
https://kawalpemilu.org#251,"SEUNEUBOK KEURANJI, KOTA BAHAGIA, ACEH SELATAN, ACEH",2,16,107,123
https://kawalpemilu.org#1120,"BEUSA SEBERANG, PEUREULAK BARAT, ACEH TIMUR, ACEH",2,17,139,156
https://kawalpemilu.org#6621,"PB. BLANG PASE, LANGSA KOTA, KOTA LANGSA, ACEH",4,38,153,191
https://kawalpemilu.org#1688,"RIMBA LANGGEH, ARONGAN LAMBALEK, ACEH BARAT, ACEH",1,11,135,146
https://kawalpemilu.org#3267,"TAMBON TUNONG, DEWANTARA, ACEH UTARA, ACEH",5,0,0,0
https://kawalpemilu.org#3243,"GLUMPANG SAMLAKOE, BAKTIYA, ACEH UTARA, ACEH",102,11,139,150
https://kawalpemilu.org#5856,"BENUA RAJA, RANTAU, ACEH TAMIANG, ACEH",5,36,138,174
https://kawalpemilu.org#2257,"LAMBITRA, DARUSSALAM, ACEH BESAR, ACEH",1,13,120,133
https://kawalpemilu.org#5849,"KALOY, TAMIANG HULU, ACEH TAMIANG, ACEH",6,46,85,131
https://kawalpemilu.org#3176,"MANYANG, GLUMPANG BARO, PIDIE, ACEH",1,1,169,170
https://kawalpemilu.org#1792,"BUKET MEUGAJAH, WOYLA TIMUR, ACEH BARAT, ACEH",1,17,135,152
https://kawalpemilu.org#3986,"KEUDE NIBONG, NIBONG, ACEH UTARA, ACEH",1,3,91,94
https://kawalpemilu.org#2282,"LAMTAMOT, LEMBAH SEULAWAH, ACEH BESAR, ACEH",4,32,183,215
https://kawalpemilu.org#6604,"SUKAREJO, LANGSA TIMUR, KOTA LANGSA, ACEH",5,15,209,224
https://kawalpemilu.org#5662,"KUBANG GAJAH, KUALA PESISIR, NAGAN RAYA, ACEH",2,19,158,177
https://kawalpemilu.org#697,"ALUE MERBO, DARUL AMAN, ACEH TIMUR, ACEH",2,16,115,131
https://kawalpemilu.org#3039,"NUBOK BADEUK, TANGSE, PIDIE, ACEH",3,17,123,140
https://kawalpemilu.org#2286,"PAYA KEUREULEH, LEMBAH SEULAWAH, ACEH BESAR, ACEH",1,39,111,150
https://kawalpemilu.org#4027,"GEULANGGANG BARO, LAPANG, ACEH UTARA, ACEH",10,7,183,190
https://kawalpemilu.org#36,"KEDAI RUNDING, KLUET SELATAN, ACEH SELATAN, ACEH",4,22,210,232
https://kawalpemilu.org#489,"PEKHAPAT TIMUR, LAWE BULAN, ACEH TENGGARA, ACEH",1,55,187,242
https://kawalpemilu.org#88100,"GEGARANG, JAGONG JEGET, ACEH TENGAH, ACEH",1,127,108,235
https://kawalpemilu.org#1145,"SEUNEUBOK ACEH, SUNGAI RAYA, ACEH TIMUR, ACEH",3,4,98,102
https://kawalpemilu.org#1498,"UJONG BAROH, JOHAN PAHWALAN, ACEH BARAT, ACEH",6,44,129,173
https://kawalpemilu.org#3999,"MADDI, NIBONG, ACEH UTARA, ACEH",1,7,124,131
https://kawalpemilu.org#2823,"CEMPALA KUNENG, PEUKAN BARO, PIDIE, ACEH",2,11,191,202
https://kawalpemilu.org#6514,"GAMPONG COT BA' U, SUKAJAYA, KOTA SABANG, ACEH",20,7,88,95
https://kawalpemilu.org#3868,"COT GIREK, COT GIREK, ACEH UTARA, ACEH",18,25,146,2
https://kawalpemilu.org#1662,"KUTA PADANG, BUBON, ACEH BARAT, ACEH",1,20,216,236
https://kawalpemilu.org#707,"BAGOK PANAH SA, DARUL AMAN, ACEH TIMUR, ACEH",2,8,161,169
https://kawalpemilu.org#3323,"COT U SIBAK, LHOKSUKON, ACEH UTARA, ACEH",56,21,109,130
https://kawalpemilu.org#2700,"KRUENG LALA, MILA, PIDIE, ACEH",1,15,165,180
https://kawalpemilu.org#6187,"POHROH, MEUREUDU, PIDIE JAYA, ACEH",1,11,123,134
https://kawalpemilu.org#172,"SEUNEUBOK, PASIE RAJA, ACEH SELATAN, ACEH",2,16,175,191
https://kawalpemilu.org#53828,"CELUKANBAWANG, GEROKGAK, BULELENG, BALI",4,206,33,239
https://kawalpemilu.org#53499,"UNGASAN, KUTA SELATAN, BADUNG, BALI",29,195,55,250
https://kawalpemilu.org#53849,"BANJARASEM, SERIRIT, BULELENG, BALI",1,192,8,200
https://kawalpemilu.org#53910,"BANYUNING, BULELENG, BULELENG, BALI",42,156,23,179
https://kawalpemilu.org#53287,"MANISTUTU, MELAYA, JEMBRANA, BALI",15,195,45,240
https://kawalpemilu.org#53734,"PESABAN, RENDANG, KARANGASEM, BALI",6,172,4,176
https://kawalpemilu.org#53245,"BANJAR TENGAH, NEGARA, JEMBRANA, BALI",6,197,18,215
https://kawalpemilu.org#53351,"BONGAN, TABANAN, TABANAN, BALI",10,229,16,245
https://kawalpemilu.org#54016,"DANGIN PURI KAJA, DENPASAR UTARA, KOTA DENPASAR, BALI",38,140,8,148
https://kawalpemilu.org#53582,"KERTA, PAYANGAN, GIANYAR, BALI",11,236,10,246
https://kawalpemilu.org#53915,"KALIUNTU, BULELENG, BULELENG, BALI",3,182,7,189
https://kawalpemilu.org#53834,"RINGDIKIT, SERIRIT, BULELENG, BALI",5,146,8,154
https://kawalpemilu.org#53529,"BEDULU, BLAHBATUH, GIANYAR, BALI",10,244,2,246
https://kawalpemilu.org#53336,"BELUMBANG, KERAMBITAN, TABANAN, BALI",1,276,9,285
https://kawalpemilu.org#53371,"PANDAK GEDE, KEDIRI, TABANAN, BALI",5,166,5,171
https://kawalpemilu.org#53863,"BUSUNGBIU, BUSUNG BIU, BULELENG, BALI",18,218,14,232
https://kawalpemilu.org#53817,"PEJARAKAN, GEROKGAK, BULELENG, BALI",2,201,9,210
https://kawalpemilu.org#53543,"SUWAT, GIANYAR, GIANYAR, BALI",1,174,3,177
https://kawalpemilu.org#53703,"SONGAN B, KINTAMANI, BANGLI, BALI",20,186,40,226
https://kawalpemilu.org#53733,"PEMPATAN, RENDANG, KARANGASEM, BALI",27,172,24,196
https://kawalpemilu.org#53750,"MANGGIS, MANGGIS, KARANGASEM, BALI",12,190,8,198
https://kawalpemilu.org#53937,"SUDAJI, SAWAN, BULELENG, BALI",23,154,7,161
https://kawalpemilu.org#53252,"BERANGBANG, NEGARA, JEMBRANA, BALI",19,218,9,227
https://kawalpemilu.org#53928,"ALASANGKER, BULELENG, BULELENG, BALI",13,177,13,190
https://kawalpemilu.org#53507,"DALUNG, KUTA UTARA, BADUNG, BALI",37,195,32,227
https://kawalpemilu.org#53921,"ANTURAN, BULELENG, BULELENG, BALI",16,158,25,183
https://kawalpemilu.org#53949,"PAKISAN, KUBUTAMBAHAN, BULELENG, BALI",5,117,5,122
https://kawalpemilu.org#54007,"PADANGSAMBIAN KAJA, DENPASAR BARAT, KOTA DENPASAR, BALI",38,222,17,239
https://kawalpemilu.org#53287,"MANISTUTU, MELAYA, JEMBRANA, BALI",2,193,50,243
https://kawalpemilu.org#53900,"SELAT, SUKASADA, BULELENG, BALI",10,162,4,166
https://kawalpemilu.org#53545,"SERONGGA, GIANYAR, GIANYAR, BALI",7,194,20,214
https://kawalpemilu.org#52196,"CIBARENO, CILOGRANG, LEBAK, BANTEN",6,51,147,198
https://kawalpemilu.org#53217,"CIPAYUNG, CIPUTAT, KOTA TANGERANG SELATAN, BANTEN",32,139,120,259
https://kawalpemilu.org#53040,"PONDOK BAHAR, KARANG TENGAH, KOTA TANGERANG, BANTEN",29,96,88,184
https://kawalpemilu.org#52975,"PORIS PLAWAD, CIPONDOH, KOTA TANGERANG, BANTEN",8,41,135,176
https://kawalpemilu.org#52313,"PETE, TIGARAKSA, TANGERANG, BANTEN",12,26,148,174
https://kawalpemilu.org#51696,"RANCATEUREUP, LABUAN, PANDEGLANG, BANTEN",3,69,120,189
https://kawalpemilu.org#53161,"BANJAR AGUNG, CIPOCOK JAYA, KOTA SERANG, BANTEN",28,58,176,234
https://kawalpemilu.org#51657,"PANACARAN, MUNJUL, PANDEGLANG, BANTEN",10,34,95,129
https://kawalpemilu.org#52370,"TEGAL KUNIR KIDUL, MAUK, TANGERANG, BANTEN",11,41,178,219
https://kawalpemilu.org#52699,"LONTAR, TIRTAYASA, SERANG, BANTEN",1,85,81,166
https://kawalpemilu.org#51703,"SUKAMAJU, LABUAN, PANDEGLANG, BANTEN",9,47,121,168
https://kawalpemilu.org#53227,"BENDA BARU, PAMULANG, KOTA TANGERANG SELATAN, BANTEN",83,137,76,213
https://kawalpemilu.org#52942,"CIKOKOL, TANGERANG, KOTA TANGERANG, BANTEN",31,88,170,258
https://kawalpemilu.org#52948,"JATAKE, JATIUWUNG, KOTA TANGERANG, BANTEN",14,31,94,125
https://kawalpemilu.org#51761,"KURUNGKAMBING, MANDALAWANGI, PANDEGLANG, BANTEN",5,46,148,194
https://kawalpemilu.org#52293,"SENTUL, BALARAJA, TANGERANG, BANTEN",21,39,119,158
https://kawalpemilu.org#53114,"UNYUR, SERANG, KOTA SERANG, BANTEN",90,87,150,237
https://kawalpemilu.org#52392,"PEKAYON, SUKADIRI, TANGERANG, BANTEN",14,38,100,138
https://kawalpemilu.org#89645,"PASIR KEMBANG, PAMARAYAN, SERANG, BANTEN",7,77,122,199
https://kawalpemilu.org#52105,"MUARA CIUJUNG TIMUR, RANGKASBITUNG, LEBAK, BANTEN",16,77,167,244
https://kawalpemilu.org#53184,"LENGKONG GUDANG, SERPONG, KOTA TANGERANG SELATAN, BANTEN",28,105,80,185
https://kawalpemilu.org#52993,"CIMONE JAYA, KARAWACI, KOTA TANGERANG, BANTEN",32,72,102,174
https://kawalpemilu.org#84987,"BOJENWETAN, SOBANG, PANDEGLANG, BANTEN",1,103,77,180
https://kawalpemilu.org#52634,"PULO AMPEL, PULO AMPEL, SERANG, BANTEN",3,25,200,225
https://kawalpemilu.org#52110,"JATIMULYA, RANGKASBITUNG, LEBAK, BANTEN",13,113,83,196
https://kawalpemilu.org#52196,"CIBARENO, CILOGRANG, LEBAK, BANTEN",2,52,139,191
https://kawalpemilu.org#53070,"LEBAKGEDE, PULOMERAK, KOTA CILEGON, BANTEN",18,68,183,251
https://kawalpemilu.org#52487,"BITUNG JAYA, CIKUPA, TANGERANG, BANTEN",23,40,82,122
https://kawalpemilu.org#53126,"BANTEN, KASEMEN, KOTA SERANG, BANTEN",35,87,147,234
https://kawalpemilu.org#52330,"MEKARSARI, JAMBE, TANGERANG, BANTEN",1,81,118,199
https://kawalpemilu.org#52482,"TALAGA, CIKUPA, TANGERANG, BANTEN",22,53,196,249
https://kawalpemilu.org#53079,"RANDAKARI, CIWANDAN, KOTA CILEGON, BANTEN",7,42,182,224
https://kawalpemilu.org#53226,"PAMULANG BARAT, PAMULANG, KOTA TANGERANG SELATAN, BANTEN",89,119,18,137
https://kawalpemilu.org#52113,"RANGKASBITUNG TIMUR, RANGKASBITUNG, LEBAK, BANTEN",22,59,132,191
https://kawalpemilu.org#53212,"SERUA, CIPUTAT, KOTA TANGERANG SELATAN, BANTEN",51,88,76,164
https://kawalpemilu.org#52343,"JEUNGJING, CISOKA, TANGERANG, BANTEN",23,55,133,188
https://kawalpemilu.org#52346,"PASIR AMPO, KRESEK, TANGERANG, BANTEN",12,117,59,176
https://kawalpemilu.org#53221,"PISANGAN, CIPUTAT TIMUR, KOTA TANGERANG SELATAN, BANTEN",4,128,105,233
https://kawalpemilu.org#52066,"SANGKANMANIK, CIMARGA, LEBAK, BANTEN",4,42,171,213
https://kawalpemilu.org#52418,"PANGADEGAN, PASAR KEMIS, TANGERANG, BANTEN",22,61,80,141
https://kawalpemilu.org#52551,"WANAKERTA, SINDANG JAYA, TANGERANG, BANTEN",9,44,131,175
https://kawalpemilu.org#51586,"TAMANJAYA, SUMUR, PANDEGLANG, BANTEN",8,116,16,132
https://kawalpemilu.org#52855,"CITAMAN, CIOMAS, SERANG, BANTEN",9,63,100,163
https://kawalpemilu.org#52260,"PONDOKPANJANG, CIHARA, LEBAK, BANTEN",6,59,169,228
https://kawalpemilu.org#51962,"SUKASARI, CIPANAS, LEBAK, BANTEN",9,76,105,181
https://kawalpemilu.org#52105,"MUARA CIUJUNG TIMUR, RANGKASBITUNG, LEBAK, BANTEN",4,48,191,239
https://kawalpemilu.org#53082,"JOMBANG WETAN, JOMBANG, KOTA CILEGON, BANTEN",40,84,108,192
https://kawalpemilu.org#52519,"LENGKONG KULON, PAGEDANGAN, TANGERANG, BANTEN",1,32,240,272
https://kawalpemilu.org#52462,"SEPATAN, SEPATAN, TANGERANG, BANTEN",27,35,187,222
https://kawalpemilu.org#52638,"SALIRA, PULO AMPEL, SERANG, BANTEN",8,31,158,189
https://kawalpemilu.org#52933,"BLOKANG, BANDUNG, SERANG, BANTEN",10,77,91,168
https://kawalpemilu.org#52412,"SINDANGSARI, PASAR KEMIS, TANGERANG, BANTEN",16,42,175,217
https://kawalpemilu.org#52216,"CIPEDANG, WANASALAM, LEBAK, BANTEN",2,64,149,213
https://kawalpemilu.org#52963,"JURUMUDI, BENDA, KOTA TANGERANG, BANTEN",21,32,151,183
https://kawalpemilu.org#51689,"KADUPANDAK, PICUNG, PANDEGLANG, BANTEN",1,101,108,209
https://kawalpemilu.org#52543,"KELAPA DUA, KELAPA DUA, TANGERANG, BANTEN",2,48,114,162
https://kawalpemilu.org#53128,"KILASAH, KASEMEN, KOTA SERANG, BANTEN",12,47,142,189
https://kawalpemilu.org#53038,"KARANG TENGAH, KARANG TENGAH, KOTA TANGERANG, BANTEN",65,102,124,226
https://kawalpemilu.org#52423,"BOJONG RENGED, TELUKNAGA, TANGERANG, BANTEN",18,71,162,233
https://kawalpemilu.org#52956,"PORIS GAGA, BATUCEPER, KOTA TANGERANG, BANTEN",40,90,149,239
https://kawalpemilu.org#52642,"PULO PANJANG, PULO AMPEL, SERANG, BANTEN",1,36,185,221
https://kawalpemilu.org#53223,"REMPOA, CIPUTAT TIMUR, KOTA TANGERANG SELATAN, BANTEN",86,172,69,241
https://kawalpemilu.org#53007,"GEBANG RAYA, PERIUK, KOTA TANGERANG, BANTEN",93,131,78,211
https://kawalpemilu.org#52710,"TENJOAYU, TANARA, SERANG, BANTEN",13,42,137,179
https://kawalpemilu.org#52443,"CENGKLONG, KOSAMBI, TANGERANG, BANTEN",3,72,96,168
https://kawalpemilu.org#52906,"MANCAK, MANCAK, SERANG, BANTEN",10,42,114,156
https://kawalpemilu.org#53214,"SAWAH, CIPUTAT, KOTA TANGERANG SELATAN, BANTEN",74,133,102,235
https://kawalpemilu.org#52938,"SUKARASA, TANGERANG, KOTA TANGERANG, BANTEN",2,100,113,213
https://kawalpemilu.org#52875,"KALUMPANG, PADARINCANG, SERANG, BANTEN",9,72,111,183
https://kawalpemilu.org#52057,"KARYAJAYA, CIMARGA, LEBAK, BANTEN",9,20,165,185
https://kawalpemilu.org#53207,"PARIGI BARU, PONDOK AREN, KOTA TANGERANG SELATAN, BANTEN",27,78,160,238
https://kawalpemilu.org#52427,"KAMPUNG MELAYU TIMUR, TELUKNAGA, TANGERANG, BANTEN",22,96,144,240
https://kawalpemilu.org#52295,"SUKAMURNI, BALARAJA, TANGERANG, BANTEN",15,75,94,169
https://kawalpemilu.org#53109,"CIPARE, SERANG, KOTA SERANG, BANTEN",36,93,169,262
https://kawalpemilu.org#53089,"RAWA ARUM, GEROGOL, KOTA CILEGON, BANTEN",9,57,158,215
https://kawalpemilu.org#53018,"NEGLASARI, NEGLASARI, KOTA TANGERANG, BANTEN",35,175,34,209
https://kawalpemilu.org#52659,"KASERANGAN, CIRUAS, SERANG, BANTEN",1,96,152,248
https://kawalpemilu.org#52726,"SITUTERATE, CIKANDE, SERANG, BANTEN",8,75,178,253
https://kawalpemilu.org#52823,"PASIRLIMUS, PAMARAYAN, SERANG, BANTEN",13,70,145,215
https://kawalpemilu.org#53006,"GEMBOR, PERIUK, KOTA TANGERANG, BANTEN",69,112,105,217
https://kawalpemilu.org#53193,"PAKU JAYA, SERPONG UTARA, KOTA TANGERANG SELATAN, BANTEN",63,114,85,199
https://kawalpemilu.org#53223,"REMPOA, CIPUTAT TIMUR, KOTA TANGERANG SELATAN, BANTEN",55,119,94,213
https://kawalpemilu.org#52993,"CIMONE JAYA, KARAWACI, KOTA TANGERANG, BANTEN",10,148,100,248
https://kawalpemilu.org#21563,"PASAR SAOH, KAUR SELATAN, KAUR, BENGKULU",1,72,152,224
https://kawalpemilu.org#21259,"PAL VIII, BERMANI ULU RAYA, REJANG LEBONG, BENGKULU",2,151,96,247
https://kawalpemilu.org#22307,"SAWAH LEBAR, RATU AGUNG, KOTA BENGKULU, BENGKULU",11,70,137,207
https://kawalpemilu.org#21371,"JAGOBAYO, LAIS, BENGKULU UTARA, BENGKULU",1,64,158,222
https://kawalpemilu.org#22255,"PAGAR DEWA, SELEBAR, KOTA BENGKULU, BENGKULU",45,102,57,159
https://kawalpemilu.org#21237,"IV SUKU MENANTI, SINDANG DATARAN, REJANG LEBONG, BENGKULU",9,95,52,117
https://kawalpemilu.org#20906,"PUNGGUK KETUPAK, MERIGI KELINDANG, BENGKULU TENGAH, BENGKULU",1,116,117,233
https://kawalpemilu.org#22297,"KANDANG MAS, KAMPUNG MELAYU, KOTA BENGKULU, BENGKULU",5,72,194,266
https://kawalpemilu.org#21605,"TRI JAYA, NASAL, KAUR, BENGKULU",1,181,77,258
https://kawalpemilu.org#22212,"BUKIT BARISAN, MERIGI, KEPAHIANG, BENGKULU",3,58,74,132
https://kawalpemilu.org#22303,"TANAH PATAH, RATU AGUNG, KOTA BENGKULU, BENGKULU",13,95,159,254
https://kawalpemilu.org#21024,"NAPAL MELINTANG, PINO RAYA, BENGKULU SELATAN, BENGKULU",2,120,49,169
https://kawalpemilu.org#22265,"LINGKAR BARAT, GADING CEMPAKA, KOTA BENGKULU, BENGKULU",14,130,127,257
https://kawalpemilu.org#21785,"GENTING JUAR, SEMIDANG ALAS MARAS, SELUMA, BENGKULU",2,66,58,124
https://kawalpemilu.org#21811,"TUMBU'AN, LUBUK SANDI, SELUMA, BENGKULU",6,118,23,141
https://kawalpemilu.org#84749,"LEMEU PIT, LEBONG SAKTI, LEBONG, BENGKULU",3,91,68,159
https://kawalpemilu.org#41990,"TRIHARJO, PANDAK, BANTUL, DAERAH ISTIMEWA YOGYAKARTA",10,186,58,244
https://kawalpemilu.org#41932,"SENDANGSARI, PENGASIH, KULON PROGO, DAERAH ISTIMEWA YOGYAKARTA",21,159,89,248
https://kawalpemilu.org#42190,"NGALANG, GEDANGSARI, GUNUNGKIDUL, DAERAH ISTIMEWA YOGYAKARTA",24,129,33,162
https://kawalpemilu.org#42119,"GIRIMULYO, PANGGANG, GUNUNGKIDUL, DAERAH ISTIMEWA YOGYAKARTA",8,198,23,221
https://kawalpemilu.org#42298,"TRIMULYO, SLEMAN, SLEMAN, DAERAH ISTIMEWA YOGYAKARTA",22,161,51,212
https://kawalpemilu.org#41942,"GIRIPURWO, GIRIMULYO, KULON PROGO, DAERAH ISTIMEWA YOGYAKARTA",7,128,67,195
https://kawalpemilu.org#42249,"MARGODADI, SEYEGAN, SLEMAN, DAERAH ISTIMEWA YOGYAKARTA",25,193,65,258
https://kawalpemilu.org#42295,"TRIHARJO, SLEMAN, SLEMAN, DAERAH ISTIMEWA YOGYAKARTA",22,158,93,251
https://kawalpemilu.org#42197,"KANIGORO, SAPTOSARI, GUNUNGKIDUL, DAERAH ISTIMEWA YOGYAKARTA",7,135,23,158
https://kawalpemilu.org#42041,"SRIMULYO, PIYUNGAN, BANTUL, DAERAH ISTIMEWA YOGYAKARTA",58,146,52,198
https://kawalpemilu.org#42161,"PETIR, RONGKOP, GUNUNGKIDUL, DAERAH ISTIMEWA YOGYAKARTA",5,138,43,181
https://kawalpemilu.org#42382,"REJOWINANGUN, KOTAGEDE, KOTA YOGYAKARTA, DAERAH ISTIMEWA YOGYAKARTA",31,104,75,179
https://kawalpemilu.org#42076,"PILANGREJO, NGLIPAR, GUNUNGKIDUL, DAERAH ISTIMEWA YOGYAKARTA",6,126,25,151
https://kawalpemilu.org#42271,"GAYAMHARJO, PRAMBANAN, SLEMAN, DAERAH ISTIMEWA YOGYAKARTA",17,94,68,162
https://kawalpemilu.org#42224,"AMBARKETAWANG, GAMPING, SLEMAN, DAERAH ISTIMEWA YOGYAKARTA",36,168,78,246
https://kawalpemilu.org#42255,"SENDANGADI, MLATI, SLEMAN, DAERAH ISTIMEWA YOGYAKARTA",22,163,59,222
https://kawalpemilu.org#42260,"CATURTUNGGAL, DEPOK, SLEMAN, DAERAH ISTIMEWA YOGYAKARTA",65,129,75,204
https://kawalpemilu.org#42030,"POTORONO, BANGUNTAPAN, BANTUL, DAERAH ISTIMEWA YOGYAKARTA",30,131,134,265
https://kawalpemilu.org#42225,"BANYURADEN, GAMPING, SLEMAN, DAERAH ISTIMEWA YOGYAKARTA",20,117,58,175
https://kawalpemilu.org#42364,"NGUPASAN, GONDOMANAN, KOTA YOGYAKARTA, DAERAH ISTIMEWA YOGYAKARTA",4,107,65,172
https://kawalpemilu.org#42375,"MUJAMUJU, UMBULHARJO, KOTA YOGYAKARTA, DAERAH ISTIMEWA YOGYAKARTA",10,144,72,216
https://kawalpemilu.org#42044,"PENDOWOHARJO, SEWON, BANTUL, DAERAH ISTIMEWA YOGYAKARTA",57,158,113,271
https://kawalpemilu.org#42032,"WIROKERTEN, BANGUNTAPAN, BANTUL, DAERAH ISTIMEWA YOGYAKARTA",23,150,102,252
https://kawalpemilu.org#41921,"SALAMREJO, SENTOLO, KULON PROGO, DAERAH ISTIMEWA YOGYAKARTA",14,199,48,247
https://kawalpemilu.org#42291,"SARDONOHARJO, NGAGLIK, SLEMAN, DAERAH ISTIMEWA YOGYAKARTA",13,113,51,164
https://kawalpemilu.org#42378,"PANDEYAN, UMBULHARJO, KOTA YOGYAKARTA, DAERAH ISTIMEWA YOGYAKARTA",40,139,71,210
https://kawalpemilu.org#42119,"GIRIMULYO, PANGGANG, GUNUNGKIDUL, DAERAH ISTIMEWA YOGYAKARTA",9,154,52,206
https://kawalpemilu.org#41963,"BANJARHARJO, KALIBAWANG, KULON PROGO, DAERAH ISTIMEWA YOGYAKARTA",24,160,35,195
https://kawalpemilu.org#42279,"SELOMARTANI, KALASAN, SLEMAN, DAERAH ISTIMEWA YOGYAKARTA",34,158,26,184
https://kawalpemilu.org#25904,"LAGOA, KOJA, JAKARTA UTARA, DKI JAKARTA",25,149,66,215
https://kawalpemilu.org#25930,"KAPUK, CENGKARENG, JAKARTA BARAT, DKI JAKARTA",233,181,61,242
https://kawalpemilu.org#26095,"BALEKAMBANG, KRAMATJATI, JAKARTA TIMUR, DKI JAKARTA",74,80,146,226
https://kawalpemilu.org#25962,"KEBON JERUK, KEBON JERUK, JAKARTA BARAT, DKI JAKARTA",22,85,124,209
https://kawalpemilu.org#26103,"GEDONG, PASAR REBO, JAKARTA TIMUR, DKI JAKARTA",9,98,114,212
https://kawalpemilu.org#26139,"LUBANG BUAYA, CIPAYUNG, JAKARTA TIMUR, DKI JAKARTA",196,106,144,250
https://kawalpemilu.org#26049,"DUREN TIGA, PANCORAN, JAKARTA SELATAN, DKI JAKARTA",46,82,129,211
https://kawalpemilu.org#26087,"CIPINANG MUARA, JATINEGARA, JAKARTA TIMUR, DKI JAKARTA",110,211,37,248
https://kawalpemilu.org#25891,"PEJAGALAN, PENJARINGAN, JAKARTA UTARA, DKI JAKARTA",70,105,100,205
https://kawalpemilu.org#26100,"KALISARI, PASAR REBO, JAKARTA TIMUR, DKI JAKARTA",120,124,148,272
https://kawalpemilu.org#26024,"CIPULIR, KEBAYORAN LAMA, JAKARTA SELATAN, DKI JAKARTA",92,87,116,203
https://kawalpemilu.org#25910,"SUKAPURA, CILINCING, JAKARTA UTARA, DKI JAKARTA",157,113,86,199
https://kawalpemilu.org#26108,"PENGGILINGAN, CAKUNG, JAKARTA TIMUR, DKI JAKARTA",90,140,113,253
https://kawalpemilu.org#25845,"GUNUNG SAHARI UTARA, SAWAH BESAR, JAKARTA PUSAT, DKI JAKARTA",45,178,59,237
https://kawalpemilu.org#25897,"SUNGAI BAMBU, TANJUNG PRIOK, JAKARTA UTARA, DKI JAKARTA",75,96,128,224
https://kawalpemilu.org#25898,"KEBON BAWANG, TANJUNG PRIOK, JAKARTA UTARA, DKI JAKARTA",150,79,97,176
https://kawalpemilu.org#26106,"JATINEGARA, CAKUNG, JAKARTA TIMUR, DKI JAKARTA",81,98,83,182
https://kawalpemilu.org#25962,"KEBON JERUK, KEBON JERUK, JAKARTA BARAT, DKI JAKARTA",98,106,113,219
https://kawalpemilu.org#26117,"MALAKA SARI, DUREN SAWIT, JAKARTA TIMUR, DKI JAKARTA",11,97,159,256
https://kawalpemilu.org#25970,"KALIDERES, KALIDERES, JAKARTA BARAT, DKI JAKARTA",134,110,103,213
https://kawalpemilu.org#25880,"KAMPUNG BALI, TANAH ABANG, JAKARTA PUSAT, DKI JAKARTA",26,93,135,228
https://kawalpemilu.org#26033,"CIPETE SELATAN, CILANDAK, JAKARTA SELATAN, DKI JAKARTA",72,103,94,197
https://kawalpemilu.org#25983,"KEMBANGAN UTARA, KEMBANGAN, JAKARTA BARAT, DKI JAKARTA",122,147,66,213
https://kawalpemilu.org#25879,"KEBON KACANG, TANAH ABANG, JAKARTA PUSAT, DKI JAKARTA",18,110,119,229
https://kawalpemilu.org#25870,"CIKINI, MENTENG, JAKARTA PUSAT, DKI JAKARTA",25,173,37,210
https://kawalpemilu.org#25926,"CENGKARENG BARAT, CENGKARENG, JAKARTA BARAT, DKI JAKARTA",40,151,50,201
https://kawalpemilu.org#25846,"MANGGA DUA SELATAN, SAWAH BESAR, JAKARTA PUSAT, DKI JAKARTA",16,122,85,207
https://kawalpemilu.org#25999,"SETIA BUDI, SETIABUDI, JAKARTA SELATAN, DKI JAKARTA",1,118,67,185
https://kawalpemilu.org#25927,"DURI KOSAMBI, CENGKARENG, JAKARTA BARAT, DKI JAKARTA",187,223,4,227
https://kawalpemilu.org#25928,"RAWA BUAYA, CENGKARENG, JAKARTA BARAT, DKI JAKARTA",153,149,134,283
https://kawalpemilu.org#25996,"MANGGARAI SELATAN, TEBET, JAKARTA SELATAN, DKI JAKARTA",74,96,100,196
https://kawalpemilu.org#25948,"PINANGSIA, TAMAN SARI, JAKARTA BARAT, DKI JAKARTA",28,88,163,251
https://kawalpemilu.org#25938,"JELAMBAR BARU, GROGOL PETAMBURAN, JAKARTA BARAT, DKI JAKARTA",115,159,7,166
https://kawalpemilu.org#25876,"KARET TENGSIN, TANAH ABANG, JAKARTA PUSAT, DKI JAKARTA",16,77,112,189
https://kawalpemilu.org#26115,"KLENDER, DUREN SAWIT, JAKARTA TIMUR, DKI JAKARTA",136,112,137,249
https://kawalpemilu.org#26134,"CILANGKAP, CIPAYUNG, JAKARTA TIMUR, DKI JAKARTA",75,88,125,213
https://kawalpemilu.org#26088,"CIPINANG BESAR SELATAN, JATINEGARA, JAKARTA TIMUR, DKI JAKARTA",25,140,99,239
https://kawalpemilu.org#25962,"KEBON JERUK, KEBON JERUK, JAKARTA BARAT, DKI JAKARTA",83,68,122,190
https://kawalpemilu.org#25942,"KRUKUT, TAMAN SARI, JAKARTA BARAT, DKI JAKARTA",59,147,44,191
https://kawalpemilu.org#25988,"KEMBANGAN SELATAN, KEMBANGAN, JAKARTA BARAT, DKI JAKARTA",2,52,150,202
https://kawalpemilu.org#25955,"JEMBATAN BESI, TAMBORA, JAKARTA BARAT, DKI JAKARTA",12,132,91,223
https://kawalpemilu.org#25899,"SUNTER AGUNG, TANJUNG PRIOK, JAKARTA UTARA, DKI JAKARTA",81,93,154,247
https://kawalpemilu.org#25994,"KEBON BARU, TEBET, JAKARTA SELATAN, DKI JAKARTA",14,89,95,184
https://kawalpemilu.org#26076,"CIPINANG, PULOGADUNG, JAKARTA TIMUR, DKI JAKARTA",20,101,111,212
https://kawalpemilu.org#25897,"SUNGAI BAMBU, TANJUNG PRIOK, JAKARTA UTARA, DKI JAKARTA",12,52,117,169
https://kawalpemilu.org#26071,"KEBON MANGGIS, MATRAMAN, JAKARTA TIMUR, DKI JAKARTA",51,70,148,218
https://kawalpemilu.org#26033,"CIPETE SELATAN, CILANDAK, JAKARTA SELATAN, DKI JAKARTA",96,82,148,230
https://kawalpemilu.org#26134,"CILANGKAP, CIPAYUNG, JAKARTA TIMUR, DKI JAKARTA",30,72,129,201
https://kawalpemilu.org#25939,"WIJAYA KUSUMA, GROGOL PETAMBURAN, JAKARTA BARAT, DKI JAKARTA",89,117,63,180
https://kawalpemilu.org#26048,"RAWAJATI, PANCORAN, JAKARTA SELATAN, DKI JAKARTA",41,98,161,259
https://kawalpemilu.org#26137,"SETU, CIPAYUNG, JAKARTA TIMUR, DKI JAKARTA",39,87,116,203
https://kawalpemilu.org#25929,"KEDAUNG KALI ANGKE, CENGKARENG, JAKARTA BARAT, DKI JAKARTA",49,104,132,236
https://kawalpemilu.org#25980,"KEMANGGISAN, PALMERAH, JAKARTA BARAT, DKI JAKARTA",32,74,106,180
https://kawalpemilu.org#25986,"SRENGSENG, KEMBANGAN, JAKARTA BARAT, DKI JAKARTA",107,120,105,225
https://kawalpemilu.org#25970,"KALIDERES, KALIDERES, JAKARTA BARAT, DKI JAKARTA",186,82,119,201
https://kawalpemilu.org#26003,"MENTENG ATAS, SETIABUDI, JAKARTA SELATAN, DKI JAKARTA",64,153,50,203
https://kawalpemilu.org#25948,"PINANGSIA, TAMAN SARI, JAKARTA BARAT, DKI JAKARTA",34,125,109,234
https://kawalpemilu.org#26109,"PULO GEBANG, CAKUNG, JAKARTA TIMUR, DKI JAKARTA",198,69,134,203
https://kawalpemilu.org#26048,"RAWAJATI, PANCORAN, JAKARTA SELATAN, DKI JAKARTA",20,76,160,236
https://kawalpemilu.org#25891,"PEJAGALAN, PENJARINGAN, JAKARTA UTARA, DKI JAKARTA",67,223,37,260
https://kawalpemilu.org#25853,"CEMPAKA BARU, KEMAYORAN, JAKARTA PUSAT, DKI JAKARTA",2,113,123,236
https://kawalpemilu.org#26016,"CILANDAK TIMUR, PASAR MINGGU, JAKARTA SELATAN, DKI JAKARTA",77,55,30,85
https://kawalpemilu.org#26114,"PONDOK BAMBU, DUREN SAWIT, JAKARTA TIMUR, DKI JAKARTA",144,87,146,233
https://kawalpemilu.org#25979,"JATIPULO, PALMERAH, JAKARTA BARAT, DKI JAKARTA",11,117,60,177
https://kawalpemilu.org#26054,"SRENGSENG SAWAH, JAGAKARSA, JAKARTA SELATAN, DKI JAKARTA",12,86,137,223
https://kawalpemilu.org#26003,"MENTENG ATAS, SETIABUDI, JAKARTA SELATAN, DKI JAKARTA",93,95,119,214
https://kawalpemilu.org#26068,"UTAN KAYU UTARA, MATRAMAN, JAKARTA TIMUR, DKI JAKARTA",10,105,141,246
https://kawalpemilu.org#25995,"BUKIT DURI, TEBET, JAKARTA SELATAN, DKI JAKARTA",40,44,145,189
https://kawalpemilu.org#25888,"PENJARINGAN, PENJARINGAN, JAKARTA UTARA, DKI JAKARTA",91,116,62,178
https://kawalpemilu.org#25892,"PLUIT, PENJARINGAN, JAKARTA UTARA, DKI JAKARTA",8,76,145,221
https://kawalpemilu.org#26077,"JATINEGARA KAUM, PULOGADUNG, JAKARTA TIMUR, DKI JAKARTA",14,78,121,199
https://kawalpemilu.org#26047,"KALIBATA, PANCORAN, JAKARTA SELATAN, DKI JAKARTA",43,78,125,0
https://kawalpemilu.org#74726,"TENILO, LIMBOTO, GORONTALO, GORONTALO",1,131,96,227
https://kawalpemilu.org#74745,"BUA, BATUDAA, GORONTALO, GORONTALO",1,135,75,210
https://kawalpemilu.org#75251,"MALANGO, TALUDITI, PAHUWATO, GORONTALO",1,95,67,162
https://kawalpemilu.org#74768,"ULOBUA, TIBAWA, GORONTALO, GORONTALO",3,206,44,250
https://kawalpemilu.org#75211,"PATUHU, RANDANGAN, PAHUWATO, GORONTALO",3,107,104,211
https://kawalpemilu.org#75242,"SUKA MAKMUR, PATILANGGIO, PAHUWATO, GORONTALO",4,115,127,242
https://kawalpemilu.org#75202,"SUKA DAMAI, LEMITO, PAHUWATO, GORONTALO",1,78,122,200
https://kawalpemilu.org#74802,"PENTADIO BARAT, TELAGA BIRU, GORONTALO, GORONTALO",2,134,99,233
https://kawalpemilu.org#75398,"PADEBUOLO, KOTA TIMUR, KOTA GORONTALO, GORONTALO",7,82,153,235
