https://kawalpemilu.org#24773,"TALANG, TELUKBETUNG SELATAN, KOTA BANDAR LAMPUNG, LAMPUNG",22,92,134,226
https://kawalpemilu.org#23318,"KOTA ALAM, KOTABUMI SELATAN, LAMPUNG UTARA, LAMPUNG",158,39,146,185
https://kawalpemilu.org#24773,"TALANG, TELUKBETUNG SELATAN, KOTA BANDAR LAMPUNG, LAMPUNG",24,89,41,130
https://kawalpemilu.org#24555,"GUNUNG KATUN, BARADATU, WAY KANAN, LAMPUNG",19,51,113,164
https://kawalpemilu.org#22361,"AMBARAWA, AMBARAWA, PRINGSEWU, LAMPUNG",16,74,37,111
https://kawalpemilu.org#22896,"SIDO LUHUR, BANGUN REJO, LAMPUNG TENGAH, LAMPUNG",9,116,32,148
https://kawalpemilu.org#23265,"CAHAYA NEGERI, ABUNG BARAT, LAMPUNG UTARA, LAMPUNG",62,61,68,129
https://kawalpemilu.org#24758,"KALIAWI, TANJUNGKARANG PUSAT, KOTA BANDAR LAMPUNG, LAMPUNG",11,62,187,249
https://kawalpemilu.org#24486,"BLAMBANGAN UMPU, BLAMBANGAN UMPU, WAY KANAN, LAMPUNG",7,61,110,171
https://kawalpemilu.org#22938,"ADI PURO, TRIMURJO, LAMPUNG TENGAH, LAMPUNG",13,80,39,119
https://kawalpemilu.org#24418,"SUMBER HADI, MELINTING, LAMPUNG TIMUR, LAMPUNG",11,142,15,157
https://kawalpemilu.org#23023,"GAYA BARU VI, SEPUTIH SURABAYA, LAMPUNG TENGAH, LAMPUNG",7,157,52,209
https://kawalpemilu.org#22987,"BUYUT BARU, SEPUTIH RAMAN, LAMPUNG TENGAH, LAMPUNG",4,192,36,228
https://kawalpemilu.org#22759,"KARANG ANYAR, JATI AGUNG, LAMPUNG SELATAN, LAMPUNG",40,180,29,209
https://kawalpemilu.org#24726,"GEDONG AIR, TANJUNGKARANG BARAT, KOTA BANDAR LAMPUNG, LAMPUNG",19,77,71,148
https://kawalpemilu.org#22414,"NUSA WUNGU, BANYUMAS, PRINGSEWU, LAMPUNG",5,75,61,136
https://kawalpemilu.org#24346,"TANJUNG HARAPAN, MARGA TIGA, LAMPUNG TIMUR, LAMPUNG",11,150,97,247
https://kawalpemilu.org#23128,"NEGARA BUMI UDIK, ANAK TUHA, LAMPUNG TENGAH, LAMPUNG",3,125,43,168
https://kawalpemilu.org#23281,"ABUNG JAYO, ABUNG SELATAN, LAMPUNG UTARA, LAMPUNG",4,0,0,0
https://kawalpemilu.org#24766,"TELUKBETUNG, TELUKBETUNG SELATAN, KOTA BANDAR LAMPUNG, LAMPUNG",4,52,103,155
https://kawalpemilu.org#24727,"SUKAJAWA, TANJUNGKARANG BARAT, KOTA BANDAR LAMPUNG, LAMPUNG",22,68,117,185
https://kawalpemilu.org#24685,"BIMA SAKTI, NEGERI BESAR, WAY KANAN, LAMPUNG",5,110,28,138
https://kawalpemilu.org#24646,"GUNUNG LABUHAN, GUNUNG LABUHAN, WAY KANAN, LAMPUNG",9,29,142,171
https://kawalpemilu.org#24568,"MEKAR ASRI, BARADATU, WAY KANAN, LAMPUNG",6,116,53,169
https://kawalpemilu.org#24739,"KARANG MARITIM, PANJANG, KOTA BANDAR LAMPUNG, LAMPUNG",4,107,53,160
https://kawalpemilu.org#24255,"TULUS REJO, PEKALONGAN, LAMPUNG TIMUR, LAMPUNG",8,81,106,187
https://kawalpemilu.org#24746,"SAWAH BREBES, TANJUNGKARANG TIMUR, KOTA BANDAR LAMPUNG, LAMPUNG",17,118,116,234
https://kawalpemilu.org#84825,"PUJI HARJO, PAGELARAN, PRINGSEWU, LAMPUNG",3,118,94,212
https://kawalpemilu.org#23050,"BUMI RATU, BUMI RATU NUBAN, LAMPUNG TENGAH, LAMPUNG",10,16,120,136
https://kawalpemilu.org#23916,"KEDAMAIAN, KOTA AGUNG, TANGGAMUS, LAMPUNG",5,48,118,166
https://kawalpemilu.org#24984,"TEMPEL REJO, KEDONDONG, PESAWARAN, LAMPUNG",15,77,60,137
https://kawalpemilu.org#22757,"JATI MULYO, JATI AGUNG, LAMPUNG SELATAN, LAMPUNG",31,158,82,240
https://kawalpemilu.org#22688,"SIDOMULYO, SIDOMULYO, LAMPUNG SELATAN, LAMPUNG",14,139,26,165
https://kawalpemilu.org#24778,"KETEGUHAN, TELUKBETUNG TIMUR, KOTA BANDAR LAMPUNG, LAMPUNG",26,106,60,166
https://kawalpemilu.org#24898,"GEDUNG GUMANTI, TEGINENENG, PESAWARAN, LAMPUNG",10,154,45,199
https://kawalpemilu.org#84794,"SUMBER REJEKI MATARAM, BANDAR MATARAM, LAMPUNG TENGAH, LAMPUNG",7,158,15,173
https://kawalpemilu.org#22828,"TITIWANGI, CANDIPURO, LAMPUNG SELATAN, LAMPUNG",17,153,66,219
https://kawalpemilu.org#23212,"SUMBER ARUM, KOTABUMI, LAMPUNG UTARA, LAMPUNG",111,125,36,161
https://kawalpemilu.org#24227,"KARYA TANI, LABUHAN MARINGGAI, LAMPUNG TIMUR, LAMPUNG",17,85,12,97
https://kawalpemilu.org#-991044,"Hong Kong, Hong Kong, Republik Rakyat Tiongkok, Luar Negeri",1014,480,84,564
https://kawalpemilu.org#-991084,"Johor Bahru, Johor Bahru, Malaysia, Luar Negeri",2072,128,86,214
https://kawalpemilu.org#-990784,"Singapura, Singapura, Singapura, Luar Negeri",10,468,69,537
https://kawalpemilu.org#-991074,"Jeddah, Jeddah, Arab Saudi, Luar Negeri",2005,103,414,517
https://kawalpemilu.org#-990454,"Kopenhagen, Kopenhagen, Denmark, Luar Negeri",1,117,34,151
https://kawalpemilu.org#-991084,"Johor Bahru, Johor Bahru, Malaysia, Luar Negeri",2110,134,50,184
https://kawalpemilu.org#-991144,"Melbourne, Melbourne, Australia, Luar Negeri",1,312,34,346
https://kawalpemilu.org#-991304,"Taipei, Taipei, Taiwan, Luar Negeri",1026,1107,142,1249
https://kawalpemilu.org#78070,"TANAH TINGGI, KOTA TERNATE SELATAN, KOTA TERNATE, MALUKU UTARA",6,63,134,197
https://kawalpemilu.org#77874,"WAILAU, SANANA, KEPULAUAN SULA, MALUKU UTARA",1,29,200,229
https://kawalpemilu.org#77288,"TALAGA, IBU SELATAN, HALMAHERA BARAT, MALUKU UTARA",2,12,137,149
https://kawalpemilu.org#78083,"SANGADJI, KOTA TERNATE UTARA, KOTA TERNATE, MALUKU UTARA",4,39,84,123
https://kawalpemilu.org#77872,"UMALOYA, SANANA, KEPULAUAN SULA, MALUKU UTARA",1,26,138,164
https://kawalpemilu.org#77288,"TALAGA, IBU SELATAN, HALMAHERA BARAT, MALUKU UTARA",1,19,105,124
https://kawalpemilu.org#77183,"TAURO, JAILOLO, HALMAHERA BARAT, MALUKU UTARA",3,110,2,112
https://kawalpemilu.org#77790,"BIBINOI, BACAN TIMUR TENGAH, HALMAHERA SELATAN, MALUKU UTARA",2,84,104,188
https://kawalpemilu.org#78108,"TANAH RAJA, KOTA TERNATE TENGAH, KOTA TERNATE, MALUKU UTARA",2,55,81,136
https://kawalpemilu.org#928883,"MALULI, TALIABU SELATAN, PULAU TALIABU, MALUKU UTARA",2,79,114,193
https://kawalpemilu.org#77017,"BATU GAJAH, SIRIMAU, KOTA AMBON, MALUKU",3,194,8,202
https://kawalpemilu.org#76676,"WAEKASAR, WAEAPO, BURU, MALUKU",4,189,60,249
https://kawalpemilu.org#77059,"OHOITEL, PULAU DULLAH UTARA, KOTA TUAL, MALUKU",6,121,50,171
https://kawalpemilu.org#77007,"KELURAHAN NUSANIWE, NUSANIWE, KOTA AMBON, MALUKU",8,195,9,204
https://kawalpemilu.org#76805,"PIRU, SERAM BARAT, SERAM BAGIAN BARAT, MALUKU",28,65,175,240
https://kawalpemilu.org#77023,"BATU MERAH, SIRIMAU, KOTA AMBON, MALUKU",80,30,116,146
https://kawalpemilu.org#76783,"WAIMITAL, KAIRATU, SERAM BAGIAN BARAT, MALUKU",2,41,149,190
https://kawalpemilu.org#77064,"LODAR ELL, PULAU DULLAH SELATAN, KOTA TUAL, MALUKU",12,65,169,234
https://kawalpemilu.org#76356,"PULAU AY, BANDA, MALUKU TENGAH, MALUKU",1,82,115,197
https://kawalpemilu.org#76467,"ALLANG, LEIHITU BARAT, MALUKU TENGAH, MALUKU",7,111,9,120
https://kawalpemilu.org#76388,"ITAWAKA, SAPARUA TIMUR, MALUKU TENGAH, MALUKU",1,83,62,145
https://kawalpemilu.org#76660,"WAEPERANG, LILIALY, BURU, MALUKU",3,121,95,216
https://kawalpemilu.org#77017,"BATU GAJAH, SIRIMAU, KOTA AMBON, MALUKU",20,147,3,150
https://kawalpemilu.org#76677,"WAENETAT, WAEAPO, BURU, MALUKU",9,126,82,208
https://kawalpemilu.org#54605,"MANGGE NA'E, DOMPU, DOMPU, NUSA TENGGARA BARAT",5,52,149,201
https://kawalpemilu.org#54935,"DAYAN PEKEN, AMPENAN, KOTA MATARAM, NUSA TENGGARA BARAT",13,58,143,201
https://kawalpemilu.org#54304,"SELONG, SELONG, LOMBOK TIMUR, NUSA TENGGARA BARAT",17,64,154,218
https://kawalpemilu.org#54995,"KODO, RASANAE TIMUR, KOTA BIMA, NUSA TENGGARA BARAT",1,56,155,211
https://kawalpemilu.org#55037,"BENTEK, GANGGA, LOMBOK UTARA, NUSA TENGGARA BARAT",20,102,15,117
https://kawalpemilu.org#54317,"KERUMUT, PRINGGABAYA, LOMBOK TIMUR, NUSA TENGGARA BARAT",10,47,95,142
https://kawalpemilu.org#85064,"AIKMEL TIMUR, AIKMEL, LOMBOK TIMUR, NUSA TENGGARA BARAT",8,31,159,190
https://kawalpemilu.org#54860,"MENALA, TALIWANG, SUMBAWA BARAT, NUSA TENGGARA BARAT",13,75,125,200
https://kawalpemilu.org#54290,"PAOK MOTONG, MASBAGIK, LOMBOK TIMUR, NUSA TENGGARA BARAT",20,57,140,197
https://kawalpemilu.org#54284,"LOYOK, SIKUR, LOMBOK TIMUR, NUSA TENGGARA BARAT",7,108,75,183
https://kawalpemilu.org#54698,"SAMILI, WOHA, BIMA, NUSA TENGGARA BARAT",6,14,159,173
https://kawalpemilu.org#54350,"ANJANI, SURALAGA, LOMBOK TIMUR, NUSA TENGGARA BARAT",25,145,35,180
https://kawalpemilu.org#54967,"MONJOK, SELAPARANG, KOTA MATARAM, NUSA TENGGARA BARAT",3,37,178,215
https://kawalpemilu.org#54236,"LAJUT, PRAYA TENGAH, LOMBOK TENGAH, NUSA TENGGARA BARAT",9,26,184,210
https://kawalpemilu.org#54129,"PRAPEN, PRAYA, LOMBOK TENGAH, NUSA TENGGARA BARAT",37,47,124,171
https://kawalpemilu.org#54204,"LOANGMAKA, JANAPRIA, LOMBOK TENGAH, NUSA TENGGARA BARAT",11,25,138,163
https://kawalpemilu.org#54116,"SENTELUK, BATU LAYAR, LOMBOK BARAT, NUSA TENGGARA BARAT",13,41,207,248
https://kawalpemilu.org#54324,"AIKMEL, AIKMEL, LOMBOK TIMUR, NUSA TENGGARA BARAT",2,72,109,181
https://kawalpemilu.org#54967,"MONJOK, SELAPARANG, KOTA MATARAM, NUSA TENGGARA BARAT",6,28,148,176
https://kawalpemilu.org#54866,"LABUHAN LALAR, TALIWANG, SUMBAWA BARAT, NUSA TENGGARA BARAT",4,57,186,243
https://kawalpemilu.org#54192,"SEMOYANG, PRAYA TIMUR, LOMBOK TENGAH, NUSA TENGGARA BARAT",27,196,76,272
https://kawalpemilu.org#54443,"UMA SIMA, SUMBAWA, SUMBAWA, NUSA TENGGARA BARAT",3,94,74,168
https://kawalpemilu.org#54940,"PAGUTAN, MATARAM, KOTA MATARAM, NUSA TENGGARA BARAT",19,99,75,174
https://kawalpemilu.org#54382,"KORLEKO, LABUHAN HAJI, LOMBOK TIMUR, NUSA TENGGARA BARAT",9,107,35,142
https://kawalpemilu.org#54201,"LEKOR, JANAPRIA, LOMBOK TENGAH, NUSA TENGGARA BARAT",18,29,150,179
https://kawalpemilu.org#54210,"KEREMBONG, JANAPRIA, LOMBOK TENGAH, NUSA TENGGARA BARAT",5,41,146,187
https://kawalpemilu.org#85085,"WANASABA LAUK, WANASABA, LOMBOK TIMUR, NUSA TENGGARA BARAT",9,122,72,194
https://kawalpemilu.org#55042,"KAYANGAN, KAYANGAN, LOMBOK UTARA, NUSA TENGGARA BARAT",12,46,101,147
https://kawalpemilu.org#54164,"SENGKOL, PUJUT, LOMBOK TENGAH, NUSA TENGGARA BARAT",20,96,112,208
https://kawalpemilu.org#54168,"PENGENGAT, PUJUT, LOMBOK TENGAH, NUSA TENGGARA BARAT",10,76,105,181
https://kawalpemilu.org#54136,"MONTONG TEREP, PRAYA, LOMBOK TENGAH, NUSA TENGGARA BARAT",23,32,173,205
https://kawalpemilu.org#87682,"LEMBAR SELATAN, LEMBAR, LOMBOK BARAT, NUSA TENGGARA BARAT",28,68,92,160
https://kawalpemilu.org#85070,"PRINGGAJURANG UTARA, MONTONG GADING, LOMBOK TIMUR, NUSA TENGGARA BARAT",1,92,108,200
https://kawalpemilu.org#54110,"LABUAN TERENG, LEMBAR, LOMBOK BARAT, NUSA TENGGARA BARAT",7,22,162,184
https://kawalpemilu.org#54126,"LENENG, PRAYA, LOMBOK TENGAH, NUSA TENGGARA BARAT",4,41,142,183
https://kawalpemilu.org#54182,"MANGKUNG, PRAYA BARAT, LOMBOK TENGAH, NUSA TENGGARA BARAT",16,129,55,184
https://kawalpemilu.org#55019,"SAMBINAE, MPUNDA, KOTA BIMA, NUSA TENGGARA BARAT",7,22,173,195
https://kawalpemilu.org#92045,"MEKAR DAMAI, PRAYA, LOMBOK TENGAH, NUSA TENGGARA BARAT",9,45,168,213
https://kawalpemilu.org#54800,"RATO, LAMBU, BIMA, NUSA TENGGARA BARAT",10,15,186,201
https://kawalpemilu.org#54890,"TATAR, SEKONGKANG, SUMBAWA BARAT, NUSA TENGGARA BARAT",1,56,134,190
https://kawalpemilu.org#56720,"RUKUN LIMA, ENDE SELATAN, ENDE, NUSA TENGGARA TIMUR",13,130,52,182
https://kawalpemilu.org#58066,"OESAPA, KELAPA LIMA, KOTA KUPANG, NUSA TENGGARA TIMUR",31,156,7,163
https://kawalpemilu.org#58055,"OEPURA, MAULAFA, KOTA KUPANG, NUSA TENGGARA TIMUR",21,169,10,179
https://kawalpemilu.org#55865,"KABUNA, KAKULUK MESAK, BELU, NUSA TENGGARA TIMUR",8,138,50,188
https://kawalpemilu.org#55504,"SANBET, TOIANAS, TIMOR TENGAH SELATAN, NUSA TENGGARA TIMUR",2,165,11,176
https://kawalpemilu.org#57660,"PACAR, PACAR, MANGGARAI BARAT, NUSA TENGGARA TIMUR",2,119,3,122
https://kawalpemilu.org#57175,"PAMBOTANDJARA, KOTA WAINGAPU, SUMBA TIMUR, NUSA TENGGARA TIMUR",4,75,0,75
https://kawalpemilu.org#57154,"PONG  LENGOR, RAHONG UTARA, MANGGARAI, NUSA TENGGARA TIMUR",3,124,1,125
https://kawalpemilu.org#58066,"OESAPA, KELAPA LIMA, KOTA KUPANG, NUSA TENGGARA TIMUR",54,181,7,188
https://kawalpemilu.org#56035,"BEIRAFU, ATAMBUA BARAT, BELU, NUSA TENGGARA TIMUR",7,141,16,157
https://kawalpemilu.org#56478,"KOKOTOBO, ADONARA TENGAH, FLORES TIMUR, NUSA TENGGARA TIMUR",3,87,5,92
https://kawalpemilu.org#90886,"DELU DEPA, KODI BANGEDO, SUMBA BARAT DAYA, NUSA TENGGARA TIMUR",1,195,14,209
https://kawalpemilu.org#56895,"KELIMUTU, ENDE TENGAH, ENDE, NUSA TENGGARA TIMUR",6,90,13,103
https://kawalpemilu.org#56097,"HALERMAN, ALOR BARAT DAYA, ALOR, NUSA TENGGARA TIMUR",2,133,6,139
https://kawalpemilu.org#56380,"WAIWERANG KOTA, ADONARA TIMUR, FLORES TIMUR, NUSA TENGGARA TIMUR",5,157,106,263
https://kawalpemilu.org#56577,"NANGATOBONG, WAIGETE, SIKKA, NUSA TENGGARA TIMUR",6,108,3,111
https://kawalpemilu.org#57162,"KETANG, LELAK, MANGGARAI, NUSA TENGGARA TIMUR",2,98,17,115
https://kawalpemilu.org#57304,"MALUMBI, KAMBERA, SUMBA TIMUR, NUSA TENGGARA TIMUR",6,148,5,153
https://kawalpemilu.org#58028,"HOHA WUNGO, KODI UTARA, SUMBA BARAT DAYA, NUSA TENGGARA TIMUR",2,142,14,156
https://kawalpemilu.org#90862,"KALAKI KAMBE, WEWEWA BARAT, SUMBA BARAT DAYA, NUSA TENGGARA TIMUR",4,173,6,179
https://kawalpemilu.org#56185,"ALILA TIMUR, KABOLA, ALOR, NUSA TENGGARA TIMUR",3,19,176,195
https://kawalpemilu.org#56690,"ONDOREA BARAT, NANGAPANDA, ENDE, NUSA TENGGARA TIMUR",1,149,9,158
https://kawalpemilu.org#91236,"RANGGATALO, LIO TIMUR, ENDE, NUSA TENGGARA TIMUR",1,145,3,148
https://kawalpemilu.org#58208,"MBENGAN, KOTA KOMBA, MANGGARAI TIMUR, NUSA TENGGARA TIMUR",6,164,11,175
https://kawalpemilu.org#56834,"FATAMARI, LIO TIMUR, ENDE, NUSA TENGGARA TIMUR",1,196,16,212
https://kawalpemilu.org#58073,"OEBUFU, OEBOBO, KOTA KUPANG, NUSA TENGGARA TIMUR",29,201,5,206
https://kawalpemilu.org#57031,"BULAN, RUTENG, MANGGARAI, NUSA TENGGARA TIMUR",3,144,9,153
https://kawalpemilu.org#58148,"WANGKAR WELI, POCO RANAKA TIMUR, MANGGARAI TIMUR, NUSA TENGGARA TIMUR",1,177,33,210
https://kawalpemilu.org#56168,"NAILANG, ALOR TIMUR LAUT, ALOR, NUSA TENGGARA TIMUR",1,137,5,142
https://kawalpemilu.org#58076,"KAYU PUTIH, OEBOBO, KOTA KUPANG, NUSA TENGGARA TIMUR",26,61,134,195
https://kawalpemilu.org#56032,"BARDAO, ATAMBUA BARAT, BELU, NUSA TENGGARA TIMUR",5,119,50,169
https://kawalpemilu.org#57169,"KAMBAJAWA, KOTA WAINGAPU, SUMBA TIMUR, NUSA TENGGARA TIMUR",23,107,9,116
https://kawalpemilu.org#57809,"UTETOTO, NANGARORO, NAGEKEO, NUSA TENGGARA TIMUR",2,125,5,130
https://kawalpemilu.org#57771,"ORONG, WELAK, MANGGARAI BARAT, NUSA TENGGARA TIMUR",1,188,9,197
https://kawalpemilu.org#56407,"HORINARA, KELUBAGOLIT, FLORES TIMUR, NUSA TENGGARA TIMUR",2,97,112,209
https://kawalpemilu.org#85150,"KOLIPETUNG, ADONARA, FLORES TIMUR, NUSA TENGGARA TIMUR",1,31,103,134
https://kawalpemilu.org#57679,"NDOSO, NDOSO, MANGGARAI BARAT, NUSA TENGGARA TIMUR",4,85,7,92
https://kawalpemilu.org#81962,"MEFKAJIM II, AYAMARU, MAYBRAT, PAPUA BARAT",1,197,1,198
https://kawalpemilu.org#81918,"WOMBA, AIFAT TIMUR SELATAN, MAYBRAT, PAPUA BARAT",1,90,0,90
https://kawalpemilu.org#81980,"HUBERITA, AYAMARU TIMUR, MAYBRAT, PAPUA BARAT",1,203,0,203
https://kawalpemilu.org#929818,"WARMON KOKODA, MAYAMUK, SORONG, PAPUA BARAT",1,66,73,139
https://kawalpemilu.org#82908,"WAIFOI, TIPLOL MAYALIBIT, RAJA AMPAT, PAPUA BARAT",1,111,0,111
https://kawalpemilu.org#82191,"DESAY, PRAFI, MANOKWARI, PAPUA BARAT",6,65,105,170
https://kawalpemilu.org#82942,"DABATAN, MISOOL SELATAN, RAJA AMPAT, PAPUA BARAT",1,125,112,237
https://kawalpemilu.org#83291,"REMU UTARA, SORONG, KOTA SORONG, PAPUA BARAT",14,84,126,210
https://kawalpemilu.org#929278,"PUNCAK CENDRAWASIH, SORONG BARAT, KOTA SORONG, PAPUA BARAT",18,201,2,203
https://kawalpemilu.org#83110,"RADO, WASIOR, TELUK WONDAMA, PAPUA BARAT",1,189,3,192
https://kawalpemilu.org#79906,"GURINDA JAYA, JAGEBOB, MERAUKE, PAPUA",4,45,87,132
https://kawalpemilu.org#79967,"WAMAL, TUBANG, MERAUKE, PAPUA",1,144,14,158
https://kawalpemilu.org#930588,"KOMOPA, AWEIDA, PANIAI, PAPUA",1,212,0,212
https://kawalpemilu.org#80879,"BEKO, PANIAI BARAT, PANIAI, PAPUA",2,75,100,175
https://kawalpemilu.org#86822,"TIKOME, AYUMNATI, LANNY JAYA, PAPUA",6,254,0,254
https://kawalpemilu.org#86240,"SOOR, YAWOSI, BIAK NUMFOR, PAPUA",1,197,6,203
https://kawalpemilu.org#81176,"WAKDE 1, PANTAI TIMUR BAGIAN BARAT, SARMI, PAPUA",2,62,1,63
https://kawalpemilu.org#81689,"SENTUL, ENDOMEN, YAHUKIMO, PAPUA",1,224,0,224
https://kawalpemilu.org#81710,"WANIM, LOLAT, YAHUKIMO, PAPUA",11,297,0,297
https://kawalpemilu.org#79832,"KELAPA LIMA, MERAUKE, MERAUKE, PAPUA",3,134,6,140
https://kawalpemilu.org#89096,"NAME / KONDENAME, MOKONI, LANNY JAYA, PAPUA",2,280,0,280
https://kawalpemilu.org#930761,"GIWO, SIRIWO, PANIAI, PAPUA",1,32,168,200
https://kawalpemilu.org#90831,"GOAK, DURAM, YAHUKIMO, PAPUA",2,241,0,241
https://kawalpemilu.org#930513,"DAGOUTO, WEGEE BINO, PANIAI, PAPUA",1,250,0,250
https://kawalpemilu.org#929058,"SAEFEN EMPAT DUA, SKANTO, KEEROM, PAPUA",1,75,133,208
https://kawalpemilu.org#80720,"MARYENDI, SAMOFA, BIAK NUMFOR, PAPUA",1,155,4,159
https://kawalpemilu.org#929750,"DELEGARI, KARU, LANNY JAYA, PAPUA",2,226,0,226
https://kawalpemilu.org#929745,"BAWI, LANNYNA, LANNY JAYA, PAPUA",1,250,0,250
https://kawalpemilu.org#79833,"RIMBA JAYA, MERAUKE, MERAUKE, PAPUA",24,168,2,170
https://kawalpemilu.org#930498,"UWAMANI, WEGEE MUKA, PANIAI, PAPUA",3,177,0,177
https://kawalpemilu.org#999008,"OBAYA DIMI, BAYA BIRU, PANIAI, PAPUA",1,244,0,244
https://kawalpemilu.org#79967,"WAMAL, TUBANG, MERAUKE, PAPUA",2,105,4,109
https://kawalpemilu.org#79498,"PELANME, KELILA, MAMBERAMO TENGAH, PAPUA",4,155,0,155
https://kawalpemilu.org#79830,"MANDALA, MERAUKE, MERAUKE, PAPUA",5,173,14,187
https://kawalpemilu.org#78589,"BOKONERI, BOKONERI, TOLIKARA, PAPUA",1,155,0,155
https://kawalpemilu.org#81234,"JAIFURI, SKANTO, KEEROM, PAPUA",4,136,85,221
https://kawalpemilu.org#80008,"SUKA MAJU, MALIND, MERAUKE, PAPUA",3,100,77,177
https://kawalpemilu.org#78972,"ANYUMKA, AMBATKWI, BOVEN DIGOEL, PAPUA",1,67,18,85
https://kawalpemilu.org#78996,"KAKUNA, MINDIPTANA, BOVEN DIGOEL, PAPUA",1,74,2,76
https://kawalpemilu.org#81081,"TEMBAGAPURA, TEMBAGAPURA, MIMIKA, PAPUA",24,131,69,200
https://kawalpemilu.org#86474,"KAMENAWARI, PANTAI BARAT, SARMI, PAPUA",1,59,0,59
https://kawalpemilu.org#90610,"BIRUBI, YENDIDORI, BIAK NUMFOR, PAPUA",1,155,0,155
https://kawalpemilu.org#86783,"LIBOME, GOLLO, LANNY JAYA, PAPUA",1,342,0,342
https://kawalpemilu.org#79856,"IWOL, OKABA, MERAUKE, PAPUA",1,93,4,97
https://kawalpemilu.org#929751,"IGIMBUA, KARU, LANNY JAYA, PAPUA",2,257,0,257
https://kawalpemilu.org#80532,"MANDALA, BIAK KOTA, BIAK NUMFOR, PAPUA",15,152,47,199
https://kawalpemilu.org#78462,"PIRILUK, UMAGI, TOLIKARA, PAPUA",1,217,0,217
https://kawalpemilu.org#79830,"MANDALA, MERAUKE, MERAUKE, PAPUA",17,110,32,142
https://kawalpemilu.org#15423,"SUNGAI APIT, SUNGAI APIT, SIAK, RIAU",12,65,192,257
https://kawalpemilu.org#15819,"SIMPANG BARU, TAMPAN, KOTA PEKANBARU, RIAU",17,32,142,174
https://kawalpemilu.org#90469,"BAGAN SINEMBAH KOTA, BAGAN SINEMBAH, ROKAN HILIR, RIAU",3,87,95,182
https://kawalpemilu.org#15808,"RUMBAI BUKIT, RUMBAI, KOTA PEKANBARU, RIAU",5,52,171,223
https://kawalpemilu.org#15316,"BAGAN BATU, BAGAN SINEMBAH, ROKAN HILIR, RIAU",6,115,77,192
https://kawalpemilu.org#15149,"KOTA LAMA, KUNTO DARUSSALAM, ROKAN HULU, RIAU",23,143,96,239
https://kawalpemilu.org#90475,"BALAM JAYA, BAGAN SINEMBAH, ROKAN HILIR, RIAU",18,39,95,134
https://kawalpemilu.org#14089,"SELATPANJANG KOTA, TEBING TINGGI, KEPULAUAN MERANTI, RIAU",12,61,134,195
https://kawalpemilu.org#15865,"BUMI AYU, DUMAI SELATAN, KOTA DUMAI, RIAU",18,87,129,216
https://kawalpemilu.org#84503,"GEMBIRA, Gaung, INDRAGIRI HILIR, RIAU",4,93,62,155
https://kawalpemilu.org#15825,"TANGKERANG TENGAH, MARPOYAN DAMAI, KOTA PEKANBARU, RIAU",64,50,124,174
https://kawalpemilu.org#15486,"SEMINAI, KERINCI KANAN, SIAK, RIAU",7,94,44,138
https://kawalpemilu.org#14971,"PANGKALAN KERINCI TIMUR, PANGKALAN KERINCI, PELALAWAN, RIAU",51,79,132,211
https://kawalpemilu.org#14873,"PULAUPALAS, Tembilahan Hulu, INDRAGIRI HILIR, RIAU",10,92,114,206
https://kawalpemilu.org#15491,"JAYA PURA, BUNGA RAYA, SIAK, RIAU",7,120,99,219
https://kawalpemilu.org#15822,"DELIMA, TAMPAN, KOTA PEKANBARU, RIAU",35,23,118,141
https://kawalpemilu.org#14228,"TANAH MERAH, SIAK HULU, KAMPAR, RIAU",23,161,4,165
https://kawalpemilu.org#15440,"MINAS TIMUR, MINAS, SIAK, RIAU",4,98,73,171
https://kawalpemilu.org#14729,"TITIAN ANTUI, PINGGIR, BENGKALIS, RIAU",47,109,71,180
https://kawalpemilu.org#15320,"BALAM SEMPURNA, BAGAN SINEMBAH, ROKAN HILIR, RIAU",28,143,18,161
https://kawalpemilu.org#14824,"KOTA BARU RETEH, Keritang, INDRAGIRI HILIR, RIAU",13,48,153,201
https://kawalpemilu.org#14672,"TEMIANG, BANDAR LAKSAMANA, BENGKALIS, RIAU",6,24,125,150
https://kawalpemilu.org#15803,"KAMPUNG BARU, SENAPELAN, KOTA PEKANBARU, RIAU",24,103,100,203
https://kawalpemilu.org#14196,"KEMANG INDAH, TAMBANG, KAMPAR, RIAU",3,4,175,179
https://kawalpemilu.org#14377,"KOTO PERAMBAHAN, KAMPA, KAMPAR, RIAU",11,13,121,134
https://kawalpemilu.org#14418,"KAMPUNG BESAR KOTA, RENGAT, INDRAGIRI HULU, RIAU",8,56,135,191
https://kawalpemilu.org#15843,"LEMBAH DAMAI, RUMBAI PESISIR, KOTA PEKANBARU, RIAU",16,11,216,227
https://kawalpemilu.org#15530,"LAKSAMANA, SABAK AUH, SIAK, RIAU",1,39,133,172
https://kawalpemilu.org#14418,"KAMPUNG BESAR KOTA, RENGAT, INDRAGIRI HULU, RIAU",6,58,123,181
https://kawalpemilu.org#14974,"MAKMUR, PANGKALAN KERINCI, PELALAWAN, RIAU",4,55,75,130
https://kawalpemilu.org#90481,"BABUSSALAM ROKAN, PUJUD, ROKAN HILIR, RIAU",1,20,157,177
https://kawalpemilu.org#15700,"TEBERAU PANJANG, GUNUNGTOAR, KUANTAN SINGINGI, RIAU",4,31,183,214
https://kawalpemilu.org#14736,"SERAI WANGI, TALANG MUANDAU, BENGKALIS, RIAU",2,100,51,151
https://kawalpemilu.org#90492,"BANGKO MAS RAYA, BANGKO PUSAKO, ROKAN HILIR, RIAU",3,31,129,160
https://kawalpemilu.org#14450,"SUNGAI BAUNG, RENGAT BARAT, INDRAGIRI HULU, RIAU",3,79,143,222
https://kawalpemilu.org#14231,"KAPAU JAYA, SIAK HULU, KAMPAR, RIAU",7,144,76,220
https://kawalpemilu.org#14586,"PERKEBUNAN SEI LALA, SUNGAI LALA, INDRAGIRI HULU, RIAU",2,128,113,241
https://kawalpemilu.org#14785,"TELUKKIAMBANG, Tempuling, INDRAGIRI HILIR, RIAU",7,23,80,103
https://kawalpemilu.org#90467,"BALAI JAYA KOTA, BAGAN SINEMBAH, ROKAN HILIR, RIAU",8,116,114,230
https://kawalpemilu.org#14780,"SUNGAIBERINGIN, Tembilahan, INDRAGIRI HILIR, RIAU",16,39,171,210
https://kawalpemilu.org#14999,"MAYANG SARI, PANGKALAN LESUNG, PELALAWAN, RIAU",2,78,138,216
https://kawalpemilu.org#15821,"TUAH KARYA, TAMPAN, KOTA PEKANBARU, RIAU",22,20,111,131
https://kawalpemilu.org#15594,"KOTO TUO, KUANTAN TENGAH, KUANTAN SINGINGI, RIAU",2,59,152,211
https://kawalpemilu.org#931197,"PEMATANGKAPAU, TENAYAN RAYA, KOTA PEKANBARU, RIAU",15,41,169,210
https://kawalpemilu.org#75910,"SULEWATANG, POLEWALI, POLEWALI MANDAR, SULAWESI BARAT",7,131,113,244
https://kawalpemilu.org#76055,"SIRINDU, PAMBOANG, MAJENE, SULAWESI BARAT",2,83,69,152
https://kawalpemilu.org#75584,"TARAILU, SAMPAGA, MAMUJU, SULAWESI BARAT",7,181,88,269
https://kawalpemilu.org#76091,"BAURUNG, BANGGAE TIMUR, MAJENE, SULAWESI BARAT",2,100,125,225
https://kawalpemilu.org#75529,"KABULOANG, KALUKKU, MAMUJU, SULAWESI BARAT",8,172,89,261
https://kawalpemilu.org#75691,"SALUDURIAN, MAMBI, MAMASA, SULAWESI BARAT",2,70,82,152
https://kawalpemilu.org#75546,"KONDO BULO, KALUMPANG, MAMUJU, SULAWESI BARAT",1,183,15,198
https://kawalpemilu.org#87604,"RANGAS, BANGGAE, MAJENE, SULAWESI BARAT",4,137,54,191
https://kawalpemilu.org#75476,"LARIANG, TIKKE RAYA, MAMUJU UTARA, SULAWESI BARAT",10,110,52,162
https://kawalpemilu.org#75550,"BABANA, BUDONG-BUDONG, MAMUJU TENGAH, SULAWESI BARAT",4,177,74,251
https://kawalpemilu.org#72373,"BONTOALA, BONTOALA, KOTA MAKASSAR, SULAWESI SELATAN",2,88,104,192
https://kawalpemilu.org#69289,"PARINDING, SESEAN, TORAJA UTARA, SULAWESI SELATAN",4,99,26,125
https://kawalpemilu.org#71052,"SORO, TAKKALALLA, WAJO, SULAWESI SELATAN",1,128,60,188
https://kawalpemilu.org#71495,"KADINGEH, BARAKA, ENREKANG, SULAWESI SELATAN",4,9,144,153
https://kawalpemilu.org#70899,"PALAKKA, BARRU, BARRU, SULAWESI SELATAN",4,91,129,220
https://kawalpemilu.org#931283,"Bitowa, MANGGALA, KOTA MAKASSAR, SULAWESI SELATAN",22,67,113,180
https://kawalpemilu.org#72436,"DAYA, BIRINGKANAYA, KOTA MAKASSAR, SULAWESI SELATAN",24,96,107,203
https://kawalpemilu.org#69458,"BATANGMATA SAPO, BONTOMATENE, KEPULAUAN SELAYAR, SULAWESI SELATAN",4,27,44,71
https://kawalpemilu.org#70341,"UJUNG TANAH, MARE, BONE, SULAWESI SELATAN",7,90,56,146
https://kawalpemilu.org#70473,"CAREBBU, AWANGPONE, BONE, SULAWESI SELATAN",3,154,45,199
https://kawalpemilu.org#70408,"SALEBBA, PONRE, BONE, SULAWESI SELATAN",1,91,157,248
https://kawalpemilu.org#71904,"PAKALA, MENGKENDEK, TANA TORAJA, SULAWESI SELATAN",1,158,36,194
https://kawalpemilu.org#72389,"TALLO, TALLO, KOTA MAKASSAR, SULAWESI SELATAN",2,101,132,233
https://kawalpemilu.org#72546,"TEMMALEBBA, BARA, KOTA PALOPO, SULAWESI SELATAN",17,56,168,224
https://kawalpemilu.org#70326,"WANUAWARU, LIBURENG, BONE, SULAWESI SELATAN",5,92,141,233
https://kawalpemilu.org#70932,"KAMIRI, BALUSU, BARRU, SULAWESI SELATAN",4,137,84,221
https://kawalpemilu.org#71226,"BAULA, TELLU LIMPOE, SIDENRENG RAPPANG, SULAWESI SELATAN",2,140,83,223
https://kawalpemilu.org#70973,"LALABATA RILAU, LALABATA, SOPPENG, SULAWESI SELATAN",8,73,104,177
https://kawalpemilu.org#71638,"TALANG BULAWANG, BAJO, LUWU, SULAWESI SELATAN",3,47,148,195
https://kawalpemilu.org#72480,"UJUNG BARU, SOREANG, KOTA PARE PARE, SULAWESI SELATAN",5,85,124,209
https://kawalpemilu.org#71110,"BELAWA, BELAWA, WAJO, SULAWESI SELATAN",3,86,110,196
https://kawalpemilu.org#69301,"KARRE PENANIAN, NANGGALA, TORAJA UTARA, SULAWESI SELATAN",1,136,12,148
https://kawalpemilu.org#71001,"TOTTONG, DONRI DONRI, SOPPENG, SULAWESI SELATAN",8,149,42,191
https://kawalpemilu.org#70083,"PENCONG, BIRINGBULU, GOWA, SULAWESI SELATAN",8,68,122,190
https://kawalpemilu.org#71414,"TADANGPALIE, CEMPA, PINRANG, SULAWESI SELATAN",9,41,136,177
https://kawalpemilu.org#71249,"SIPODECENG, BARANTI, SIDENRENG RAPPANG, SULAWESI SELATAN",8,88,112,200
https://kawalpemilu.org#71165,"BOLA, BOLA, WAJO, SULAWESI SELATAN",1,124,108,232
https://kawalpemilu.org#71526,"SAWITO, BUNGIN, ENREKANG, SULAWESI SELATAN",4,63,51,114
https://kawalpemilu.org#70666,"BAJI PAMAI, MAROS BARU, MAROS, SULAWESI SELATAN",5,79,127,206
https://kawalpemilu.org#72263,"LAUWO, BURAU, LUWU TIMUR, SULAWESI SELATAN",2,95,138,233
https://kawalpemilu.org#71559,"LUNJEN, BUNTU BATU, ENREKANG, SULAWESI SELATAN",5,10,122,132
