https://kawalpemilu.org#32367,"SUKAMULYA, CINAMBO, KOTA BANDUNG, JAWA BARAT",11,72,165,237
https://kawalpemilu.org#26588,"CIBURUY, CIGOMBONG, BOGOR, JAWA BARAT",20,38,155,193
https://kawalpemilu.org#27146,"CIBODAS, PACET, CIANJUR, JAWA BARAT",13,95,111,206
https://kawalpemilu.org#30069,"MAJASARI, LIGUNG, MAJALENGKA, JAWA BARAT",3,61,75,136
https://kawalpemilu.org#32483,"TUGU, CIMANGGIS, KOTA DEPOK, JAWA BARAT",255,62,98,160
https://kawalpemilu.org#27453,"SANGKANHURIP, KATAPANG, BANDUNG, JAWA BARAT",3,85,126,211
https://kawalpemilu.org#32424,"MARGA JAYA, BEKASI SELATAN, KOTA BEKASI, JAWA BARAT",36,80,144,224
https://kawalpemilu.org#31751,"MEKARWANGI, CIKARANG BARAT, BEKASI, JAWA BARAT",27,58,113,171
https://kawalpemilu.org#32025,"KARANGTANJUNG, CILILIN, BANDUNG BARAT, JAWA BARAT",20,24,160,184
https://kawalpemilu.org#30242,"CIPASANG, CIBUGEL, SUMEDANG, JAWA BARAT",1,133,88,221
https://kawalpemilu.org#28575,"CIAMIS, CIAMIS, CIAMIS, JAWA BARAT",69,80,105,185
https://kawalpemilu.org#32423,"PEKAYON JAYA, BEKASI SELATAN, KOTA BEKASI, JAWA BARAT",3,112,134,246
https://kawalpemilu.org#26164,"CIKEAS UDIK, GUNUNG PUTRI, BOGOR, JAWA BARAT",42,52,156,208
https://kawalpemilu.org#26778,"PALASARI GIRANG, KALAPA NUNGGAL, SUKABUMI, JAWA BARAT",6,23,85,108
https://kawalpemilu.org#28023,"GIRIMUKTI, SINGAJAYA, GARUT, JAWA BARAT",10,54,115,169
https://kawalpemilu.org#26875,"BABAKAN, CISAAT, SUKABUMI, JAWA BARAT",5,41,139,180
https://kawalpemilu.org#30481,"UJUNGJAYA, UJUNGJAYA, SUMEDANG, JAWA BARAT",20,99,129,228
https://kawalpemilu.org#29625,"WANAKAYA, GUNUNG JATI, CIREBON, JAWA BARAT",2,102,141,243
https://kawalpemilu.org#30753,"ERETAN WETAN, KANDANGHAUR, INDRAMAYU, JAWA BARAT",11,156,43,199
https://kawalpemilu.org#28149,"DUNGUSWIRU, BL. LIMBANGAN, GARUT, JAWA BARAT",10,60,95,155
https://kawalpemilu.org#31438,"SRIJAYA, TIRTAJAYA, KARAWANG, JAWA BARAT",12,116,85,201
https://kawalpemilu.org#26393,"LUMPANG, PARUNG PANJANG, BOGOR, JAWA BARAT",17,80,100,180
https://kawalpemilu.org#28893,"BEBER, CIMARAGAS, CIAMIS, JAWA BARAT",6,39,82,123
https://kawalpemilu.org#31742,"WANASARI, CIBITUNG, BEKASI, JAWA BARAT",134,89,197,286
https://kawalpemilu.org#26629,"CIKAKAK, CIKAKAK, SUKABUMI, JAWA BARAT",7,41,91,132
https://kawalpemilu.org#26397,"KABASIRAN, PARUNG PANJANG, BOGOR, JAWA BARAT",12,74,115,189
https://kawalpemilu.org#32423,"PEKAYON JAYA, BEKASI SELATAN, KOTA BEKASI, JAWA BARAT",35,104,159,263
https://kawalpemilu.org#84886,"MEKARWARU, GANTAR, INDRAMAYU, JAWA BARAT",12,141,31,172
https://kawalpemilu.org#26509,"CIHERANG, DRAMAGA, BOGOR, JAWA BARAT",29,50,138,188
https://kawalpemilu.org#30942,"PATIMBAN, PUSAKANAGARA, SUBANG, JAWA BARAT",10,142,21,163
https://kawalpemilu.org#31924,"PADAASIH, CISARUA, BANDUNG BARAT, JAWA BARAT",8,124,123,247
https://kawalpemilu.org#30754,"ERETAN KULON, KANDANGHAUR, INDRAMAYU, JAWA BARAT",5,150,43,193
https://kawalpemilu.org#26293,"WARINGINJAYA, BOJONG GEDE, BOGOR, JAWA BARAT",29,71,100,171
https://kawalpemilu.org#32218,"SUKA ASIH, BOJONGLOA KALER, KOTA BANDUNG, JAWA BARAT",50,56,134,190
https://kawalpemilu.org#30542,"CIKEDUNG LOR, CIKEDUNG, INDRAMAYU, JAWA BARAT",4,131,87,218
https://kawalpemilu.org#32464,"CIMUNING, MUSTIKA JAYA, KOTA BEKASI, JAWA BARAT",12,78,141,219
https://kawalpemilu.org#26291,"RAGAJAYA, BOJONG GEDE, BOGOR, JAWA BARAT",3,69,123,192
https://kawalpemilu.org#30625,"LOMBANG, JUNTINYUAT, INDRAMAYU, JAWA BARAT",19,131,29,160
https://kawalpemilu.org#31480,"DAWUAN TENGAH, CIKAMPEK, KARAWANG, JAWA BARAT",19,45,128,173
https://kawalpemilu.org#27750,"WANAMEKAR, WANARAJA, GARUT, JAWA BARAT",19,44,77,121
https://kawalpemilu.org#30790,"SANCA, GANTAR, INDRAMAYU, JAWA BARAT",20,132,51,183
https://kawalpemilu.org#27887,"MEKARASIH, MALANGBONG, GARUT, JAWA BARAT",10,69,102,171
https://kawalpemilu.org#31786,"JATIREJA, CIKARANG TIMUR, BEKASI, JAWA BARAT",16,165,68,233
https://kawalpemilu.org#30690,"RAMBATAN WETAN, SINDANG, INDRAMAYU, JAWA BARAT",10,149,66,215
https://kawalpemilu.org#38539,"KENANTI, DUKUHSETI, PATI, JAWA TENGAH",3,182,14,196
https://kawalpemilu.org#36107,"CARIKAN, JUWIRING, KLATEN, JAWA TENGAH",7,196,20,216
https://kawalpemilu.org#40778,"KENDALSARI, PETARUKAN, PEMALANG, JAWA TENGAH",7,138,56,194
https://kawalpemilu.org#38926,"BANDUNGREJO, MRANGGEN, DEMAK, JAWA TENGAH",2,126,84,210
https://kawalpemilu.org#40636,"BATURSARI, PULOSARI, PEMALANG, JAWA TENGAH",5,103,4,107
https://kawalpemilu.org#84918,"TRITIH LOR, JERUKLEGI, CILACAP, JAWA TENGAH",18,155,41,196
https://kawalpemilu.org#32877,"JENANG, MAJENANG, CILACAP, JAWA TENGAH",20,157,83,240
https://kawalpemilu.org#40929,"BALAPULANG WETAN, BALAPULANG, TEGAL, JAWA TENGAH",27,161,49,210
https://kawalpemilu.org#38025,"PADARAN, REMBANG, REMBANG, JAWA TENGAH",6,214,22,236
https://kawalpemilu.org#39052,"JATISONO, GAJAH, DEMAK, JAWA TENGAH",6,129,53,182
https://kawalpemilu.org#40580,"PEKUNCEN, WIRADESA, PEKALONGAN, JAWA TENGAH",13,133,114,247
https://kawalpemilu.org#41303,"SIGENTONG, WANASARI, BREBES, JAWA TENGAH",15,155,42,197
https://kawalpemilu.org#39508,"SOBOREJO, PRINGSURAT, TEMANGGUNG, JAWA TENGAH",4,196,34,230
https://kawalpemilu.org#37321,"SIMO, KRADENAN, GROBOGAN, JAWA TENGAH",12,237,8,245
https://kawalpemilu.org#39609,"SUKOMARTO, JUMO, TEMANGGUNG, JAWA TENGAH",4,219,15,234
https://kawalpemilu.org#41763,"BRINGIN, NGALIYAN, KOTA SEMARANG, JAWA TENGAH",30,166,83,249
https://kawalpemilu.org#34232,"SIDOMUKTI, ADIMULYO, KEBUMEN, JAWA TENGAH",2,142,62,204
https://kawalpemilu.org#36395,"GENENGSARI, POLOKARTO, SUKOHARJO, JAWA TENGAH",4,167,79,246
https://kawalpemilu.org#36914,"NGASEM, COLOMADU, KARANGANYAR, JAWA TENGAH",12,186,13,199
https://kawalpemilu.org#38822,"JERUKWANGI, BANGSRI, JEPARA, JAWA TENGAH",6,174,35,209
https://kawalpemilu.org#36414,"TELUKAN, GROGOL, SUKOHARJO, JAWA TENGAH",12,166,92,258
https://kawalpemilu.org#36366,"MULUR, BENDOSARI, SUKOHARJO, JAWA TENGAH",12,157,87,244
https://kawalpemilu.org#34904,"SUMBEREJO, WADASLINTANG, WONOSOBO, JAWA TENGAH",6,113,27,140
https://kawalpemilu.org#41626,"SAWAH BESAR, GAYAM SARI, KOTA SEMARANG, JAWA TENGAH",16,186,16,202
https://kawalpemilu.org#33347,"KEDUNGBENDA, KEMANGKON, PURBALINGGA, JAWA TENGAH",11,163,5,168
https://kawalpemilu.org#33135,"KEDUNGRANDU, PATIKRAJA, BANYUMAS, JAWA TENGAH",14,160,34,194
https://kawalpemilu.org#87452,"TARISI, WANAREJA, CILACAP, JAWA TENGAH",20,156,26,182
https://kawalpemilu.org#38356,"DENGKEK, PATI, PATI, JAWA TENGAH",7,151,40,191
https://kawalpemilu.org#33457,"CANDIWULAN, KUTASARI, PURBALINGGA, JAWA TENGAH",4,154,36,190
https://kawalpemilu.org#40080,"BANDAR, BANDAR, BATANG, JAWA TENGAH",6,137,67,204
https://kawalpemilu.org#39991,"TAMBAKSARI, ROWOSARI, KENDAL, JAWA TENGAH",8,194,11,205
https://kawalpemilu.org#36556,"BATURETNO, BATURETNO, WONOGIRI, JAWA TENGAH",13,130,58,188
https://kawalpemilu.org#35390,"NGAWONGGO, KALIANGKRIK, MAGELANG, JAWA TENGAH",3,165,42,207
https://kawalpemilu.org#41836,"PEKAUMAN, TEGAL BARAT, KOTA TEGAL, JAWA TENGAH",20,133,114,247
https://kawalpemilu.org#37342,"KARANGREJO, GABUS, GROBOGAN, JAWA TENGAH",7,177,12,189
https://kawalpemilu.org#36141,"DELANGGU, DELANGGU, KLATEN, JAWA TENGAH",19,129,21,150
https://kawalpemilu.org#35387,"SUKOMAKMUR, KAJORAN, MAGELANG, JAWA TENGAH",3,133,11,144
https://kawalpemilu.org#37007,"MANYARREJO, PLUPUH, SRAGEN, JAWA TENGAH",5,144,25,169
https://kawalpemilu.org#39269,"KESONGO, TUNTANG, SEMARANG, JAWA TENGAH",8,168,63,231
https://kawalpemilu.org#35569,"GIRIMULYO, WINDUSARI, MAGELANG, JAWA TENGAH",4,170,63,233
https://kawalpemilu.org#41682,"GAJAHMUNGKUR, GAJAH MUNGKUR, KOTA SEMARANG, JAWA TENGAH",12,197,34,231
https://kawalpemilu.org#40851,"PESANTREN, ULUJAMI, PEMALANG, JAWA TENGAH",25,163,39,202
https://kawalpemilu.org#37487,"TLOGOREJO, TEGOWANU, GROBOGAN, JAWA TENGAH",12,181,29,210
https://kawalpemilu.org#41424,"LARANGAN, LARANGAN, BREBES, JAWA TENGAH",68,125,44,169
https://kawalpemilu.org#34949,"SAPURAN, SAPURAN, WONOSOBO, JAWA TENGAH",17,163,26,189
https://kawalpemilu.org#38493,"GUNUNGWUNGKAL, GUNUNGWUNGKAL, PATI, JAWA TENGAH",7,130,30,160
https://kawalpemilu.org#41163,"DUKUHWARU, DUKUHWARU, TEGAL, JAWA TENGAH",22,97,91,188
https://kawalpemilu.org#36844,"PABLENGAN, MATESIH, KARANGANYAR, JAWA TENGAH",4,103,21,124
https://kawalpemilu.org#39399,"ROGOMULYO, KALIWUNGU, SEMARANG, JAWA TENGAH",3,198,28,226
https://kawalpemilu.org#37067,"BEDORO, SAMBUNGMACAN, SRAGEN, JAWA TENGAH",17,135,22,157
https://kawalpemilu.org#35256,"SRUMBUNG, SRUMBUNG, MAGELANG, JAWA TENGAH",11,117,65,182
https://kawalpemilu.org#33978,"GROGOLBENINGSARI, PETANAHAN, KEBUMEN, JAWA TENGAH",4,156,59,215
https://kawalpemilu.org#39994,"TANJUNGSARI, ROWOSARI, KENDAL, JAWA TENGAH",10,182,26,208
https://kawalpemilu.org#41823,"JENGGOT, PEKALONGAN SELATAN, KOTA PEKALONGAN, JAWA TENGAH",22,121,116,237
https://kawalpemilu.org#41200,"PANGEBATAN, BANTARKAWUNG, BREBES, JAWA TENGAH",37,38,88,126
https://kawalpemilu.org#39272,"TUNTANG, TUNTANG, SEMARANG, JAWA TENGAH",15,203,35,238
https://kawalpemilu.org#36252,"NGEMPLAK, KALIKOTES, KLATEN, JAWA TENGAH",10,125,59,184
https://kawalpemilu.org#33683,"KRANDEGAN, BANJARNEGARA, BANJARNEGARA, JAWA TENGAH",21,70,57,127
https://kawalpemilu.org#36695,"BULUKERTO, BULUKERTO, WONOGIRI, JAWA TENGAH",8,157,21,178
https://kawalpemilu.org#36214,"KAYUMAS, JATINOM, KLATEN, JAWA TENGAH",3,230,20,250
https://kawalpemilu.org#38579,"KALIWUNGU, KALIWUNGU, KUDUS, JAWA TENGAH",10,153,22,175
https://kawalpemilu.org#34851,"TRIREJO, LOANO, PURWOREJO, JAWA TENGAH",1,94,28,122
https://kawalpemilu.org#33052,"KECILA, KEMRANJEN, BANYUMAS, JAWA TENGAH",17,125,74,199
https://kawalpemilu.org#41023,"DUKUHSALAM, SLAWI, TEGAL, JAWA TENGAH",8,111,86,197
https://kawalpemilu.org#40181,"KEBONDALEM, GRINGSING, BATANG, JAWA TENGAH",15,138,29,167
https://kawalpemilu.org#33031,"TIPAR, RAWALO, BANYUMAS, JAWA TENGAH",6,148,32,180
https://kawalpemilu.org#40591,"REMBUN, SIWALAN, PEKALONGAN, JAWA TENGAH",1,170,15,185
https://kawalpemilu.org#35088,"KURIPAN, WATUMALANG, WONOSOBO, JAWA TENGAH",4,165,13,178
https://kawalpemilu.org#35893,"GESIKAN, GANTIWARNO, KLATEN, JAWA TENGAH",1,115,43,158
https://kawalpemilu.org#32863,"NEGARAJATI, CIMANGGU, CILACAP, JAWA TENGAH",6,105,43,148
https://kawalpemilu.org#39027,"GETAS, WONOSALAM, DEMAK, JAWA TENGAH",12,147,54,201
https://kawalpemilu.org#37964,"RINGIN, PAMOTAN, REMBANG, JAWA TENGAH",1,98,68,166
https://kawalpemilu.org#41665,"PETERONGAN, SEMARANG SELATAN, KOTA SEMARANG, JAWA TENGAH",9,216,44,183
https://kawalpemilu.org#36999,"DONOYUDAN, KALIJAMBE, SRAGEN, JAWA TENGAH",14,150,60,210
https://kawalpemilu.org#40984,"KEDUNGBANTENG, KEDUNGBANTENG, TEGAL, JAWA TENGAH",15,141,53,194
https://kawalpemilu.org#41135,"JATIMULYA, SURADADI, TEGAL, JAWA TENGAH",9,160,33,193
https://kawalpemilu.org#40794,"KLAREYAN, PETARUKAN, PEMALANG, JAWA TENGAH",39,0,0,0
https://kawalpemilu.org#33025,"MENGANTI, RAWALO, BANYUMAS, JAWA TENGAH",8,128,34,162
https://kawalpemilu.org#40291,"KARANGGENENG, KANDEMAN, BATANG, JAWA TENGAH",6,176,38,214
https://kawalpemilu.org#38122,"GEDONGMULYO, LASEM, REMBANG, JAWA TENGAH",11,146,43,189
https://kawalpemilu.org#41325,"PEMARON, BREBES, BREBES, JAWA TENGAH",1,79,96,175
https://kawalpemilu.org#41295,"KLAMPOK, WANASARI, BREBES, JAWA TENGAH",14,185,18,203
https://kawalpemilu.org#39200,"TEGALREJO, TENGARAN, SEMARANG, JAWA TENGAH",4,138,75,213
https://kawalpemilu.org#41833,"PESURUNGAN KIDUL, TEGAL BARAT, KOTA TEGAL, JAWA TENGAH",3,134,56,190
https://kawalpemilu.org#33493,"TLAGAYASA, BOBOTSARI, PURBALINGGA, JAWA TENGAH",6,140,66,206
https://kawalpemilu.org#40929,"BALAPULANG WETAN, BALAPULANG, TEGAL, JAWA TENGAH",7,162,66,228
https://kawalpemilu.org#33250,"LEDUG, KEMBARAN, BANYUMAS, JAWA TENGAH",7,150,57,207
https://kawalpemilu.org#34677,"SUMBERSARI, BUTUH, PURWOREJO, JAWA TENGAH",1,65,39,104
https://kawalpemilu.org#41673,"JOMBLANG, CANDISARI, KOTA SEMARANG, JAWA TENGAH",45,195,39,234
https://kawalpemilu.org#37247,"MOJOAGUNG, KARANGRAYUNG, GROBOGAN, JAWA TENGAH",17,168,18,186
https://kawalpemilu.org#36729,"GONDANGSARI, JATISRONO, WONOGIRI, JAWA TENGAH",13,146,21,167
https://kawalpemilu.org#40283,"BAKALAN, KANDEMAN, BATANG, JAWA TENGAH",6,219,20,239
https://kawalpemilu.org#39532,"SAMIRANAN, KANDANGAN, TEMANGGUNG, JAWA TENGAH",7,182,25,207
https://kawalpemilu.org#40020,"KEDUNGSARI, RINGINARUM, KENDAL, JAWA TENGAH",4,192,17,209
https://kawalpemilu.org#41230,"PAKUJATI, PAGUYANGAN, BREBES, JAWA TENGAH",10,128,57,185
https://kawalpemilu.org#34326,"GUNUNGSARI, KARANGGAYAM, KEBUMEN, JAWA TENGAH",11,85,27,112
https://kawalpemilu.org#35187,"NGADIREJO, SALAMAN, MAGELANG, JAWA TENGAH",9,152,43,195
https://kawalpemilu.org#40049,"MAGELUNG, KALIWUNGU SELATAN, KENDAL, JAWA TENGAH",10,175,24,199
https://kawalpemilu.org#34055,"SINGOSARI, AMBAL, KEBUMEN, JAWA TENGAH",3,153,58,211
https://kawalpemilu.org#39159,"MUTIH WETAN, WEDUNG, DEMAK, JAWA TENGAH",4,101,44,145
https://kawalpemilu.org#33028,"TAMBAKNEGARA, RAWALO, BANYUMAS, JAWA TENGAH",14,145,45,190
https://kawalpemilu.org#35940,"BENDUNGAN, CAWAS, KLATEN, JAWA TENGAH",3,109,35,144
https://kawalpemilu.org#32741,"PAGUBUGAN KULON, BINANGUN, CILACAP, JAWA TENGAH",8,154,44,198
https://kawalpemilu.org#32874,"PAHONJEAN, MAJENANG, CILACAP, JAWA TENGAH",25,123,61,184
https://kawalpemilu.org#34573,"MRANTI, PURWOREJO, PURWOREJO, JAWA TENGAH",4,142,34,176
https://kawalpemilu.org#39137,"TRIDONOREJO, BONANG, DEMAK, JAWA TENGAH",16,0,0,0
https://kawalpemilu.org#37676,"TAMANREJO, TUNJUNGAN, BLORA, JAWA TENGAH",1,121,74,195
https://kawalpemilu.org#34402,"BAKUREJO, GRABAG, PURWOREJO, JAWA TENGAH",2,102,14,116
https://kawalpemilu.org#38833,"KELING, KELING, JEPARA, JAWA TENGAH",19,159,8,167
https://kawalpemilu.org#34920,"GONDOWULAN, KEPIL, WONOSOBO, JAWA TENGAH",1,75,53,128
https://kawalpemilu.org#38854,"TAHUNAN, TAHUNAN, JEPARA, JAWA TENGAH",31,205,28,233
https://kawalpemilu.org#38984,"BEDONO, SAYUNG, DEMAK, JAWA TENGAH",8,197,29,226
https://kawalpemilu.org#38475,"NGEMPLAK LOR, MARGOYOSO, PATI, JAWA TENGAH",4,108,41,149
https://kawalpemilu.org#34836,"SALAM, GEBANG, PURWOREJO, JAWA TENGAH",2,95,16,111
https://kawalpemilu.org#37060,"PLOSOREJO, GONDANG, SRAGEN, JAWA TENGAH",10,141,16,157
https://kawalpemilu.org#38735,"LEBUAWU, PECANGAAN, JEPARA, JAWA TENGAH",5,137,56,193
https://kawalpemilu.org#41021,"KALISAPU, SLAWI, TEGAL, JAWA TENGAH",3,94,124,218
https://kawalpemilu.org#39485,"PURWOREJO, TEMANGGUNG, TEMANGGUNG, JAWA TENGAH",6,147,35,182
https://kawalpemilu.org#39009,"WONOAGUNG, KARANGTENGAH, DEMAK, JAWA TENGAH",1,158,41,199
https://kawalpemilu.org#33756,"KANDANGWANGI, WANADADI, BANJARNEGARA, JAWA TENGAH",11,162,47,209
https://kawalpemilu.org#41576,"TEGALREJO, ARGOMULYO, KOTA SALATIGA, JAWA TENGAH",35,143,90,233
https://kawalpemilu.org#33053,"NUSAMANGIR, KEMRANJEN, BANYUMAS, JAWA TENGAH",4,119,47,166
https://kawalpemilu.org#84931,"PANULISAN TIMUR, DAYEUHLUHUR, CILACAP, JAWA TENGAH",11,119,22,141
https://kawalpemilu.org#33684,"KUTABANJARNEGARA, BANJARNEGARA, BANJARNEGARA, JAWA TENGAH",24,96,124,220
https://kawalpemilu.org#33511,"LUMPANG, KARANGANYAR, PURBALINGGA, JAWA TENGAH",5,130,53,183
https://kawalpemilu.org#35965,"SAJEN, TRUCUK, KLATEN, JAWA TENGAH",1,153,37,190
https://kawalpemilu.org#87464,"DAYEUHLUHUR, DAYEUHLUHUR, CILACAP, JAWA TENGAH",17,136,53,189
https://kawalpemilu.org#33537,"LOSARI, REMBANG, PURBALINGGA, JAWA TENGAH",20,82,48,130
https://kawalpemilu.org#37848,"SENDANGMULYO, BULU, REMBANG, JAWA TENGAH",6,175,7,182
https://kawalpemilu.org#87453,"BANTAR, WANAREJA, CILACAP, JAWA TENGAH",4,114,88,202
https://kawalpemilu.org#37903,"BABAKTULUNG, SARANG, REMBANG, JAWA TENGAH",8,102,54,156
https://kawalpemilu.org#39362,"GONDORIYO, BERGAS, SEMARANG, JAWA TENGAH",4,203,23,226
https://kawalpemilu.org#35592,"NGARGOSARI, AMPEL, BOYOLALI, JAWA TENGAH",5,159,26,185
https://kawalpemilu.org#36440,"GENTAN, BAKI, SUKOHARJO, JAWA TENGAH",17,177,69,246
https://kawalpemilu.org#36945,"KEBAK, KEBAKKRAMAT, KARANGANYAR, JAWA TENGAH",8,77,33,110
https://kawalpemilu.org#33681,"PARAKANCANGGAH, BANJARNEGARA, BANJARNEGARA, JAWA TENGAH",19,163,89,252
https://kawalpemilu.org#35967,"KRADENAN, TRUCUK, KLATEN, JAWA TENGAH",11,139,65,204
https://kawalpemilu.org#41769,"WONOSARI, NGALIYAN, KOTA SEMARANG, JAWA TENGAH",37,112,76,188
https://kawalpemilu.org#87476,"SERANG, CIPARI, CILACAP, JAWA TENGAH",3,118,58,176
https://kawalpemilu.org#35132,"MENJER, GARUNG, WONOSOBO, JAWA TENGAH",3,167,36,203
https://kawalpemilu.org#41524,"SEMANGGI, PASAR KLIWON, KOTA SURAKARTA, JAWA TENGAH",61,181,54,235
https://kawalpemilu.org#41620,"REJOSARI, SEMARANG TIMUR, KOTA SEMARANG, JAWA TENGAH",19,165,45,210
https://kawalpemilu.org#48619,"KAPAS, KAPAS, BOJONEGORO, JAWA TIMUR",1,87,77,164
https://kawalpemilu.org#42947,"SUMBER BENING, DONGKO, TRENGGALEK, JAWA TIMUR",13,187,22,209
https://kawalpemilu.org#48632,"MOJOKAMPUNG, BOJONEGORO, BOJONEGORO, JAWA TIMUR",11,104,90,194
https://kawalpemilu.org#51432,"TAMBAKREJO, SIMOKERTO, KOTA SURABAYA, JAWA TIMUR",5,103,42,145
https://kawalpemilu.org#43235,"SUMBERINGIN KULON, NGUNUT, TULUNGAGUNG, JAWA TIMUR",2,151,32,183
https://kawalpemilu.org#89586,"GADUNGAN, WATES, KEDIRI, JAWA TIMUR",1,187,17,204
https://kawalpemilu.org#44973,"BENCULUK, CLURING, BANYUWANGI, JAWA TIMUR",27,170,37,207
https://kawalpemilu.org#45915,"PURUT, LUMBANG, PROBOLINGGO, JAWA TIMUR",15,104,80,184
https://kawalpemilu.org#44593,"KALIBOTO LOR, JATIROTO, LUMAJANG, JAWA TIMUR",30,94,49,143
https://kawalpemilu.org#48015,"PANDEAN, MAOSPATI, MAGETAN, JAWA TIMUR",5,178,56,234
https://kawalpemilu.org#48361,"SUMBERARUM, NGRAHO, BOJONEGORO, JAWA TIMUR",7,144,22,166
https://kawalpemilu.org#42590,"GUNDIK, SLAHUNG, PONOROGO, JAWA TIMUR",6,159,63,222
https://kawalpemilu.org#44625,"TEGALBANGSRI, RANUYOSO, LUMAJANG, JAWA TIMUR",1,87,129,216
https://kawalpemilu.org#48244,"GENTONG, PARON, NGAWI, JAWA TIMUR",4,117,89,206
https://kawalpemilu.org#42635,"CAMPURSARI, SAMBIT, PONOROGO, JAWA TIMUR",4,143,58,201
https://kawalpemilu.org#50005,"LEBAK, SANGKAPURA, GRESIK, JAWA TIMUR",11,53,88,141
https://kawalpemilu.org#44663,"SUMBERAGUNG, SUMBERBARU, JEMBER, JAWA TIMUR",30,120,54,174
https://kawalpemilu.org#51270,"KARANGKETUG, GADINGREJO, KOTA PASURUAN, JAWA TIMUR",1,109,83,192
https://kawalpemilu.org#43076,"BAGO, TULUNGAGUNG, TULUNGAGUNG, JAWA TIMUR",24,155,57,212
https://kawalpemilu.org#47573,"MUSIR LOR, REJOSO, NGANJUK, JAWA TIMUR",2,136,37,173
https://kawalpemilu.org#51214,"TANJUNGREJO, SUKUN, KOTA MALANG, JAWA TIMUR",71,209,36,245
https://kawalpemilu.org#50779,"POTERAN, TALANGO, SUMENEP, JAWA TIMUR",11,68,67,135
https://kawalpemilu.org#48162,"SIDOREJO, KENDAL, NGAWI, JAWA TIMUR",4,143,13,156
https://kawalpemilu.org#44844,"PATEMON, PAKUSARI, JEMBER, JAWA TIMUR",4,116,77,193
https://kawalpemilu.org#50341,"BUNDAH, SRESEH, SAMPANG, JAWA TIMUR",6,58,130,188
https://kawalpemilu.org#50777,"ESSANG, TALANGO, SUMENEP, JAWA TIMUR",3,111,48,159
https://kawalpemilu.org#46784,"PUNGGING, PUNGGING, MOJOKERTO, JAWA TIMUR",23,158,36,194
https://kawalpemilu.org#46451,"SIDOKARE, SIDOARJO, SIDOARJO, JAWA TIMUR",35,145,91,236
https://kawalpemilu.org#44739,"LOJEJER, WULUHAN, JEMBER, JAWA TIMUR",29,139,51,190
https://kawalpemilu.org#49096,"NGRAYUNG, PLUMPANG, TUBAN, JAWA TIMUR",3,140,57,197
https://kawalpemilu.org#42525,"NGLARAN, TULAKAN, PACITAN, JAWA TIMUR",2,35,140,175
https://kawalpemilu.org#50620,"RANGPERANG DAJA, PROPPO, PAMEKASAN, JAWA TIMUR",4,8,185,193
https://kawalpemilu.org#46051,"KALIREJO, SUKOREJO, PASURUAN, JAWA TIMUR",11,147,101,248
https://kawalpemilu.org#50547,"BUKEK, TLANAKAN, PAMEKASAN, JAWA TIMUR",1,0,0,0
https://kawalpemilu.org#44224,"KEMANTREN, JABUNG, MALANG, JAWA TIMUR",1,60,94,154
https://kawalpemilu.org#49332,"BLUMBANG, MADURAN, LAMONGAN, JAWA TIMUR",1,77,35,112
https://kawalpemilu.org#48263,"KEDUNGGALAR, KEDUNGGALAR, NGAWI, JAWA TIMUR",28,130,60,190
https://kawalpemilu.org#50646,"PLAK PAK, PEGANTENAN, PAMEKASAN, JAWA TIMUR",6,7,206,213
https://kawalpemilu.org#47680,"KAIBON, GEGER, MADIUN, JAWA TIMUR",11,152,42,194
https://kawalpemilu.org#44324,"SIDOLUHUR, LAWANG, MALANG, JAWA TIMUR",19,132,30,162
https://kawalpemilu.org#51425,"KAPASMADYA BARU, TAMBAKSARI, KOTA SURABAYA, JAWA TIMUR",25,147,62,209
https://kawalpemilu.org#49295,"TITIK, SEKARAN, LAMONGAN, JAWA TIMUR",1,73,30,103
https://kawalpemilu.org#43657,"TAMBIBENDO, MOJO, KEDIRI, JAWA TIMUR",11,127,37,164
https://kawalpemilu.org#50016,"DAUN, SANGKAPURA, GRESIK, JAWA TIMUR",14,93,86,194
https://kawalpemilu.org#49083,"SUMURGUNG, TUBAN, TUBAN, JAWA TIMUR",24,77,74,151
https://kawalpemilu.org#45234,"PETUNG, CURAHDAMI, BONDOWOSO, JAWA TIMUR",2,61,126,187
https://kawalpemilu.org#45436,"KETAH, SUBOH, SITUBONDO, JAWA TIMUR",5,124,57,181
https://kawalpemilu.org#47975,"TINAP, SUKOMORO, MAGETAN, JAWA TIMUR",12,95,50,145
https://kawalpemilu.org#48440,"WEDORO, SUGIHWARAS, BOJONEGORO, JAWA TIMUR",1,103,85,188
https://kawalpemilu.org#46556,"SEKETI, BALONGBENDO, SIDOARJO, JAWA TIMUR",2,206,26,232
https://kawalpemilu.org#51206,"ARJOWINANGUN, KEDUNGKANDANG, KOTA MALANG, JAWA TIMUR",10,143,96,239
https://kawalpemilu.org#44475,"SUKOSARI, KUNIR, LUMAJANG, JAWA TIMUR",6,138,70,208
https://kawalpemilu.org#45530,"WONOREJO, BANYUPUTIH, SITUBONDO, JAWA TIMUR",6,133,20,153
https://kawalpemilu.org#50473,"NEPA, BANYUATES, SAMPANG, JAWA TIMUR",10,13,165,178
https://kawalpemilu.org#43524,"SUMBERAGUNG, PANGGUNGREJO, BLITAR, JAWA TIMUR",2,105,48,153
https://kawalpemilu.org#50889,"AENGPANAS, PRAGAAN, SUMENEP, JAWA TIMUR",9,48,141,189
https://kawalpemilu.org#43106,"RINGINPITU, KEDUNGWARU, TULUNGAGUNG, JAWA TIMUR",19,193,22,215
https://kawalpemilu.org#44332,"KETINDAN, LAWANG, MALANG, JAWA TIMUR",11,143,69,212
https://kawalpemilu.org#51212,"BANDUNGREJOSARI, SUKUN, KOTA MALANG, JAWA TIMUR",39,130,59,189
https://kawalpemilu.org#46930,"BERATWETAN, GEDEG, MOJOKERTO, JAWA TIMUR",2,161,45,206
https://kawalpemilu.org#51308,"KRANGGAN, KRANGGAN, KOTA MOJOKERTO, JAWA TIMUR",15,140,66,206
https://kawalpemilu.org#87494,"KEBONSARI KULON, KANIGARAN, KOTA PROBOLINGGO, JAWA TIMUR",5,120,108,228
https://kawalpemilu.org#46211,"GROGOL, GONDANGWETAN, PASURUAN, JAWA TIMUR",5,192,43,235
https://kawalpemilu.org#47645,"REJOSARI, KEBONSARI, MADIUN, JAWA TIMUR",2,102,40,142
https://kawalpemilu.org#45058,"DADAPAN, KABAT, BANYUWANGI, JAWA TIMUR",9,145,83,228
https://kawalpemilu.org#49873,"SUKO ANYAR, CERME, GRESIK, JAWA TIMUR",2,96,79,175
https://kawalpemilu.org#45757,"KANDANGJATI KULON, KRAKSAAN, PROBOLINGGO, JAWA TIMUR",4,146,55,201
https://kawalpemilu.org#51405,"MOJO, GUBENG, KOTA SURABAYA, JAWA TIMUR",16,137,39,176
https://kawalpemilu.org#43885,"TERTEK, PARE, KEDIRI, JAWA TIMUR",31,125,66,191
https://kawalpemilu.org#46666,"TAMBAKSAWAH, WARU, SIDOARJO, JAWA TIMUR",7,173,49,222
https://kawalpemilu.org#46648,"TAMBAKCEMANDI, SEDATI, SIDOARJO, JAWA TIMUR",5,174,46,220
https://kawalpemilu.org#50134,"TENGGUN DAJAH, KLAMPIS, BANGKALAN, JAWA TIMUR",10,75,129,204
https://kawalpemilu.org#49601,"LALADAN, DEKET, LAMONGAN, JAWA TIMUR",3,105,42,147
https://kawalpemilu.org#43979,"KARANGREJO, NGASEM, KEDIRI, JAWA TIMUR",30,131,57,188
https://kawalpemilu.org#47435,"KALORAN, NGRONGGOT, NGANJUK, JAWA TIMUR",6,148,19,167
https://kawalpemilu.org#49207,"GIRIK, NGIMBANG, LAMONGAN, JAWA TIMUR",1,154,31,185
https://kawalpemilu.org#45471,"MIMBAAN, PANJI, SITUBONDO, JAWA TIMUR",13,87,66,153
https://kawalpemilu.org#42919,"NGULUNGWETAN, MUNJUNGAN, TRENGGALEK, JAWA TIMUR",7,173,18,191
https://kawalpemilu.org#48921,"GEMULUNG, KEREK, TUBAN, JAWA TIMUR",5,142,16,158
https://kawalpemilu.org#51374,"PENJARINGAN SARI, RUNGKUT, KOTA SURABAYA, JAWA TIMUR",32,134,103,237
https://kawalpemilu.org#45225,"DAWUHAN, GRUJUGAN, BONDOWOSO, JAWA TIMUR",1,57,139,196
https://kawalpemilu.org#45505,"JATISARI, ARJASA, SITUBONDO, JAWA TIMUR",25,102,32,134
https://kawalpemilu.org#44298,"AMPELDENTO, KARANGPLOSO, MALANG, JAWA TIMUR",2,146,77,223
https://kawalpemilu.org#48706,"KUNIRAN, PURWOSARI, BOJONEGORO, JAWA TIMUR",13,152,50,202
https://kawalpemilu.org#43572,"TANGKIL, WLINGI, BLITAR, JAWA TIMUR",10,97,59,156
https://kawalpemilu.org#46567,"TAMAN, TAMAN, SIDOARJO, JAWA TIMUR",10,118,58,176
https://kawalpemilu.org#44808,"JEMBERKIDUL, KALIWATES, JEMBER, JAWA TIMUR",55,114,58,172
https://kawalpemilu.org#43608,"WATES, WATES, BLITAR, JAWA TIMUR",10,126,53,179
https://kawalpemilu.org#51422,"PACARKEMBANG, TAMBAKSARI, KOTA SURABAYA, JAWA TIMUR",112,92,65,157
https://kawalpemilu.org#48772,"SUKOSEWU, SUKOSEWU, BOJONEGORO, JAWA TIMUR",7,128,94,222
https://kawalpemilu.org#51204,"MADYOPURO, KEDUNGKANDANG, KOTA MALANG, JAWA TIMUR",23,84,105,189
https://kawalpemilu.org#43456,"GLEDUG, SANANKULON, BLITAR, JAWA TIMUR",5,127,21,148
https://kawalpemilu.org#51407,"KERTAJAYA, GUBENG, KOTA SURABAYA, JAWA TIMUR",42,133,59,192
https://kawalpemilu.org#44818,"PATRANG, PATRANG, JEMBER, JAWA TIMUR",31,123,86,209
https://kawalpemilu.org#45403,"BOTOLINGGO, BOTOLINGGO, BONDOWOSO, JAWA TIMUR",7,64,105,169
https://kawalpemilu.org#43201,"BENDUNGAN, GONDANG, TULUNGAGUNG, JAWA TIMUR",8,136,35,171
https://kawalpemilu.org#51380,"NGAGEL, WONOKROMO, KOTA SURABAYA, JAWA TIMUR",7,177,29,206
https://kawalpemilu.org#47129,"PANDANWANGI, DIWEK, JOMBANG, JAWA TIMUR",7,124,54,178
https://kawalpemilu.org#51325,"KEDUNDUNG, MAGERSARI, KOTA MOJOKERTO, JAWA TIMUR",44,116,76,192
https://kawalpemilu.org#44295,"KEPUHARJO, KARANGPLOSO, MALANG, JAWA TIMUR",12,163,79,242
https://kawalpemilu.org#44721,"TUGUSARI, BANGSALSARI, JEMBER, JAWA TIMUR",21,84,121,205
https://kawalpemilu.org#44755,"NOGOSARI, RAMBIPUJI, JEMBER, JAWA TIMUR",51,170,26,196
https://kawalpemilu.org#44371,"SEGARAN, GEDANGAN, MALANG, JAWA TIMUR",6,171,45,216
https://kawalpemilu.org#45954,"BANJARIMBO, LUMBANG, PASURUAN, JAWA TIMUR",5,170,29,199
https://kawalpemilu.org#46879,"SUMOLAWANG, PURI, MOJOKERTO, JAWA TIMUR",3,96,87,183
https://kawalpemilu.org#46710,"WONOPLOSO, GONDANG, MOJOKERTO, JAWA TIMUR",8,157,51,208
https://kawalpemilu.org#43992,"BLARU, BADAS, KEDIRI, JAWA TIMUR",12,130,37,167
https://kawalpemilu.org#43382,"SUKOREJO, UDANAWU, BLITAR, JAWA TIMUR",6,128,37,165
https://kawalpemilu.org#44587,"BANDARAN, KEDUNGJAJANG, LUMAJANG, JAWA TIMUR",2,98,82,180
