https://kawalpemilu.org#45603,"KARANGANYAR, BANTARAN, PROBOLINGGO, JAWA TIMUR",8,71,79,150
https://kawalpemilu.org#51055,"KALISANGKA, ARJASA, SUMENEP, JAWA TIMUR",11,44,110,154
https://kawalpemilu.org#42767,"SOMOROTO, KAUMAN, PONOROGO, JAWA TIMUR",7,107,90,197
https://kawalpemilu.org#47254,"KABUH, KABUH, JOMBANG, JAWA TIMUR",1,161,44,205
https://kawalpemilu.org#46909,"JAPAN, SOOKO, MOJOKERTO, JAWA TIMUR",15,180,46,226
https://kawalpemilu.org#44699,"PONDOKDALEM, SEMBORO, JEMBER, JAWA TIMUR",12,80,50,130
https://kawalpemilu.org#46747,"PENANGUNGAN, TRAWAS, MOJOKERTO, JAWA TIMUR",1,217,39,256
https://kawalpemilu.org#45883,"TUNGGAKCERME, WONOMERTO, PROBOLINGGO, JAWA TIMUR",3,101,59,160
https://kawalpemilu.org#44098,"WAJAK, WAJAK, MALANG, JAWA TIMUR",32,129,34,163
https://kawalpemilu.org#47012,"PLOSOGENUK, PERAK, JOMBANG, JAWA TIMUR",11,172,30,202
https://kawalpemilu.org#45934,"KAYU KEBEK, TUTUR, PASURUAN, JAWA TIMUR",7,139,78,217
https://kawalpemilu.org#44636,"KEBONSARI, SUMBERSUKO, LUMAJANG, JAWA TIMUR",12,133,69,202
https://kawalpemilu.org#50012,"SUNGAI RUJING, SANGKAPURA, GRESIK, JAWA TIMUR",3,47,122,169
https://kawalpemilu.org#50731,"DEMPO BARAT, PASEAN, PAMEKASAN, JAWA TIMUR",16,4,130,134
https://kawalpemilu.org#42436,"KAYEN, PACITAN, PACITAN, JAWA TIMUR",3,41,184,225
https://kawalpemilu.org#44226,"GUNUNG JATI, JABUNG, MALANG, JAWA TIMUR",4,115,21,136
https://kawalpemilu.org#48767,"KANDANGAN, TRUCUK, BOJONEGORO, JAWA TIMUR",2,123,84,207
https://kawalpemilu.org#44792,"WIROWONGSO, AJUNG, JEMBER, JAWA TIMUR",7,102,87,189
https://kawalpemilu.org#48221,"PACING, PADAS, NGAWI, JAWA TIMUR",1,150,60,210
https://kawalpemilu.org#49221,"GENDONG KULON, BABAT, LAMONGAN, JAWA TIMUR",12,165,52,217
https://kawalpemilu.org#43937,"BANYAKAN, BANYAKAN, KEDIRI, JAWA TIMUR",7,142,71,213
https://kawalpemilu.org#45174,"SUMBERSARI, MAESAN, BONDOWOSO, JAWA TIMUR",22,48,108,156
https://kawalpemilu.org#44808,"JEMBERKIDUL, KALIWATES, JEMBER, JAWA TIMUR",45,111,40,151
https://kawalpemilu.org#46915,"NGINGASREMBYONG, SOOKO, MOJOKERTO, JAWA TIMUR",9,169,48,217
https://kawalpemilu.org#44708,"PUGERKULON, PUGER, JEMBER, JAWA TIMUR",42,87,69,156
https://kawalpemilu.org#44335,"BENDOSARI, PUJON, MALANG, JAWA TIMUR",3,198,35,233
https://kawalpemilu.org#48523,"KARANGDAYU, BAURENO, BOJONEGORO, JAWA TIMUR",3,148,103,251
https://kawalpemilu.org#43366,"WONODADI, WONODADI, BLITAR, JAWA TIMUR",27,123,26,149
https://kawalpemilu.org#44758,"KALIWINING, RAMBIPUJI, JEMBER, JAWA TIMUR",41,121,34,155
https://kawalpemilu.org#46286,"KAWIS REJO, REJOSO, PASURUAN, JAWA TIMUR",7,160,69,229
https://kawalpemilu.org#43429,"TUMPAKKEPUH, BAKUNG, BLITAR, JAWA TIMUR",10,98,0,98
https://kawalpemilu.org#51004,"PALOLOAN, GAPURA, SUMENEP, JAWA TIMUR",2,111,54,165
https://kawalpemilu.org#51188,"SUKOHARJO, KLOJEN, KOTA MALANG, JAWA TIMUR",11,162,5,167
https://kawalpemilu.org#44822,"SUMBERSARI, SUMBERSARI, JEMBER, JAWA TIMUR",66,133,90,223
https://kawalpemilu.org#48361,"SUMBERARUM, NGRAHO, BOJONEGORO, JAWA TIMUR",1,148,32,180
https://kawalpemilu.org#46007,"PATEBON, KEJAYAN, PASURUAN, JAWA TIMUR",6,127,120,247
https://kawalpemilu.org#50709,"BATU BINTANG, BATUMARMAR, PAMEKASAN, JAWA TIMUR",9,45,168,213
https://kawalpemilu.org#47430,"JUWET, NGRONGGOT, NGANJUK, JAWA TIMUR",15,176,18,194
https://kawalpemilu.org#44939,"GRAJAGAN, PURWOHARJO, BANYUWANGI, JAWA TIMUR",2,121,77,198
https://kawalpemilu.org#46654,"SEDATIGEDE, SEDATI, SIDOARJO, JAWA TIMUR",24,146,59,205
https://kawalpemilu.org#45606,"TIGASAN WETAN, LECES, PROBOLINGGO, JAWA TIMUR",1,161,100,261
https://kawalpemilu.org#50628,"PANGBATOK, PROPPO, PAMEKASAN, JAWA TIMUR",4,3,251,254
https://kawalpemilu.org#43637,"PUHSARANG, SEMEN, KEDIRI, JAWA TIMUR",4,162,8,170
https://kawalpemilu.org#49955,"GIRI, KEBOMAS, GRESIK, JAWA TIMUR",1,122,101,223
https://kawalpemilu.org#46768,"BANDARASRI, NGORO, MOJOKERTO, JAWA TIMUR",2,157,55,212
https://kawalpemilu.org#47423,"SUGIHWARAS, PRAMBON, NGANJUK, JAWA TIMUR",17,137,23,160
https://kawalpemilu.org#47429,"TANJUNGKALANG, NGRONGGOT, NGANJUK, JAWA TIMUR",24,179,23,202
https://kawalpemilu.org#45995,"WRATI, KEJAYAN, PASURUAN, JAWA TIMUR",3,121,94,215
https://kawalpemilu.org#50369,"TAMAN SAREH, SAMPANG, SAMPANG, JAWA TIMUR",8,6,178,184
https://kawalpemilu.org#43769,"BANGKOK, GURAH, KEDIRI, JAWA TIMUR",10,143,38,181
https://kawalpemilu.org#45869,"POHSANGITLERES, SUMBERASIH, PROBOLINGGO, JAWA TIMUR",6,149,49,198
https://kawalpemilu.org#44320,"RANDUANGUNG, SINGOSARI, MALANG, JAWA TIMUR",9,152,72,224
https://kawalpemilu.org#47807,"KLUMUTAN, SARADAN, MADIUN, JAWA TIMUR",19,128,41,169
https://kawalpemilu.org#48984,"JEGULO, SOKO, TUBAN, JAWA TIMUR",14,169,34,203
https://kawalpemilu.org#46479,"GELANG, TULANGAN, SIDOARJO, JAWA TIMUR",9,167,54,221
https://kawalpemilu.org#43924,"KUWIK, KUNJANG, KEDIRI, JAWA TIMUR",15,162,26,188
https://kawalpemilu.org#46096,"WONOSUNYO, GEMPOL, PASURUAN, JAWA TIMUR",2,229,35,264
https://kawalpemilu.org#43721,"SUMBERAGUNG, WATES, KEDIRI, JAWA TIMUR",2,111,27,138
https://kawalpemilu.org#45412,"JATIBANTENG, JATIBANTENG, SITUBONDO, JAWA TIMUR",2,62,99,161
https://kawalpemilu.org#47618,"NGEPUNG, LENGKONG, NGANJUK, JAWA TIMUR",2,137,39,176
https://kawalpemilu.org#47952,"BULUHARJO, PLAOSAN, MAGETAN, JAWA TIMUR",9,86,108,194
https://kawalpemilu.org#47930,"TAWANGANOM, MAGETAN, MAGETAN, JAWA TIMUR",17,123,106,229
https://kawalpemilu.org#48056,"KUWON, KARAS, MAGETAN, JAWA TIMUR",12,98,27,125
https://kawalpemilu.org#45267,"PELALANGAN, WONOSARI, BONDOWOSO, JAWA TIMUR",8,49,58,107
https://kawalpemilu.org#44442,"KLOPOSAWIT, CANDIPURO, LUMAJANG, JAWA TIMUR",14,152,39,191
https://kawalpemilu.org#89584,"DUWET, WATES, KEDIRI, JAWA TIMUR",15,224,21,245
https://kawalpemilu.org#43010,"NGRAYUNG, GANDUSARI, TRENGGALEK, JAWA TIMUR",12,179,21,200
https://kawalpemilu.org#45405,"SUMBER CANTING, BOTOLINGGO, BONDOWOSO, JAWA TIMUR",2,19,147,166
https://kawalpemilu.org#49148,"GESIKAN, GRABAGAN, TUBAN, JAWA TIMUR",9,163,20,183
https://kawalpemilu.org#50696,"WARU TIMUR, WARU, PAMEKASAN, JAWA TIMUR",40,5,232,237
https://kawalpemilu.org#45249,"KONCER KIDUL, TENGGARANG, BONDOWOSO, JAWA TIMUR",13,91,62,153
https://kawalpemilu.org#43540,"JAJAR, TALUN, BLITAR, JAWA TIMUR",8,125,14,139
https://kawalpemilu.org#44052,"POJOK, DAMPIT, MALANG, JAWA TIMUR",5,147,17,164
https://kawalpemilu.org#44740,"AMPEL, WULUHAN, JEMBER, JAWA TIMUR",34,151,18,169
https://kawalpemilu.org#46736,"SUMBERKEMBAR, PACET, MOJOKERTO, JAWA TIMUR",6,172,51,223
https://kawalpemilu.org#50395,"RAPALAOK, OMBEN, SAMPANG, JAWA TIMUR",7,24,258,282
https://kawalpemilu.org#48358,"TAPELAN, NGRAHO, BOJONEGORO, JAWA TIMUR",10,97,29,126
https://kawalpemilu.org#44423,"TEMPURSARI, TEMPURSARI, LUMAJANG, JAWA TIMUR",28,184,4,188
https://kawalpemilu.org#48396,"SENDANGHARJO, NGASEM, BOJONEGORO, JAWA TIMUR",1,117,60,177
https://kawalpemilu.org#50791,"LOBUK, BLUTO, SUMENEP, JAWA TIMUR",13,27,146,173
https://kawalpemilu.org#51431,"SIMOLAWANG, SIMOKERTO, KOTA SURABAYA, JAWA TIMUR",41,60,106,172
https://kawalpemilu.org#47371,"TANJUNGREJO, LOCERET, NGANJUK, JAWA TIMUR",12,157,44,201
https://kawalpemilu.org#43268,"REJOTANGAN, REJOTANGAN, TULUNGAGUNG, JAWA TIMUR",26,78,52,130
https://kawalpemilu.org#47943,"NGANCAR, PLAOSAN, MAGETAN, JAWA TIMUR",5,110,86,196
https://kawalpemilu.org#50414,"BANYUKAPAH, KEDUNGDUNG, SAMPANG, JAWA TIMUR",8,136,108,244
https://kawalpemilu.org#48224,"SAMBIROTO, PADAS, NGAWI, JAWA TIMUR",3,177,69,246
https://kawalpemilu.org#45655,"BERMI, KRUCIL, PROBOLINGGO, JAWA TIMUR",9,138,40,178
https://kawalpemilu.org#51135,"BLABAK, PESANTREN, KOTA KEDIRI, JAWA TIMUR",18,155,18,173
https://kawalpemilu.org#84949,"TUNGE, WATES, KEDIRI, JAWA TIMUR",1,167,18,185
https://kawalpemilu.org#43633,"SIDOMULYO, SEMEN, KEDIRI, JAWA TIMUR",12,165,15,180
https://kawalpemilu.org#45108,"SIDODADI, WONGSOREJO, BANYUWANGI, JAWA TIMUR",6,136,98,234
https://kawalpemilu.org#46568,"GELURAN, TAMAN, SIDOARJO, JAWA TIMUR",11,174,65,239
https://kawalpemilu.org#46630,"TEBEL, GEDANGAN, SIDOARJO, JAWA TIMUR",33,137,70,207
https://kawalpemilu.org#44939,"GRAJAGAN, PURWOHARJO, BANYUWANGI, JAWA TIMUR",6,163,22,185
https://kawalpemilu.org#58473,"SIMPANG EMPAT, TANGARAN, SAMBAS, KALIMANTAN BARAT",2,100,77,177
https://kawalpemilu.org#58860,"BATU MAS, NANGA TAYAP, KETAPANG, KALIMANTAN BARAT",5,151,8,159
https://kawalpemilu.org#59053,"BALAI HARAPAN, TEMPUNAK, SINTANG, KALIMANTAN BARAT",2,191,54,245
https://kawalpemilu.org#58713,"BULU BALA, BALAI, SANGGAU, KALIMANTAN BARAT",3,163,16,179
https://kawalpemilu.org#60188,"KOTA BARU, PONTIANAK SELATAN, KOTA PONTIANAK, KALIMANTAN BARAT",54,80,124,204
https://kawalpemilu.org#58726,"MELIAU HULU, MELIAU, SANGGAU, KALIMANTAN BARAT",2,39,120,159
https://kawalpemilu.org#59246,"SAWANG SENGHIANG, SERAWAI, SINTANG, KALIMANTAN BARAT",3,82,10,92
https://kawalpemilu.org#60075,"MELANA, SOKAN, MELAWI, KALIMANTAN BARAT",3,19,180,199
https://kawalpemilu.org#58653,"TANJUNG MERPATI, KEMBAYAN, SANGGAU, KALIMANTAN BARAT",1,45,87,132
https://kawalpemilu.org#60152,"SUNGAI MATA-MATA, SIMPANG HILIR, KAYONG UTARA, KALIMANTAN BARAT",3,104,129,233
https://kawalpemilu.org#59731,"GARU, MEMPAWAH HULU, LANDAK, KALIMANTAN BARAT",6,128,16,144
https://kawalpemilu.org#60253,"SIJANGKUNG, SINGKAWANG SELATAN, KOTA SINGKAWANG, KALIMANTAN BARAT",13,163,10,173
https://kawalpemilu.org#59561,"SUNGAI JAGA B, SUNGAI RAYA, BENGKAYANG, KALIMANTAN BARAT",4,49,159,208
https://kawalpemilu.org#60225,"ROBAN, SINGKAWANG TENGAH, KOTA SINGKAWANG, KALIMANTAN BARAT",70,27,142,169
https://kawalpemilu.org#58360,"SERINDANG, TEBAS, SAMBAS, KALIMANTAN BARAT",6,87,88,175
https://kawalpemilu.org#59745,"NANGKA, MENJALIN, LANDAK, KALIMANTAN BARAT",1,123,4,127
https://kawalpemilu.org#60170,"DUSUN KECIL, PULAU MAYA, KAYONG UTARA, KALIMANTAN BARAT",2,60,90,150
https://kawalpemilu.org#60207,"BATU LAYANG, PONTIANAK UTARA, KOTA PONTIANAK, KALIMANTAN BARAT",23,14,107,121
https://kawalpemilu.org#60206,"SIANTAN HILIR, PONTIANAK UTARA, KOTA PONTIANAK, KALIMANTAN BARAT",83,130,53,183
https://kawalpemilu.org#60200,"SUNGAI JAWI DALAM, PONTIANAK BARAT, KOTA PONTIANAK, KALIMANTAN BARAT",28,77,148,225
https://kawalpemilu.org#58502,"PAK LAHENG, TOHO, MEMPAWAH, KALIMANTAN BARAT",1,151,6,157
https://kawalpemilu.org#60165,"TELUK BATANG UTARA, TELUK BATANG, KAYONG UTARA, KALIMANTAN BARAT",5,48,142,190
https://kawalpemilu.org#59695,"BENGKILU, TUJUH BELAS, BENGKAYANG, KALIMANTAN BARAT",8,141,86,227
https://kawalpemilu.org#60204,"SIANTAN HULU, PONTIANAK UTARA, KOTA PONTIANAK, KALIMANTAN BARAT",53,73,115,188
https://kawalpemilu.org#60186,"BENUA MELAYU DARAT, PONTIANAK SELATAN, KOTA PONTIANAK, KALIMANTAN BARAT",73,183,10,0
https://kawalpemilu.org#60275,"RETOK, KUALA MANDOR B, KUBU RAYA, KALIMANTAN BARAT",10,19,127,146
https://kawalpemilu.org#59786,"KAYU ARA, MENYUKE, LANDAK, KALIMANTAN BARAT",7,149,16,165
https://kawalpemilu.org#59277,"SUNGAI PUKAT, KELAM PERMAI, SINTANG, KALIMANTAN BARAT",1,148,15,163
https://kawalpemilu.org#60317,"KUBU, KUBU, KUBU RAYA, KALIMANTAN BARAT",14,65,104,169
https://kawalpemilu.org#60051,"LOKA JAYA, TANAH PINOH, MELAWI, KALIMANTAN BARAT",7,21,192,213
https://kawalpemilu.org#59586,"BUMI EMAS, BENGKAYANG, BENGKAYANG, KALIMANTAN BARAT",13,181,23,181
https://kawalpemilu.org#58681,"RIYAI, TAYAN HULU, SANGGAU, KALIMANTAN BARAT",4,101,1,102
https://kawalpemilu.org#60225,"ROBAN, SINGKAWANG TENGAH, KOTA SINGKAWANG, KALIMANTAN BARAT",43,61,140,201
https://kawalpemilu.org#60210,"DARAT SEKIP, PONTIANAK KOTA, KOTA PONTIANAK, KALIMANTAN BARAT",31,84,95,179
https://kawalpemilu.org#58913,"TANGGERANG, JELAI HULU, KETAPANG, KALIMANTAN BARAT",4,194,5,199
https://kawalpemilu.org#58370,"PENJAJAP, PEMANGKAT, SAMBAS, KALIMANTAN BARAT",16,61,140,201
https://kawalpemilu.org#59855,"TEMBAWANG BALE, BANYUKE HULU, LANDAK, KALIMANTAN BARAT",3,77,1,78
https://kawalpemilu.org#58359,"BATU MAKJAGE, TEBAS, SAMBAS, KALIMANTAN BARAT",4,117,77,194
https://kawalpemilu.org#58480,"PARIT BARU, SALATIGA, SAMBAS, KALIMANTAN BARAT",5,100,86,186
https://kawalpemilu.org#59367,"BUNUT HILIR, BUNUT HILIR, KAPUAS HULU, KALIMANTAN BARAT",2,93,67,160
https://kawalpemilu.org#59695,"BENGKILU, TUJUH BELAS, BENGKAYANG, KALIMANTAN BARAT",3,248,13,261
https://kawalpemilu.org#62470,"SUNGAI TUAN ULU, ASTAMBUL, BANJAR, KALIMANTAN SELATAN",1,25,159,184
https://kawalpemilu.org#63033,"JAMBU HULU, PADANG BATUNG, HULU SUNGAI SELATAN, KALIMANTAN SELATAN",3,33,129,162
https://kawalpemilu.org#63842,"KAMPUNG BARU, SIMPANG EMPAT, TANAH BUMBU, KALIMANTAN SELATAN",19,67,80,147
https://kawalpemilu.org#62412,"SEKUMPUL, MARTAPURA, BANJAR, KALIMANTAN SELATAN",16,45,116,161
https://kawalpemilu.org#62615,"BALIANGIN, SAMBUNG MAKMUR, BANJAR, KALIMANTAN SELATAN",5,45,95,140
https://kawalpemilu.org#62406,"KERATON, MARTAPURA, BANJAR, KALIMANTAN SELATAN",29,74,104,178
https://kawalpemilu.org#62615,"BALIANGIN, SAMBUNG MAKMUR, BANJAR, KALIMANTAN SELATAN",2,66,109,175
https://kawalpemilu.org#64067,"SURGI MUFTI, BANJARMASIN UTARA, KOTA BANJARMASIN, KALIMANTAN SELATAN",41,72,155,227
https://kawalpemilu.org#63255,"HILIR BANUA, PANDAWAN, HULU SUNGAI TENGAH, KALIMANTAN SELATAN",4,26,146,172
https://kawalpemilu.org#62266,"BINTURUNG, PAMUKAN UTARA, KOTABARU, KALIMANTAN SELATAN",16,80,26,106
https://kawalpemilu.org#64030,"KELAYAN SELATAN, BANJARMASIN SELATAN, KOTA BANJARMASIN, KALIMANTAN SELATAN",33,34,52,86
https://kawalpemilu.org#62661,"PURWOSARI I, TAMBAN, BARITO KUALA, KALIMANTAN SELATAN",3,69,109,178
https://kawalpemilu.org#62539,"APUAI, ARANIO, BANJAR, KALIMANTAN SELATAN",1,75,94,169
https://kawalpemilu.org#64087,"LANDASAN ULIN TIMUR, LANDASAN ULIN, KOTA BANJARBARU, KALIMANTAN SELATAN",40,121,92,213
https://kawalpemilu.org#63787,"WONOREJO, SATUI, TANAH BUMBU, KALIMANTAN SELATAN",9,145,60,205
https://kawalpemilu.org#62608,"TAMBAK ANYAR ILIR, MARTAPURA TIMUR, BANJAR, KALIMANTAN SELATAN",2,59,112,171
https://kawalpemilu.org#63856,"DUKUH REJO, MANTEWE, TANAH BUMBU, KALIMANTAN SELATAN",3,96,87,183
https://kawalpemilu.org#63236,"BINJAI PIRUA, LABUAN AMAS UTARA, HULU SUNGAI TENGAH, KALIMANTAN SELATAN",1,26,128,154
https://kawalpemilu.org#62297,"MAGALAU HULU, KELUMPANG BARAT, KOTABARU, KALIMANTAN SELATAN",2,155,70,225
https://kawalpemilu.org#64094,"SUNGAI TIUNG, CEMPAKA, KOTA BANJARBARU, KALIMANTAN SELATAN",4,103,153,256
https://kawalpemilu.org#63946,"TIMBUN TULANG, BATU MANDI, BALANGAN, KALIMANTAN SELATAN",1,34,152,186
https://kawalpemilu.org#64068,"PANGERAN, BANJARMASIN UTARA, KOTA BANJARMASIN, KALIMANTAN SELATAN",14,63,151,214
https://kawalpemilu.org#62962,"BATU AMPAR, PIANI, TAPIN, KALIMANTAN SELATAN",1,26,176,202
https://kawalpemilu.org#61972,"GUNUNG MAKMUR, TAKISUNG, TANAH LAUT, KALIMANTAN SELATAN",4,147,90,237
https://kawalpemilu.org#64055,"TELAGA BIRU, BANJARMASIN BARAT, KOTA BANJARMASIN, KALIMANTAN SELATAN",19,60,85,145
https://kawalpemilu.org#62740,"KARANG BUNGA, MANDASTANA, BARITO KUALA, KALIMANTAN SELATAN",2,105,82,187
https://kawalpemilu.org#64099,"LANDASAN ULIN BARAT, LIANG ANGGANG, KOTA BANJARBARU, KALIMANTAN SELATAN",11,62,63,125
https://kawalpemilu.org#61979,"SUMBER MAKMUR, TAKISUNG, TANAH LAUT, KALIMANTAN SELATAN",2,139,47,186
https://kawalpemilu.org#62323,"MANDALA, KELUMPANG HILIR, KOTABARU, KALIMANTAN SELATAN",1,155,56,211
https://kawalpemilu.org#62613,"BATU TANAM, SAMBUNG MAKMUR, BANJAR, KALIMANTAN SELATAN",3,10,102,112
https://kawalpemilu.org#63304,"LABUNGANAK, BATANG ALAI UTARA, HULU SUNGAI TENGAH, KALIMANTAN SELATAN",5,34,111,145
https://kawalpemilu.org#63739,"BATUAH, KUSAN HILIR, TANAH BUMBU, KALIMANTAN SELATAN",2,52,97,149
https://kawalpemilu.org#64038,"PEMURUS DALAM, BANJARMASIN SELATAN, KOTA BANJARMASIN, KALIMANTAN SELATAN",2,85,149,234
https://kawalpemilu.org#61365,"PADANG, SUKAMARA, SUKAMARA, KALIMANTAN TENGAH",8,131,94,225
https://kawalpemilu.org#60657,"SELAT TENGAH, SELAT, KAPUAS, KALIMANTAN TENGAH",39,35,72,107
https://kawalpemilu.org#60607,"WARINGIN AGUNG, ANTANG KALANG, KOTAWARINGIN TIMUR, KALIMANTAN TENGAH",3,120,18,138
https://kawalpemilu.org#61960,"PETUK BARUNAI, RAKUMPIT, KOTA PALANGKARAYA, KALIMANTAN TENGAH",3,94,23,117
https://kawalpemilu.org#61947,"MENTENG, JEKAN RAYA, KOTA PALANGKARAYA, KALIMANTAN TENGAH",120,87,26,113
https://kawalpemilu.org#61666,"GOHA, BANAMA TINGANG, PULANG PISAU, KALIMANTAN TENGAH",2,246,10,256
https://kawalpemilu.org#61373,"KUALA JELAI, JELAI, SUKAMARA, KALIMANTAN TENGAH",3,146,90,236
https://kawalpemilu.org#60452,"SUNGAI MELAWEN, PANGKALAN LADA, KOTAWARINGIN BARAT, KALIMANTAN TENGAH",7,177,53,230
https://kawalpemilu.org#60955,"MUARA RIPUNG, DUSUN SELATAN, BARITO SELATAN, KALIMANTAN TENGAH",2,144,10,154
https://kawalpemilu.org#60574,"HANAUT, PULAU HANAUT, KOTAWARINGIN TIMUR, KALIMANTAN TENGAH",1,70,69,139
https://kawalpemilu.org#61175,"TUMBANG SANAMANG, KATINGAN HULU, KATINGAN, KALIMANTAN TENGAH",6,134,56,190
https://kawalpemilu.org#61261,"PERSIL RAYA, SERUYAN HILIR, SERUYAN, KALIMANTAN TENGAH",2,77,60,137
https://kawalpemilu.org#61424,"NANGA BULIK, BULIK, LAMANDAU, KALIMANTAN TENGAH",16,72,73,145
https://kawalpemilu.org#61510,"TEWAH, TEWAH, GUNUNG MAS, KALIMANTAN TENGAH",19,126,19,145
https://kawalpemilu.org#61379,"JIHING, BALAI RIAM, SUKAMARA, KALIMANTAN TENGAH",3,119,36,155
https://kawalpemilu.org#60727,"HANDIWUNG, PULAU PETAK, KAPUAS, KALIMANTAN TENGAH",3,24,96,120
https://kawalpemilu.org#61413,"KUDANGAN, DELANG, LAMANDAU, KALIMANTAN TENGAH",1,178,43,221
https://kawalpemilu.org#61948,"BUKIT TUNGGAL, JEKAN RAYA, KOTA PALANGKARAYA, KALIMANTAN TENGAH",70,85,37,122
https://kawalpemilu.org#61133,"BATU BADINDING, KATINGAN TENGAH, KATINGAN, KALIMANTAN TENGAH",4,156,43,199
https://kawalpemilu.org#60534,"BAAMANG TENGAH, BAAMANG, KOTAWARINGIN TIMUR, KALIMANTAN TENGAH",26,53,59,112
https://kawalpemilu.org#64571,"TANJUNG BATU, PULAU DERAWAN, BERAU, KALIMANTAN TIMUR",15,125,62,187
https://kawalpemilu.org#65506,"RAWA MULIA, BABULU, PENAJAM PASER UTARA, KALIMANTAN TIMUR",2,177,41,218
https://kawalpemilu.org#65575,"SUNGAI KELEDANG, SAMARINDA SEBERANG, KOTA SAMARINDA, KALIMANTAN TIMUR",44,40,69,109
https://kawalpemilu.org#64268,"LOH SUMBER, LOA KULU, KUTAI KARTANEGARA, KALIMANTAN TIMUR",5,109,126,235
https://kawalpemilu.org#65550,"KARANG JATI, BALIKPAPAN TENGAH, KOTA BALIKPAPAN, KALIMANTAN TIMUR",12,96,58,154
https://kawalpemilu.org#65615,"SUNGAI PINANG DALAM, SUNGAI PINANG, KOTA SAMARINDA, KALIMANTAN TIMUR",82,88,104,192
https://kawalpemilu.org#65660,"LOK TUAN, BONTANG UTARA, KOTA BONTANG, KALIMANTAN TIMUR",36,73,98,171
https://kawalpemilu.org#65473,"PETUNG, PENAJAM, PENAJAM PASER UTARA, KALIMANTAN TIMUR",1,112,125,237
https://kawalpemilu.org#65481,"PENAJAM, PENAJAM, PENAJAM PASER UTARA, KALIMANTAN TIMUR",9,52,166,218
https://kawalpemilu.org#65386,"KOMBENG INDAH, KOMBENG, KUTAI TIMUR, KALIMANTAN TIMUR",2,187,33,220
https://kawalpemilu.org#65243,"LINGGANG MELAPEH, LINGGANG BIGUNG, KUTAI BARAT, KALIMANTAN TIMUR",15,200,14,214
https://kawalpemilu.org#65381,"MAKMUR JAYA, KOMBENG, KUTAI TIMUR, KALIMANTAN TIMUR",6,170,26,196
https://kawalpemilu.org#65660,"LOK TUAN, BONTANG UTARA, KOTA BONTANG, KALIMANTAN TIMUR",58,122,161,283
https://kawalpemilu.org#65493,"GIRIPURWA, PENAJAM, PENAJAM PASER UTARA, KALIMANTAN TIMUR",4,146,88,234
https://kawalpemilu.org#64124,"TANJUNG ARU, TANJUNG HARAPAN, PASER, KALIMANTAN TIMUR",1,58,120,178
https://kawalpemilu.org#65543,"GUNUNGSAMARINDA, BALIKPAPAN UTARA, KOTA BALIKPAPAN, KALIMANTAN TIMUR",58,60,71,131
https://kawalpemilu.org#928244,"SEMPAJA BARAT, SAMARINDA UTARA, KOTA SAMARINDA, KALIMANTAN TIMUR",11,64,138,202
https://kawalpemilu.org#65556,"SEPINGGAN, BALIKPAPAN SELATAN, KOTA BALIKPAPAN, KALIMANTAN TIMUR",48,152,84,236
https://kawalpemilu.org#64471,"LOA LEPU, TENGGARONG SEBERANG, KUTAI KARTANEGARA, KALIMANTAN TIMUR",2,71,102,173
https://kawalpemilu.org#64271,"MARGA RAHAYU, LOA KULU, KUTAI KARTANEGARA, KALIMANTAN TIMUR",6,126,113,239
https://kawalpemilu.org#85507,"GRAHA INDAH, BALIKPAPAN UTARA, KOTA BALIKPAPAN, KALIMANTAN TIMUR",23,184,71,255
https://kawalpemilu.org#65673,"GUNUNG TELIHAN, BONTANG BARAT, KOTA BONTANG, KALIMANTAN TIMUR",13,152,81,233
https://kawalpemilu.org#64551,"TANJUNG REDEB, TANJUNG REDEB, BERAU, KALIMANTAN TIMUR",47,93,112,205
https://kawalpemilu.org#85507,"GRAHA INDAH, BALIKPAPAN UTARA, KOTA BALIKPAPAN, KALIMANTAN TIMUR",33,89,61,150
https://kawalpemilu.org#65109,"MATALIBAQ, LONG HUBUNG, MAHAKAM ULU, KALIMANTAN TIMUR",2,226,10,236
https://kawalpemilu.org#65487,"GERSIK, PENAJAM, PENAJAM PASER UTARA, KALIMANTAN TIMUR",2,105,88,193
https://kawalpemilu.org#64333,"SEBULU MODERN, SEBULU, KUTAI KARTANEGARA, KALIMANTAN TIMUR",2,152,24,176
https://kawalpemilu.org#65548,"GUNUNGSARI ILIR, BALIKPAPAN TENGAH, KOTA BALIKPAPAN, KALIMANTAN TIMUR",17,90,43,133
https://kawalpemilu.org#64945,"SELISUN, NUNUKAN SELATAN, NUNUKAN, KALIMANTAN UTARA",14,153,51,204
https://kawalpemilu.org#64724,"NUNUKAN TIMUR, NUNUKAN, NUNUKAN, KALIMANTAN UTARA",29,87,40,127
https://kawalpemilu.org#64948,"TANJUNG HARAPAN, NUNUKAN SELATAN, NUNUKAN, KALIMANTAN UTARA",4,137,51,188
https://kawalpemilu.org#65016,"PUNAN SETARAP, MALINAU SELATAN HILIR, MALINAU, KALIMANTAN UTARA",1,105,6,111
https://kawalpemilu.org#64629,"LONG BELUAH, TANJUNG PALAS BARAT, BULUNGAN, KALIMANTAN UTARA",5,213,17,230
https://kawalpemilu.org#64938,"LIANG BUNYU, SEBATIK BARAT, NUNUKAN, KALIMANTAN UTARA",4,99,126,225
https://kawalpemilu.org#25195,"DUL, PANGKALAN BARU, BANGKA TENGAH, KEPULAUAN BANGKA BELITUNG",4,81,142,223
https://kawalpemilu.org#25030,"KACE, MENDO BARAT, BANGKA, KEPULAUAN BANGKA BELITUNG",6,106,83,189
https://kawalpemilu.org#25396,"PARIT LALANG, RANGKUI, KOTA PANGKALPINANG, KEPULAUAN BANGKA BELITUNG",13,145,128,273
https://kawalpemilu.org#25315,"TELUK LIMAU, PARITTIGA, BANGKA BARAT, KEPULAUAN BANGKA BELITUNG",7,151,48,199
https://kawalpemilu.org#25333,"BATU PENYU, GANTUNG, BELITUNG TIMUR, KEPULAUAN BANGKA BELITUNG",8,191,24,215
https://kawalpemilu.org#25395,"MELINTANG, RANGKUI, KOTA PANGKALPINANG, KEPULAUAN BANGKA BELITUNG",2,107,115,222
https://kawalpemilu.org#24996,"SUNGAILIAT, SUNGAILIAT, BANGKA, KEPULAUAN BANGKA BELITUNG",53,95,107,202
https://kawalpemilu.org#25148,"AIR BARA, AIR GEGAS, BANGKA SELATAN, KEPULAUAN BANGKA BELITUNG",7,94,24,118
https://kawalpemilu.org#25079,"PANGKAL LALANG, TANJUNG PANDAN, BELITUNG, KEPULAUAN BANGKA BELITUNG",27,141,92,233
https://kawalpemilu.org#25118,"CERUCUK, BADAU, BELITUNG, KEPULAUAN BANGKA BELITUNG",1,137,35,172
https://kawalpemilu.org#25788,"MANGSANG, SEI BEDUK, KOTA BATAM, KEPULAUAN RIAU",96,129,54,183
https://kawalpemilu.org#25809,"SUNGAI PANAS, BATAM KOTA, KOTA BATAM, KEPULAUAN RIAU",69,120,45,165
https://kawalpemilu.org#25783,"TANJUNG UMA, LUBUK BAJA, KOTA BATAM, KEPULAUAN RIAU",13,90,151,241
https://kawalpemilu.org#25812,"TEMBESI, SAGULUNG, KOTA BATAM, KEPULAUAN RIAU",21,72,154,226
https://kawalpemilu.org#25764,"SUNGAI HARAPAN, SEKUPANG, KOTA BATAM, KEPULAUAN RIAU",32,213,6,219
https://kawalpemilu.org#25817,"SUNGAI PELUNGGUT, SAGULUNG, KOTA BATAM, KEPULAUAN RIAU",9,94,32,126
https://kawalpemilu.org#25559,"MERAL KOTA, MERAL, KARIMUN, KEPULAUAN RIAU",9,121,37,158
https://kawalpemilu.org#25531,"TELUK SASAH, SERI KUALA LOBAM, BINTAN, KEPULAUAN RIAU",11,127,129,256
https://kawalpemilu.org#25656,"SABANG MAWANG BARAT, PULAU TIGA, NATUNA, KEPULAUAN RIAU",1,84,35,119
https://kawalpemilu.org#25426,"TANJUNG AYUN SAKTI, BUKIT BESTARI, KOTA TANJUNGPINANG, KEPULAUAN RIAU",11,99,89,188
https://kawalpemilu.org#91358,"TANJUNGIRAT, SINGKEP BARAT, LINGGA, KEPULAUAN RIAU",2,178,13,197
https://kawalpemilu.org#25670,"HARAPAN JAYA, BUNGURAN TENGAH, NATUNA, KEPULAUAN RIAU",1,135,86,221
https://kawalpemilu.org#25674,"CEMAGA, BUNGURAN SELATAN, NATUNA, KEPULAUAN RIAU",1,99,60,159
https://kawalpemilu.org#25782,"BALOI INDAH, LUBUK BAJA, KOTA BATAM, KEPULAUAN RIAU",23,56,46,102
https://kawalpemilu.org#24086,"BETUNG, PEMATANG SAWA, TANGGAMUS, LAMPUNG",2,25,141,166
https://kawalpemilu.org#22965,"YUKUM JAYA, TERBANGGI BESAR, LAMPUNG TENGAH, LAMPUNG",14,37,148,185
https://kawalpemilu.org#23055,"RENGAS, BEKRI, LAMPUNG TENGAH, LAMPUNG",9,119,78,197
https://kawalpemilu.org#24727,"SUKAJAWA, TANJUNGKARANG BARAT, KOTA BANDAR LAMPUNG, LAMPUNG",18,63,124,187
https://kawalpemilu.org#23735,"TEMBELANG, BANDAR NEGERI SUOH, LAMPUNG BARAT, LAMPUNG",2,113,37,150
https://kawalpemilu.org#84831,"PANGGUNG REJO UTARA, SUKOHARJO, PRINGSEWU, LAMPUNG",5,123,32,155
https://kawalpemilu.org#22984,"RAMA NIRWANA, SEPUTIH RAMAN, LAMPUNG TENGAH, LAMPUNG",1,157,54,211
https://kawalpemilu.org#23667,"ULU KRUI, WAY KRUI, PESISIR BARAT, LAMPUNG",2,96,126,222
https://kawalpemilu.org#22954,"BADRAN SARI, PUNGGUR, LAMPUNG TENGAH, LAMPUNG",2,97,55,152
https://kawalpemilu.org#22909,"BANDAR SARI, PADANG RATU, LAMPUNG TENGAH, LAMPUNG",9,98,80,178
https://kawalpemilu.org#87255,"KOTA SEPANG, LABUHAN RATU, KOTA BANDAR LAMPUNG, LAMPUNG",7,68,100,168
https://kawalpemilu.org#23220,"KOTA AGUNG, SUNGKAI SELATAN, LAMPUNG UTARA, LAMPUNG",6,0,0,0
https://kawalpemilu.org#22693,"PARDASUKA, KATIBUNG, LAMPUNG SELATAN, LAMPUNG",26,166,57,223
https://kawalpemilu.org#22945,"TEMPURAN, TRIMURJO, LAMPUNG TENGAH, LAMPUNG",8,129,132,261
https://kawalpemilu.org#24261,"SUMBERGEDE, SEKAMPUNG, LAMPUNG TIMUR, LAMPUNG",8,97,83,180
https://kawalpemilu.org#23135,"SENDANG MULYO, SENDANG AGUNG, LAMPUNG TENGAH, LAMPUNG",18,134,74,208
https://kawalpemilu.org#23574,"TANJUNGRAYA, SUKAU, LAMPUNG BARAT, LAMPUNG",4,71,114,185
https://kawalpemilu.org#23316,"KELAPA TUJUH, KOTABUMI SELATAN, LAMPUNG UTARA, LAMPUNG",139,41,133,174
https://kawalpemilu.org#23764,"MORIS JAYA, BANJAR AGUNG, TULANG BAWANG, LAMPUNG",5,211,12,223
https://kawalpemilu.org#23086,"MATARAM UDIK, BANDAR MATARAM, LAMPUNG TENGAH, LAMPUNG",81,158,69,227
https://kawalpemilu.org#23881,"PANCA KARSA PURNA JAYA, BANJAR BARU, TULANG BAWANG, LAMPUNG",4,84,139,223
https://kawalpemilu.org#24227,"KARYA TANI, LABUHAN MARINGGAI, LAMPUNG TIMUR, LAMPUNG",8,141,23,164
https://kawalpemilu.org#23802,"BOGATAMA, PENAWAR TAMA, TULANG BAWANG, LAMPUNG",2,115,43,158
https://kawalpemilu.org#23040,"GUNUNG AGUNG, TERUSAN NUNYAI, LAMPUNG TENGAH, LAMPUNG",24,147,57,204
https://kawalpemilu.org#22834,"BARU RANJI, MERBAU MATARAM, LAMPUNG SELATAN, LAMPUNG",7,63,64,127
