https://kawalpemilu.org#43929,"KAPI, KUNJANG, KEDIRI, JAWA TIMUR",8,101,33,134
https://kawalpemilu.org#51387,"KEDUNGDORO, TEGALSARI, KOTA SURABAYA, JAWA TIMUR",33,42,43,85
https://kawalpemilu.org#48083,"BALEGONDO, NGARIBOYO, MAGETAN, JAWA TIMUR",3,98,88,186
https://kawalpemilu.org#48761,"PADANG, TRUCUK, BOJONEGORO, JAWA TIMUR",4,115,87,202
https://kawalpemilu.org#42392,"KLEPU, DONOROJO, PACITAN, JAWA TIMUR",5,113,33,146
https://kawalpemilu.org#48857,"SIDING, BANCAR, TUBAN, JAWA TIMUR",6,145,54,199
https://kawalpemilu.org#48799,"BOBOL, SEKAR, BOJONEGORO, JAWA TIMUR",13,133,20,153
https://kawalpemilu.org#45688,"PAKUNIRAN, PAKUNIRAN, PROBOLINGGO, JAWA TIMUR",12,84,90,174
https://kawalpemilu.org#44656,"WONOREJO, KENCONG, JEMBER, JAWA TIMUR",3,140,35,175
https://kawalpemilu.org#44931,"SUKOREJO, BANGOREJO, BANYUWANGI, JAWA TIMUR",6,172,52,224
https://kawalpemilu.org#47642,"SIDOREJO, KEBONSARI, MADIUN, JAWA TIMUR",15,87,81,168
https://kawalpemilu.org#44080,"WONOMULYO, PONCOKUSUMO, MALANG, JAWA TIMUR",8,186,48,234
https://kawalpemilu.org#45041,"KARANGBENDO, ROGOJAMPI, BANYUWANGI, JAWA TIMUR",18,183,40,223
https://kawalpemilu.org#42820,"POLOREJO, BABADAN, PONOROGO, JAWA TIMUR",14,185,52,237
https://kawalpemilu.org#46205,"KERSIKAN, GONDANGWETAN, PASURUAN, JAWA TIMUR",5,154,69,223
https://kawalpemilu.org#47178,"SEBANI, SUMOBITO, JOMBANG, JAWA TIMUR",7,148,60,208
https://kawalpemilu.org#45709,"TALKANDANG, KOTAANYAR, PROBOLINGGO, JAWA TIMUR",1,149,101,250
https://kawalpemilu.org#48238,"JURUREJO, NGAWI, NGAWI, JAWA TIMUR",18,94,115,209
https://kawalpemilu.org#44465,"JATISARI, TEMPEH, LUMAJANG, JAWA TIMUR",1,95,107,202
https://kawalpemilu.org#48670,"SUKOHARJO, KALITIDU, BOJONEGORO, JAWA TIMUR",4,155,63,218
https://kawalpemilu.org#50567,"DASOK, PADEMAWU, PAMEKASAN, JAWA TIMUR",3,55,161,216
https://kawalpemilu.org#42871,"TALUN, NGEBEL, PONOROGO, JAWA TIMUR",9,107,14,121
https://kawalpemilu.org#51276,"KRAPYAKREJO, GADINGREJO, KOTA PASURUAN, JAWA TIMUR",14,148,64,212
https://kawalpemilu.org#47040,"NGORO, NGORO, JOMBANG, JAWA TIMUR",11,149,38,187
https://kawalpemilu.org#48704,"PURWOSARI, PURWOSARI, BOJONEGORO, JAWA TIMUR",5,108,54,162
https://kawalpemilu.org#44655,"KENCONG, KENCONG, JEMBER, JAWA TIMUR",32,124,30,154
https://kawalpemilu.org#47496,"DEMANGAN, TANJUNGANOM, NGANJUK, JAWA TIMUR",9,100,59,159
https://kawalpemilu.org#51440,"ALUN-ALUN CONTONG, BUBUTAN, KOTA SURABAYA, JAWA TIMUR",14,163,43,206
https://kawalpemilu.org#51164,"PLOSOKEREP, SANANWETAN, KOTA BLITAR, JAWA TIMUR",11,189,49,238
https://kawalpemilu.org#47284,"GONDANGMANIS, BANDARKEDUNGMULYO, JOMBANG, JAWA TIMUR",6,110,69,179
https://kawalpemilu.org#43443,"CANDIREJO, PONGGOK, BLITAR, JAWA TIMUR",27,140,25,165
https://kawalpemilu.org#49817,"BANYUURIP, KEDAMEAN, GRESIK, JAWA TIMUR",22,136,26,162
https://kawalpemilu.org#46807,"SINGOWANGI, KUTOREJO, MOJOKERTO, JAWA TIMUR",3,210,31,241
https://kawalpemilu.org#48472,"DROKILO, KEDUNGADEM, BOJONEGORO, JAWA TIMUR",3,118,60,178
https://kawalpemilu.org#44645,"PADOMASAN, JOMBANG, JEMBER, JAWA TIMUR",22,117,62,179
https://kawalpemilu.org#47892,"TAKERAN, TAKERAN, MAGETAN, JAWA TIMUR",6,88,96,184
https://kawalpemilu.org#48615,"TANJUNGHARJO, KAPAS, BOJONEGORO, JAWA TIMUR",1,127,102,229
https://kawalpemilu.org#50841,"GEDUGAN, GILI GINTING, SUMENEP, JAWA TIMUR",7,0,0,0
https://kawalpemilu.org#47453,"LAMBANGKUNING, KERTOSONO, NGANJUK, JAWA TIMUR",10,151,20,171
https://kawalpemilu.org#46593,"KEBONAGUNG, SUKODONO, SIDOARJO, JAWA TIMUR",19,168,53,221
https://kawalpemilu.org#48483,"SIDOMUKTI, KEPOH BARU, BOJONEGORO, JAWA TIMUR",10,89,70,159
https://kawalpemilu.org#43519,"PANGGUNGREJO, PANGGUNGREJO, BLITAR, JAWA TIMUR",30,166,23,189
https://kawalpemilu.org#51488,"DUKUH PAKIS, DUKUHPAKIS, KOTA SURABAYA, JAWA TIMUR",27,158,40,198
https://kawalpemilu.org#51548,"BRINGIN, SAMBIKEREP, KOTA SURABAYA, JAWA TIMUR",1,165,59,224
https://kawalpemilu.org#43574,"KLEMUNAN, WLINGI, BLITAR, JAWA TIMUR",17,73,10,83
https://kawalpemilu.org#48978,"PRAMBONTERGAYANG, SOKO, TUBAN, JAWA TIMUR",7,144,58,202
https://kawalpemilu.org#47013,"SUKOREJO, PERAK, JOMBANG, JAWA TIMUR",5,139,38,177
https://kawalpemilu.org#50464,"TLAGAH, BANYUATES, SAMPANG, JAWA TIMUR",35,223,22,0
https://kawalpemilu.org#48334,"WIDODAREN, GERIH, NGAWI, JAWA TIMUR",3,120,8,128
https://kawalpemilu.org#49090,"SUMURJALAK, PLUMPANG, TUBAN, JAWA TIMUR",2,169,31,200
https://kawalpemilu.org#46137,"KALIREJO, BANGIL, PASURUAN, JAWA TIMUR",13,98,152,250
https://kawalpemilu.org#48933,"MARGOMULYO, KEREK, TUBAN, JAWA TIMUR",7,166,61,227
https://kawalpemilu.org#42751,"TATUNG, BALONG, PONOROGO, JAWA TIMUR",6,113,61,174
https://kawalpemilu.org#45144,"SILIRAGUNG, SILIRAGUNG, BANYUWANGI, JAWA TIMUR",15,169,47,216
https://kawalpemilu.org#50710,"BLABAN, BATUMARMAR, PAMEKASAN, JAWA TIMUR",16,100,147,247
https://kawalpemilu.org#44740,"AMPEL, WULUHAN, JEMBER, JAWA TIMUR",53,136,42,178
https://kawalpemilu.org#44926,"PESANGGARAN, PESANGGARAN, BANYUWANGI, JAWA TIMUR",40,151,25,176
https://kawalpemilu.org#43954,"SELODONO, RINGINREJO, KEDIRI, JAWA TIMUR",13,166,26,192
https://kawalpemilu.org#45902,"CURAHTULIS, TONGAS, PROBOLINGGO, JAWA TIMUR",19,146,73,219
https://kawalpemilu.org#47009,"GLAGAHAN, PERAK, JOMBANG, JAWA TIMUR",8,152,30,182
https://kawalpemilu.org#45530,"WONOREJO, BANYUPUTIH, SITUBONDO, JAWA TIMUR",12,132,26,158
https://kawalpemilu.org#47807,"KLUMUTAN, SARADAN, MADIUN, JAWA TIMUR",19,128,41,169
https://kawalpemilu.org#46094,"SUMBER REJO, PANDAAN, PASURUAN, JAWA TIMUR",10,183,49,232
https://kawalpemilu.org#47171,"JOGOLOYO, SUMOBITO, JOMBANG, JAWA TIMUR",15,147,40,187
https://kawalpemilu.org#48229,"KARANG TENGAH, NGAWI, NGAWI, JAWA TIMUR",4,147,73,220
https://kawalpemilu.org#48801,"SEKAR, SEKAR, BOJONEGORO, JAWA TIMUR",14,198,12,210
https://kawalpemilu.org#44007,"PANDANREJO, PAGAK, MALANG, JAWA TIMUR",3,90,57,147
https://kawalpemilu.org#43164,"KEDOYO, SENDANG, TULUNGAGUNG, JAWA TIMUR",10,151,22,173
https://kawalpemilu.org#46628,"GANTING, GEDANGAN, SIDOARJO, JAWA TIMUR",8,182,80,262
https://kawalpemilu.org#42925,"BESUKI, MUNJUNGAN, TRENGGALEK, JAWA TIMUR",15,143,30,173
https://kawalpemilu.org#50974,"LARANGAN BARMA, BATU PUTIH, SUMENEP, JAWA TIMUR",7,29,175,204
https://kawalpemilu.org#49519,"SUGIHWARAS, KALITENGAH, LAMONGAN, JAWA TIMUR",6,137,32,169
https://kawalpemilu.org#46795,"SIMBARINGIN, KUTOREJO, MOJOKERTO, JAWA TIMUR",7,161,42,203
https://kawalpemilu.org#51349,"MOJOREJO, TAMAN, KOTA MADIUN, JAWA TIMUR",5,138,45,183
https://kawalpemilu.org#47195,"CARANGREJO, KESAMBEN, JOMBANG, JAWA TIMUR",11,111,44,155
https://kawalpemilu.org#48330,"PANDEAN, KARANGANYAR, NGAWI, JAWA TIMUR",20,169,28,197
https://kawalpemilu.org#50543,"TLESAH, TLANAKAN, PAMEKASAN, JAWA TIMUR",4,100,138,238
https://kawalpemilu.org#44441,"TAMBAHREJO, CANDIPURO, LUMAJANG, JAWA TIMUR",4,99,20,119
https://kawalpemilu.org#42517,"GEMAHARJO, TEGALOMBO, PACITAN, JAWA TIMUR",11,105,120,225
https://kawalpemilu.org#43026,"SUMBERGEDONG, TRENGGALEK, TRENGGALEK, JAWA TIMUR",11,119,84,203
https://kawalpemilu.org#44145,"SENGGRENG, SUMBERPUCUNG, MALANG, JAWA TIMUR",12,91,29,120
https://kawalpemilu.org#49211,"LAMONGREJO, NGIMBANG, LAMONGAN, JAWA TIMUR",9,200,36,236
https://kawalpemilu.org#47765,"KEBONAGUNG, BALEREJO, MADIUN, JAWA TIMUR",2,142,30,172
https://kawalpemilu.org#44536,"SENDURO, SENDURO, LUMAJANG, JAWA TIMUR",17,126,47,173
https://kawalpemilu.org#50646,"PLAK PAK, PEGANTENAN, PAMEKASAN, JAWA TIMUR",5,12,173,185
https://kawalpemilu.org#60257,"SUNGAI RAYA, SUNGAI RAYA, KUBU RAYA, KALIMANTAN BARAT",26,33,187,220
https://kawalpemilu.org#85337,"DELINTAS KARYA, BOYAN TANJUNG, KAPUAS HULU, KALIMANTAN BARAT",1,129,48,177
https://kawalpemilu.org#58625,"UPE, BONTI, SANGGAU, KALIMANTAN BARAT",7,210,17,227
https://kawalpemilu.org#59963,"BATU NANTA, BELIMBING, MELAWI, KALIMANTAN BARAT",1,232,35,267
https://kawalpemilu.org#58470,"SABARAN, JAWAI SELATAN, SAMBAS, KALIMANTAN BARAT",5,101,64,165
https://kawalpemilu.org#59695,"BENGKILU, TUJUH BELAS, BENGKAYANG, KALIMANTAN BARAT",2,218,22,240
https://kawalpemilu.org#60232,"PASIRAN, SINGKAWANG BARAT, KOTA SINGKAWANG, KALIMANTAN BARAT",107,79,3,82
https://kawalpemilu.org#85357,"SUNGAI RAYA DALAM, SUNGAI RAYA, KUBU RAYA, KALIMANTAN BARAT",37,73,89,162
https://kawalpemilu.org#58360,"SERINDANG, TEBAS, SAMBAS, KALIMANTAN BARAT",4,107,84,191
https://kawalpemilu.org#58371,"JELUTUNG, PEMANGKAT, SAMBAS, KALIMANTAN BARAT",16,104,12,116
https://kawalpemilu.org#60305,"PADANG TIKAR SATU, BATU AMPAR, KUBU RAYA, KALIMANTAN BARAT",4,25,184,209
https://kawalpemilu.org#58763,"BATU PAYUNG DUA, MARAU, KETAPANG, KALIMANTAN BARAT",2,143,19,162
https://kawalpemilu.org#59357,"MENUA SADAP, EMBALOH HULU, KAPUAS HULU, KALIMANTAN BARAT",3,56,5,61
https://kawalpemilu.org#60205,"SIANTAN TENGAH, PONTIANAK UTARA, KOTA PONTIANAK, KALIMANTAN BARAT",92,15,154,169
https://kawalpemilu.org#58510,"SUNGAI PINYUH, SUNGAI PINYUH, MEMPAWAH, KALIMANTAN BARAT",33,43,160,203
https://kawalpemilu.org#60251,"SEDAU, SINGKAWANG SELATAN, KOTA SINGKAWANG, KALIMANTAN BARAT",72,182,7,189
https://kawalpemilu.org#58753,"LAMAN SATONG, MATAN HILIR UTARA, KETAPANG, KALIMANTAN BARAT",8,136,53,189
https://kawalpemilu.org#60251,"SEDAU, SINGKAWANG SELATAN, KOTA SINGKAWANG, KALIMANTAN BARAT",7,103,24,127
https://kawalpemilu.org#59891,"TINTING BOYOK, SEKADAU HULU, SEKADAU, KALIMANTAN BARAT",5,276,3,279
https://kawalpemilu.org#58592,"PENYELIMAU JAYA, KAPUAS, SANGGAU, KALIMANTAN BARAT",3,190,24,214
https://kawalpemilu.org#58709,"MAK KAWING, BALAI, SANGGAU, KALIMANTAN BARAT",3,156,4,160
https://kawalpemilu.org#88497,"MABOH PERMAI, BELITANG, SEKADAU, KALIMANTAN BARAT",2,180,25,205
https://kawalpemilu.org#60204,"SIANTAN HULU, PONTIANAK UTARA, KOTA PONTIANAK, KALIMANTAN BARAT",48,92,32,124
https://kawalpemilu.org#60205,"SIANTAN TENGAH, PONTIANAK UTARA, KOTA PONTIANAK, KALIMANTAN BARAT",12,74,129,203
https://kawalpemilu.org#59760,"MANDOR, MANDOR, LANDAK, KALIMANTAN BARAT",9,70,57,127
https://kawalpemilu.org#59985,"TANJUNG TENGANG, NANGA PINOH, MELAWI, KALIMANTAN BARAT",5,43,179,222
https://kawalpemilu.org#58524,"JUNGKAT, SIANTAN, MEMPAWAH, KALIMANTAN BARAT",40,100,102,202
https://kawalpemilu.org#60196,"DALAM BUGIS, PONTIANAK TIMUR, KOTA PONTIANAK, KALIMANTAN BARAT",44,28,205,233
https://kawalpemilu.org#59973,"TANJUNG NIAGA, NANGA PINOH, MELAWI, KALIMANTAN BARAT",8,68,145,213
https://kawalpemilu.org#60276,"SUNGAI ENAU, KUALA MANDOR B, KUBU RAYA, KALIMANTAN BARAT",21,53,26,79
https://kawalpemilu.org#930893,"KEDABANG, SINTANG, SINTANG, KALIMANTAN BARAT",1,149,68,217
https://kawalpemilu.org#58371,"JELUTUNG, PEMANGKAT, SAMBAS, KALIMANTAN BARAT",13,96,5,101
https://kawalpemilu.org#60189,"AKCAYA, PONTIANAK SELATAN, KOTA PONTIANAK, KALIMANTAN BARAT",37,100,148,248
https://kawalpemilu.org#59742,"TEMPOAK, MENJALIN, LANDAK, KALIMANTAN BARAT",5,115,0,115
https://kawalpemilu.org#58762,"RIAM BATU GADING, MARAU, KETAPANG, KALIMANTAN BARAT",3,170,9,179
https://kawalpemilu.org#58576,"NANGA BIANG, KAPUAS, SANGGAU, KALIMANTAN BARAT",4,6,124,130
https://kawalpemilu.org#59770,"MERAYUH, AIR BESAR, LANDAK, KALIMANTAN BARAT",2,153,8,161
https://kawalpemilu.org#60047,"BEROBAI PERMAI, SAYAN, MELAWI, KALIMANTAN BARAT",2,29,180,209
https://kawalpemilu.org#60225,"ROBAN, SINGKAWANG TENGAH, KOTA SINGKAWANG, KALIMANTAN BARAT",94,18,121,139
https://kawalpemilu.org#58481,"SUNGAI TOMAN, SALATIGA, SAMBAS, KALIMANTAN BARAT",1,155,51,206
https://kawalpemilu.org#60323,"SERUAT TIGA, KUBU, KUBU RAYA, KALIMANTAN BARAT",1,9,174,183
https://kawalpemilu.org#64062,"ALALAK TENGAH, BANJARMASIN UTARA, KOTA BANJARMASIN, KALIMANTAN SELATAN",20,36,61,97
https://kawalpemilu.org#64038,"PEMURUS DALAM, BANJARMASIN SELATAN, KOTA BANJARMASIN, KALIMANTAN SELATAN",19,88,152,240
https://kawalpemilu.org#63380,"SUNGAI DALAM, BABIRIK, HULU SUNGAI UTARA, KALIMANTAN SELATAN",1,44,152,196
https://kawalpemilu.org#63747,"MANURUNG, KUSAN HILIR, TANAH BUMBU, KALIMANTAN SELATAN",2,75,162,237
https://kawalpemilu.org#63826,"WARINGIN TUNGGAL, KURANJI, TANAH BUMBU, KALIMANTAN SELATAN",3,76,90,166
https://kawalpemilu.org#62787,"JAMBU, KURIPAN, BARITO KUALA, KALIMANTAN SELATAN",1,47,145,192
https://kawalpemilu.org#63202,"PANTAI HAMBAWANG BARAT, LABUAN AMAS SELATAN, HULU SUNGAI TENGAH, KALIMANTAN SELATAN",10,24,82,106
https://kawalpemilu.org#62362,"KERTAK HANYAR II, KERTAK HANYAR, BANJAR, KALIMANTAN SELATAN",7,50,98,148
https://kawalpemilu.org#62369,"GAMBUT, GAMBUT, BANJAR, KALIMANTAN SELATAN",47,56,134,190
https://kawalpemilu.org#63031,"PANDULANGAN, PADANG BATUNG, HULU SUNGAI SELATAN, KALIMANTAN SELATAN",3,30,152,182
https://kawalpemilu.org#63074,"GAMBAH LUAR, KANDANGAN, HULU SUNGAI SELATAN, KALIMANTAN SELATAN",2,17,104,121
https://kawalpemilu.org#62911,"BANUA HALAT KIRI, TAPIN UTARA, TAPIN, KALIMANTAN SELATAN",2,44,215,259
https://kawalpemilu.org#62344,"BUNIPAH, ALUH ALUH, BANJAR, KALIMANTAN SELATAN",3,51,122,173
https://kawalpemilu.org#64057,"TELUK TIRAM, BANJARMASIN BARAT, KOTA BANJARMASIN, KALIMANTAN SELATAN",13,90,84,174
https://kawalpemilu.org#64097,"LANDASAN ULIN TENGAH, LIANG ANGGANG, KOTA BANJARBARU, KALIMANTAN SELATAN",10,73,127,200
https://kawalpemilu.org#63816,"PURWODADI, ANGSANA, TANAH BUMBU, KALIMANTAN SELATAN",7,114,70,184
https://kawalpemilu.org#63683,"PADANGIN, MUARA HARUS, TABALONG, KALIMANTAN SELATAN",2,31,154,185
https://kawalpemilu.org#62786,"JAMBU BARU, KURIPAN, BARITO KUALA, KALIMANTAN SELATAN",1,79,80,159
https://kawalpemilu.org#62128,"SEMARAS, PULAULAUT BARAT, KOTABARU, KALIMANTAN SELATAN",5,91,72,163
https://kawalpemilu.org#61993,"KARANG TARUNA, PELAIHARI, TANAH LAUT, KALIMANTAN SELATAN",1,45,146,191
https://kawalpemilu.org#63727,"KERSIK PUTIH, BATU LICIN, TANAH BUMBU, KALIMANTAN SELATAN",6,97,107,204
https://kawalpemilu.org#63169,"PENGAMBAU HILIR LUAR, HARUYAN, HULU SUNGAI TENGAH, KALIMANTAN SELATAN",1,30,129,159
https://kawalpemilu.org#61994,"PELAIHARI, PELAIHARI, TANAH LAUT, KALIMANTAN SELATAN",35,28,120,148
https://kawalpemilu.org#63633,"KAMBITIN, TANJUNG, TABALONG, KALIMANTAN SELATAN",4,56,95,151
https://kawalpemilu.org#62108,"HANDIL BIRAYANG ATAS, BUMI MAKMUR, TANAH LAUT, KALIMANTAN SELATAN",3,98,103,201
https://kawalpemilu.org#85452,"MAKMUR MULIA, SATUI, TANAH BUMBU, KALIMANTAN SELATAN",1,68,79,147
https://kawalpemilu.org#63261,"BARABAI TIMUR, BARABAI, HULU SUNGAI TENGAH, KALIMANTAN SELATAN",15,13,85,98
https://kawalpemilu.org#63170,"PANGGUNG, HARUYAN, HULU SUNGAI TENGAH, KALIMANTAN SELATAN",4,46,99,145
https://kawalpemilu.org#62666,"JELAPAT I, TAMBAN, BARITO KUALA, KALIMANTAN SELATAN",10,39,68,107
https://kawalpemilu.org#62043,"KANDANGAN LAMA, PANYIPATAN, TANAH LAUT, KALIMANTAN SELATAN",2,73,131,204
https://kawalpemilu.org#64098,"LANDASAN ULIN UTARA, LIANG ANGGANG, KOTA BANJARBARU, KALIMANTAN SELATAN",49,87,93,180
https://kawalpemilu.org#91429,"GUNUNGRAYA, MANTEWE, TANAH BUMBU, KALIMANTAN SELATAN",1,40,54,94
https://kawalpemilu.org#63075,"GAMBAH LUAR MUKA, KANDANGAN, HULU SUNGAI SELATAN, KALIMANTAN SELATAN",6,36,111,147
https://kawalpemilu.org#928282,"PULAU TELO BARU, SELAT, KAPUAS, KALIMANTAN TENGAH",3,76,55,131
https://kawalpemilu.org#60569,"BAPINANG HILIR, PULAU HANAUT, KOTAWARINGIN TIMUR, KALIMANTAN TENGAH",1,48,129,177
https://kawalpemilu.org#61675,"BUNTOI, KAHAYAN HILIR, PULANG PISAU, KALIMANTAN TENGAH",5,197,44,241
https://kawalpemilu.org#60547,"EKA BAHURUI, MENTAWA BARU KETAPANG, KOTAWARINGIN TIMUR, KALIMANTAN TENGAH",7,63,62,125
https://kawalpemilu.org#61923,"WURAN, KARUSEN JANANG, BARITO TIMUR, KALIMANTAN TENGAH",1,109,9,118
https://kawalpemilu.org#61495,"KUALA KURUN, KURUN, GUNUNG MAS, KALIMANTAN TENGAH",20,80,9,89
https://kawalpemilu.org#61931,"PAHANDUT, PAHANDUT, KOTA PALANGKARAYA, KALIMANTAN TENGAH",69,34,48,82
https://kawalpemilu.org#60453,"PANGKALAN DURIN, PANGKALAN LADA, KOTAWARINGIN BARAT, KALIMANTAN TENGAH",2,154,35,189
https://kawalpemilu.org#60444,"PANDU SANJAYA, PANGKALAN LADA, KOTAWARINGIN BARAT, KALIMANTAN TENGAH",12,201,13,214
https://kawalpemilu.org#61637,"BAHAUR HILIR, KAHAYAN KUALA, PULANG PISAU, KALIMANTAN TENGAH",2,70,168,238
https://kawalpemilu.org#60560,"SAMUDA BESAR, MENTAYA HILIR SELATAN, KOTAWARINGIN TIMUR, KALIMANTAN TENGAH",3,39,128,167
https://kawalpemilu.org#60657,"SELAT TENGAH, SELAT, KAPUAS, KALIMANTAN TENGAH",24,30,96,126
https://kawalpemilu.org#61386,"BUKIT SUNGKAI, BALAI RIAM, SUKAMARA, KALIMANTAN TENGAH",1,186,47,233
https://kawalpemilu.org#61175,"TUMBANG SANAMANG, KATINGAN HULU, KATINGAN, KALIMANTAN TENGAH",6,134,56,190
https://kawalpemilu.org#60461,"AMIN JAYA, PANGKALAN BANTENG, KOTAWARINGIN BARAT, KALIMANTAN TENGAH",9,180,20,200
https://kawalpemilu.org#85363,"SUNGAI PULAU, PANGKALAN BANTENG, KOTAWARINGIN BARAT, KALIMANTAN TENGAH",2,149,34,183
https://kawalpemilu.org#61701,"JABIREN, JABIREN, PULANG PISAU, KALIMANTAN TENGAH",8,87,29,116
https://kawalpemilu.org#61651,"PAMARUNAN, KAHAYAN TENGAH, PULANG PISAU, KALIMANTAN TENGAH",1,147,22,169
https://kawalpemilu.org#61946,"PALANGKA, JEKAN RAYA, KOTA PALANGKARAYA, KALIMANTAN TENGAH",90,59,108,167
https://kawalpemilu.org#85407,"GANDANG BARAT, MALIKU, PULANG PISAU, KALIMANTAN TENGAH",3,113,48,161
https://kawalpemilu.org#64485,"PERANGAT BARU, MARANG KAYU, KUTAI KARTANEGARA, KALIMANTAN TIMUR",2,133,96,229
https://kawalpemilu.org#65560,"GUNUNGBAHAGIA, BALIKPAPAN SELATAN, KOTA BALIKPAPAN, KALIMANTAN TIMUR",24,79,58,137
https://kawalpemilu.org#64259,"JANTUR SELATAN, MUARA MUNTAI, KUTAI KARTANEGARA, KALIMANTAN TIMUR",3,133,76,209
https://kawalpemilu.org#65547,"GUNUNGSARI ULU, BALIKPAPAN TENGAH, KOTA BALIKPAPAN, KALIMANTAN TIMUR",36,83,80,163
https://kawalpemilu.org#65557,"KLANDASAN ILIR, BALIKPAPAN KOTA, KOTA BALIKPAPAN, KALIMANTAN TIMUR",65,85,60,145
https://kawalpemilu.org#64389,"MENAMANG KANAN, MUARA KAMAN, KUTAI KARTANEGARA, KALIMANTAN TIMUR",1,213,19,232
https://kawalpemilu.org#65585,"GUNUNG KELUA, SAMARINDA ULU, KOTA SAMARINDA, KALIMANTAN TIMUR",7,74,114,188
https://kawalpemilu.org#65600,"LOA BAKUNG, SUNGAI KUNJANG, KOTA SAMARINDA, KALIMANTAN TIMUR",43,48,98,146
https://kawalpemilu.org#64553,"GAYAM, TANJUNG REDEB, BERAU, KALIMANTAN TIMUR",27,62,47,109
https://kawalpemilu.org#64430,"HANDIL BARU, SAMBOJA, KUTAI KARTANEGARA, KALIMANTAN TIMUR",10,21,41,62
https://kawalpemilu.org#65267,"MUHUR, SILUQ NGURAI, KUTAI BARAT, KALIMANTAN TIMUR",3,206,15,221
https://kawalpemilu.org#64176,"LOMBOK, LONG IKIS, PASER, KALIMANTAN TIMUR",5,103,101,204
https://kawalpemilu.org#65581,"AIR PUTIH, SAMARINDA ULU, KOTA SAMARINDA, KALIMANTAN TIMUR",57,71,86,157
https://kawalpemilu.org#64573,"KASAI, PULAU DERAWAN, BERAU, KALIMANTAN TIMUR",5,136,53,189
https://kawalpemilu.org#65592,"PELITA, SAMARINDA ILIR, KOTA SAMARINDA, KALIMANTAN TIMUR",23,82,144,226
https://kawalpemilu.org#65406,"BUMI SEJAHTERA, KALIORANG, KUTAI TIMUR, KALIMANTAN TIMUR",3,114,83,197
https://kawalpemilu.org#64354,"KOTA BANGUN SEBERANG, KOTA BANGUN, KUTAI KARTANEGARA, KALIMANTAN TIMUR",2,164,68,232
https://kawalpemilu.org#65571,"BUKUAN, PALARAN, KOTA SAMARINDA, KALIMANTAN TIMUR",25,115,34,149
https://kawalpemilu.org#65517,"TENGIN BARU, SEPAKU, PENAJAM PASER UTARA, KALIMANTAN TIMUR",5,192,64,256
https://kawalpemilu.org#65154,"SIMPANG RAYA, BARONG TONGKOK, KUTAI BARAT, KALIMANTAN TIMUR",1,197,48,245
https://kawalpemilu.org#92885,"MUARA BUNYUT, MELAK, KUTAI BARAT, KALIMANTAN TIMUR",3,99,4,103
https://kawalpemilu.org#65557,"KLANDASAN ILIR, BALIKPAPAN KOTA, KOTA BALIKPAPAN, KALIMANTAN TIMUR",1,117,34,151
https://kawalpemilu.org#65148,"GELEO BARU, BARONG TONGKOK, KUTAI BARAT, KALIMANTAN TIMUR",3,187,12,199
https://kawalpemilu.org#64145,"JANJU, TANAH GROGOT, PASER, KALIMANTAN TIMUR",5,54,112,166
https://kawalpemilu.org#64427,"TANJUNG HARAPAN, SAMBOJA, KUTAI KARTANEGARA, KALIMANTAN TIMUR",5,70,99,169
https://kawalpemilu.org#65603,"LOK BAHU, SUNGAI KUNJANG, KOTA SAMARINDA, KALIMANTAN TIMUR",50,111,137,248
https://kawalpemilu.org#65672,"BELIMBING, BONTANG BARAT, KOTA BONTANG, KALIMANTAN TIMUR",10,79,112,191
https://kawalpemilu.org#65579,"TELUK LERONG ILIR, SAMARINDA ULU, KOTA SAMARINDA, KALIMANTAN TIMUR",36,77,109,186
https://kawalpemilu.org#64824,"PA'LEMUMUT, LUMBIS, NUNUKAN, KALIMANTAN UTARA",1,34,9,43
https://kawalpemilu.org#64715,"BALANSIKU, SEBATIK, NUNUKAN, KALIMANTAN UTARA",5,93,10,103
https://kawalpemilu.org#65650,"PANTAI AMAL, TARAKAN TIMUR, KOTA TARAKAN, KALIMANTAN UTARA",12,172,54,226
https://kawalpemilu.org#85473,"SUNGAI NYAMUK, SEBATIK TIMUR, NUNUKAN, KALIMANTAN UTARA",3,140,63,203
https://kawalpemilu.org#64654,"JELARAI SELOR, TANJUNG SELOR, BULUNGAN, KALIMANTAN UTARA",14,88,32,120
https://kawalpemilu.org#64905,"TINAMPAK II, TULIN ONSOI, NUNUKAN, KALIMANTAN UTARA",1,106,2,108
https://kawalpemilu.org#25115,"AIR BATU BUDING, BADAU, BELITUNG, KEPULAUAN BANGKA BELITUNG",3,170,38,208
https://kawalpemilu.org#25240,"KULUR, LUBUK BESAR, BANGKA TENGAH, KEPULAUAN BANGKA BELITUNG",4,98,11,109
https://kawalpemilu.org#25307,"TELAK, PARITTIGA, BANGKA BARAT, KEPULAUAN BANGKA BELITUNG",2,146,126,272
https://kawalpemilu.org#25096,"PULAU SUMEDANG, MEMBALONG, BELITUNG, KEPULAUAN BANGKA BELITUNG",1,141,15,156
https://kawalpemilu.org#25322,"LALANG, MANGGAR, BELITUNG TIMUR, KEPULAUAN BANGKA BELITUNG",4,169,58,227
https://kawalpemilu.org#25346,"PEMBAHARUAN, KELAPA KAMPIT, BELITUNG TIMUR, KEPULAUAN BANGKA BELITUNG",8,100,8,108
https://kawalpemilu.org#25371,"AIR ITAM, BUKITINTAN, KOTA PANGKALPINANG, KEPULAUAN BANGKA BELITUNG",4,85,174,259
https://kawalpemilu.org#25013,"BATU RUSA, MERAWANG, BANGKA, KEPULAUAN BANGKA BELITUNG",10,114,127,241
https://kawalpemilu.org#25220,"SUNGKAP, SIMPANG KATIS, BANGKA TENGAH, KEPULAUAN BANGKA BELITUNG",5,72,148,220
https://kawalpemilu.org#25160,"PAYUNG, PAYUNG, BANGKA SELATAN, KEPULAUAN BANGKA BELITUNG",11,130,77,207
https://kawalpemilu.org#25593,"TELAGA TUJUH, DURAI, KARIMUN, KEPULAUAN RIAU",2,93,66,159
https://kawalpemilu.org#25810,"BALOI PERMAI, BATAM KOTA, KOTA BATAM, KEPULAUAN RIAU",84,77,88,165
https://kawalpemilu.org#25570,"DARUSSALAM, MERAL BARAT, KARIMUN, KEPULAUAN RIAU",6,51,110,161
https://kawalpemilu.org#25813,"SUNGAI BINTI, SAGULUNG, KOTA BATAM, KEPULAUAN RIAU",1,59,107,166
https://kawalpemilu.org#25795,"REMPANG CATE, GALANG, KOTA BATAM, KEPULAUAN RIAU",4,89,41,130
https://kawalpemilu.org#25810,"BALOI PERMAI, BATAM KOTA, KOTA BATAM, KEPULAUAN RIAU",5,86,64,150
https://kawalpemilu.org#25580,"SEI UNGAR UTARA, KUNDUR UTARA, KARIMUN, KEPULAUAN RIAU",6,76,101,177
https://kawalpemilu.org#25805,"TELUK TERING, BATAM KOTA, KOTA BATAM, KEPULAUAN RIAU",18,226,20,246
https://kawalpemilu.org#25781,"KAMPUNG PELITA, LUBUK BAJA, KOTA BATAM, KEPULAUAN RIAU",16,22,44,66
https://kawalpemilu.org#25810,"BALOI PERMAI, BATAM KOTA, KOTA BATAM, KEPULAUAN RIAU",66,103,100,203
https://kawalpemilu.org#84861,"SUNGAILAKAM BARAT, KARIMUN, KARIMUN, KEPULAUAN RIAU",4,82,79,161
https://kawalpemilu.org#25416,"BATU IX, TANJUNG PINANG TIMUR, KOTA TANJUNGPINANG, KEPULAUAN RIAU",16,80,139,219
https://kawalpemilu.org#25814,"SUNGAI LEKOP, SAGULUNG, KOTA BATAM, KEPULAUAN RIAU",20,174,55,229
https://kawalpemilu.org#25815,"SAGULUNG KOTA, SAGULUNG, KOTA BATAM, KEPULAUAN RIAU",7,98,36,134
https://kawalpemilu.org#22953,"NUNGGAL REJO, PUNGGUR, LAMPUNG TENGAH, LAMPUNG",2,199,37,236
https://kawalpemilu.org#22889,"PONCO WARNO, KALIREJO, LAMPUNG TENGAH, LAMPUNG",6,114,43,157
https://kawalpemilu.org#24932,"HANURA, TELUK PANDAN, PESAWARAN, LAMPUNG",4,73,79,152
https://kawalpemilu.org#23980,"SUMBER MULYA, PULAU PANGGUNG, TANGGAMUS, LAMPUNG",5,79,97,176
https://kawalpemilu.org#22691,"TARAHAN, KATIBUNG, LAMPUNG SELATAN, LAMPUNG",6,102,140,242
https://kawalpemilu.org#929386,"SIMPANG MESUJI, SIMPANG PEMATANG, MESUJI, LAMPUNG",3,81,162,243
https://kawalpemilu.org#22731,"TANJUNG SARI, PALAS, LAMPUNG SELATAN, LAMPUNG",6,131,21,152
https://kawalpemilu.org#87250,"SUMBERREJO SEJAHTERA, KEMILING, KOTA BANDAR LAMPUNG, LAMPUNG",12,135,87,222
https://kawalpemilu.org#24956,"KAMPUNG BARU, MARGA PUNDUH, PESAWARAN, LAMPUNG",6,60,91,151
https://kawalpemilu.org#87255,"KOTA SEPANG, LABUHAN RATU, KOTA BANDAR LAMPUNG, LAMPUNG",12,86,78,164
https://kawalpemilu.org#24677,"ADI JAYA, NEGARA BATIN, WAY KANAN, LAMPUNG",2,133,36,169
https://kawalpemilu.org#23093,"GUNUNGHAJI, PUBIAN, LAMPUNG TENGAH, LAMPUNG",4,97,59,156
https://kawalpemilu.org#23823,"SUKAMAJU, BANJAR MARGO, TULANG BAWANG, LAMPUNG",3,114,131,245
https://kawalpemilu.org#23300,"KOTA NEGARA, SUNGKAI UTARA, LAMPUNG UTARA, LAMPUNG",45,141,72,213
https://kawalpemilu.org#23975,"PULAU PANGGUNG, PULAU PANGGUNG, TANGGAMUS, LAMPUNG",3,54,103,157
https://kawalpemilu.org#22516,"SRI TANJUNG, TANJUNG RAYA, MESUJI, LAMPUNG",2,132,16,148
https://kawalpemilu.org#24399,"SRIMENANTI, BANDAR SRIBHAWONO, LAMPUNG TIMUR, LAMPUNG",1,129,81,210
https://kawalpemilu.org#24549,"BALI SADAR TENGAH, BANJIT, WAY KANAN, LAMPUNG",4,184,45,229
https://kawalpemilu.org#23279,"CANDI MAS, ABUNG SELATAN, LAMPUNG UTARA, LAMPUNG",52,34,96,130
https://kawalpemilu.org#23577,"TAPAK SIRING, SUKAU, LAMPUNG BARAT, LAMPUNG",2,18,102,120
https://kawalpemilu.org#23340,"PEKURUN BARAT, ABUNG TENGAH, LAMPUNG UTARA, LAMPUNG",36,86,46,132
https://kawalpemilu.org#22642,"PURWODADI SIMPANG, TANJUNG BINTANG, LAMPUNG SELATAN, LAMPUNG",12,147,81,228
https://kawalpemilu.org#23228,"MERAMBUNG, TANJUNG RAJA, LAMPUNG UTARA, LAMPUNG",75,29,86,115
https://kawalpemilu.org#22682,"SUAK, SIDOMULYO, LAMPUNG SELATAN, LAMPUNG",10,113,88,201
https://kawalpemilu.org#22971,"TERBANGGI BESAR, TERBANGGI BESAR, LAMPUNG TENGAH, LAMPUNG",52,80,80,160
https://kawalpemilu.org#24209,"TERBANGGI MARGA, SUKADANA, LAMPUNG TIMUR, LAMPUNG",6,122,83,205
https://kawalpemilu.org#23288,"KEMBANG GADING, ABUNG SELATAN, LAMPUNG UTARA, LAMPUNG",1,0,0,0
https://kawalpemilu.org#87259,"BUMI KEDAMAIAN, KEDAMAIAN, KOTA BANDAR LAMPUNG, LAMPUNG",27,81,129,210
https://kawalpemilu.org#22525,"PANARAGAN, TULANG BAWANG TENGAH, TULANG BAWANG BARAT, LAMPUNG",4,50,130,180
https://kawalpemilu.org#84833,"MULYO ASRI, TULANG BAWANG TENGAH, TULANG BAWANG BARAT, LAMPUNG",16,68,130,198
https://kawalpemilu.org#24297,"BRAJA SAKTI, WAY JEPARA, LAMPUNG TIMUR, LAMPUNG",12,105,79,184
https://kawalpemilu.org#22958,"NGESTI RAHAYU, PUNGGUR, LAMPUNG TENGAH, LAMPUNG",9,168,47,215
