https://kawalpemilu.org#23830,"AGUNG JAYA, BANJAR MARGO, TULANG BAWANG, LAMPUNG",9,179,46,225
https://kawalpemilu.org#24825,"HADIMULYO TIMUR, METRO PUSAT, KOTA METRO, LAMPUNG",2,84,136,220
https://kawalpemilu.org#22525,"PANARAGAN, TULANG BAWANG TENGAH, TULANG BAWANG BARAT, LAMPUNG",7,30,101,131
https://kawalpemilu.org#22607,"HAJIMENA, NATAR, LAMPUNG SELATAN, LAMPUNG",16,42,70,112
https://kawalpemilu.org#24420,"NEGERI AGUNG, GUNUNG PELINDUNG, LAMPUNG TIMUR, LAMPUNG",11,174,17,191
https://kawalpemilu.org#23769,"TRI TUNGGAL JAYA, BANJAR AGUNG, TULANG BAWANG, LAMPUNG",3,101,95,196
https://kawalpemilu.org#22744,"MEKAR MULYA, PALAS, LAMPUNG SELATAN, LAMPUNG",15,107,74,181
https://kawalpemilu.org#24648,"BANJAR SAKTI, GUNUNG LABUHAN, WAY KANAN, LAMPUNG",1,64,114,178
https://kawalpemilu.org#22943,"NOTO HARJO, TRIMURJO, LAMPUNG TENGAH, LAMPUNG",11,149,55,204
https://kawalpemilu.org#24227,"KARYA TANI, LABUHAN MARINGGAI, LAMPUNG TIMUR, LAMPUNG",15,121,54,175
https://kawalpemilu.org#24714,"SURABAYA, KEDATON, KOTA BANDAR LAMPUNG, LAMPUNG",18,71,98,169
https://kawalpemilu.org#24838,"GANJAR ASRI, METRO BARAT, KOTA METRO, LAMPUNG",16,130,53,183
https://kawalpemilu.org#23153,"BUMI NABUNG ILIR, BUMI NABUNG, LAMPUNG TENGAH, LAMPUNG",19,119,44,163
https://kawalpemilu.org#92003,"RAJABASA PEMUKA, RAJABASA, KOTA BANDAR LAMPUNG, LAMPUNG",14,66,200,266
https://kawalpemilu.org#24126,"SUKA BANJAR, KOTA AGUNG TIMUR, TANGGAMUS, LAMPUNG",6,65,39,104
https://kawalpemilu.org#24666,"NEGARA BATIN, NEGARA BATIN, WAY KANAN, LAMPUNG",5,191,76,267
https://kawalpemilu.org#24206,"BUMI NABUNG UDIK, SUKADANA, LAMPUNG TIMUR, LAMPUNG",3,56,81,137
https://kawalpemilu.org#23418,"SUMBER TANI, ABUNG PEKURUN, LAMPUNG UTARA, LAMPUNG",1,0,0,0
https://kawalpemilu.org#23302,"BARU RAHARJA, SUNGKAI UTARA, LAMPUNG UTARA, LAMPUNG",11,11,54,65
https://kawalpemilu.org#23328,"ALAM JAYA, KOTABUMI SELATAN, LAMPUNG UTARA, LAMPUNG",16,30,135,165
https://kawalpemilu.org#23141,"SENDANG ASRI, SENDANG AGUNG, LAMPUNG TENGAH, LAMPUNG",1,82,114,196
https://kawalpemilu.org#22668,"GUNUNG TERANG, KALIANDA, LAMPUNG SELATAN, LAMPUNG",3,83,102,185
https://kawalpemilu.org#23739,"MENGGALA SELATAN, MENGGALA, TULANG BAWANG, LAMPUNG",14,128,89,217
https://kawalpemilu.org#24225,"BANDAR NEGERI, LABUHAN MARINGGAI, LAMPUNG TIMUR, LAMPUNG",7,126,86,212
https://kawalpemilu.org#24072,"GUNUNG SARI, ULU BELU, TANGGAMUS, LAMPUNG",11,104,47,151
https://kawalpemilu.org#23311,"MARGO REJO, KOTABUMI UTARA, LAMPUNG UTARA, LAMPUNG",63,71,118,189
https://kawalpemilu.org#24783,"NEGERI OLOK GADING, TELUKBETUNG BARAT, KOTA BANDAR LAMPUNG, LAMPUNG",17,34,216,250
https://kawalpemilu.org#22363,"KRESNO MULYO, AMBARAWA, PRINGSEWU, LAMPUNG",11,110,31,141
https://kawalpemilu.org#24915,"TANJUNG AGUNG, WAY LIMA, PESAWARAN, LAMPUNG",1,49,172,221
https://kawalpemilu.org#23086,"MATARAM UDIK, BANDAR MATARAM, LAMPUNG TENGAH, LAMPUNG",99,151,94,245
https://kawalpemilu.org#23109,"NYUKANG HARJO, SELAGAI LINGGA, LAMPUNG TENGAH, LAMPUNG",12,73,15,88
https://kawalpemilu.org#24177,"AIR KUBANG, AIR NANINGAN, TANGGAMUS, LAMPUNG",4,61,139,200
https://kawalpemilu.org#23017,"WIRATA AGUNG, SEPUTIH MATARAM, LAMPUNG TENGAH, LAMPUNG",6,190,22,212
https://kawalpemilu.org#22677,"TALANG BARU, SIDOMULYO, LAMPUNG SELATAN, LAMPUNG",7,55,31,86
https://kawalpemilu.org#23149,"PURWOREJO, KOTA GAJAH, LAMPUNG TENGAH, LAMPUNG",7,139,72,211
https://kawalpemilu.org#22434,"KEPUTRAN, SUKOHARJO, PRINGSEWU, LAMPUNG",1,112,112,224
https://kawalpemilu.org#24181,"DATAR LEBUAY, AIR NANINGAN, TANGGAMUS, LAMPUNG",15,111,74,185
https://kawalpemilu.org#23150,"KOTA GAJAH, KOTA GAJAH, LAMPUNG TENGAH, LAMPUNG",8,160,86,246
https://kawalpemilu.org#22686,"SIDODADI, SIDOMULYO, LAMPUNG SELATAN, LAMPUNG",3,155,54,209
https://kawalpemilu.org#24534,"RANTAU TEMIANG, BANJIT, WAY KANAN, LAMPUNG",3,14,180,194
https://kawalpemilu.org#23078,"LEMPUYANG BANDAR, WAY PENGUBUAN, LAMPUNG TENGAH, LAMPUNG",33,86,123,209
https://kawalpemilu.org#22950,"PUJO ASRI, TRIMURJO, LAMPUNG TENGAH, LAMPUNG",2,130,89,219
https://kawalpemilu.org#23432,"SRI AGUNG, SUNGKAI JAYA, LAMPUNG UTARA, LAMPUNG",29,44,110,154
https://kawalpemilu.org#24440,"TANJUNG WANGI, WAWAY KARYA, LAMPUNG TIMUR, LAMPUNG",12,150,34,184
https://kawalpemilu.org#-990474,"Kuwait City, Kuwait City, Kuwait, Luar Negeri",5,183,189,372
https://kawalpemilu.org#-991204,"Perth, Perth, Australia, Luar Negeri",18,63,13,76
https://kawalpemilu.org#-991304,"Taipei, Taipei, Taiwan, Luar Negeri",1002,922,148,1070
https://kawalpemilu.org#-990594,"New Delhi, New Delhi, India, Luar Negeri",1001,67,21,88
https://kawalpemilu.org#-990484,"Lima, Lima, Peru, Luar Negeri",1001,21,2,23
https://kawalpemilu.org#-990374,"Harare, Harare, Zimbabwe, Luar Negeri",3,58,19,77
https://kawalpemilu.org#-990464,"Kuala Lumpur, Kuala Lumpur, Malaysia, Luar Negeri",154,67,33,100
https://kawalpemilu.org#-991304,"Taipei, Taipei, Taiwan, Luar Negeri",32,372,49,421
https://kawalpemilu.org#77631,"LEMO LEMO, GANE BARAT, HALMAHERA SELATAN, MALUKU UTARA",2,62,80,142
https://kawalpemilu.org#77313,"NUSLIKO, WEDA, HALMAHERA TENGAH, MALUKU UTARA",2,125,8,133
https://kawalpemilu.org#89622,"SAMA, SULABESI TIMUR, KEPULAUAN SULA, MALUKU UTARA",2,50,99,149
https://kawalpemilu.org#77289,"TOBELOS, IBU SELATAN, HALMAHERA BARAT, MALUKU UTARA",2,132,13,145
https://kawalpemilu.org#77515,"SOAKONORA, GALELA SELATAN, HALMAHERA UTARA, MALUKU UTARA",3,56,96,152
https://kawalpemilu.org#77191,"TUGUIS, LOLODA, HALMAHERA BARAT, MALUKU UTARA",1,176,18,194
https://kawalpemilu.org#77378,"KUMO, TOBELO, HALMAHERA UTARA, MALUKU UTARA",2,192,1,193
https://kawalpemilu.org#77745,"MANDAWONG, BACAN SELATAN, HALMAHERA SELATAN, MALUKU UTARA",3,44,115,159
https://kawalpemilu.org#77645,"BARU, OBI, HALMAHERA SELATAN, MALUKU UTARA",1,58,143,201
https://kawalpemilu.org#77854,"MADOPOLO BARAT, OBI UTARA, HALMAHERA SELATAN, MALUKU UTARA",2,76,126,202
https://kawalpemilu.org#76391,"TUHAHA, SAPARUA TIMUR, MALUKU TENGAH, MALUKU",6,174,4,178
https://kawalpemilu.org#76787,"URAUR, KAIRATU, SERAM BAGIAN BARAT, MALUKU",1,217,10,227
https://kawalpemilu.org#77035,"HUNUTH/DURIAN PATAH, TELUK AMBON, KOTA AMBON, MALUKU",7,37,203,240
https://kawalpemilu.org#76257,"PASIR PUTIH, KEPALA MADAN, BURU SELATAN, MALUKU",7,103,42,145
https://kawalpemilu.org#77040,"HATIVE BESAR, TELUK AMBON, KOTA AMBON, MALUKU",7,168,4,172
https://kawalpemilu.org#76287,"TAMILOUW, AMAHAI, MALUKU TENGAH, MALUKU",19,156,52,208
https://kawalpemilu.org#76644,"LORWEMBUN, KORMOMOLIN, MALUKU TENGGARA BARAT, MALUKU",1,140,2,142
https://kawalpemilu.org#77060,"DULLAH LAUT, PULAU DULLAH UTARA, KOTA TUAL, MALUKU",5,154,3,157
https://kawalpemilu.org#76505,"FAA, KEI BESAR UTARA BARAT, MALUKU TENGGARA, MALUKU",1,45,123,168
https://kawalpemilu.org#928806,"DUDUNWAHAN, KEI KECIL, MALUKU TENGGARA, MALUKU",2,111,82,193
https://kawalpemilu.org#76727,"KUWAOS, SIRITAUN WIDA TIMUR, SERAM BAGIAN TIMUR, MALUKU",4,30,171,201
https://kawalpemilu.org#76310,"WATLUDAN, TEON NILA SERUA, MALUKU TENGAH, MALUKU",3,198,9,207
https://kawalpemilu.org#77024,"SOYA, SIRIMAU, KOTA AMBON, MALUKU",18,197,19,216
https://kawalpemilu.org#91171,"OTADEMAN, WAKATE, SERAM BAGIAN TIMUR, MALUKU",2,35,147,182
https://kawalpemilu.org#54213,"SEPAKEK, PRINGGARATA, LOMBOK TENGAH, NUSA TENGGARA BARAT",7,51,90,141
https://kawalpemilu.org#54960,"TANJUNG KARANG, SEKARBELA, KOTA MATARAM, NUSA TENGGARA BARAT",9,59,114,173
https://kawalpemilu.org#54424,"MOTONG, UTAN, SUMBAWA, NUSA TENGGARA BARAT",1,62,166,228
https://kawalpemilu.org#54717,"ROKA, BELO, BIMA, NUSA TENGGARA BARAT",5,14,173,187
https://kawalpemilu.org#85057,"LENEK RAMBAN BIAK, AIKMEL, LOMBOK TIMUR, NUSA TENGGARA BARAT",2,119,35,154
https://kawalpemilu.org#54249,"PANDAN INDAH, PRAYA BARAT DAYA, LOMBOK TENGAH, NUSA TENGGARA BARAT",16,65,78,143
https://kawalpemilu.org#54197,"GANTI, PRAYA TIMUR, LOMBOK TENGAH, NUSA TENGGARA BARAT",26,193,34,227
https://kawalpemilu.org#54959,"KARANG PULE, SEKARBELA, KOTA MATARAM, NUSA TENGGARA BARAT",40,102,101,203
https://kawalpemilu.org#54295,"LENDANG NANGKA, MASBAGIK, LOMBOK TIMUR, NUSA TENGGARA BARAT",30,54,109,163
https://kawalpemilu.org#54290,"PAOK MOTONG, MASBAGIK, LOMBOK TIMUR, NUSA TENGGARA BARAT",39,33,129,162
https://kawalpemilu.org#54083,"SESELA, GUNUNGSARI, LOMBOK BARAT, NUSA TENGGARA BARAT",32,42,147,189
https://kawalpemilu.org#54182,"MANGKUNG, PRAYA BARAT, LOMBOK TENGAH, NUSA TENGGARA BARAT",7,61,128,185
https://kawalpemilu.org#55000,"JATIWANGI, ASAKOTA, KOTA BIMA, NUSA TENGGARA BARAT",3,53,167,220
https://kawalpemilu.org#54719,"TARLAWI, WAWO, BIMA, NUSA TENGGARA BARAT",4,49,184,233
https://kawalpemilu.org#85077,"PRINGGASELA TIMUR, PRINGGASELA, LOMBOK TIMUR, NUSA TENGGARA BARAT",6,129,60,189
https://kawalpemilu.org#54147,"PUYUNG, JONGGAT, LOMBOK TENGAH, NUSA TENGGARA BARAT",34,30,122,152
https://kawalpemilu.org#54602,"DORE BARA, DOMPU, DOMPU, NUSA TENGGARA BARAT",7,48,147,195
https://kawalpemilu.org#54330,"KALIJAGA TIMUR, AIKMEL, LOMBOK TIMUR, NUSA TENGGARA BARAT",4,32,142,174
https://kawalpemilu.org#85010,"BATU PUTIK, KERUAK, LOMBOK TIMUR, NUSA TENGGARA BARAT",3,75,104,179
https://kawalpemilu.org#55062,"PEMENANG BARAT, PEMENANG, LOMBOK UTARA, NUSA TENGGARA BARAT",12,74,124,198
https://kawalpemilu.org#54193,"MUJUR, PRAYA TIMUR, LOMBOK TENGAH, NUSA TENGGARA BARAT",19,80,100,180
https://kawalpemilu.org#54654,"LANCI JAYA, MANGGELEWA, DOMPU, NUSA TENGGARA BARAT",5,43,174,217
https://kawalpemilu.org#54933,"KEBUN SARI, AMPENAN, KOTA MATARAM, NUSA TENGGARA BARAT",2,36,169,205
https://kawalpemilu.org#54966,"DASAN AGUNG, SELAPARANG, KOTA MATARAM, NUSA TENGGARA BARAT",16,18,201,219
https://kawalpemilu.org#54978,"SELAGALAS, SANDUBAYA, KOTA MATARAM, NUSA TENGGARA BARAT",20,70,142,212
https://kawalpemilu.org#54341,"KILANG, MONTONG GADING, LOMBOK TIMUR, NUSA TENGGARA BARAT",2,72,139,211
https://kawalpemilu.org#54154,"BUJAK, BATUKLIANG, LOMBOK TENGAH, NUSA TENGGARA BARAT",34,50,89,139
https://kawalpemilu.org#54963,"KEKALIK JAYA, SEKARBELA, KOTA MATARAM, NUSA TENGGARA BARAT",27,44,151,195
https://kawalpemilu.org#927565,"SORITATANGA, PEKAT, DOMPU, NUSA TENGGARA BARAT",2,64,84,148
https://kawalpemilu.org#54897,"SAPUGARA BREE, BRANG REA, SUMBAWA BARAT, NUSA TENGGARA BARAT",4,68,146,214
https://kawalpemilu.org#927550,"BATU LAYAR BARAT, BATU LAYAR, LOMBOK BARAT, NUSA TENGGARA BARAT",3,52,129,181
https://kawalpemilu.org#87711,"BANJARSARI, LABUHAN HAJI, LOMBOK TIMUR, NUSA TENGGARA BARAT",1,42,129,171
https://kawalpemilu.org#54185,"PENUJAK, PRAYA BARAT, LOMBOK TENGAH, NUSA TENGGARA BARAT",29,55,205,260
https://kawalpemilu.org#54301,"SUKAMULIA, SUKAMULIA, LOMBOK TIMUR, NUSA TENGGARA BARAT",1,85,124,209
https://kawalpemilu.org#85011,"KETAPANG RAYA, KERUAK, LOMBOK TIMUR, NUSA TENGGARA BARAT",13,109,60,169
https://kawalpemilu.org#54698,"SAMILI, WOHA, BIMA, NUSA TENGGARA BARAT",4,14,164,178
https://kawalpemilu.org#55036,"GONDANG, GANGGA, LOMBOK UTARA, NUSA TENGGARA BARAT",1,78,131,209
https://kawalpemilu.org#54980,"TURIDA, SANDUBAYA, KOTA MATARAM, NUSA TENGGARA BARAT",8,33,151,184
https://kawalpemilu.org#54938,"PAGESANGAN, MATARAM, KOTA MATARAM, NUSA TENGGARA BARAT",16,161,5,166
https://kawalpemilu.org#54819,"LABUHAN KANANGA, TAMBORA, BIMA, NUSA TENGGARA BARAT",6,65,65,130
https://kawalpemilu.org#57151,"LIANG BUA, RAHONG UTARA, MANGGARAI, NUSA TENGGARA TIMUR",1,83,3,86
https://kawalpemilu.org#55123,"KEL. OESAO, KUPANG TIMUR, KUPANG, NUSA TENGGARA TIMUR",4,235,8,243
https://kawalpemilu.org#58058,"NAIMATA, MAULAFA, KOTA KUPANG, NUSA TENGGARA TIMUR",8,195,5,200
https://kawalpemilu.org#55554,"KIUFATU, KUALIN, TIMOR TENGAH SELATAN, NUSA TENGGARA TIMUR",6,193,9,202
https://kawalpemilu.org#56808,"MAUSAMBI, MAUROLE, ENDE, NUSA TENGGARA TIMUR",4,159,13,172
https://kawalpemilu.org#55533,"SE'I, KOLBANO, TIMOR TENGAH SELATAN, NUSA TENGGARA TIMUR",3,225,11,236
https://kawalpemilu.org#55688,"MOTADIK, BIBOKI ANLEU, TIMOR TENGAH UTARA, NUSA TENGGARA TIMUR",1,232,9,241
https://kawalpemilu.org#55136,"MANUSAK, KUPANG TIMUR, KUPANG, NUSA TENGGARA TIMUR",3,139,56,195
https://kawalpemilu.org#56767,"MAUTENDA, WEWARIA, ENDE, NUSA TENGGARA TIMUR",9,111,0,111
https://kawalpemilu.org#90894,"WAITARU, KODI UTARA, SUMBA BARAT DAYA, NUSA TENGGARA TIMUR",5,160,13,173
https://kawalpemilu.org#56743,"WOLOTOLO TENGAH, DETUSOKO, ENDE, NUSA TENGGARA TIMUR",1,193,2,195
https://kawalpemilu.org#58086,"FONTEIN, KOTA RAJA, KOTA KUPANG, NUSA TENGGARA TIMUR",6,221,6,227
https://kawalpemilu.org#57488,"PADA, NUBATUKAN, LEMBATA, NUSA TENGGARA TIMUR",1,192,37,229
https://kawalpemilu.org#56831,"DETUPERA, LIO TIMUR, ENDE, NUSA TENGGARA TIMUR",1,171,7,178
https://kawalpemilu.org#55889,"UMAKATAHAN, MALAKA TENGAH, MALAKA, NUSA TENGGARA TIMUR",8,123,1,124
https://kawalpemilu.org#91332,"TANA METE, KODI BANGEDO, SUMBA BARAT DAYA, NUSA TENGGARA TIMUR",1,219,9,228
https://kawalpemilu.org#55676,"MAUBELI, KOTA KEFAMENANU, TIMOR TENGAH UTARA, NUSA TENGGARA TIMUR",4,236,45,281
https://kawalpemilu.org#56612,"WURING, ALOK BARAT, SIKKA, NUSA TENGGARA TIMUR",5,153,54,207
https://kawalpemilu.org#57715,"GOLO NDARING, SANO NGGOANG, MANGGARAI BARAT, NUSA TENGGARA TIMUR",2,100,33,133
https://kawalpemilu.org#56055,"KALABAHI TENGAH, TELUK MUTIARA, ALOR, NUSA TENGGARA TIMUR",17,120,20,140
https://kawalpemilu.org#55731,"AINAN, MUSI, TIMOR TENGAH UTARA, NUSA TENGGARA TIMUR",1,171,4,175
https://kawalpemilu.org#56983,"NARUWOLO, JEREBUU, NGADA, NUSA TENGGARA TIMUR",1,190,0,190
https://kawalpemilu.org#56047,"ALAS UTARA, KOBALIMA TIMUR, MALAKA, NUSA TENGGARA TIMUR",3,140,12,152
https://kawalpemilu.org#57030,"PONG MURUNG, RUTENG, MANGGARAI, NUSA TENGGARA TIMUR",3,120,4,124
https://kawalpemilu.org#55157,"MATA AIR, KUPANG TENGAH, KUPANG, NUSA TENGGARA TIMUR",5,222,12,234
https://kawalpemilu.org#56033,"TULAMALAE, ATAMBUA BARAT, BELU, NUSA TENGGARA TIMUR",4,163,11,174
https://kawalpemilu.org#56060,"WELAI TIMUR, TELUK MUTIARA, ALOR, NUSA TENGGARA TIMUR",4,167,41,208
https://kawalpemilu.org#57055,"TAL, SATAR MESE, MANGGARAI, NUSA TENGGARA TIMUR",5,120,11,129
https://kawalpemilu.org#85192,"WUE, WOLOMEZE, NGADA, NUSA TENGGARA TIMUR",2,112,6,118
https://kawalpemilu.org#57741,"LABUAN BAJO, KOMODO, MANGGARAI BARAT, NUSA TENGGARA TIMUR",4,124,54,178
https://kawalpemilu.org#58165,"LIANG DERUK, LAMBA LEDA, MANGGARAI TIMUR, NUSA TENGGARA TIMUR",1,203,36,239
https://kawalpemilu.org#55899,"HAREKAKAE, MALAKA TENGAH, MALAKA, NUSA TENGGARA TIMUR",6,94,20,114
https://kawalpemilu.org#57301,"KAMBANIRU, KAMBERA, SUMBA TIMUR, NUSA TENGGARA TIMUR",16,171,20,191
https://kawalpemilu.org#56920,"TODABELU, GOLEWA, NGADA, NUSA TENGGARA TIMUR",1,159,18,177
https://kawalpemilu.org#57255,"TAMMA, PAHUNGA LODU, SUMBA TIMUR, NUSA TENGGARA TIMUR",4,86,1,87
https://kawalpemilu.org#57595,"HELEBEIK, LOBALAIN, ROTE NDAO, NUSA TENGGARA TIMUR",3,124,3,127
https://kawalpemilu.org#56261,"TENAWAHANG, TITEHENA, FLORES TIMUR, NUSA TENGGARA TIMUR",3,168,16,184
https://kawalpemilu.org#927830,"SRUMAKIT, AIFAT TIMUR SELATAN, MAYBRAT, PAPUA BARAT",1,50,0,50
https://kawalpemilu.org#82096,"MAKBUSUN, MAYAMUK, SORONG, PAPUA BARAT",15,74,86,160
https://kawalpemilu.org#82097,"MAKBALIM, MAYAMUK, SORONG, PAPUA BARAT",5,51,134,185
https://kawalpemilu.org#83126,"AISANDAMI, TELUK DUAIRI, TELUK WONDAMA, PAPUA BARAT",1,105,3,108
https://kawalpemilu.org#927665,"KOCUAS UTARA, AIFAT, MAYBRAT, PAPUA BARAT",1,210,0,210
https://kawalpemilu.org#83308,"KLAWASI, SORONG BARAT, KOTA SORONG, PAPUA BARAT",12,92,115,155
https://kawalpemilu.org#927829,"WARMU, AIFAT TIMUR SELATAN, MAYBRAT, PAPUA BARAT",1,106,0,106
https://kawalpemilu.org#82098,"MAKOTYAMSA, MAYAMUK, SORONG, PAPUA BARAT",1,77,73,150
https://kawalpemilu.org#83112,"MANIWAK, WASIOR, TELUK WONDAMA, PAPUA BARAT",13,203,16,219
https://kawalpemilu.org#82981,"MOROMBUY, MERDEY, TELUK BINTUNI, PAPUA BARAT",1,171,0,171
https://kawalpemilu.org#79498,"PELANME, KELILA, MAMBERAMO TENGAH, PAPUA",1,300,0,300
https://kawalpemilu.org#79008,"ASIKI I, JAIR, BOVEN DIGOEL, PAPUA",55,53,15,68
https://kawalpemilu.org#79835,"SERINGGU JAYA, MERAUKE, MERAUKE, PAPUA",9,165,40,205
https://kawalpemilu.org#78572,"ALOPUR, KUARI, TOLIKARA, PAPUA",2,220,0,220
https://kawalpemilu.org#81354,"KAMEME, BIME, PEGUNUNGAN BINTANG, PAPUA",2,216,0,216
https://kawalpemilu.org#79835,"SERINGGU JAYA, MERAUKE, MERAUKE, PAPUA",12,75,13,88
https://kawalpemilu.org#81106,"MARARENA, SARMI, SARMI, PAPUA",9,80,40,120
https://kawalpemilu.org#930786,"KENEGI, EKADIDE, PANIAI, PAPUA",1,0,400,400
https://kawalpemilu.org#79832,"KELAPA LIMA, MERAUKE, MERAUKE, PAPUA",24,107,19,126
https://kawalpemilu.org#80010,"KOA, ANIMHA, MERAUKE, PAPUA",2,123,2,125
https://kawalpemilu.org#86794,"JUTA, GELOK BEAM, LANNY JAYA, PAPUA",2,210,0,210
https://kawalpemilu.org#79474,"LUARIMA, KOBAGMA, MAMBERAMO TENGAH, PAPUA",2,262,0,262
https://kawalpemilu.org#930635,"UTIKINI DUA, KUALA KENCANA, MIMIKA, PAPUA",1,300,0,300
https://kawalpemilu.org#86486,"LULIS WII, ABOY, PEGUNUNGAN BINTANG, PAPUA",1,202,0,202
https://kawalpemilu.org#86549,"OKBUMUL, OKLIP, PEGUNUNGAN BINTANG, PAPUA",1,114,0,114
https://kawalpemilu.org#79337,"RAYORI, KEPULAUAN ARURI, SUPIORI, PAPUA",6,193,4,197
https://kawalpemilu.org#79401,"BARAPASI, WAROPEN ATAS, MAMBERAMO RAYA, PAPUA",1,225,11,236
https://kawalpemilu.org#81028,"POUMAKO, MIMIKA TIMUR, MIMIKA, PAPUA",3,119,51,170
https://kawalpemilu.org#930777,"DIMIYA, YATAMO, PANIAI, PAPUA",1,291,0,291
https://kawalpemilu.org#79341,"YAMNAISU, KEPULAUAN ARURI, SUPIORI, PAPUA",2,144,5,149
https://kawalpemilu.org#930588,"KOMOPA, AWEIDA, PANIAI, PAPUA",1,212,0,212
https://kawalpemilu.org#930499,"MUYADEBE, WEGEE MUKA, PANIAI, PAPUA",1,200,0,200
https://kawalpemilu.org#79841,"WAN, MUTING, MERAUKE, PAPUA",1,179,7,186
https://kawalpemilu.org#81224,"WOSLAY, SENGGI, KEEROM, PAPUA",3,107,97,204
https://kawalpemilu.org#930735,"EMAI, ARADIDE, PANIAI, PAPUA",1,201,0,201
https://kawalpemilu.org#79010,"BOMAKIA I, BOMAKIA, BOVEN DIGOEL, PAPUA",2,75,5,80
https://kawalpemilu.org#79404,"BENSOR, WAROPEN ATAS, MAMBERAMO RAYA, PAPUA",1,189,4,193
https://kawalpemilu.org#89111,"TEKUL, BUGUK GONA, LANNY JAYA, PAPUA",4,267,0,267
https://kawalpemilu.org#930565,"NOMOUWODIDE, BAYA BIRU, PANIAI, PAPUA",3,262,0,262
https://kawalpemilu.org#79884,"YASA MULYA, TANAH MIRING, MERAUKE, PAPUA",4,91,93,184
https://kawalpemilu.org#930602,"PASAR SENTRAL, MIMIKA BARU, MIMIKA, PAPUA",1,227,30,257
https://kawalpemilu.org#79495,"TARI, KELILA, MAMBERAMO TENGAH, PAPUA",1,300,0,300
https://kawalpemilu.org#999003,"BUTUMO, YATAMO, PANIAI, PAPUA",1,300,0,300
https://kawalpemilu.org#80858,"MADI, PANIAI TIMUR, PANIAI, PAPUA",1,298,0,298
https://kawalpemilu.org#79321,"WARBOR, SUPIORI UTARA, SUPIORI, PAPUA",1,160,7,167
https://kawalpemilu.org#79004,"GETENTIRI I, JAIR, BOVEN DIGOEL, PAPUA",3,156,0,156
https://kawalpemilu.org#79440,"ASANO, ABEPURA, KOTA JAYAPURA, PAPUA",22,81,94,175
https://kawalpemilu.org#79994,"WETAU, WAAN, MERAUKE, PAPUA",1,182,5,187
https://kawalpemilu.org#14957,"UKUI I, UKUI, PELALAWAN, RIAU",8,133,92,225
https://kawalpemilu.org#15851,"BUKIT DATUK, DUMAI SELATAN, KOTA DUMAI, RIAU",11,106,48,154
https://kawalpemilu.org#15063,"SERAPUNG, KUALA KAMPAR, PELALAWAN, RIAU",7,55,73,128
https://kawalpemilu.org#15209,"BANGUN PURBA BARAT, BANGUN PURBA, ROKAN HULU, RIAU",1,70,167,237
https://kawalpemilu.org#14834,"Sencalang, Keritang, INDRAGIRI HILIR, RIAU",1,145,86,231
https://kawalpemilu.org#14095,"ALAH AIR TIMUR, TEBING TINGGI, KEPULAUAN MERANTI, RIAU",1,66,144,210
https://kawalpemilu.org#15493,"BUANTAN LESTARI, BUNGA RAYA, SIAK, RIAU",1,136,104,240
https://kawalpemilu.org#14504,"PANGKALAN KASAI, SIBERIDA, INDRAGIRI HULU, RIAU",11,72,90,162
https://kawalpemilu.org#15659,"SIKAKAK, CERENTI, KUANTAN SINGINGI, RIAU",4,24,171,195
https://kawalpemilu.org#14876,"SELENSEN, Kemuning, INDRAGIRI HILIR, RIAU",12,40,69,109
https://kawalpemilu.org#14170,"KUMANTAN, BANGKINANG KOTA, KAMPAR, RIAU",2,13,244,257
https://kawalpemilu.org#15511,"SIMPANG BELUTU, KANDIS, SIAK, RIAU",3,67,156,223
https://kawalpemilu.org#14992,"HARAPAN JAYA, PANGKALAN KURAS, PELALAWAN, RIAU",4,128,76,204
https://kawalpemilu.org#15854,"RATU SIMA, DUMAI SELATAN, KOTA DUMAI, RIAU",13,152,14,166
https://kawalpemilu.org#14970,"PANGKALAN KERINCI KOTA, PANGKALAN KERINCI, PELALAWAN, RIAU",81,29,134,163
https://kawalpemilu.org#15186,"RAMBAH, RAMBAH HILIR, ROKAN HULU, RIAU",19,90,41,131
https://kawalpemilu.org#931199,"TIRTASIAK, PAYUNG SEKAKI, KOTA PEKANBARU, RIAU",22,81,181,262
https://kawalpemilu.org#15214,"BONO TAPUNG, TANDUN, ROKAN HULU, RIAU",7,84,47,131
https://kawalpemilu.org#931187,"TOBEKGODANG, TAMPAN, KOTA PEKANBARU, RIAU",38,22,144,166
https://kawalpemilu.org#15872,"BAGAN BESAR, BUKIT KAPUR, KOTA DUMAI, RIAU",20,88,129,217
https://kawalpemilu.org#14769,"TANJUNGLAJAU, Kuala Indragiri, INDRAGIRI HILIR, RIAU",1,74,110,184
https://kawalpemilu.org#14763,"Suhada, Enok, INDRAGIRI HILIR, RIAU",4,78,142,220
https://kawalpemilu.org#14168,"BANGKINANG, BANGKINANG KOTA, KAMPAR, RIAU",17,12,211,223
https://kawalpemilu.org#14331,"SINAMA NENEK, TAPUNG HULU, KAMPAR, RIAU",6,68,97,165
https://kawalpemilu.org#14504,"PANGKALAN KASAI, SIBERIDA, INDRAGIRI HULU, RIAU",30,112,88,200
https://kawalpemilu.org#15875,"LUBUK GAUNG, SUNGAI SEMBILAN, KOTA DUMAI, RIAU",10,68,133,201
https://kawalpemilu.org#15841,"LIMBUNGAN, RUMBAI PESISIR, KOTA PEKANBARU, RIAU",1,12,131,143
https://kawalpemilu.org#15179,"RAMBAH HILIR TENGAH, RAMBAH HILIR, ROKAN HULU, RIAU",7,11,122,133
https://kawalpemilu.org#14695,"BATU PANJANG, RUPAT, BENGKALIS, RIAU",11,67,94,161
https://kawalpemilu.org#14945,"SUNGAIGANTANG, Kempas, INDRAGIRI HILIR, RIAU",2,52,121,173
https://kawalpemilu.org#14661,"MUNTAI, BANTAN, BENGKALIS, RIAU",5,82,91,173
https://kawalpemilu.org#15811,"SRI MERANTI, RUMBAI, KOTA PEKANBARU, RIAU",40,52,182,234
https://kawalpemilu.org#15761,"PULAU BUSUK JAYA, INUMAN, KUANTAN SINGINGI, RIAU",4,39,179,218
https://kawalpemilu.org#84458,"BUKITRANAH, KAMPAR, KAMPAR, RIAU",5,23,210,233
https://kawalpemilu.org#14809,"Bantayan, Mandah, INDRAGIRI HILIR, RIAU",4,5,91,96
https://kawalpemilu.org#14757,"Pengalihan, Enok, INDRAGIRI HILIR, RIAU",9,68,112,180
https://kawalpemilu.org#14512,"PETALA BUMI, SIBERIDA, INDRAGIRI HULU, RIAU",4,98,119,217
https://kawalpemilu.org#14733,"BALAI PUNGUT, PINGGIR, BENGKALIS, RIAU",3,55,178,233
https://kawalpemilu.org#84485,"MADANI, Reteh, INDRAGIRI HILIR, RIAU",6,102,95,197
https://kawalpemilu.org#14206,"PULAU GADANG, XIII KOTO KAMPAR, KAMPAR, RIAU",8,30,121,151
https://kawalpemilu.org#14228,"TANAH MERAH, SIAK HULU, KAMPAR, RIAU",13,26,172,198
https://kawalpemilu.org#15333,"BAGAN SINEMBAH BARAT, BAGAN SINEMBAH, ROKAN HILIR, RIAU",11,115,50,165
https://kawalpemilu.org#14824,"KOTA BARU RETEH, Keritang, INDRAGIRI HILIR, RIAU",2,89,61,150
https://kawalpemilu.org#15154,"SUNGAI KUTI, KUNTO DARUSSALAM, ROKAN HULU, RIAU",6,123,71,194
https://kawalpemilu.org#76018,"PAPANDANGAN, ANREAPI, POLEWALI MANDAR, SULAWESI BARAT",2,154,68,222
https://kawalpemilu.org#76091,"BAURUNG, BANGGAE TIMUR, MAJENE, SULAWESI BARAT",4,134,97,231
https://kawalpemilu.org#75510,"TADUI, MAMUJU, MAMUJU, SULAWESI BARAT",7,180,79,259
https://kawalpemilu.org#76050,"BARU, BANGGAE, MAJENE, SULAWESI BARAT",3,114,106,220
https://kawalpemilu.org#75719,"OSANGO, MAMASA, MAMASA, SULAWESI BARAT",5,195,36,231
https://kawalpemilu.org#75661,"BONEHAU, BONEHAU, MAMUJU, SULAWESI BARAT",2,108,30,138
https://kawalpemilu.org#75798,"BALLABATU, TANDUK KALUA, MAMASA, SULAWESI BARAT",2,159,28,187
https://kawalpemilu.org#75528,"BELANG BELANG, KALUKKU, MAMUJU, SULAWESI BARAT",9,120,55,175
https://kawalpemilu.org#75485,"BAMBAIRA, BAMBAIRA, MAMUJU UTARA, SULAWESI BARAT",1,105,150,255
https://kawalpemilu.org#75539,"KARAMA, KALUMPANG, MAMUJU, SULAWESI BARAT",2,178,24,202
https://kawalpemilu.org#70848,"BONTO LANGKASA, MINASA TENE, PANGKAJENE DAN KEPULAUAN, SULAWESI SELATAN",7,64,141,205
https://kawalpemilu.org#72294,"MARGOMULYO, TOMONI TIMUR, LUWU TIMUR, SULAWESI SELATAN",6,146,84,230
https://kawalpemilu.org#71382,"LAMPA, DUAMPANUA, PINRANG, SULAWESI SELATAN",3,62,130,192
https://kawalpemilu.org#69667,"ANRANG, RILAUALE, BULUKUMBA, SULAWESI SELATAN",2,41,165,206
https://kawalpemilu.org#72081,"SALAMA, SABBANG, LUWU UTARA, SULAWESI SELATAN",2,104,84,188
https://kawalpemilu.org#90174,"WANASARI, ANGKONA, LUWU TIMUR, SULAWESI SELATAN",2,184,27,211
https://kawalpemilu.org#70611,"SADAR, TELLULIMPOE, BONE, SULAWESI SELATAN",2,220,22,242
https://kawalpemilu.org#69971,"BONTOBIRAENG UTARA, BONTONOMPO, GOWA, SULAWESI SELATAN",3,120,127,247
https://kawalpemilu.org#72039,"BUNGAPATI, TANA LILI, LUWU UTARA, SULAWESI SELATAN",4,92,94,186
https://kawalpemilu.org#69542,"BONTO NYELENG, GANTARANG, BULUKUMBA, SULAWESI SELATAN",6,83,103,186
https://kawalpemilu.org#71376,"SIPATUO, PATAMPANUA, PINRANG, SULAWESI SELATAN",6,33,170,203
https://kawalpemilu.org#70981,"UMPUNGENG, LALABATA, SOPPENG, SULAWESI SELATAN",2,72,32,104
https://kawalpemilu.org#72426,"JONGAYA, TAMALATE, KOTA MAKASSAR, SULAWESI SELATAN",2,40,58,98
https://kawalpemilu.org#70849,"KABBA, MINASA TENE, PANGKAJENE DAN KEPULAUAN, SULAWESI SELATAN",6,93,154,247
https://kawalpemilu.org#70753,"TURIKALE, TURIKALE, MAROS, SULAWESI SELATAN",11,62,163,225
https://kawalpemilu.org#70717,"SAMANGKI, SIMBANG, MAROS, SULAWESI SELATAN",7,116,96,212
https://kawalpemilu.org#71001,"TOTTONG, DONRI DONRI, SOPPENG, SULAWESI SELATAN",5,124,57,181
https://kawalpemilu.org#71036,"KAMPIRI, PAMMANA, WAJO, SULAWESI SELATAN",3,128,116,244
https://kawalpemilu.org#70645,"BONTO MATENE, MANDAI, MAROS, SULAWESI SELATAN",6,81,153,234
https://kawalpemilu.org#72009,"PATTIMANG, MALANGKE, LUWU UTARA, SULAWESI SELATAN",7,78,86,164
https://kawalpemilu.org#70918,"NEPO, MALLUSETASI, BARRU, SULAWESI SELATAN",1,146,96,242
https://kawalpemilu.org#72391,"WALA-WALAYA, TALLO, KOTA MAKASSAR, SULAWESI SELATAN",4,57,134,191
https://kawalpemilu.org#70196,"BONTO, SINJAI TENGAH, SINJAI, SULAWESI SELATAN",4,49,105,154
https://kawalpemilu.org#70944,"MARIORITENGNGA, MARIORIWAWO, SOPPENG, SULAWESI SELATAN",2,109,103,212
https://kawalpemilu.org#71418,"PAMMASE, TIROANG, PINRANG, SULAWESI SELATAN",13,21,125,146
