https://kawalpemilu.org#49074,"RONGGOMULYO, TUBAN, TUBAN, JAWA TIMUR",14,135,62,197
https://kawalpemilu.org#47156,"KEPLAKSARI, PETERONGAN, JOMBANG, JAWA TIMUR",1,126,79,205
https://kawalpemilu.org#49034,"PEKUWON, RENGEL, TUBAN, JAWA TIMUR",11,122,56,178
https://kawalpemilu.org#47424,"WATUDANDANG, PRAMBON, NGANJUK, JAWA TIMUR",15,131,32,163
https://kawalpemilu.org#45806,"MARON KIDUL, MARON, PROBOLINGGO, JAWA TIMUR",21,199,18,217
https://kawalpemilu.org#47343,"SURU, NGETOS, NGANJUK, JAWA TIMUR",3,151,24,175
https://kawalpemilu.org#43934,"PAKIS, KUNJANG, KEDIRI, JAWA TIMUR",1,166,16,182
https://kawalpemilu.org#45943,"NGEMBAL, TUTUR, PASURUAN, JAWA TIMUR",15,118,110,228
https://kawalpemilu.org#51050,"PASERAMAN, ARJASA, SUMENEP, JAWA TIMUR",6,9,115,124
https://kawalpemilu.org#44671,"GUMUKMAS, GUMUKMAS, JEMBER, JAWA TIMUR",23,146,51,197
https://kawalpemilu.org#44273,"PARANGARGO, WAGIR, MALANG, JAWA TIMUR",9,136,95,231
https://kawalpemilu.org#42846,"KENITEN, PONOROGO, PONOROGO, JAWA TIMUR",11,138,86,224
https://kawalpemilu.org#51430,"SIDODADI, SIMOKERTO, KOTA SURABAYA, JAWA TIMUR",36,139,36,175
https://kawalpemilu.org#48016,"SURATMAJAN, MAOSPATI, MAGETAN, JAWA TIMUR",7,113,53,166
https://kawalpemilu.org#46616,"SIWALANPANJI, BUDURAN, SIDOARJO, JAWA TIMUR",11,118,116,234
https://kawalpemilu.org#42923,"KARANGTURI, MUNJUNGAN, TRENGGALEK, JAWA TIMUR",18,141,16,157
https://kawalpemilu.org#48404,"WADANG, NGASEM, BOJONEGORO, JAWA TIMUR",18,139,53,192
https://kawalpemilu.org#51044,"MASALIMA, MASALEMBU, SUMENEP, JAWA TIMUR",3,80,30,110
https://kawalpemilu.org#46418,"NGABAN, TANGGULANGIN, SIDOARJO, JAWA TIMUR",12,138,55,193
https://kawalpemilu.org#46410,"GEMPOLSARI, TANGGULANGIN, SIDOARJO, JAWA TIMUR",12,184,36,220
https://kawalpemilu.org#46216,"GONDANG REJO, GONDANGWETAN, PASURUAN, JAWA TIMUR",1,125,115,240
https://kawalpemilu.org#48263,"KEDUNGGALAR, KEDUNGGALAR, NGAWI, JAWA TIMUR",1,158,40,198
https://kawalpemilu.org#44304,"PAGENTAN, SINGOSARI, MALANG, JAWA TIMUR",3,108,57,165
https://kawalpemilu.org#44671,"GUMUKMAS, GUMUKMAS, JEMBER, JAWA TIMUR",25,155,55,210
https://kawalpemilu.org#44471,"JATIMULYO, KUNIR, LUMAJANG, JAWA TIMUR",4,101,115,216
https://kawalpemilu.org#46130,"KAUMAN, BANGIL, PASURUAN, JAWA TIMUR",4,76,170,246
https://kawalpemilu.org#44941,"GLAGAHAGUNG, PURWOHARJO, BANYUWANGI, JAWA TIMUR",20,118,98,216
https://kawalpemilu.org#44098,"WAJAK, WAJAK, MALANG, JAWA TIMUR",4,77,45,122
https://kawalpemilu.org#42850,"SETONO, JENANGAN, PONOROGO, JAWA TIMUR",9,140,35,175
https://kawalpemilu.org#46737,"KURIPANSARI, PACET, MOJOKERTO, JAWA TIMUR",2,155,49,204
https://kawalpemilu.org#46593,"KEBONAGUNG, SUKODONO, SIDOARJO, JAWA TIMUR",20,160,49,209
https://kawalpemilu.org#46204,"WONOSARI, GONDANGWETAN, PASURUAN, JAWA TIMUR",5,145,107,252
https://kawalpemilu.org#49355,"KRETERANGGON, SAMBENG, LAMONGAN, JAWA TIMUR",1,195,38,233
https://kawalpemilu.org#44402,"SUMBERTEMPUR, WONOSARI, MALANG, JAWA TIMUR",11,146,42,188
https://kawalpemilu.org#50703,"BANGSERREH, BATUMARMAR, PAMEKASAN, JAWA TIMUR",2,23,180,195
https://kawalpemilu.org#46367,"WONOMLATI, KREMBUNG, SIDOARJO, JAWA TIMUR",6,132,61,193
https://kawalpemilu.org#45478,"TOKELAN, PANJI, SITUBONDO, JAWA TIMUR",2,106,96,202
https://kawalpemilu.org#42702,"KUTU WETAN, JETIS, PONOROGO, JAWA TIMUR",5,115,36,151
https://kawalpemilu.org#50944,"RUBARU, RUBARU, SUMENEP, JAWA TIMUR",8,5,204,209
https://kawalpemilu.org#44105,"SAWAHAN, TUREN, MALANG, JAWA TIMUR",7,177,36,213
https://kawalpemilu.org#44559,"BODANG, PADANG, LUMAJANG, JAWA TIMUR",15,154,66,220
https://kawalpemilu.org#44607,"RANUWURUNG, RANDUAGUNG, LUMAJANG, JAWA TIMUR",17,34,160,194
https://kawalpemilu.org#45134,"KALIPURO, KALIPURO, BANYUWANGI, JAWA TIMUR",11,131,92,223
https://kawalpemilu.org#46355,"MOJORUNTUT, KREMBUNG, SIDOARJO, JAWA TIMUR",11,146,61,207
https://kawalpemilu.org#42426,"KEBONSARI, PUNUNG, PACITAN, JAWA TIMUR",3,44,86,130
https://kawalpemilu.org#51474,"LIDAH WETAN, LAKARSANTRI, KOTA SURABAYA, JAWA TIMUR",1,185,61,246
https://kawalpemilu.org#44512,"CITRODIWANGSAN, LUMAJANG, LUMAJANG, JAWA TIMUR",11,146,53,199
https://kawalpemilu.org#45505,"JATISARI, ARJASA, SITUBONDO, JAWA TIMUR",16,85,52,137
https://kawalpemilu.org#47754,"KWANGSEN, JIWAN, MADIUN, JAWA TIMUR",4,138,38,176
https://kawalpemilu.org#43285,"TUNGGANGRI, KALIDAWIR, TULUNGAGUNG, JAWA TIMUR",2,137,36,173
https://kawalpemilu.org#45024,"CANTUK, SINGOJURUH, BANYUWANGI, JAWA TIMUR",4,88,102,190
https://kawalpemilu.org#51177,"PANDANWANGI, BLIMBING, KOTA MALANG, JAWA TIMUR",26,172,54,226
https://kawalpemilu.org#46559,"BALONGBENDO, BALONGBENDO, SIDOARJO, JAWA TIMUR",4,163,35,198
https://kawalpemilu.org#44503,"WONOGRIYO, TEKUNG, LUMAJANG, JAWA TIMUR",8,78,124,202
https://kawalpemilu.org#44654,"KRATON, KENCONG, JEMBER, JAWA TIMUR",12,129,66,195
https://kawalpemilu.org#44074,"KARANGNONGKO, PONCOKUSUMO, MALANG, JAWA TIMUR",22,165,16,181
https://kawalpemilu.org#43927,"KLEPEK, KUNJANG, KEDIRI, JAWA TIMUR",1,169,31,200
https://kawalpemilu.org#47132,"KERAS, DIWEK, JOMBANG, JAWA TIMUR",9,127,100,227
https://kawalpemilu.org#50301,"SEN ASEN, KONANG, BANGKALAN, JAWA TIMUR",10,134,52,186
https://kawalpemilu.org#44581,"UMBUL, KEDUNGJAJANG, LUMAJANG, JAWA TIMUR",13,57,162,219
https://kawalpemilu.org#49121,"KARANGAGUNG, PALANG, TUBAN, JAWA TIMUR",5,91,76,167
https://kawalpemilu.org#51231,"LOWOKWARU, LOWOKWARU, KOTA MALANG, JAWA TIMUR",42,145,98,243
https://kawalpemilu.org#46791,"NGRAME, PUNGGING, MOJOKERTO, JAWA TIMUR",4,142,38,180
https://kawalpemilu.org#48738,"KEDUNGSARI, TEMAYANG, BOJONEGORO, JAWA TIMUR",2,130,105,235
https://kawalpemilu.org#46453,"SEKARDANGAN, SIDOARJO, SIDOARJO, JAWA TIMUR",15,59,90,149
https://kawalpemilu.org#45828,"RANDUPITU, GENDING, PROBOLINGGO, JAWA TIMUR",3,136,86,222
https://kawalpemilu.org#44295,"KEPUHARJO, KARANGPLOSO, MALANG, JAWA TIMUR",5,176,83,259
https://kawalpemilu.org#46576,"WAGE, TAMAN, SIDOARJO, JAWA TIMUR",7,137,55,192
https://kawalpemilu.org#44333,"WONOREJO, LAWANG, MALANG, JAWA TIMUR",8,119,73,192
https://kawalpemilu.org#47533,"BUDURAN, BAGOR, NGANJUK, JAWA TIMUR",3,127,33,160
https://kawalpemilu.org#46078,"JOGOSARI, PANDAAN, PASURUAN, JAWA TIMUR",16,115,79,194
https://kawalpemilu.org#51152,"BENDO, KEPANJENKIDUL, KOTA BLITAR, JAWA TIMUR",17,155,42,197
https://kawalpemilu.org#43350,"GESIKAN, PAKEL, TULUNGAGUNG, JAWA TIMUR",9,171,18,189
https://kawalpemilu.org#44119,"PUTAT KIDUL, GONDANGLEGI, MALANG, JAWA TIMUR",4,118,57,175
https://kawalpemilu.org#51462,"UJUNG, SEMAMPIR, KOTA SURABAYA, JAWA TIMUR",33,48,68,116
https://kawalpemilu.org#46426,"KARANGTANJUNG, CANDI, SIDOARJO, JAWA TIMUR",10,131,96,227
https://kawalpemilu.org#46619,"SAWOHAN, BUDURAN, SIDOARJO, JAWA TIMUR",4,145,59,204
https://kawalpemilu.org#51113,"BALOWERTI, KOTA, KOTA KEDIRI, JAWA TIMUR",17,166,33,199
https://kawalpemilu.org#51305,"MANDARANREJO, PANGGUNGREJO, KOTA PASURUAN, JAWA TIMUR",3,89,77,166
https://kawalpemilu.org#46478,"KENONGO, TULANGAN, SIDOARJO, JAWA TIMUR",2,70,149,219
https://kawalpemilu.org#51371,"KALIRUNGKUT, RUNGKUT, KOTA SURABAYA, JAWA TIMUR",39,177,68,245
https://kawalpemilu.org#48247,"KEDUNG PUTRI, PARON, NGAWI, JAWA TIMUR",28,106,10,116
https://kawalpemilu.org#50709,"BATU BINTANG, BATUMARMAR, PAMEKASAN, JAWA TIMUR",18,17,187,204
https://kawalpemilu.org#44921,"JAMBEARUM, SUMBERJAMBE, JEMBER, JAWA TIMUR",12,62,62,124
https://kawalpemilu.org#45334,"RAMBAN KULON, CERMEE, BONDOWOSO, JAWA TIMUR",9,109,52,161
https://kawalpemilu.org#45331,"CERMEE, CERMEE, BONDOWOSO, JAWA TIMUR",12,114,49,163
https://kawalpemilu.org#51223,"TLOGOMAS, LOWOKWARU, KOTA MALANG, JAWA TIMUR",32,136,79,215
https://kawalpemilu.org#51048,"PAJANANGGER, ARJASA, SUMENEP, JAWA TIMUR",11,29,164,193
https://kawalpemilu.org#48470,"MEGALE, KEDUNGADEM, BOJONEGORO, JAWA TIMUR",13,64,97,161
https://kawalpemilu.org#42963,"NGLONGSOR, TUGU, TRENGGALEK, JAWA TIMUR",13,113,70,183
https://kawalpemilu.org#47553,"NGUDIKAN, WILANGAN, NGANJUK, JAWA TIMUR",5,151,57,208
https://kawalpemilu.org#58677,"PERUAN DALAM, TAYAN HULU, SANGGAU, KALIMANTAN BARAT",6,122,10,132
https://kawalpemilu.org#60127,"ULAK MUID, TANAH PINOH BARAT, MELAWI, KALIMANTAN BARAT",6,62,68,130
https://kawalpemilu.org#60363,"SUNGAI RENGAS, SUNGAI KAKAP, KUBU RAYA, KALIMANTAN BARAT",3,43,142,185
https://kawalpemilu.org#58533,"SUNGAI LIMAU, SUNGAI KUNYIT, MEMPAWAH, KALIMANTAN BARAT",4,50,194,244
https://kawalpemilu.org#60365,"SUNGAI BELIDAK, SUNGAI KAKAP, KUBU RAYA, KALIMANTAN BARAT",5,48,115,163
https://kawalpemilu.org#58446,"SEPADU, SEMPARUK, SAMBAS, KALIMANTAN BARAT",10,85,89,174
https://kawalpemilu.org#58429,"RATU SEPUDAK, GALING, SAMBAS, KALIMANTAN BARAT",1,59,127,186
https://kawalpemilu.org#59279,"SEPAN LEBANG, KELAM PERMAI, SINTANG, KALIMANTAN BARAT",3,123,57,180
https://kawalpemilu.org#58735,"CUPANG, MELIAU, SANGGAU, KALIMANTAN BARAT",2,12,116,128
https://kawalpemilu.org#59506,"NANGA SEBINTANG, KALIS, KAPUAS HULU, KALIMANTAN BARAT",3,48,2,50
https://kawalpemilu.org#60207,"BATU LAYANG, PONTIANAK UTARA, KOTA PONTIANAK, KALIMANTAN BARAT",41,34,109,143
https://kawalpemilu.org#58980,"AIR DURIAN JAYA, AIR UPAS, KETAPANG, KALIMANTAN BARAT",3,122,48,170
https://kawalpemilu.org#59774,"TEMOYOK, AIR BESAR, LANDAK, KALIMANTAN BARAT",4,199,9,208
https://kawalpemilu.org#58906,"JELAYAN, TUMBANG TITI, KETAPANG, KALIMANTAN BARAT",1,173,6,179
https://kawalpemilu.org#58598,"SUNGAI MAWANG, MUKOK, SANGGAU, KALIMANTAN BARAT",4,121,20,141
https://kawalpemilu.org#59871,"SUNGAI RINGIN, SEKADAU HILIR, SEKADAU, KALIMANTAN BARAT",35,114,56,170
https://kawalpemilu.org#59992,"LENGKONG NYADOM, ELLA HILIR, MELAWI, KALIMANTAN BARAT",1,26,231,257
https://kawalpemilu.org#59802,"SEBATIH, SENGAH TEMILA, LANDAK, KALIMANTAN BARAT",18,174,3,177
https://kawalpemilu.org#58569,"TANJUNG KAPUAS, KAPUAS, SANGGAU, KALIMANTAN BARAT",12,213,17,230
https://kawalpemilu.org#60205,"SIANTAN TENGAH, PONTIANAK UTARA, KOTA PONTIANAK, KALIMANTAN BARAT",63,79,55,134
https://kawalpemilu.org#58548,"KEPAYANG, ANJONGAN, MEMPAWAH, KALIMANTAN BARAT",10,154,67,221
https://kawalpemilu.org#58294,"LORONG, SAMBAS, SAMBAS, KALIMANTAN BARAT",2,98,110,208
https://kawalpemilu.org#60251,"SEDAU, SINGKAWANG SELATAN, KOTA SINGKAWANG, KALIMANTAN BARAT",48,45,85,130
https://kawalpemilu.org#58676,"SOSOK, TAYAN HULU, SANGGAU, KALIMANTAN BARAT",19,179,12,191
https://kawalpemilu.org#58673,"GUNAM, PARINDU, SANGGAU, KALIMANTAN BARAT",4,228,12,240
https://kawalpemilu.org#59210,"NANGA MASAU, KAYAN HULU, SINTANG, KALIMANTAN BARAT",3,100,20,120
https://kawalpemilu.org#60359,"SUNGAI KAKAP, SUNGAI KAKAP, KUBU RAYA, KALIMANTAN BARAT",22,89,155,244
https://kawalpemilu.org#58510,"SUNGAI PINYUH, SUNGAI PINYUH, MEMPAWAH, KALIMANTAN BARAT",42,54,142,196
https://kawalpemilu.org#58686,"KEDAKAS, TAYAN HULU, SANGGAU, KALIMANTAN BARAT",8,120,6,126
https://kawalpemilu.org#59291,"MERARAI DUA, SUNGAI TEBELIAN, SINTANG, KALIMANTAN BARAT",3,112,42,154
https://kawalpemilu.org#58748,"SURUH TEMBAWANG, ENTIKONG, SANGGAU, KALIMANTAN BARAT",9,171,7,178
https://kawalpemilu.org#58720,"KAMPUNG BARU, TOBA, SANGGAU, KALIMANTAN BARAT",4,73,18,91
https://kawalpemilu.org#60156,"MATAN JAYA, SIMPANG HILIR, KAYONG UTARA, KALIMANTAN BARAT",8,111,103,214
https://kawalpemilu.org#58664,"PANDU RAYA, PARINDU, SANGGAU, KALIMANTAN BARAT",4,187,4,191
https://kawalpemilu.org#59214,"RIAM MUNTIK, KAYAN HULU, SINTANG, KALIMANTAN BARAT",1,117,41,158
https://kawalpemilu.org#58840,"BALAI PINANG, SIMPANG HULU, KETAPANG, KALIMANTAN BARAT",10,130,10,140
https://kawalpemilu.org#85312,"TUNAS MUDA, HULU GURUNG, KAPUAS HULU, KALIMANTAN BARAT",2,8,105,113
https://kawalpemilu.org#58668,"SUKA MULYA, PARINDU, SANGGAU, KALIMANTAN BARAT",3,181,62,243
https://kawalpemilu.org#59559,"SUNGAI DURI, SUNGAI RAYA, BENGKAYANG, KALIMANTAN BARAT",5,145,69,214
https://kawalpemilu.org#59835,"KUMPANG TENGAH, SEBANGKI, LANDAK, KALIMANTAN BARAT",3,32,116,148
https://kawalpemilu.org#60194,"TANJUNG HULU, PONTIANAK TIMUR, KOTA PONTIANAK, KALIMANTAN BARAT",9,89,100,189
https://kawalpemilu.org#63619,"PUAIN KANAN, TANTA, TABALONG, KALIMANTAN SELATAN",3,47,98,145
https://kawalpemilu.org#63162,"TANJUNG SELOR, DAHA BARAT, HULU SUNGAI SELATAN, KALIMANTAN SELATAN",2,72,54,126
https://kawalpemilu.org#63092,"AMPARAYA, SIMPUR, HULU SUNGAI SELATAN, KALIMANTAN SELATAN",6,21,133,154
https://kawalpemilu.org#63251,"BANUA ASAM, PANDAWAN, HULU SUNGAI TENGAH, KALIMANTAN SELATAN",1,11,131,142
https://kawalpemilu.org#62259,"BANJAR SARI, SAMPANAHAN, KOTABARU, KALIMANTAN SELATAN",1,68,51,119
https://kawalpemilu.org#61993,"KARANG TARUNA, PELAIHARI, TANAH LAUT, KALIMANTAN SELATAN",9,56,137,193
https://kawalpemilu.org#63629,"PAMARANGAN KIWA, TANJUNG, TABALONG, KALIMANTAN SELATAN",6,27,110,137
https://kawalpemilu.org#63372,"MURUNG PANTI HILIR, BABIRIK, HULU SUNGAI UTARA, KALIMANTAN SELATAN",2,33,98,131
https://kawalpemilu.org#62357,"MANDARSARI, KERTAK HANYAR, BANJAR, KALIMANTAN SELATAN",4,41,63,104
https://kawalpemilu.org#64110,"SUNGAI  BESAR, BANJARBARU SELATAN, KOTA BANJARBARU, KALIMANTAN SELATAN",1,69,77,145
https://kawalpemilu.org#63799,"GUNTUNG, KUSAN HULU, TANAH BUMBU, KALIMANTAN SELATAN",4,67,96,163
https://kawalpemilu.org#62666,"JELAPAT I, TAMBAN, BARITO KUALA, KALIMANTAN SELATAN",13,56,71,127
https://kawalpemilu.org#61997,"BUMI JAYA, PELAIHARI, TANAH LAUT, KALIMANTAN SELATAN",4,140,101,241
https://kawalpemilu.org#63036,"JEMBATAN MERAH, PADANG BATUNG, HULU SUNGAI SELATAN, KALIMANTAN SELATAN",2,36,214,250
https://kawalpemilu.org#63302,"MARINGGIT, BATANG ALAI UTARA, HULU SUNGAI TENGAH, KALIMANTAN SELATAN",1,18,108,126
https://kawalpemilu.org#63573,"RANTAU BUJUR HULU, SUNGAI TABUKAN, HULU SUNGAI UTARA, KALIMANTAN SELATAN",1,82,62,144
https://kawalpemilu.org#63219,"SUNGAI JARANIH, LABUAN AMAS SELATAN, HULU SUNGAI TENGAH, KALIMANTAN SELATAN",5,31,105,136
https://kawalpemilu.org#64103,"MENTAOS, BANJARBARU UTARA, KOTA BANJARBARU, KALIMANTAN SELATAN",9,53,110,163
https://kawalpemilu.org#63624,"JANGKUNG, TANJUNG, TABALONG, KALIMANTAN SELATAN",13,26,130,156
https://kawalpemilu.org#64047,"BANUA ANYAR, BANJARMASIN TIMUR, KOTA BANJARMASIN, KALIMANTAN SELATAN",2,76,185,261
https://kawalpemilu.org#63967,"LOK HAMAWANG, LAMPIHONG, BALANGAN, KALIMANTAN SELATAN",2,39,106,145
https://kawalpemilu.org#63464,"KOTA RADEN HULU, AMUNTAI TENGAH, HULU SUNGAI UTARA, KALIMANTAN SELATAN",3,45,172,217
https://kawalpemilu.org#63353,"BARU, DANAU PANGGANG, HULU SUNGAI UTARA, KALIMANTAN SELATAN",1,34,78,112
https://kawalpemilu.org#63728,"BATULICIN, BATU LICIN, TANAH BUMBU, KALIMANTAN SELATAN",5,100,40,140
https://kawalpemilu.org#63460,"SUNGAI MALANG, AMUNTAI TENGAH, HULU SUNGAI UTARA, KALIMANTAN SELATAN",8,49,166,215
https://kawalpemilu.org#63662,"PEMBATAAN, MURUNG PUDAK, TABALONG, KALIMANTAN SELATAN",14,54,92,146
https://kawalpemilu.org#62701,"ANJIR SERAPAT BARU I, ANJIR MUARA, BARITO KUALA, KALIMANTAN SELATAN",1,63,128,191
https://kawalpemilu.org#62233,"PUDI, KELUMPANG UTARA, KOTABARU, KALIMANTAN SELATAN",3,88,103,191
https://kawalpemilu.org#62799,"RANTAU BAMBAN, TABUKAN, BARITO KUALA, KALIMANTAN SELATAN",2,71,81,152
https://kawalpemilu.org#63329,"PEMBAKULAN, BATANG ALAI TIMUR, HULU SUNGAI TENGAH, KALIMANTAN SELATAN",2,31,68,99
https://kawalpemilu.org#62685,"ANJIR SEBERANG PASAR II, ANJIR PASAR, BARITO KUALA, KALIMANTAN SELATAN",3,61,61,122
https://kawalpemilu.org#62533,"HAKIM MAKMUR, SUNGAI PINANG, BANJAR, KALIMANTAN SELATAN",4,149,12,161
https://kawalpemilu.org#62144,"TANJUNGSELOKA, PULAULAUT SELATAN, KOTABARU, KALIMANTAN SELATAN",9,98,48,146
https://kawalpemilu.org#61947,"MENTENG, JEKAN RAYA, KOTA PALANGKARAYA, KALIMANTAN TENGAH",147,46,61,1
https://kawalpemilu.org#61268,"AYAWAN, SERUYAN TENGAH, SERUYAN, KALIMANTAN TENGAH",7,66,7,73
https://kawalpemilu.org#60400,"PASIR PANJANG, ARUT SELATAN, KOTAWARINGIN BARAT, KALIMANTAN TENGAH",20,145,103,248
https://kawalpemilu.org#60393,"MENDAWAI, ARUT SELATAN, KOTAWARINGIN BARAT, KALIMANTAN TENGAH",29,108,66,174
https://kawalpemilu.org#928450,"SAMU JAYA, LAMANDAU, LAMANDAU, KALIMANTAN TENGAH",2,135,24,159
https://kawalpemilu.org#60542,"KETAPANG, MENTAWA BARU KETAPANG, KOTAWARINGIN TIMUR, KALIMANTAN TENGAH",49,39,62,101
https://kawalpemilu.org#60558,"BASIRIH HILIR, MENTAYA HILIR SELATAN, KOTAWARINGIN TIMUR, KALIMANTAN TENGAH",2,55,126,182
https://kawalpemilu.org#61226,"HANDIWUNG, TASIK PAYAWAN, KATINGAN, KALIMANTAN TENGAH",1,176,44,220
https://kawalpemilu.org#61054,"LAHEI II, LAHEI, BARITO UTARA, KALIMANTAN TENGAH",4,111,107,218
https://kawalpemilu.org#61954,"KAMELOH BARU, SABANGAU, KOTA PALANGKARAYA, KALIMANTAN TENGAH",1,109,97,206
https://kawalpemilu.org#61028,"MELAYU, TEWEH TENGAH, BARITO UTARA, KALIMANTAN TENGAH",37,77,62,139
https://kawalpemilu.org#61640,"SEI PUDAK, KAHAYAN KUALA, PULANG PISAU, KALIMANTAN TENGAH",8,53,82,135
https://kawalpemilu.org#61948,"BUKIT TUNGGAL, JEKAN RAYA, KOTA PALANGKARAYA, KALIMANTAN TENGAH",43,72,73,145
https://kawalpemilu.org#61511,"SARERANGAN, TEWAH, GUNUNG MAS, KALIMANTAN TENGAH",3,180,31,211
https://kawalpemilu.org#928312,"LAMUNTI PERMAI, MANTANGAI, KAPUAS, KALIMANTAN TENGAH",2,117,45,162
https://kawalpemilu.org#61536,"TUMBANG TANJUNGAN, KAHAYAN HULU UTARA, GUNUNG MAS, KALIMANTAN TENGAH",2,130,6,136
https://kawalpemilu.org#61799,"TUMBANG MASAO, SUMBER BARITO, MURUNG RAYA, KALIMANTAN TENGAH",3,118,46,164
https://kawalpemilu.org#60700,"WARNA SARI, TAMBAN CATUR, KAPUAS, KALIMANTAN TENGAH",3,66,96,162
https://kawalpemilu.org#61946,"PALANGKA, JEKAN RAYA, KOTA PALANGKARAYA, KALIMANTAN TENGAH",104,61,110,171
https://kawalpemilu.org#60960,"PENDA ASAM, DUSUN SELATAN, BARITO SELATAN, KALIMANTAN TENGAH",2,109,69,178
https://kawalpemilu.org#64327,"SEBULU ILIR, SEBULU, KUTAI KARTANEGARA, KALIMANTAN TIMUR",7,107,101,208
https://kawalpemilu.org#65609,"SAMBUTAN, SAMBUTAN, KOTA SAMARINDA, KALIMANTAN TIMUR",54,84,126,210
https://kawalpemilu.org#928246,"BUDAYA PAMPANG, SAMARINDA UTARA, KOTA SAMARINDA, KALIMANTAN TIMUR",4,145,7,152
https://kawalpemilu.org#65609,"SAMBUTAN, SAMBUTAN, KOTA SAMARINDA, KALIMANTAN TIMUR",32,90,83,173
https://kawalpemilu.org#64490,"SEBEMBAN, MUARA WIS, KUTAI KARTANEGARA, KALIMANTAN TIMUR",3,160,43,203
https://kawalpemilu.org#65535,"BARU ILIR, BALIKPAPAN BARAT, KOTA BALIKPAPAN, KALIMANTAN TIMUR",38,128,72,200
https://kawalpemilu.org#64262,"JANTUR BARU, MUARA MUNTAI, KUTAI KARTANEGARA, KALIMANTAN TIMUR",3,108,42,150
https://kawalpemilu.org#65626,"SIMPANG TIGA/LOA JANAN ILIR, LOA JANAN ILIR, KOTA SAMARINDA, KALIMANTAN TIMUR",32,64,76,140
https://kawalpemilu.org#65487,"GERSIK, PENAJAM, PENAJAM PASER UTARA, KALIMANTAN TIMUR",5,84,61,145
https://kawalpemilu.org#65616,"GUNUNG LINGAI, SUNGAI PINANG, KOTA SAMARINDA, KALIMANTAN TIMUR",2,56,158,214
https://kawalpemilu.org#65601,"LOA BUAH, SUNGAI KUNJANG, KOTA SAMARINDA, KALIMANTAN TIMUR",2,101,129,230
https://kawalpemilu.org#87244,"SEPINGGAN BARU, BALIKPAPAN SELATAN, KOTA BALIKPAPAN, KALIMANTAN TIMUR",23,134,90,224
https://kawalpemilu.org#64586,"LABANAN MAKMUR, TELUK BAYUR, BERAU, KALIMANTAN TIMUR",3,187,98,285
https://kawalpemilu.org#928207,"LELENG, SEKOLAQ DARAT, KUTAI BARAT, KALIMANTAN TIMUR",1,164,18,182
https://kawalpemilu.org#91450,"MEKAR JAYA, SEBULU, KUTAI KARTANEGARA, KALIMANTAN TIMUR",4,174,58,232
https://kawalpemilu.org#64532,"SEI BEBANIR BANGUN, SAMBALIUNG, BERAU, KALIMANTAN TIMUR",5,125,76,201
https://kawalpemilu.org#92931,"BANGUN MULYA, WARU, PENAJAM PASER UTARA, KALIMANTAN TIMUR",12,159,32,191
https://kawalpemilu.org#64166,"KERTA BUMI, KUARO, PASER, KALIMANTAN TIMUR",3,99,79,178
https://kawalpemilu.org#65555,"DAMAI, BALIKPAPAN KOTA, KOTA BALIKPAPAN, KALIMANTAN TIMUR",34,122,76,198
https://kawalpemilu.org#64277,"BAKUNGAN, LOA JANAN, KUTAI KARTANEGARA, KALIMANTAN TIMUR",20,81,94,175
https://kawalpemilu.org#64291,"SUNGAI MERIAM, ANGGANA, KUTAI KARTANEGARA, KALIMANTAN TIMUR",25,63,118,181
https://kawalpemilu.org#928242,"TENUN SAMARINDA, SAMARINDA SEBERANG, KOTA SAMARINDA, KALIMANTAN TIMUR",17,53,106,159
https://kawalpemilu.org#65435,"KEBON AGUNG, RANTAU PULUNG, KUTAI TIMUR, KALIMANTAN TIMUR",2,162,54,216
https://kawalpemilu.org#65617,"MUGIREJO, SUNGAI PINANG, KOTA SAMARINDA, KALIMANTAN TIMUR",39,100,67,167
https://kawalpemilu.org#65557,"KLANDASAN ILIR, BALIKPAPAN KOTA, KOTA BALIKPAPAN, KALIMANTAN TIMUR",38,103,94,197
https://kawalpemilu.org#65214,"JAMBUK, BONGAN, KUTAI BARAT, KALIMANTAN TIMUR",2,155,58,213
https://kawalpemilu.org#64340,"LOLENG, KOTA BANGUN, KUTAI KARTANEGARA, KALIMANTAN TIMUR",5,153,54,207
https://kawalpemilu.org#65548,"GUNUNGSARI ILIR, BALIKPAPAN TENGAH, KOTA BALIKPAPAN, KALIMANTAN TIMUR",42,131,22,153
https://kawalpemilu.org#87654,"SEBERANG, SEBATIK UTARA, NUNUKAN, KALIMANTAN UTARA",3,74,16,90
https://kawalpemilu.org#64721,"BUKIT HARAPAN, SEBATIK TENGAH, NUNUKAN, KALIMANTAN UTARA",2,125,37,162
https://kawalpemilu.org#64663,"TANJUNG BUKA, TANJUNG PALAS TENGAH, BULUNGAN, KALIMANTAN UTARA",9,158,22,180
https://kawalpemilu.org#64722,"TANJUNG HARAPAN, SEBATIK TIMUR, NUNUKAN, KALIMANTAN UTARA",4,66,32,98
https://kawalpemilu.org#64657,"GUNUNG SARI, TANJUNG SELOR, BULUNGAN, KALIMANTAN UTARA",5,109,57,166
https://kawalpemilu.org#64725,"NUNUKAN BARAT, NUNUKAN, NUNUKAN, KALIMANTAN UTARA",43,148,22,170
https://kawalpemilu.org#25274,"RANGGI ASAM, JEBUS, BANGKA BARAT, KEPULAUAN BANGKA BELITUNG",3,190,78,268
https://kawalpemilu.org#25176,"BATU BETUMPANG, PULAU BESAR, BANGKA SELATAN, KEPULAUAN BANGKA BELITUNG",6,82,98,180
https://kawalpemilu.org#25375,"BATIN TIKAL, TAMAN SARI, KOTA PANGKALPINANG, KEPULAUAN BANGKA BELITUNG",6,75,112,187
https://kawalpemilu.org#25399,"TAMAN BUNGA, GERUNGGANG, KOTA PANGKALPINANG, KEPULAUAN BANGKA BELITUNG",5,111,113,224
https://kawalpemilu.org#25207,"KERANTAI, SUNGAI SELAN, BANGKA TENGAH, KEPULAUAN BANGKA BELITUNG",2,127,72,199
https://kawalpemilu.org#25196,"AIR MESU, PANGKALAN BARU, BANGKA TENGAH, KEPULAUAN BANGKA BELITUNG",2,81,138,219
https://kawalpemilu.org#929412,"SINAR JAYA JELUTUNG, SUNGAILIAT, BANGKA, KEPULAUAN BANGKA BELITUNG",12,133,84,217
https://kawalpemilu.org#25055,"RIAU, RIAU SILIP, BANGKA, KEPULAUAN BANGKA BELITUNG",1,112,3,115
https://kawalpemilu.org#24997,"SRI MENANTI, SUNGAILIAT, BANGKA, KEPULAUAN BANGKA BELITUNG",11,102,92,194
https://kawalpemilu.org#25005,"AIR JUKUNG, BELINYU, BANGKA, KEPULAUAN BANGKA BELITUNG",10,171,53,224
https://kawalpemilu.org#25810,"BALOI PERMAI, BATAM KOTA, KOTA BATAM, KEPULAUAN RIAU",65,68,58,126
https://kawalpemilu.org#25764,"SUNGAI HARAPAN, SEKUPANG, KOTA BATAM, KEPULAUAN RIAU",25,58,80,138
https://kawalpemilu.org#25782,"BALOI INDAH, LUBUK BAJA, KOTA BATAM, KEPULAUAN RIAU",25,85,54,139
https://kawalpemilu.org#25809,"SUNGAI PANAS, BATAM KOTA, KOTA BATAM, KEPULAUAN RIAU",5,67,210,277
https://kawalpemilu.org#25415,"AIR RAJA, TANJUNG PINANG TIMUR, KOTA TANJUNGPINANG, KEPULAUAN RIAU",23,112,83,195
https://kawalpemilu.org#25820,"BULIANG, BATU AJI, KOTA BATAM, KEPULAUAN RIAU",78,96,153,249
https://kawalpemilu.org#25532,"KUALA SEMPANG, SERI KUALA LOBAM, BINTAN, KEPULAUAN RIAU",6,101,37,138
https://kawalpemilu.org#84861,"SUNGAILAKAM BARAT, KARIMUN, KARIMUN, KEPULAUAN RIAU",17,79,126,205
https://kawalpemilu.org#25781,"KAMPUNG PELITA, LUBUK BAJA, KOTA BATAM, KEPULAUAN RIAU",4,98,62,160
https://kawalpemilu.org#25410,"KAMPUNG BARU, TANJUNG PINANG BARAT, KOTA TANJUNGPINANG, KEPULAUAN RIAU",15,114,122,236
https://kawalpemilu.org#25411,"BUKIT CERMIN, TANJUNG PINANG BARAT, KOTA TANJUNGPINANG, KEPULAUAN RIAU",5,82,101,183
https://kawalpemilu.org#25820,"BULIANG, BATU AJI, KOTA BATAM, KEPULAUAN RIAU",41,119,115,234
https://kawalpemilu.org#25821,"KIBING, BATU AJI, KOTA BATAM, KEPULAUAN RIAU",15,110,68,178
https://kawalpemilu.org#25812,"TEMBESI, SAGULUNG, KOTA BATAM, KEPULAUAN RIAU",20,29,234,263
https://kawalpemilu.org#23967,"TANJUNG REJO, PULAU PANGGUNG, TANGGAMUS, LAMPUNG",1,118,130,248
https://kawalpemilu.org#23332,"KINCIRAN, ABUNG TENGAH, LAMPUNG UTARA, LAMPUNG",16,53,91,144
https://kawalpemilu.org#23300,"KOTA NEGARA, SUNGKAI UTARA, LAMPUNG UTARA, LAMPUNG",41,72,184,256
https://kawalpemilu.org#22750,"WAY HUWI, JATI AGUNG, LAMPUNG SELATAN, LAMPUNG",28,85,65,150
https://kawalpemilu.org#24073,"ULU SEMONG, ULU BELU, TANGGAMUS, LAMPUNG",3,85,101,186
https://kawalpemilu.org#24944,"TANJUNG AGUNG, TELUK PANDAN, PESAWARAN, LAMPUNG",5,138,31,169
https://kawalpemilu.org#23861,"SUKARAME, MERAKSA AJI, TULANG BAWANG, LAMPUNG",3,106,38,144
https://kawalpemilu.org#24948,"MULYOSARI, WAY RATAI, PESAWARAN, LAMPUNG",9,79,38,117
https://kawalpemilu.org#24017,"TANGKIT SERDANG, PUGUNG, TANGGAMUS, LAMPUNG",11,88,70,158
https://kawalpemilu.org#24802,"TANJUNG SENANG, TANJUNG SENANG, KOTA BANDAR LAMPUNG, LAMPUNG",9,67,102,169
https://kawalpemilu.org#24051,"KEBUMEN, SUMBER REJO, TANGGAMUS, LAMPUNG",1,151,76,227
https://kawalpemilu.org#23005,"SETIA BAKTI, SEPUTIH BANYAK, LAMPUNG TENGAH, LAMPUNG",13,176,57,233
https://kawalpemilu.org#22859,"KERTOSARI, TANJUNG SARI, LAMPUNG SELATAN, LAMPUNG",11,157,26,183
https://kawalpemilu.org#22331,"FAJARESUK, PRINGSEWU, PRINGSEWU, LAMPUNG",6,170,66,236
https://kawalpemilu.org#91289,"MEKAR JAYA, BANGUN REJO, LAMPUNG TENGAH, LAMPUNG",5,140,43,183
https://kawalpemilu.org#22640,"WAY GALIH, TANJUNG BINTANG, LAMPUNG SELATAN, LAMPUNG",18,195,45,240
https://kawalpemilu.org#24330,"REJO BINANGUN, RAMAN UTARA, LAMPUNG TIMUR, LAMPUNG",10,146,18,164
https://kawalpemilu.org#24222,"LABUHAN MARINGGAI, LABUHAN MARINGGAI, LAMPUNG TIMUR, LAMPUNG",4,104,65,169
https://kawalpemilu.org#24853,"PAMPANGAN, GEDONG TATAAN, PESAWARAN, LAMPUNG",2,36,139,175
https://kawalpemilu.org#22341,"FAJAR AGUNG, PRINGSEWU, PRINGSEWU, LAMPUNG",6,111,47,158
https://kawalpemilu.org#23311,"MARGO REJO, KOTABUMI UTARA, LAMPUNG UTARA, LAMPUNG",67,63,108,171
https://kawalpemilu.org#24824,"METRO, METRO PUSAT, KOTA METRO, LAMPUNG",8,129,87,216
https://kawalpemilu.org#22963,"BANDAR JAYA TIMUR, TERBANGGI BESAR, LAMPUNG TENGAH, LAMPUNG",13,97,104,201
https://kawalpemilu.org#23308,"KALI CINTA, KOTABUMI UTARA, LAMPUNG UTARA, LAMPUNG",33,101,56,157
https://kawalpemilu.org#23388,"ISO REJO, BUNGA MAYANG, LAMPUNG UTARA, LAMPUNG",11,120,35,155
https://kawalpemilu.org#22805,"CUGUNG, RAJA BASA, LAMPUNG SELATAN, LAMPUNG",3,89,65,154
