https://kawalpemilu.org#30482,"PALABUAN, UJUNGJAYA, SUMEDANG, JAWA BARAT",2,132,57,189
https://kawalpemilu.org#32293,"CIGONDEWAH RAHAYU, BANDUNG KULON, KOTA BANDUNG, JAWA BARAT",4,58,193,251
https://kawalpemilu.org#30219,"CIMANINTIN, JATINUNGGAL, SUMEDANG, JAWA BARAT",11,90,92,182
https://kawalpemilu.org#31789,"SERTAJAYA, CIKARANG TIMUR, BEKASI, JAWA BARAT",18,62,106,168
https://kawalpemilu.org#31815,"SUKAINDAH, SUKAKARYA, BEKASI, JAWA BARAT",10,84,108,192
https://kawalpemilu.org#27966,"CISURUPAN, CISURUPAN, GARUT, JAWA BARAT",18,55,140,195
https://kawalpemilu.org#32537,"CILANGKAP, TAPOS, KOTA DEPOK, JAWA BARAT",88,76,91,167
https://kawalpemilu.org#27559,"CANGKUANG, RANCAEKEK, BANDUNG, JAWA BARAT",30,35,153,188
https://kawalpemilu.org#27913,"PASANGGRAHAN, SUKAWENING, GARUT, JAWA BARAT",1,46,145,191
https://kawalpemilu.org#26166,"KARANGGAN, GUNUNG PUTRI, BOGOR, JAWA BARAT",31,39,81,120
https://kawalpemilu.org#32543,"PONDOK PETIR, BOJONGSARI, KOTA DEPOK, JAWA BARAT",33,121,91,212
https://kawalpemilu.org#27072,"SUKASARI, CILAKU, CIANJUR, JAWA BARAT",17,40,136,176
https://kawalpemilu.org#32212,"CIRANGRANG, BABAKAN CIPARAY, KOTA BANDUNG, JAWA BARAT",12,80,132,219
https://kawalpemilu.org#31353,"NAGASARI, KARAWANG BARAT, KARAWANG, JAWA BARAT",43,78,106,184
https://kawalpemilu.org#26536,"LIGARMUKTI, KLAPANUNGGAL, BOGOR, JAWA BARAT",6,39,177,216
https://kawalpemilu.org#31257,"PASAWAHANANYAR, PASAWAHAN, PURWAKARTA, JAWA BARAT",5,63,155,218
https://kawalpemilu.org#27186,"MEKARSARI, CIKALONGKULON, CIANJUR, JAWA BARAT",16,59,64,123
https://kawalpemilu.org#30620,"JUNTIKEDOKAN, JUNTINYUAT, INDRAMAYU, JAWA BARAT",1,140,71,211
https://kawalpemilu.org#32513,"BEJI TIMUR, BEJI, KOTA DEPOK, JAWA BARAT",26,77,130,207
https://kawalpemilu.org#27509,"PATROLSARI, ARJASARI, BANDUNG, JAWA BARAT",11,116,77,193
https://kawalpemilu.org#32024,"KARANGANYAR, CILILIN, BANDUNG BARAT, JAWA BARAT",15,79,127,206
https://kawalpemilu.org#30923,"BINONG, BINONG, SUBANG, JAWA BARAT",18,134,82,216
https://kawalpemilu.org#30872,"PASIRKAREUMBI, SUBANG, SUBANG, JAWA BARAT",44,75,86,161
https://kawalpemilu.org#31029,"CIMENTENG, CIJAMBE, SUBANG, JAWA BARAT",8,158,54,212
https://kawalpemilu.org#29742,"DEPOK, DEPOK, CIREBON, JAWA BARAT",7,121,56,177
https://kawalpemilu.org#32565,"CIPAGERAN, CIMAHI UTARA, KOTA CIMAHI, JAWA BARAT",44,86,166,252
https://kawalpemilu.org#32405,"BEKASI JAYA, BEKASI TIMUR, KOTA BEKASI, JAWA BARAT",105,134,117,251
https://kawalpemilu.org#28434,"MANGUNREJA, MANGUNREJA, TASIKMALAYA, JAWA BARAT",4,58,165,223
https://kawalpemilu.org#32534,"SUKATANI, TAPOS, KOTA DEPOK, JAWA BARAT",32,88,138,226
https://kawalpemilu.org#26690,"BOJONGKERTA, WARUNG KIARA, SUKABUMI, JAWA BARAT",11,74,131,205
https://kawalpemilu.org#28448,"PUSPARAJA, CIGALONTANG, TASIKMALAYA, JAWA BARAT",8,51,158,209
https://kawalpemilu.org#29628,"BUYUT, GUNUNG JATI, CIREBON, JAWA BARAT",11,100,129,229
https://kawalpemilu.org#32065,"WENINGGALIH, SINDANGKERTA, BANDUNG BARAT, JAWA BARAT",18,98,101,199
https://kawalpemilu.org#32308,"CIBADUYUT WETAN, BOJONGLOA KIDUL, KOTA BANDUNG, JAWA BARAT",5,86,135,221
https://kawalpemilu.org#27507,"MEKARJAYA, ARJASARI, BANDUNG, JAWA BARAT",20,45,116,161
https://kawalpemilu.org#32577,"NAGARASARI, CIPEDES, KOTA TASIKMALAYA, JAWA BARAT",60,120,142,262
https://kawalpemilu.org#28502,"JATIHURIP, CISAYONG, TASIKMALAYA, JAWA BARAT",5,23,228,251
https://kawalpemilu.org#28345,"CIKEUSAL, TANJUNGJAYA, TASIKMALAYA, JAWA BARAT",7,63,153,216
https://kawalpemilu.org#26842,"TALAGAMURNI, CIBITUNG, SUKABUMI, JAWA BARAT",8,41,125,166
https://kawalpemilu.org#28215,"CIKALONG, CIKALONG, TASIKMALAYA, JAWA BARAT",6,54,170,224
https://kawalpemilu.org#26713,"KARANGTENGAH, CIBADAK, SUKABUMI, JAWA BARAT",28,59,115,174
https://kawalpemilu.org#26237,"CIKUTAMAHI, CARIU, BOGOR, JAWA BARAT",5,46,140,186
https://kawalpemilu.org#26876,"SUKAMANTRI, CISAAT, SUKABUMI, JAWA BARAT",22,65,174,239
https://kawalpemilu.org#29960,"CIKALONG, SUKAHAJI, MAJALENGKA, JAWA BARAT",15,68,183,251
https://kawalpemilu.org#29410,"BABAKAN LOSARI LOR, PABEDILAN, CIREBON, JAWA BARAT",2,147,65,212
https://kawalpemilu.org#29660,"ARJAWINANGUN, ARJAWINANGUN, CIREBON, JAWA BARAT",9,89,47,136
https://kawalpemilu.org#28807,"BOJONGSARI, PADAHERANG, PANGANDARAN, JAWA BARAT",7,150,33,183
https://kawalpemilu.org#32097,"BARANANGSIANG, BOGOR TIMUR, KOTA BOGOR, JAWA BARAT",14,95,123,218
https://kawalpemilu.org#26859,"CIBOLANG, GUNUNG GURUH, SUKABUMI, JAWA BARAT",13,37,114,151
https://kawalpemilu.org#31538,"CIWULAN, TELAGASARI, KARAWANG, JAWA BARAT",1,99,158,257
https://kawalpemilu.org#26393,"LUMPANG, PARUNG PANJANG, BOGOR, JAWA BARAT",8,124,47,171
https://kawalpemilu.org#31628,"PANGULAH UTARA, KOTA BARU, KARAWANG, JAWA BARAT",31,89,182,271
https://kawalpemilu.org#30835,"SUKAMULYA, TUKDANA, INDRAMAYU, JAWA BARAT",9,145,54,199
https://kawalpemilu.org#31009,"BELENDUNG, CIBOGO, SUBANG, JAWA BARAT",2,168,52,220
https://kawalpemilu.org#29640,"KAPETAKAN, KAPETAKAN, CIREBON, JAWA BARAT",17,132,33,165
https://kawalpemilu.org#32009,"CIPATIK, CIHAMPELAS, BANDUNG BARAT, JAWA BARAT",18,57,168,225
https://kawalpemilu.org#30334,"GENTENG, SUKASARI, SUMEDANG, JAWA BARAT",17,15,88,103
https://kawalpemilu.org#31178,"ANJUN, PLERED, PURWAKARTA, JAWA BARAT",1,46,217,263
https://kawalpemilu.org#26526,"SUKAJADI, TAMANSARI, BOGOR, JAWA BARAT",2,38,198,236
https://kawalpemilu.org#30263,"KARANGHEULEUT, SITURAJA, SUMEDANG, JAWA BARAT",2,44,142,186
https://kawalpemilu.org#27898,"KUTANAGARA, MALANGBONG, GARUT, JAWA BARAT",1,33,169,202
https://kawalpemilu.org#31736,"SETIAMEKAR, TAMBUN SELATAN, BEKASI, JAWA BARAT",7,76,137,213
https://kawalpemilu.org#27412,"CINUNUK, CILEUNYI, BANDUNG, JAWA BARAT",129,46,118,164
https://kawalpemilu.org#30488,"CIPELANG, UJUNGJAYA, SUMEDANG, JAWA BARAT",1,82,133,215
https://kawalpemilu.org#27662,"SUKAJADI, SOREANG, BANDUNG, JAWA BARAT",18,78,111,189
https://kawalpemilu.org#29585,"LURAH, PLUMBON, CIREBON, JAWA BARAT",15,130,66,196
https://kawalpemilu.org#28293,"WANDASARI, BOJONGGAMBIR, TASIKMALAYA, JAWA BARAT",9,111,58,169
https://kawalpemilu.org#30933,"DUKUH, CIASEM, SUBANG, JAWA BARAT",16,196,32,228
https://kawalpemilu.org#32465,"MUSTIKASARI, MUSTIKA JAYA, KOTA BEKASI, JAWA BARAT",80,116,143,259
https://kawalpemilu.org#29296,"BUNIGEULIS, HANTARA, KUNINGAN, JAWA BARAT",4,81,106,187
https://kawalpemilu.org#26352,"CIASIHAN, PAMIJAHAN, BOGOR, JAWA BARAT",33,62,103,165
https://kawalpemilu.org#32252,"CIBADAK, ASTANA ANYAR, KOTA BANDUNG, JAWA BARAT",10,123,70,193
https://kawalpemilu.org#27608,"WARGAMEKAR, BALEENDAH, BANDUNG, JAWA BARAT",74,89,72,161
https://kawalpemilu.org#30784,"SUKRAWETAN, SUKRA, INDRAMAYU, JAWA BARAT",3,137,59,196
https://kawalpemilu.org#31789,"SERTAJAYA, CIKARANG TIMUR, BEKASI, JAWA BARAT",12,32,45,77
https://kawalpemilu.org#32527,"CINERE, CINERE, KOTA DEPOK, JAWA BARAT",92,174,53,227
https://kawalpemilu.org#29817,"PURWAWINANGUN, SURANENGGALA, CIREBON, JAWA BARAT",25,71,139,210
https://kawalpemilu.org#29093,"SUKARAJA, CIAWIGEBANG, KUNINGAN, JAWA BARAT",7,86,83,169
https://kawalpemilu.org#28761,"PASAWAHAN, BANJARANYAR, CIAMIS, JAWA BARAT",9,105,104,209
https://kawalpemilu.org#27253,"PASIRBARU, PAGELARAN, CIANJUR, JAWA BARAT",19,62,110,172
https://kawalpemilu.org#34548,"PANDANREJO, KALIGESING, PURWOREJO, JAWA TENGAH",3,92,34,126
https://kawalpemilu.org#37453,"KOPEK, GODONG, GROBOGAN, JAWA TENGAH",4,148,42,190
https://kawalpemilu.org#34321,"LOGANDU, KARANGGAYAM, KEBUMEN, JAWA TENGAH",9,121,41,162
https://kawalpemilu.org#34314,"KAJORAN, KARANGGAYAM, KEBUMEN, JAWA TENGAH",3,165,33,198
https://kawalpemilu.org#91445,"SIDANEGARA, CILACAP TENGAH, CILACAP, JAWA TENGAH",25,102,48,150
https://kawalpemilu.org#37836,"SUMBER, SUMBER, REMBANG, JAWA TENGAH",5,117,38,155
https://kawalpemilu.org#32828,"MUKTISARI, GANDRUNGMANGU, CILACAP, JAWA TENGAH",11,109,39,148
https://kawalpemilu.org#36414,"TELUKAN, GROGOL, SUKOHARJO, JAWA TENGAH",9,148,49,197
https://kawalpemilu.org#36736,"GUNUNGSARI, JATISRONO, WONOGIRI, JAWA TENGAH",11,180,14,194
https://kawalpemilu.org#39518,"KALIMANGGIS, KALORAN, TEMANGGUNG, JAWA TENGAH",1,173,18,191
https://kawalpemilu.org#35225,"BLIGO, NGLUWAR, MAGELANG, JAWA TENGAH",13,137,40,177
https://kawalpemilu.org#37359,"KUNDEN, WIROSARI, GROBOGAN, JAWA TENGAH",14,169,63,232
https://kawalpemilu.org#41511,"KERTEN, LAWEYAN, KOTA SURAKARTA, JAWA TENGAH",31,221,48,269
https://kawalpemilu.org#33417,"KEDUNG MENJANGAN, PURBALINGGA, PURBALINGGA, JAWA TENGAH",9,168,45,213
https://kawalpemilu.org#37295,"JAMBANGAN, GEYER, GROBOGAN, JAWA TENGAH",6,242,8,250
https://kawalpemilu.org#39235,"SUKOREJO, SURUH, SEMARANG, JAWA TENGAH",9,115,44,159
https://kawalpemilu.org#40774,"WANAREJAN UTARA, TAMAN, PEMALANG, JAWA TENGAH",13,152,64,216
https://kawalpemilu.org#40039,"KEBONAGUNG, NGAMPEL, KENDAL, JAWA TENGAH",1,147,37,184
https://kawalpemilu.org#33643,"MANDIRAJAKULON, MANDIRAJA, BANJARNEGARA, JAWA TENGAH",9,140,76,216
https://kawalpemilu.org#40141,"SURJO, BAWANG, BATANG, JAWA TENGAH",7,143,66,209
https://kawalpemilu.org#84902,"GENTASARI, KROYA, CILACAP, JAWA TENGAH",16,139,102,241
https://kawalpemilu.org#41687,"METESEH, TEMBALANG, KOTA SEMARANG, JAWA TENGAH",23,202,35,237
https://kawalpemilu.org#39088,"GENENG, MIJEN, DEMAK, JAWA TENGAH",5,82,12,94
https://kawalpemilu.org#40394,"KALIMOJOSARI, DORO, PEKALONGAN, JAWA TENGAH",13,147,16,163
https://kawalpemilu.org#37427,"TARUMAN, KLAMBU, GROBOGAN, JAWA TENGAH",1,131,43,174
https://kawalpemilu.org#36611,"WURYOREJO, WONOGIRI, WONOGIRI, JAWA TENGAH",17,140,58,198
https://kawalpemilu.org#41322,"LEMBARAWA, BREBES, BREBES, JAWA TENGAH",8,84,15,99
https://kawalpemilu.org#87435,"PEKUNCEN, KROYA, CILACAP, JAWA TENGAH",21,134,48,182
https://kawalpemilu.org#41627,"SIWALAN, GAYAM SARI, KOTA SEMARANG, JAWA TENGAH",15,211,50,261
https://kawalpemilu.org#39473,"TEMANGGUNG 2, TEMANGGUNG, TEMANGGUNG, JAWA TENGAH",4,141,111,252
https://kawalpemilu.org#34023,"BOCOR, BULUSPESANTREN, KEBUMEN, JAWA TENGAH",4,136,30,166
https://kawalpemilu.org#35102,"SOJOPURO, MOJOTENGAH, WONOSOBO, JAWA TENGAH",4,87,92,179
https://kawalpemilu.org#41039,"LEMAH DUWUR, ADIWERNA, TEGAL, JAWA TENGAH",9,183,80,263
https://kawalpemilu.org#34139,"WONOKROMO, ALIAN, KEBUMEN, JAWA TENGAH",7,98,12,110
https://kawalpemilu.org#35271,"KALIBENING, DUKUN, MAGELANG, JAWA TENGAH",4,73,118,191
https://kawalpemilu.org#41127,"PADAHARJA, KRAMAT, TEGAL, JAWA TENGAH",1,149,76,225
https://kawalpemilu.org#91441,"TAMBAKREJA, CILACAP SELATAN, CILACAP, JAWA TENGAH",17,142,36,178
https://kawalpemilu.org#39855,"BOJA, BOJA, KENDAL, JAWA TENGAH",16,142,59,201
https://kawalpemilu.org#33069,"KEMIRI, SUMPIUH, BANYUMAS, JAWA TENGAH",3,115,67,182
https://kawalpemilu.org#41763,"BRINGIN, NGALIYAN, KOTA SEMARANG, JAWA TENGAH",30,166,83,249
https://kawalpemilu.org#33831,"PENUSUPAN, PEJAWARAN, BANJARNEGARA, JAWA TENGAH",7,143,71,214
https://kawalpemilu.org#37741,"BOTORECO, KUNDURAN, BLORA, JAWA TENGAH",18,214,11,225
https://kawalpemilu.org#37935,"KUMBO, SEDAN, REMBANG, JAWA TENGAH",2,148,20,168
https://kawalpemilu.org#38987,"GEMULAK, SAYUNG, DEMAK, JAWA TENGAH",11,184,55,239
https://kawalpemilu.org#37950,"PAMOTAN, PAMOTAN, REMBANG, JAWA TENGAH",5,151,88,239
https://kawalpemilu.org#41450,"TANGGUNGSARI, KETANGGUNGAN, BREBES, JAWA TENGAH",3,112,58,170
https://kawalpemilu.org#41312,"LIMBANGAN KULON, BREBES, BREBES, JAWA TENGAH",12,60,24,84
https://kawalpemilu.org#36566,"PULOHARJO, EROMOKO, WONOGIRI, JAWA TENGAH",6,170,13,183
https://kawalpemilu.org#41861,"SUMURPANGGANG, MARGADANA, KOTA TEGAL, JAWA TENGAH",18,95,84,179
https://kawalpemilu.org#38653,"BULUNGCANGKRING, JEKULO, KUDUS, JAWA TENGAH",26,137,27,164
https://kawalpemilu.org#38450,"PAGERHARJO, WEDARIJAKSA, PATI, JAWA TENGAH",13,199,11,210
https://kawalpemilu.org#41609,"PANGGUNG KIDUL, SEMARANG UTARA, KOTA SEMARANG, JAWA TENGAH",5,231,25,256
https://kawalpemilu.org#37454,"KEMLOKO, GODONG, GROBOGAN, JAWA TENGAH",4,174,67,241
https://kawalpemilu.org#41696,"SENDANGGUWO, TEMBALANG, KOTA SEMARANG, JAWA TENGAH",50,138,44,182
https://kawalpemilu.org#41858,"CABAWAN, MARGADANA, KOTA TEGAL, JAWA TENGAH",14,88,42,130
https://kawalpemilu.org#41674,"KARANGANYAR GUNUNG, CANDISARI, KOTA SEMARANG, JAWA TENGAH",28,135,24,159
https://kawalpemilu.org#40449,"SRINAHAN, KESESI, PEKALONGAN, JAWA TENGAH",9,120,51,171
https://kawalpemilu.org#33234,"SOKARAJA TENGAH, SOKARAJA, BANYUMAS, JAWA TENGAH",11,134,69,203
https://kawalpemilu.org#39170,"MIJEN, KEBONAGUNG, DEMAK, JAWA TENGAH",10,151,37,188
https://kawalpemilu.org#41783,"PODOSUGIH, PEKALONGAN BARAT, KOTA PEKALONGAN, JAWA TENGAH",5,150,72,222
https://kawalpemilu.org#35598,"URUTSEWU, AMPEL, BOYOLALI, JAWA TENGAH",16,186,34,220
https://kawalpemilu.org#84936,"CARUY, CIPARI, CILACAP, JAWA TENGAH",7,133,31,164
https://kawalpemilu.org#37417,"TEMON, BRATI, GROBOGAN, JAWA TENGAH",12,168,13,181
https://kawalpemilu.org#33607,"GUMELEM WETAN, SUSUKAN, BANJARNEGARA, JAWA TENGAH",17,155,42,197
https://kawalpemilu.org#39028,"MOJODEMAK, WONOSALAM, DEMAK, JAWA TENGAH",7,138,18,156
https://kawalpemilu.org#38958,"BOGOSARI, GUNTUR, DEMAK, JAWA TENGAH",14,162,50,212
https://kawalpemilu.org#32807,"KUBANGKANGKUNG, KAWUNGANTEN, CILACAP, JAWA TENGAH",4,133,51,184
https://kawalpemilu.org#32743,"KARANGTAWANG, NUSAWUNGU, CILACAP, JAWA TENGAH",9,153,25,178
https://kawalpemilu.org#37511,"TANGGUNGHARJO, TANGGUNGHARJO, GROBOGAN, JAWA TENGAH",5,155,21,176
https://kawalpemilu.org#40720,"RANDUDONGKAL, RANDUDONGKAL, PEMALANG, JAWA TENGAH",28,127,90,217
https://kawalpemilu.org#34147,"KEBUMEN, KEBUMEN, KEBUMEN, JAWA TENGAH",7,127,65,192
https://kawalpemilu.org#32825,"GINTUNGREJA, GANDRUNGMANGU, CILACAP, JAWA TENGAH",17,128,27,155
https://kawalpemilu.org#34012,"PODOLUHUR, KLIRONG, KEBUMEN, JAWA TENGAH",9,137,33,170
https://kawalpemilu.org#33673,"JOHO, BAWANG, BANJARNEGARA, JAWA TENGAH",1,124,64,188
https://kawalpemilu.org#40739,"SUGIHWARAS, PEMALANG, PEMALANG, JAWA TENGAH",46,153,35,188
https://kawalpemilu.org#39326,"BARAN, AMBARAWA, SEMARANG, JAWA TENGAH",18,162,31,193
https://kawalpemilu.org#41238,"BENDA, SIRAMPOG, BREBES, JAWA TENGAH",6,125,38,163
https://kawalpemilu.org#39555,"GONDANGWAYANG, KEDU, TEMANGGUNG, JAWA TENGAH",13,213,29,242
https://kawalpemilu.org#41296,"KUPU, WANASARI, BREBES, JAWA TENGAH",23,151,25,176
https://kawalpemilu.org#39620,"BENDUNGAN, TRETEP, TEMANGGUNG, JAWA TENGAH",3,85,116,201
https://kawalpemilu.org#37345,"SENDANGREJO, NGARINGAN, GROBOGAN, JAWA TENGAH",7,190,15,205
https://kawalpemilu.org#41752,"WONOLOPO, MIJEN, KOTA SEMARANG, JAWA TENGAH",20,194,58,252
https://kawalpemilu.org#39645,"PENDOWO, KRANGGAN, TEMANGGUNG, JAWA TENGAH",8,217,17,234
https://kawalpemilu.org#38785,"MINDAHAN KIDUL, BATEALIT, JEPARA, JAWA TENGAH",6,209,32,241
https://kawalpemilu.org#41075,"LAWATAN, DUKUHTURI, TEGAL, JAWA TENGAH",3,118,71,189
https://kawalpemilu.org#41509,"PURWOSARI, LAWEYAN, KOTA SURAKARTA, JAWA TENGAH",15,217,34,251
https://kawalpemilu.org#35176,"KARANGSAMBUNG, KALIBAWANG, WONOSOBO, JAWA TENGAH",5,113,18,131
https://kawalpemilu.org#41608,"PANGGUNG LOR, SEMARANG UTARA, KOTA SEMARANG, JAWA TENGAH",17,172,3,175
https://kawalpemilu.org#41554,"MANGKUBUMEN, BANJARSARI, KOTA SURAKARTA, JAWA TENGAH",3,222,27,249
https://kawalpemilu.org#41148,"KEDUNGKELOR, WARUREJA, TEGAL, JAWA TENGAH",15,130,59,189
https://kawalpemilu.org#36032,"JIWAN, KARANGNONGKO, KLATEN, JAWA TENGAH",13,215,13,228
https://kawalpemilu.org#37754,"KLOKAH, KUNDURAN, BLORA, JAWA TENGAH",6,149,29,178
https://kawalpemilu.org#37097,"SRAGEN WETAN, SRAGEN, SRAGEN, JAWA TENGAH",20,151,43,194
https://kawalpemilu.org#35307,"PUCUNGREJO, MUNTILAN, MAGELANG, JAWA TENGAH",4,158,60,218
https://kawalpemilu.org#41233,"TARABAN, PAGUYANGAN, BREBES, JAWA TENGAH",23,150,26,176
https://kawalpemilu.org#40640,"GAMBUHAN, PULOSARI, PEMALANG, JAWA TENGAH",25,64,42,106
https://kawalpemilu.org#91434,"MERTASINGA, CILACAP UTARA, CILACAP, JAWA TENGAH",41,168,27,195
https://kawalpemilu.org#41310,"BREBES, BREBES, BREBES, JAWA TENGAH",13,121,114,235
https://kawalpemilu.org#41100,"KEDUNGBUNGKUS, TARUB, TEGAL, JAWA TENGAH",3,80,81,161
https://kawalpemilu.org#37309,"JETAKSARI, PULOKULON, GROBOGAN, JAWA TENGAH",3,144,28,172
https://kawalpemilu.org#39960,"PIDODO WETAN, PATEBON, KENDAL, JAWA TENGAH",2,135,43,178
https://kawalpemilu.org#38684,"KEDUNGSARI, GEBOG, KUDUS, JAWA TENGAH",39,198,17,215
https://kawalpemilu.org#36841,"KARANGBANGUN, MATESIH, KARANGANYAR, JAWA TENGAH",17,150,34,184
https://kawalpemilu.org#33627,"KALIMANDI, PURWOREJO KLAMPOK, BANJARNEGARA, JAWA TENGAH",10,54,109,163
https://kawalpemilu.org#39312,"MENDONGAN, SUMOWONO, SEMARANG, JAWA TENGAH",3,187,39,226
https://kawalpemilu.org#33172,"KEDUNGURANG, GUMELAR, BANYUMAS, JAWA TENGAH",3,108,54,162
https://kawalpemilu.org#32861,"CIMANGGU, CIMANGGU, CILACAP, JAWA TENGAH",24,130,50,180
https://kawalpemilu.org#34275,"KEDUNGJATI, SEMPOR, KEBUMEN, JAWA TENGAH",8,97,21,118
https://kawalpemilu.org#89314,"JLAMPRANG, WONOSOBO, WONOSOBO, JAWA TENGAH",6,142,48,190
https://kawalpemilu.org#34145,"TAMANWINANGUN, KEBUMEN, KEBUMEN, JAWA TENGAH",22,144,89,233
https://kawalpemilu.org#39393,"KENER, KALIWUNGU, SEMARANG, JAWA TENGAH",1,149,55,204
https://kawalpemilu.org#33950,"ARJOWINANGUN, PURING, KEBUMEN, JAWA TENGAH",1,66,54,120
https://kawalpemilu.org#40081,"TUMBREP, BANDAR, BATANG, JAWA TENGAH",10,127,43,170
https://kawalpemilu.org#33889,"SIRONGGE, PANDANARUM, BANJARNEGARA, JAWA TENGAH",3,112,13,125
https://kawalpemilu.org#37694,"BACEM, BANJAREJO, BLORA, JAWA TENGAH",8,142,12,154
https://kawalpemilu.org#34219,"JOHO, ADIMULYO, KEBUMEN, JAWA TENGAH",2,110,40,150
https://kawalpemilu.org#39667,"TANGGULANOM, SELOPAMPANG, TEMANGGUNG, JAWA TENGAH",7,212,12,224
https://kawalpemilu.org#36257,"GEMBLEGAN, KALIKOTES, KLATEN, JAWA TENGAH",1,127,63,190
https://kawalpemilu.org#36314,"PURON, BULU, SUKOHARJO, JAWA TENGAH",1,158,38,196
https://kawalpemilu.org#34889,"LEGETAN, BENER, PURWOREJO, JAWA TENGAH",9,156,31,187
https://kawalpemilu.org#39742,"KARANGSENENG, GEMAWANG, TEMANGGUNG, JAWA TENGAH",1,131,30,161
https://kawalpemilu.org#38889,"SUMANDING, KEMBANG, JEPARA, JAWA TENGAH",4,133,91,224
https://kawalpemilu.org#41283,"PAMENGGER, JATIBARANG, BREBES, JAWA TENGAH",9,114,54,168
https://kawalpemilu.org#33416,"TOYAREJA, PURBALINGGA, PURBALINGGA, JAWA TENGAH",6,168,25,193
https://kawalpemilu.org#38092,"WORO, KRAGAN, REMBANG, JAWA TENGAH",5,152,68,220
https://kawalpemilu.org#36328,"PONOWAREN, TAWANGSARI, SUKOHARJO, JAWA TENGAH",10,216,15,231
https://kawalpemilu.org#40126,"WONOROJO, REBAN, BATANG, JAWA TENGAH",2,151,22,173
https://kawalpemilu.org#35809,"KACANGAN, ANDONG, BOYOLALI, JAWA TENGAH",8,180,15,195
https://kawalpemilu.org#40867,"MARGASARI, MARGASARI, TEGAL, JAWA TENGAH",14,139,84,223
https://kawalpemilu.org#33367,"TIDU, BUKATEJA, PURBALINGGA, JAWA TENGAH",3,169,25,194
https://kawalpemilu.org#37366,"SAMBIREJO, WIROSARI, GROBOGAN, JAWA TENGAH",10,181,10,191
https://kawalpemilu.org#87446,"GLEMPANG, MAOS, CILACAP, JAWA TENGAH",3,95,78,173
https://kawalpemilu.org#41301,"SIASEM, WANASARI, BREBES, JAWA TENGAH",15,111,66,177
https://kawalpemilu.org#38646,"JOJO, MEJOBO, KUDUS, JAWA TENGAH",2,158,27,185
https://kawalpemilu.org#41812,"PANJANG WETAN, PEKALONGAN UTARA, KOTA PEKALONGAN, JAWA TENGAH",16,152,69,221
https://kawalpemilu.org#32888,"PADANGJAYA, MAJENANG, CILACAP, JAWA TENGAH",3,114,94,208
https://kawalpemilu.org#87466,"BOLANG, DAYEUHLUHUR, CILACAP, JAWA TENGAH",3,27,86,113
https://kawalpemilu.org#35391,"MUNGGANGSARI, KALIANGKRIK, MAGELANG, JAWA TENGAH",6,158,44,202
https://kawalpemilu.org#34393,"KETAWANGREJO, GRABAG, PURWOREJO, JAWA TENGAH",8,158,43,201
https://kawalpemilu.org#35138,"CAMPURSARI, KEJAJAR, WONOSOBO, JAWA TENGAH",2,208,15,223
https://kawalpemilu.org#37684,"GEMPOLREJO, TUNJUNGAN, BLORA, JAWA TENGAH",13,138,91,229
https://kawalpemilu.org#34967,"PESODONGAN, KALIWIRO, WONOSOBO, JAWA TENGAH",7,116,19,135
https://kawalpemilu.org#38837,"BUMIHARJO, KELING, JEPARA, JAWA TENGAH",9,200,35,235
https://kawalpemilu.org#32881,"BOJA, MAJENANG, CILACAP, JAWA TENGAH",4,97,7,104
https://kawalpemilu.org#34276,"SEMALI, SEMPOR, KEBUMEN, JAWA TENGAH",1,129,99,228
https://kawalpemilu.org#39150,"BUKO, WEDUNG, DEMAK, JAWA TENGAH",7,160,37,197
https://kawalpemilu.org#84902,"GENTASARI, KROYA, CILACAP, JAWA TENGAH",7,189,29,218
https://kawalpemilu.org#38218,"KARANGKONANG, WINONG, PATI, JAWA TENGAH",4,159,36,195
https://kawalpemilu.org#36713,"TUNGGUR, SLOGOHIMO, WONOGIRI, JAWA TENGAH",6,123,3,126
https://kawalpemilu.org#39372,"KLEPU, PRINGAPUS, SEMARANG, JAWA TENGAH",21,184,39,223
https://kawalpemilu.org#39483,"MANDING, TEMANGGUNG, TEMANGGUNG, JAWA TENGAH",7,119,82,201
https://kawalpemilu.org#37378,"TARUB, TAWANGHARJO, GROBOGAN, JAWA TENGAH",15,191,13,204
https://kawalpemilu.org#38173,"PAKIS, TAMBAKROMO, PATI, JAWA TENGAH",6,127,7,134
https://kawalpemilu.org#39788,"SELOKATON, SUKOREJO, KENDAL, JAWA TENGAH",4,90,56,146
https://kawalpemilu.org#87431,"TAMBAKSARI, KEDUNGREJA, CILACAP, JAWA TENGAH",13,154,62,216
https://kawalpemilu.org#37908,"GUNUNGMULYO, SARANG, REMBANG, JAWA TENGAH",1,103,66,169
https://kawalpemilu.org#33028,"TAMBAKNEGARA, RAWALO, BANYUMAS, JAWA TENGAH",25,139,43,182
https://kawalpemilu.org#37037,"JENGGRIK, KEDAWUNG, SRAGEN, JAWA TENGAH",12,164,27,191
https://kawalpemilu.org#39172,"MANGUNREJO, KEBONAGUNG, DEMAK, JAWA TENGAH",6,162,35,197
https://kawalpemilu.org#38662,"HONGGOSOCO, JEKULO, KUDUS, JAWA TENGAH",2,136,62,198
https://kawalpemilu.org#39000,"SAMPANG, KARANGTENGAH, DEMAK, JAWA TENGAH",7,200,42,242
https://kawalpemilu.org#36997,"SAREN, KALIJAMBE, SRAGEN, JAWA TENGAH",6,54,78,132
https://kawalpemilu.org#33139,"KEDUNGWRINGIN, PATIKRAJA, BANYUMAS, JAWA TENGAH",11,161,72,233
https://kawalpemilu.org#38597,"DAMARAN, KUDUS, KUDUS, JAWA TENGAH",1,80,39,119
https://kawalpemilu.org#38579,"KALIWUNGU, KALIWUNGU, KUDUS, JAWA TENGAH",28,147,33,180
https://kawalpemilu.org#37407,"NGLOBAR, PURWODADI, GROBOGAN, JAWA TENGAH",12,175,14,189
https://kawalpemilu.org#33061,"KARANGSALAM, KEMRANJEN, BANYUMAS, JAWA TENGAH",12,158,44,202
https://kawalpemilu.org#84906,"MAOS KIDUL, MAOS, CILACAP, JAWA TENGAH",11,107,88,195
https://kawalpemilu.org#37164,"NGANDUL, SUMBERLAWANG, SRAGEN, JAWA TENGAH",13,177,3,180
https://kawalpemilu.org#33870,"KALIBOMBONG, KALIBENING, BANJARNEGARA, JAWA TENGAH",13,135,29,164
https://kawalpemilu.org#37817,"PENGKOLREJO, JAPAH, BLORA, JAWA TENGAH",13,146,23,169
https://kawalpemilu.org#38578,"MIJEN, KALIWUNGU, KUDUS, JAWA TENGAH",6,133,47,180
https://kawalpemilu.org#36304,"NGRECO, WERU, SUKOHARJO, JAWA TENGAH",4,170,5,175
https://kawalpemilu.org#38939,"JRAGUNG, KARANGAWEN, DEMAK, JAWA TENGAH",22,170,39,209
https://kawalpemilu.org#41041,"UJUNGRUSI, ADIWERNA, TEGAL, JAWA TENGAH",11,166,89,255
https://kawalpemilu.org#35734,"DONOHUDAN, NGEMPLAK, BOYOLALI, JAWA TENGAH",20,174,50,224
https://kawalpemilu.org#34964,"LEBAK, KALIWIRO, WONOSOBO, JAWA TENGAH",6,143,1,144
https://kawalpemilu.org#36430,"GEDONGAN, BAKI, SUKOHARJO, JAWA TENGAH",5,215,32,247
https://kawalpemilu.org#40187,"SUKOREJO, LIMPUNG, BATANG, JAWA TENGAH",7,199,13,212
https://kawalpemilu.org#41269,"JATIBARANG KIDUL, JATIBARANG, BREBES, JAWA TENGAH",29,103,73,176
https://kawalpemilu.org#33650,"KALIAJIR, PURWONEGORO, BANJARNEGARA, JAWA TENGAH",13,162,24,186
https://kawalpemilu.org#35740,"MANGGUNG, NGEMPLAK, BOYOLALI, JAWA TENGAH",10,173,18,191
https://kawalpemilu.org#38118,"SUMBERGIRANG, LASEM, REMBANG, JAWA TENGAH",18,68,14,82
https://kawalpemilu.org#33234,"SOKARAJA TENGAH, SOKARAJA, BANYUMAS, JAWA TENGAH",12,167,53,220
https://kawalpemilu.org#40105,"KALIPANCUR, BLADO, BATANG, JAWA TENGAH",7,154,29,183
https://kawalpemilu.org#40533,"PEKAJANGAN, KEDUNGWUNI, PEKALONGAN, JAWA TENGAH",10,142,106,248
https://kawalpemilu.org#41235,"WINDUAJI, PAGUYANGAN, BREBES, JAWA TENGAH",10,107,35,142
https://kawalpemilu.org#35684,"KATEGUHAN, SAWIT, BOYOLALI, JAWA TENGAH",8,208,15,223
https://kawalpemilu.org#40770,"KALIGELANG, TAMAN, PEMALANG, JAWA TENGAH",6,127,35,162
https://kawalpemilu.org#37767,"TINAPAN, TODANAN, BLORA, JAWA TENGAH",11,201,12,213
https://kawalpemilu.org#37124,"PADAS, TANON, SRAGEN, JAWA TENGAH",6,183,17,200
https://kawalpemilu.org#38163,"KAYEN, KAYEN, PATI, JAWA TENGAH",36,126,63,189
https://kawalpemilu.org#37773,"KEDUNGWUNGU, TODANAN, BLORA, JAWA TENGAH",12,223,12,235
https://kawalpemilu.org#34551,"PURBOWONO, KALIGESING, PURWOREJO, JAWA TENGAH",1,105,21,126
https://kawalpemilu.org#39224,"KENTENG, SUSUKAN, SEMARANG, JAWA TENGAH",10,160,37,197
https://kawalpemilu.org#36946,"WARU, KEBAKKRAMAT, KARANGANYAR, JAWA TENGAH",23,138,60,198
https://kawalpemilu.org#41385,"KEMURANG WETAN, TANJUNG, BREBES, JAWA TENGAH",32,137,32,169
https://kawalpemilu.org#35079,"BOMERTO, WONOSOBO, WONOSOBO, JAWA TENGAH",2,192,67,259
https://kawalpemilu.org#41835,"KEMANDUNGAN, TEGAL BARAT, KOTA TEGAL, JAWA TENGAH",7,160,77,237
https://kawalpemilu.org#41018,"PROCOT, SLAWI, TEGAL, JAWA TENGAH",10,134,80,214
https://kawalpemilu.org#41229,"PAGUYANGAN, PAGUYANGAN, BREBES, JAWA TENGAH",8,131,69,200
https://kawalpemilu.org#33698,"RANDEGAN, SIGALUH, BANJARNEGARA, JAWA TENGAH",4,107,34,141
https://kawalpemilu.org#41388,"LUWUNGGEDE, TANJUNG, BREBES, JAWA TENGAH",6,89,61,150
https://kawalpemilu.org#35668,"DLINGO, MOJOSONGO, BOYOLALI, JAWA TENGAH",12,193,13,206
https://kawalpemilu.org#36924,"KLODRAN, COLOMADU, KARANGANYAR, JAWA TENGAH",8,142,22,164
https://kawalpemilu.org#35924,"PASEBAN, BAYAT, KLATEN, JAWA TENGAH",9,193,18,211
https://kawalpemilu.org#40238,"MANGGIS, TULIS, BATANG, JAWA TENGAH",3,123,32,155
https://kawalpemilu.org#38168,"TRIMULYO, KAYEN, PATI, JAWA TENGAH",4,163,25,188
https://kawalpemilu.org#38619,"MEGAWON, JATI, KUDUS, JAWA TENGAH",5,122,51,173
https://kawalpemilu.org#36377,"GENTAN, BENDOSARI, SUKOHARJO, JAWA TENGAH",13,209,16,225
https://kawalpemilu.org#39074,"CANGKRING, KARANGANYAR, DEMAK, JAWA TENGAH",15,163,50,213
https://kawalpemilu.org#37449,"MANGGARMAS, GODONG, GROBOGAN, JAWA TENGAH",12,137,53,190
https://kawalpemilu.org#36055,"TEMUWANGI, PEDAN, KLATEN, JAWA TENGAH",1,186,27,213
https://kawalpemilu.org#36600,"PARE, SELOGIRI, WONOGIRI, JAWA TENGAH",9,134,17,151
