https://kawalpemilu.org#44801,"CURAHTAKIR, TEMPUREJO, JEMBER, JAWA TIMUR",25,38,119,157
https://kawalpemilu.org#44452,"PASIRIAN, PASIRIAN, LUMAJANG, JAWA TIMUR",17,150,52,202
https://kawalpemilu.org#43810,"GROGOL, GROGOL, KEDIRI, JAWA TIMUR",18,116,102,218
https://kawalpemilu.org#46654,"SEDATIGEDE, SEDATI, SIDOARJO, JAWA TIMUR",7,138,113,251
https://kawalpemilu.org#49204,"MENDOGO, NGIMBANG, LAMONGAN, JAWA TIMUR",2,116,66,182
https://kawalpemilu.org#50627,"CAMPOR, PROPPO, PAMEKASAN, JAWA TIMUR",26,4,267,271
https://kawalpemilu.org#45526,"ASEMBAGUS, ASEMBAGUS, SITUBONDO, JAWA TIMUR",13,108,107,215
https://kawalpemilu.org#43593,"JUGO, KESAMBEN, BLITAR, JAWA TIMUR",16,130,43,173
https://kawalpemilu.org#44747,"TEGALSARI, AMBULU, JEMBER, JAWA TIMUR",20,68,52,120
https://kawalpemilu.org#50210,"SENDANG LAOK, LABANG, BANGKALAN, JAWA TIMUR",6,132,80,212
https://kawalpemilu.org#44027,"TEGALREJO, SUMBERMANJING WETAN, MALANG, JAWA TIMUR",5,119,56,175
https://kawalpemilu.org#45013,"KALIBARUWETAN, KALIBARU, BANYUWANGI, JAWA TIMUR",1,82,89,171
https://kawalpemilu.org#51189,"KASIN, KLOJEN, KOTA MALANG, JAWA TIMUR",18,175,23,198
https://kawalpemilu.org#44692,"DARUNGAN, TANGGUL, JEMBER, JAWA TIMUR",29,59,139,198
https://kawalpemilu.org#49287,"KARANGTAWAR, LAREN, LAMONGAN, JAWA TIMUR",1,52,60,112
https://kawalpemilu.org#48013,"MALANG, MAOSPATI, MAGETAN, JAWA TIMUR",2,113,90,203
https://kawalpemilu.org#46260,"SUMBER ANYAR, NGULING, PASURUAN, JAWA TIMUR",15,177,16,193
https://kawalpemilu.org#46790,"WATUKENONGO, PUNGGING, MOJOKERTO, JAWA TIMUR",7,193,51,244
https://kawalpemilu.org#44733,"BALUNGKULON, BALUNG, JEMBER, JAWA TIMUR",36,145,31,176
https://kawalpemilu.org#50661,"BLUMBUNGAN, LARANGAN, PAMEKASAN, JAWA TIMUR",42,26,165,191
https://kawalpemilu.org#47023,"SUKOPINGGIR, GUDO, JOMBANG, JAWA TIMUR",9,132,43,175
https://kawalpemilu.org#51443,"JEPARA, BUBUTAN, KOTA SURABAYA, JAWA TIMUR",14,149,47,196
https://kawalpemilu.org#50834,"DARAMESTA, LENTENG, SUMENEP, JAWA TIMUR",11,15,71,86
https://kawalpemilu.org#47490,"BANJARANYAR, TANJUNGANOM, NGANJUK, JAWA TIMUR",4,147,24,171
https://kawalpemilu.org#51483,"WIYUNG, WIYUNG, KOTA SURABAYA, JAWA TIMUR",46,179,8,187
https://kawalpemilu.org#51216,"BANDULAN, SUKUN, KOTA MALANG, JAWA TIMUR",30,170,73,243
https://kawalpemilu.org#45314,"KARANG ANYAR, KLABANG, BONDOWOSO, JAWA TIMUR",6,21,186,207
https://kawalpemilu.org#48278,"KARANGBANYU, WIDODAREN, NGAWI, JAWA TIMUR",22,16,456,472
https://kawalpemilu.org#43419,"PULEREJO, BAKUNG, BLITAR, JAWA TIMUR",8,74,12,86
https://kawalpemilu.org#51209,"CIPTOMULYO, SUKUN, KOTA MALANG, JAWA TIMUR",35,176,58,234
https://kawalpemilu.org#48278,"KARANGBANYU, WIDODAREN, NGAWI, JAWA TIMUR",16,98,21,119
https://kawalpemilu.org#43282,"JOHO, KALIDAWIR, TULUNGAGUNG, JAWA TIMUR",20,167,8,175
https://kawalpemilu.org#50467,"TEROSAN, BANYUATES, SAMPANG, JAWA TIMUR",15,5,147,152
https://kawalpemilu.org#48711,"PURWOREJO, PADANGAN, BOJONEGORO, JAWA TIMUR",4,109,61,170
https://kawalpemilu.org#43950,"DAWUNG, RINGINREJO, KEDIRI, JAWA TIMUR",6,174,36,210
https://kawalpemilu.org#44951,"KEDUNGWUNGU, TEGALDLIMO, BANYUWANGI, JAWA TIMUR",5,122,70,192
https://kawalpemilu.org#50472,"TEBANAH, BANYUATES, SAMPANG, JAWA TIMUR",7,4,280,280
https://kawalpemilu.org#43585,"DOKO, DOKO, BLITAR, JAWA TIMUR",15,133,9,142
https://kawalpemilu.org#49947,"SINGOSARI, KEBOMAS, GRESIK, JAWA TIMUR",5,121,53,174
https://kawalpemilu.org#47496,"DEMANGAN, TANJUNGANOM, NGANJUK, JAWA TIMUR",6,138,31,169
https://kawalpemilu.org#44744,"TANJUNGREJO, WULUHAN, JEMBER, JAWA TIMUR",20,156,50,206
https://kawalpemilu.org#44705,"MLOKOREJO, PUGER, JEMBER, JAWA TIMUR",10,92,57,149
https://kawalpemilu.org#46347,"TEMU, PRAMBON, SIDOARJO, JAWA TIMUR",6,166,54,220
https://kawalpemilu.org#42646,"TEMPURAN, SAWOO, PONOROGO, JAWA TIMUR",20,165,49,214
https://kawalpemilu.org#45860,"SUMBERBULU, TEGALSIWALAN, PROBOLINGGO, JAWA TIMUR",4,103,129,232
https://kawalpemilu.org#43102,"GEDANGSEWU, BOYOLANGU, TULUNGAGUNG, JAWA TIMUR",5,142,33,175
https://kawalpemilu.org#47759,"NGETREP, JIWAN, MADIUN, JAWA TIMUR",6,117,69,186
https://kawalpemilu.org#59136,"SEBADAK, KETUNGAU HULU, SINTANG, KALIMANTAN BARAT",3,281,6,287
https://kawalpemilu.org#58865,"SIMPANG TIGA SEMBELANGAAN, NANGA TAYAP, KETAPANG, KALIMANTAN BARAT",6,123,69,192
https://kawalpemilu.org#60206,"SIANTAN HILIR, PONTIANAK UTARA, KOTA PONTIANAK, KALIMANTAN BARAT",11,39,107,146
https://kawalpemilu.org#58304,"SUMBER HARAPAN, SAMBAS, SAMBAS, KALIMANTAN BARAT",6,62,66,128
https://kawalpemilu.org#60318,"OLAK-OLAK KUBU, KUBU, KUBU RAYA, KALIMANTAN BARAT",10,96,65,161
https://kawalpemilu.org#60251,"SEDAU, SINGKAWANG SELATAN, KOTA SINGKAWANG, KALIMANTAN BARAT",41,115,4,159
https://kawalpemilu.org#58578,"ENTAKAI, KAPUAS, SANGGAU, KALIMANTAN BARAT",4,176,15,191
https://kawalpemilu.org#60160,"MAS BANGUN, TELUK BATANG, KAYONG UTARA, KALIMANTAN BARAT",4,91,87,178
https://kawalpemilu.org#59837,"RANTAU PANJANG, SEBANGKI, LANDAK, KALIMANTAN BARAT",6,19,143,162
https://kawalpemilu.org#58571,"SUNGAI SENGKUANG, KAPUAS, SANGGAU, KALIMANTAN BARAT",4,49,174,223
https://kawalpemilu.org#930867,"LAMBAU, JAWAI, SAMBAS, KALIMANTAN BARAT",1,88,74,162
https://kawalpemilu.org#58362,"MATANG LABONG, TEBAS, SAMBAS, KALIMANTAN BARAT",9,130,61,191
https://kawalpemilu.org#59595,"SAHAN, SELUAS, BENGKAYANG, KALIMANTAN BARAT",1,179,18,197
https://kawalpemilu.org#58933,"MULIA KERTA, BENUA KAYONG, KETAPANG, KALIMANTAN BARAT",8,49,192,241
https://kawalpemilu.org#58605,"EMPOTO, NOYAN, SANGGAU, KALIMANTAN BARAT",8,126,1,127
https://kawalpemilu.org#58505,"SEPANG, TOHO, MEMPAWAH, KALIMANTAN BARAT",8,151,23,174
https://kawalpemilu.org#60078,"MUARA TANJUNG, SOKAN, MELAWI, KALIMANTAN BARAT",1,73,157,230
https://kawalpemilu.org#59987,"KELAKIK, NANGA PINOH, MELAWI, KALIMANTAN BARAT",4,32,213,245
https://kawalpemilu.org#58746,"ENTIKONG, ENTIKONG, SANGGAU, KALIMANTAN BARAT",12,222,14,236
https://kawalpemilu.org#60209,"SUNGAI BANGKONG, PONTIANAK KOTA, KOTA PONTIANAK, KALIMANTAN BARAT",12,46,100,146
https://kawalpemilu.org#59683,"SUNGAI RAYA, SUNGAI RAYA KEPULAUAN, BENGKAYANG, KALIMANTAN BARAT",3,96,84,180
https://kawalpemilu.org#63766,"SARI MULYA, SUNGAI LOBAN, TANAH BUMBU, KALIMANTAN SELATAN",6,53,65,118
https://kawalpemilu.org#62206,"CANTUNG KIRI HILIR, KELUMPANG HULU, KOTABARU, KALIMANTAN SELATAN",1,100,46,146
https://kawalpemilu.org#92745,"PARINGIN KOTA, PARINGIN, BALANGAN, KALIMANTAN SELATAN",2,38,64,102
https://kawalpemilu.org#64053,"BELITUNG SELATAN, BANJARMASIN BARAT, KOTA BANJARMASIN, KALIMANTAN SELATAN",22,68,124,192
https://kawalpemilu.org#62384,"SUNGAI LULUT, SUNGAI TABUK, BANJAR, KALIMANTAN SELATAN",50,60,87,147
https://kawalpemilu.org#64095,"CEMPAKA, CEMPAKA, KOTA BANJARBARU, KALIMANTAN SELATAN",27,76,146,222
https://kawalpemilu.org#63818,"KARANG INDAH, ANGSANA, TANAH BUMBU, KALIMANTAN SELATAN",8,135,55,190
https://kawalpemilu.org#63654,"BELIMBING RAYA, MURUNG PUDAK, TABALONG, KALIMANTAN SELATAN",13,71,74,145
https://kawalpemilu.org#62273,"WONOREJO, PAMUKAN UTARA, KOTABARU, KALIMANTAN SELATAN",2,172,28,200
https://kawalpemilu.org#64095,"CEMPAKA, CEMPAKA, KOTA BANJARBARU, KALIMANTAN SELATAN",33,45,99,144
https://kawalpemilu.org#62455,"ABIRAU, KARANG INTAN, BANJAR, KALIMANTAN SELATAN",4,29,87,116
https://kawalpemilu.org#64103,"MENTAOS, BANJARBARU UTARA, KOTA BANJARBARU, KALIMANTAN SELATAN",29,45,56,101
https://kawalpemilu.org#63262,"BARABAI SELATAN, BARABAI, HULU SUNGAI TENGAH, KALIMANTAN SELATAN",5,48,153,201
https://kawalpemilu.org#63588,"PURAI, BANUA LAWAS, TABALONG, KALIMANTAN SELATAN",2,30,143,173
https://kawalpemilu.org#64076,"TELUK DALAM, BANJARMASIN TENGAH, KOTA BANJARMASIN, KALIMANTAN SELATAN",2,78,165,243
https://kawalpemilu.org#62185,"SEBATUNG, PULAULAUT UTARA, KOTABARU, KALIMANTAN SELATAN",1,69,80,149
https://kawalpemilu.org#62359,"SIMPANG EMPAT, KERTAK HANYAR, BANJAR, KALIMANTAN SELATAN",4,47,185,232
https://kawalpemilu.org#61267,"SUKA MANDANG, SERUYAN TENGAH, SERUYAN, KALIMANTAN TENGAH",7,145,20,165
https://kawalpemilu.org#60390,"PANGKALAN SATU, KUMAI, KOTAWARINGIN BARAT, KALIMANTAN TENGAH",3,156,63,219
https://kawalpemilu.org#60504,"TANJUNG JARIANGAU, MENTAYA HULU, KOTAWARINGIN TIMUR, KALIMANTAN TENGAH",7,84,87,173
https://kawalpemilu.org#61364,"MENDAWAI, SUKAMARA, SUKAMARA, KALIMANTAN TENGAH",23,122,86,208
https://kawalpemilu.org#60584,"TUMBANG HEJAN, ANTANG KALANG, KOTAWARINGIN TIMUR, KALIMANTAN TENGAH",2,87,13,100
https://kawalpemilu.org#61028,"MELAYU, TEWEH TENGAH, BARITO UTARA, KALIMANTAN TENGAH",16,63,80,143
https://kawalpemilu.org#60505,"BUANA MUSTIKA, TELAGA ANTANG, KOTAWARINGIN TIMUR, KALIMANTAN TENGAH",4,150,32,182
https://kawalpemilu.org#60564,"JAYA KARET, MENTAYA HILIR SELATAN, KOTAWARINGIN TIMUR, KALIMANTAN TENGAH",7,17,95,112
https://kawalpemilu.org#60713,"SAKA MANGKAHAI, KAPUAS BARAT, KAPUAS, KALIMANTAN TENGAH",6,113,80,193
https://kawalpemilu.org#60603,"GUNUNG MAKMUR, ANTANG KALANG, KOTAWARINGIN TIMUR, KALIMANTAN TENGAH",2,145,33,178
https://kawalpemilu.org#65582,"SIDODADI, SAMARINDA ULU, KOTA SAMARINDA, KALIMANTAN TIMUR",83,78,86,164
https://kawalpemilu.org#64557,"GUNUNG TABUR, GUNUNG TABUR, BERAU, KALIMANTAN TIMUR",10,120,73,193
https://kawalpemilu.org#65588,"SELILI, SAMARINDA ILIR, KOTA SAMARINDA, KALIMANTAN TIMUR",11,55,102,157
https://kawalpemilu.org#65572,"SIMPANG PASIR, PALARAN, KOTA SAMARINDA, KALIMANTAN TIMUR",13,113,58,171
https://kawalpemilu.org#65487,"GERSIK, PENAJAM, PENAJAM PASER UTARA, KALIMANTAN TIMUR",2,105,88,193
https://kawalpemilu.org#65597,"SEMPAJA UTARA, SAMARINDA UTARA, KOTA SAMARINDA, KALIMANTAN TIMUR",39,91,124,215
https://kawalpemilu.org#64291,"SUNGAI MERIAM, ANGGANA, KUTAI KARTANEGARA, KALIMANTAN TIMUR",15,79,138,217
https://kawalpemilu.org#64229,"KERANG, BATU ENGAU, PASER, KALIMANTAN TIMUR",3,61,119,180
https://kawalpemilu.org#65559,"PRAPATAN, BALIKPAPAN KOTA, KOTA BALIKPAPAN, KALIMANTAN TIMUR",21,84,55,139
https://kawalpemilu.org#65552,"SUMBER REJO, BALIKPAPAN TENGAH, KOTA BALIKPAPAN, KALIMANTAN TIMUR",60,80,63,143
https://kawalpemilu.org#65540,"MARGA SARI, BALIKPAPAN BARAT, KOTA BALIKPAPAN, KALIMANTAN TIMUR",6,67,114,181
https://kawalpemilu.org#65481,"PENAJAM, PENAJAM, PENAJAM PASER UTARA, KALIMANTAN TIMUR",33,111,106,217
https://kawalpemilu.org#65618,"BANDARA, SUNGAI PINANG, KOTA SAMARINDA, KALIMANTAN TIMUR",8,83,119,202
https://kawalpemilu.org#928245,"SEMPAJA TIMUR, SAMARINDA UTARA, KOTA SAMARINDA, KALIMANTAN TIMUR",53,104,86,190
https://kawalpemilu.org#65642,"SELUMIT, TARAKAN TENGAH, KOTA TARAKAN, KALIMANTAN UTARA",22,95,71,166
https://kawalpemilu.org#65004,"LANGAP, MALINAU SELATAN, MALINAU, KALIMANTAN UTARA",4,112,25,137
https://kawalpemilu.org#64894,"TETABAN, SEBUKU, NUNUKAN, KALIMANTAN UTARA",1,238,21,259
https://kawalpemilu.org#25027,"MENDO, MENDO BARAT, BANGKA, KEPULAUAN BANGKA BELITUNG",6,25,161,186
https://kawalpemilu.org#25369,"SRIWIJAYA, GIRIMAYA, KOTA PANGKALPINANG, KEPULAUAN BANGKA BELITUNG",8,94,86,180
https://kawalpemilu.org#25249,"SUNGAI BARU, MUNTOK, BANGKA BARAT, KEPULAUAN BANGKA BELITUNG",16,115,94,209
https://kawalpemilu.org#25186,"PADANG MULIA, KOBA, BANGKA TENGAH, KEPULAUAN BANGKA BELITUNG",10,134,118,252
https://kawalpemilu.org#25082,"TANJUNGPENDAM, TANJUNG PANDAN, BELITUNG, KEPULAUAN BANGKA BELITUNG",1,170,76,256
https://kawalpemilu.org#25782,"BALOI INDAH, LUBUK BAJA, KOTA BATAM, KEPULAUAN RIAU",39,65,169,234
https://kawalpemilu.org#25408,"TANJUNG PINANG BARAT, TANJUNG PINANG BARAT, KOTA TANJUNGPINANG, KEPULAUAN RIAU",16,73,155,228
https://kawalpemilu.org#25820,"BULIANG, BATU AJI, KOTA BATAM, KEPULAUAN RIAU",11,121,147,268
https://kawalpemilu.org#25803,"TANJUNG BUNTUNG, BENGKONG, KOTA BATAM, KEPULAUAN RIAU",81,116,119,235
https://kawalpemilu.org#89274,"BARAN, SENAYANG, LINGGA, KEPULAUAN RIAU",4,87,11,98
https://kawalpemilu.org#25480,"GUNUNG LENGKUAS, BINTAN TIMUR, BINTAN, KEPULAUAN RIAU",15,140,135,275
https://kawalpemilu.org#25731,"LIMBUNG, LINGGA UTARA, LINGGA, KEPULAUAN RIAU",7,110,31,141
https://kawalpemilu.org#22535,"TUNAS ASRI, TULANG BAWANG TENGAH, TULANG BAWANG BARAT, LAMPUNG",5,105,105,210
https://kawalpemilu.org#22893,"SIDO REJO, BANGUN REJO, LAMPUNG TENGAH, LAMPUNG",9,157,60,217
https://kawalpemilu.org#24295,"PURWODADI MEKAR, BATANGHARI, LAMPUNG TIMUR, LAMPUNG",4,196,40,236
https://kawalpemilu.org#87261,"TANJUNGBARU, KEDAMAIAN, KOTA BANDAR LAMPUNG, LAMPUNG",4,117,115,232
https://kawalpemilu.org#24795,"BATU PUTUK, TELUKBETUNG BARAT, KOTA BANDAR LAMPUNG, LAMPUNG",17,92,45,137
https://kawalpemilu.org#23456,"TANJUNG IMAN, BLAMBANGAN PAGAR, LAMPUNG UTARA, LAMPUNG",10,13,127,140
https://kawalpemilu.org#24900,"SINAR JATI, TEGINENENG, PESAWARAN, LAMPUNG",2,154,34,188
https://kawalpemilu.org#22547,"WAY SIDO, TULANG BAWANG UDIK, TULANG BAWANG BARAT, LAMPUNG",5,109,89,198
https://kawalpemilu.org#23643,"BANDAR DALAM, BANGKUNAT, PESISIR BARAT, LAMPUNG",6,99,62,161
https://kawalpemilu.org#22495,"WIRA BANGUN, SIMPANG PEMATANG, MESUJI, LAMPUNG",9,165,75,240
https://kawalpemilu.org#22426,"SINAR BARU, SUKOHARJO, PRINGSEWU, LAMPUNG",2,38,85,123
https://kawalpemilu.org#87999,"WATES TIMUR, GADING REJO, PRINGSEWU, LAMPUNG",7,115,53,168
https://kawalpemilu.org#23973,"MUARA DUA, PULAU PANGGUNG, TANGGAMUS, LAMPUNG",3,65,147,212
https://kawalpemilu.org#23011,"REJO SARI MATARAM, SEPUTIH MATARAM, LAMPUNG TENGAH, LAMPUNG",12,144,59,203
https://kawalpemilu.org#23633,"SUKA BANJAR, NGAMBUR, PESISIR BARAT, LAMPUNG",4,169,92,261
https://kawalpemilu.org#22869,"KARANG PUCUNG, WAY SULAN, LAMPUNG SELATAN, LAMPUNG",4,119,66,185
https://kawalpemilu.org#22351,"WONODADI, GADING REJO, PRINGSEWU, LAMPUNG",8,59,75,134
https://kawalpemilu.org#23065,"ENDANG REJO, SEPUTIH AGUNG, LAMPUNG TENGAH, LAMPUNG",3,123,71,194
https://kawalpemilu.org#23066,"DONO ARUM, SEPUTIH AGUNG, LAMPUNG TENGAH, LAMPUNG",3,135,62,197
https://kawalpemilu.org#24844,"TEJO AGUNG, METRO TIMUR, KOTA METRO, LAMPUNG",2,121,100,221
https://kawalpemilu.org#22760,"MARGA KAYA, JATI AGUNG, LAMPUNG SELATAN, LAMPUNG",7,168,32,200
https://kawalpemilu.org#24274,"MEKAR MULYA, SEKAMPUNG, LAMPUNG TIMUR, LAMPUNG",3,151,43,194
https://kawalpemilu.org#23088,"MATARAM JAYA, BANDAR MATARAM, LAMPUNG TENGAH, LAMPUNG",2,157,22,179
https://kawalpemilu.org#24605,"PULAU BATU, NEGERI AGUNG, WAY KANAN, LAMPUNG",2,45,156,201
https://kawalpemilu.org#23163,"SRI BUSONO, WAY SEPUTIH, LAMPUNG TENGAH, LAMPUNG",3,145,31,176
https://kawalpemilu.org#22492,"BUDI AJI, SIMPANG PEMATANG, MESUJI, LAMPUNG",3,141,97,238
https://kawalpemilu.org#23747,"KAGUNGAN RAHAYU, MENGGALA, TULANG BAWANG, LAMPUNG",9,152,29,181
https://kawalpemilu.org#22888,"SINAR SARI, KALIREJO, LAMPUNG TENGAH, LAMPUNG",8,126,38,164
https://kawalpemilu.org#91293,"RULUNG SARI, NATAR, LAMPUNG SELATAN, LAMPUNG",2,181,48,229
https://kawalpemilu.org#24600,"SERUPA INDAH, PAKUAN RATU, WAY KANAN, LAMPUNG",6,108,58,166
https://kawalpemilu.org#23092,"GUNUNGRAYA, PUBIAN, LAMPUNG TENGAH, LAMPUNG",6,53,161,214
https://kawalpemilu.org#23744,"UJUNG GUNUNG ILIR, MENGGALA, TULANG BAWANG, LAMPUNG",9,106,26,132
https://kawalpemilu.org#23855,"PADUAN RAJAWALI, MERAKSA AJI, TULANG BAWANG, LAMPUNG",2,142,52,194
https://kawalpemilu.org#23047,"SUKAJADI, BUMI RATU NUBAN, LAMPUNG TENGAH, LAMPUNG",6,136,36,172
https://kawalpemilu.org#23195,"TANJUNG BARU TIMUR, BUKIT KEMUNING, LAMPUNG UTARA, LAMPUNG",1,0,0,0
https://kawalpemilu.org#-991304,"Taipei, Taipei, Taiwan, Luar Negeri",9,345,83,428
https://kawalpemilu.org#-991084,"Johor Bahru, Johor Bahru, Malaysia, Luar Negeri",2271,76,85,161
https://kawalpemilu.org#-990774,"Seoul, Seoul, Korea Selatan, Luar Negeri",4,104,48,152
https://kawalpemilu.org#-990464,"Kuala Lumpur, Kuala Lumpur, Malaysia, Luar Negeri",40,86,92,178
https://kawalpemilu.org#77939,"SAHU, TALIABU UTARA, PULAU TALIABU, MALUKU UTARA",1,80,91,171
https://kawalpemilu.org#77882,"KAWALO, TALIABU BARAT, PULAU TALIABU, MALUKU UTARA",2,69,153,222
https://kawalpemilu.org#77185,"GUARIA, JAILOLO, HALMAHERA BARAT, MALUKU UTARA",1,201,1,202
https://kawalpemilu.org#77676,"SUMA TINGGI, BACAN, HALMAHERA SELATAN, MALUKU UTARA",2,49,59,108
https://kawalpemilu.org#78111,"MALIARO, KOTA TERNATE TENGAH, KOTA TERNATE, MALUKU UTARA",17,52,96,148
https://kawalpemilu.org#77023,"BATU MERAH, SIRIMAU, KOTA AMBON, MALUKU",42,32,152,184
https://kawalpemilu.org#77036,"POKA, TELUK AMBON, KOTA AMBON, MALUKU",12,57,98,155
https://kawalpemilu.org#76469,"HATU, LEIHITU BARAT, MALUKU TENGAH, MALUKU",9,165,5,170
https://kawalpemilu.org#76842,"WALAKONE, TANIWEL TIMUR, SERAM BAGIAN BARAT, MALUKU",1,132,10,142
https://kawalpemilu.org#76406,"KAILOLO, PULAU HARUKU, MALUKU TENGAH, MALUKU",11,30,214,244
https://kawalpemilu.org#76519,"LARAT, KEI BESAR SELATAN, MALUKU TENGGARA, MALUKU",2,33,126,159
https://kawalpemilu.org#77038,"WAYAME, TELUK AMBON, KOTA AMBON, MALUKU",6,81,93,174
https://kawalpemilu.org#54125,"PRAYA, PRAYA, LOMBOK TENGAH, NUSA TENGGARA BARAT",10,46,151,197
https://kawalpemilu.org#54121,"KURIPAN UTARA, KURIPAN, LOMBOK BARAT, NUSA TENGGARA BARAT",25,46,105,151
https://kawalpemilu.org#54449,"POTO, MOYO HILIR, SUMBAWA, NUSA TENGGARA BARAT",2,31,167,198
https://kawalpemilu.org#54058,"BADRAIN, NARMADA, LOMBOK BARAT, NUSA TENGGARA BARAT",4,38,125,163
https://kawalpemilu.org#54114,"SANDIK, BATU LAYAR, LOMBOK BARAT, NUSA TENGGARA BARAT",54,74,77,151
https://kawalpemilu.org#54320,"PRINGGABAYA, PRINGGABAYA, LOMBOK TIMUR, NUSA TENGGARA BARAT",8,129,63,192
https://kawalpemilu.org#54304,"SELONG, SELONG, LOMBOK TIMUR, NUSA TENGGARA BARAT",11,89,130,219
https://kawalpemilu.org#55004,"PENARAGA, RABA, KOTA BIMA, NUSA TENGGARA BARAT",2,18,176,194
https://kawalpemilu.org#85058,"SUKAREMA, AIKMEL, LOMBOK TIMUR, NUSA TENGGARA BARAT",7,123,113,236
https://kawalpemilu.org#54184,"SETANGGOR, PRAYA BARAT, LOMBOK TENGAH, NUSA TENGGARA BARAT",1,9,178,183
https://kawalpemilu.org#54438,"PEKAT, SUMBAWA, SUMBAWA, NUSA TENGGARA BARAT",11,10,109,119
https://kawalpemilu.org#54808,"WORO, MADAPANGGA, BIMA, NUSA TENGGARA BARAT",6,7,121,128
https://kawalpemilu.org#54164,"SENGKOL, PUJUT, LOMBOK TENGAH, NUSA TENGGARA BARAT",27,84,141,225
https://kawalpemilu.org#54175,"MERTAK, PUJUT, LOMBOK TENGAH, NUSA TENGGARA BARAT",27,49,147,196
https://kawalpemilu.org#54636,"BARA, WOJA, DOMPU, NUSA TENGGARA BARAT",11,48,164,212
https://kawalpemilu.org#54104,"BATU MEKAR, LINGSAR, LOMBOK BARAT, NUSA TENGGARA BARAT",19,22,153,175
https://kawalpemilu.org#54243,"KABUL, PRAYA BARAT DAYA, LOMBOK TENGAH, NUSA TENGGARA BARAT",12,66,133,199
https://kawalpemilu.org#54114,"SANDIK, BATU LAYAR, LOMBOK BARAT, NUSA TENGGARA BARAT",23,28,193,221
https://kawalpemilu.org#85011,"KETAPANG RAYA, KERUAK, LOMBOK TIMUR, NUSA TENGGARA BARAT",4,43,98,141
https://kawalpemilu.org#85104,"PEMATUNG, SAKRA BARAT, LOMBOK TIMUR, NUSA TENGGARA BARAT",3,47,65,112
https://kawalpemilu.org#90886,"DELU DEPA, KODI BANGEDO, SUMBA BARAT DAYA, NUSA TENGGARA TIMUR",1,195,14,209
https://kawalpemilu.org#56610,"WAILITI, ALOK BARAT, SIKKA, NUSA TENGGARA TIMUR",7,153,1,154
https://kawalpemilu.org#56976,"WANGKA SELATAN, RIUNG, NGADA, NUSA TENGGARA TIMUR",2,186,20,206
https://kawalpemilu.org#56058,"NUSA KENARI, TELUK MUTIARA, ALOR, NUSA TENGGARA TIMUR",1,35,108,143
https://kawalpemilu.org#85133,"POHON BAO, LARANTUKA, FLORES TIMUR, NUSA TENGGARA TIMUR",2,222,20,242
https://kawalpemilu.org#58216,"BAMO, KOTA KOMBA, MANGGARAI TIMUR, NUSA TENGGARA TIMUR",2,105,4,109
https://kawalpemilu.org#57130,"POPO, SATAR MESE UTARA, MANGGARAI, NUSA TENGGARA TIMUR",1,170,9,179
https://kawalpemilu.org#57819,"REGA, BOAWAE, NAGEKEO, NUSA TENGGARA TIMUR",1,194,1,195
https://kawalpemilu.org#57118,"PAU, LANGKE REMBONG, MANGGARAI, NUSA TENGGARA TIMUR",10,116,9,125
https://kawalpemilu.org#57759,"POTA WANGKA, BOLENG, MANGGARAI BARAT, NUSA TENGGARA TIMUR",1,165,1,166
https://kawalpemilu.org#56664,"KLOANGPOPOT, DORENG, SIKKA, NUSA TENGGARA TIMUR",2,203,8,211
https://kawalpemilu.org#85162,"BINAWALI, AIMERE, NGADA, NUSA TENGGARA TIMUR",1,169,12,181
https://kawalpemilu.org#57638,"BOA, ROTE BARAT, ROTE NDAO, NUSA TENGGARA TIMUR",1,193,2,195
https://kawalpemilu.org#55687,"PONU, BIBOKI ANLEU, TIMOR TENGAH UTARA, NUSA TENGGARA TIMUR",4,211,8,219
https://kawalpemilu.org#58045,"NUNHILA, ALAK, KOTA KUPANG, NUSA TENGGARA TIMUR",5,213,8,221
https://kawalpemilu.org#55489,"OEBOBO, BATU PUTIH, TIMOR TENGAH SELATAN, NUSA TENGGARA TIMUR",6,206,8,214
https://kawalpemilu.org#55254,"NIUKBAUN, AMARASI BARAT, KUPANG, NUSA TENGGARA TIMUR",3,193,18,211
https://kawalpemilu.org#57994,"WERI LOLO, WEWEWA SELATAN, SUMBA BARAT DAYA, NUSA TENGGARA TIMUR",3,281,0,281
https://kawalpemilu.org#57691,"COMPANG KULES, KUWUS BARAT, MANGGARAI BARAT, NUSA TENGGARA TIMUR",2,167,9,176
https://kawalpemilu.org#83292,"KLADEMAK, SORONG, KOTA SORONG, PAPUA BARAT",9,147,3,150
https://kawalpemilu.org#82892,"TOMOLOL, MISOOL TIMUR, RAJA AMPAT, PAPUA BARAT",3,66,17,83
https://kawalpemilu.org#929280,"MALASILEN, SORONG UTARA, KOTA SORONG, PAPUA BARAT",6,162,88,250
https://kawalpemilu.org#927791,"NESET, AIFAT UTARA, MAYBRAT, PAPUA BARAT",1,129,0,129
https://kawalpemilu.org#931338,"AIMASA, AIFAT TIMUR TENGAH, MAYBRAT, PAPUA BARAT",1,137,0,137
https://kawalpemilu.org#79403,"BARIWARO, WAROPEN ATAS, MAMBERAMO RAYA, PAPUA",2,109,10,119
https://kawalpemilu.org#81056,"GESELEMA, ALAMA, MIMIKA, PAPUA",1,294,0,294
https://kawalpemilu.org#79511,"PAGALE, ERAGAYAM, MAMBERAMO TENGAH, PAPUA",2,176,0,176
https://kawalpemilu.org#86816,"BALIME, BALINGGA, LANNY JAYA, PAPUA",2,276,0,276
https://kawalpemilu.org#81710,"WANIM, LOLAT, YAHUKIMO, PAPUA",2,300,0,300
https://kawalpemilu.org#81837,"HILIPUK, HILIPUK, YAHUKIMO, PAPUA",2,300,0,300
https://kawalpemilu.org#81690,"GIDOMEN, ENDOMEN, YAHUKIMO, PAPUA",1,222,0,222
https://kawalpemilu.org#81234,"JAIFURI, SKANTO, KEEROM, PAPUA",5,108,113,221
https://kawalpemilu.org#929681,"KILUDO, WIRINGGAMBUT, LANNY JAYA, PAPUA",1,187,0,187
https://kawalpemilu.org#81758,"LANGDA, LANGDA, YAHUKIMO, PAPUA",4,299,0,299
https://kawalpemilu.org#81821,"KEMLIGIN, KWELEMDUA, YAHUKIMO, PAPUA",2,150,0,150
https://kawalpemilu.org#930496,"SIGAD, ILWAYAB, MERAUKE, PAPUA",1,125,6,131
https://kawalpemilu.org#79828,"KARANG INDAH, MERAUKE, MERAUKE, PAPUA",26,92,18,110
https://kawalpemilu.org#79436,"HAMADI, JAYAPURA SELATAN, KOTA JAYAPURA, PAPUA",36,49,120,169
https://kawalpemilu.org#81385,"ILWAP, ANGGRUK, YAHUKIMO, PAPUA",1,183,0,183
https://kawalpemilu.org#81749,"MOO, KORUPUN, YAHUKIMO, PAPUA",1,282,0,282
https://kawalpemilu.org#79402,"SIPISI, WAROPEN ATAS, MAMBERAMO RAYA, PAPUA",3,95,5,100
https://kawalpemilu.org#81491,"SILORIN, AMUMA, YAHUKIMO, PAPUA",1,300,0,300
https://kawalpemilu.org#79018,"MANGGEMAHE, YANIRUMA, BOVEN DIGOEL, PAPUA",5,24,0,24
https://kawalpemilu.org#15581,"SUNGAI MANAU, KUANTAN MUDIK, KUANTAN SINGINGI, RIAU",1,31,218,249
https://kawalpemilu.org#15034,"MAK TEDUH, KERUMUTAN, PELALAWAN, RIAU",3,54,193,247
https://kawalpemilu.org#15275,"BAGAN TIMUR, BANGKO, ROKAN HILIR, RIAU",27,15,149,164
https://kawalpemilu.org#14311,"SUNGAI AGUNG, TAPUNG, KAMPAR, RIAU",5,117,48,225
https://kawalpemilu.org#14987,"KESUMA, PANGKALAN KURAS, PELALAWAN, RIAU",12,138,16,154
https://kawalpemilu.org#14099,"NIPAH SENDANU, TEBING TINGGI TIMUR, KEPULAUAN MERANTI, RIAU",1,113,76,189
https://kawalpemilu.org#15430,"MENGKAPAN, SUNGAI APIT, SIAK, RIAU",2,53,126,179
https://kawalpemilu.org#14093,"BANGLAS, TEBING TINGGI, KEPULAUAN MERANTI, RIAU",15,56,140,196
https://kawalpemilu.org#14938,"SUNGAIBERAPIT, Concong, INDRAGIRI HILIR, RIAU",3,55,61,116
https://kawalpemilu.org#15714,"SIMPANG RAYA, SINGINGI HILIR, KUANTAN SINGINGI, RIAU",9,135,43,178
https://kawalpemilu.org#15229,"TELUK SONO, BONAI DARUSSALAM, ROKAN HULU, RIAU",2,152,48,200
https://kawalpemilu.org#15821,"TUAH KARYA, TAMPAN, KOTA PEKANBARU, RIAU",27,32,235,267
https://kawalpemilu.org#14632,"KOTA BENGKALIS, BENGKALIS, BENGKALIS, RIAU",6,76,122,198
https://kawalpemilu.org#14679,"AIR JAMBAN, MANDAU, BENGKALIS, RIAU",51,26,110,136
https://kawalpemilu.org#14697,"TERKUL, RUPAT, BENGKALIS, RIAU",10,101,54,155
https://kawalpemilu.org#15820,"SIDOMULYA BARAT, TAMPAN, KOTA PEKANBARU, RIAU",87,9,79,88
https://kawalpemilu.org#14808,"Bekawan, Mandah, INDRAGIRI HILIR, RIAU",4,36,108,144
https://kawalpemilu.org#928982,"KOTO RAJA, SIAK KECIL, BENGKALIS, RIAU",3,54,135,189
https://kawalpemilu.org#931198,"BAMBUKUNING, TENAYAN RAYA, KOTA PEKANBARU, RIAU",15,63,101,164
https://kawalpemilu.org#15298,"MENGGALA SAKTI, TANAH PUTIH, ROKAN HILIR, RIAU",10,102,125,227
https://kawalpemilu.org#15279,"BAGAN JAWA, BANGKO, ROKAN HILIR, RIAU",20,30,113,143
https://kawalpemilu.org#15866,"BINTAN, DUMAI KOTA, KOTA DUMAI, RIAU",22,81,159,240
https://kawalpemilu.org#75523,"SINYONYOI, KALUKKU, MAMUJU, SULAWESI BARAT",9,202,96,298
https://kawalpemilu.org#87642,"LEMBANG, BANGGAE TIMUR, MAJENE, SULAWESI BARAT",4,126,94,220
https://kawalpemilu.org#75437,"PAKAVA, PASANGKAYU, MAMUJU UTARA, SULAWESI BARAT",7,146,34,180
https://kawalpemilu.org#75526,"SONDOANG, KALUKKU, MAMUJU, SULAWESI BARAT",2,162,37,199
https://kawalpemilu.org#76055,"SIRINDU, PAMBOANG, MAJENE, SULAWESI BARAT",4,93,71,164
https://kawalpemilu.org#71660,"LALONG, WALENRANG, LUWU, SULAWESI SELATAN",7,74,146,220
https://kawalpemilu.org#69716,"BORONG LOE, PAJUKUKANG, BANTAENG, SULAWESI SELATAN",10,16,102,118
https://kawalpemilu.org#72352,"PISANG SELATAN, UJUNG PANDANG, KOTA MAKASSAR, SULAWESI SELATAN",8,125,42,167
https://kawalpemilu.org#70057,"TAMARUNANG, SOMBA OPU, GOWA, SULAWESI SELATAN",18,65,158,223
https://kawalpemilu.org#70663,"MANGELORENG, BANTIMURUNG, MAROS, SULAWESI SELATAN",3,70,96,166
https://kawalpemilu.org#70771,"SABARU, LIUKANG KALMAS, PANGKAJENE DAN KEPULAUAN, SULAWESI SELATAN",2,84,46,130
https://kawalpemilu.org#71300,"TACCIMPO, DUA PITUE, SIDENRENG RAPPANG, SULAWESI SELATAN",2,65,90,155
https://kawalpemilu.org#70101,"PALLANTIKANG, PATTALLASSANG, GOWA, SULAWESI SELATAN",10,76,113,189
https://kawalpemilu.org#70621,"SELLI, BENGO, BONE, SULAWESI SELATAN",14,91,24,115
https://kawalpemilu.org#69750,"BONTORANNU, BANGKALA, JENEPONTO, SULAWESI SELATAN",6,87,66,153
https://kawalpemilu.org#69274,"MALANGO', RANTEPAO, TORAJA UTARA, SULAWESI SELATAN",4,137,11,148
