Link KawalPemilu,Nama Kelurahan,Nomor TPS,Suara 01,Suara 02,Suara Sah
https://kawalpemilu.org#6370,"SAGOE, TRIENGGADENG, PIDIE JAYA, ACEH",3,6,170,176
https://kawalpemilu.org#3291,"LHOK JOK, KUTA MAKMUR, ACEH UTARA, ACEH",12,24,146,170
https://kawalpemilu.org#3084,"SAGOE, KEUMALA, PIDIE, ACEH",1,14,212,226
https://kawalpemilu.org#4349,"SINGKOHOR, SINGKOHOR, ACEH SINGKIL, ACEH",2,92,153,245
https://kawalpemilu.org#1113,"ALUE BU ALUE NIREH, PEUREULAK TIMUR, ACEH TIMUR, ACEH",1,21,58,79
https://kawalpemilu.org#4409,"GLUMPANG PAYONG, SAMALANGA, BIREUEN, ACEH",1,17,131,148
https://kawalpemilu.org#6174,"MANYANG CUT, MEUREUDU, PIDIE JAYA, ACEH",2,6,193,199
https://kawalpemilu.org#2457,"PULO TUKOK, BATEE, PIDIE, ACEH",2,22,123,145
https://kawalpemilu.org#2342,"LAMBARO SAMAHANI, KUTA MALAKA, ACEH BESAR, ACEH",1,11,239,250
https://kawalpemilu.org#251,"SEUNEUBOK KEURANJI, KOTA BAHAGIA, ACEH SELATAN, ACEH",2,16,107,123
https://kawalpemilu.org#1120,"BEUSA SEBERANG, PEUREULAK BARAT, ACEH TIMUR, ACEH",2,17,139,156
https://kawalpemilu.org#6621,"PB. BLANG PASE, LANGSA KOTA, KOTA LANGSA, ACEH",4,38,153,191
https://kawalpemilu.org#1688,"RIMBA LANGGEH, ARONGAN LAMBALEK, ACEH BARAT, ACEH",1,11,135,146
https://kawalpemilu.org#3267,"TAMBON TUNONG, DEWANTARA, ACEH UTARA, ACEH",5,0,0,0
https://kawalpemilu.org#3243,"GLUMPANG SAMLAKOE, BAKTIYA, ACEH UTARA, ACEH",102,11,139,150
https://kawalpemilu.org#5856,"BENUA RAJA, RANTAU, ACEH TAMIANG, ACEH",5,36,138,174
https://kawalpemilu.org#2257,"LAMBITRA, DARUSSALAM, ACEH BESAR, ACEH",1,13,120,133
https://kawalpemilu.org#5849,"KALOY, TAMIANG HULU, ACEH TAMIANG, ACEH",6,46,85,131
https://kawalpemilu.org#3176,"MANYANG, GLUMPANG BARO, PIDIE, ACEH",1,1,169,170
https://kawalpemilu.org#1792,"BUKET MEUGAJAH, WOYLA TIMUR, ACEH BARAT, ACEH",1,17,135,152
https://kawalpemilu.org#3986,"KEUDE NIBONG, NIBONG, ACEH UTARA, ACEH",1,3,91,94
https://kawalpemilu.org#2282,"LAMTAMOT, LEMBAH SEULAWAH, ACEH BESAR, ACEH",4,32,183,215
https://kawalpemilu.org#53828,"CELUKANBAWANG, GEROKGAK, BULELENG, BALI",4,206,33,239
https://kawalpemilu.org#53499,"UNGASAN, KUTA SELATAN, BADUNG, BALI",29,195,55,250
https://kawalpemilu.org#53849,"BANJARASEM, SERIRIT, BULELENG, BALI",1,192,8,200
https://kawalpemilu.org#53910,"BANYUNING, BULELENG, BULELENG, BALI",42,156,23,179
https://kawalpemilu.org#53287,"MANISTUTU, MELAYA, JEMBRANA, BALI",15,195,45,240
https://kawalpemilu.org#53734,"PESABAN, RENDANG, KARANGASEM, BALI",6,172,4,176
https://kawalpemilu.org#53245,"BANJAR TENGAH, NEGARA, JEMBRANA, BALI",6,197,18,215
https://kawalpemilu.org#53351,"BONGAN, TABANAN, TABANAN, BALI",10,229,16,245
https://kawalpemilu.org#54016,"DANGIN PURI KAJA, DENPASAR UTARA, KOTA DENPASAR, BALI",38,140,8,148
https://kawalpemilu.org#53582,"KERTA, PAYANGAN, GIANYAR, BALI",11,236,10,246
https://kawalpemilu.org#53915,"KALIUNTU, BULELENG, BULELENG, BALI",3,182,7,189
https://kawalpemilu.org#53834,"RINGDIKIT, SERIRIT, BULELENG, BALI",5,146,8,154
https://kawalpemilu.org#53529,"BEDULU, BLAHBATUH, GIANYAR, BALI",10,244,2,246
https://kawalpemilu.org#53336,"BELUMBANG, KERAMBITAN, TABANAN, BALI",1,276,9,285
https://kawalpemilu.org#53371,"PANDAK GEDE, KEDIRI, TABANAN, BALI",5,166,5,171
https://kawalpemilu.org#53863,"BUSUNGBIU, BUSUNG BIU, BULELENG, BALI",18,218,14,232
https://kawalpemilu.org#52196,"CIBARENO, CILOGRANG, LEBAK, BANTEN",6,51,147,198
https://kawalpemilu.org#53217,"CIPAYUNG, CIPUTAT, KOTA TANGERANG SELATAN, BANTEN",32,139,120,259
https://kawalpemilu.org#53040,"PONDOK BAHAR, KARANG TENGAH, KOTA TANGERANG, BANTEN",29,96,88,184
https://kawalpemilu.org#52975,"PORIS PLAWAD, CIPONDOH, KOTA TANGERANG, BANTEN",8,41,135,176
https://kawalpemilu.org#52313,"PETE, TIGARAKSA, TANGERANG, BANTEN",12,26,148,174
https://kawalpemilu.org#51696,"RANCATEUREUP, LABUAN, PANDEGLANG, BANTEN",3,69,120,189
https://kawalpemilu.org#53161,"BANJAR AGUNG, CIPOCOK JAYA, KOTA SERANG, BANTEN",28,58,176,234
https://kawalpemilu.org#51657,"PANACARAN, MUNJUL, PANDEGLANG, BANTEN",10,34,95,129
https://kawalpemilu.org#52370,"TEGAL KUNIR KIDUL, MAUK, TANGERANG, BANTEN",11,41,178,219
https://kawalpemilu.org#52699,"LONTAR, TIRTAYASA, SERANG, BANTEN",1,85,81,166
https://kawalpemilu.org#51703,"SUKAMAJU, LABUAN, PANDEGLANG, BANTEN",9,47,121,168
https://kawalpemilu.org#53227,"BENDA BARU, PAMULANG, KOTA TANGERANG SELATAN, BANTEN",83,137,76,213
https://kawalpemilu.org#52942,"CIKOKOL, TANGERANG, KOTA TANGERANG, BANTEN",31,88,170,258
https://kawalpemilu.org#52948,"JATAKE, JATIUWUNG, KOTA TANGERANG, BANTEN",14,31,94,125
https://kawalpemilu.org#51761,"KURUNGKAMBING, MANDALAWANGI, PANDEGLANG, BANTEN",5,46,148,194
https://kawalpemilu.org#52293,"SENTUL, BALARAJA, TANGERANG, BANTEN",21,39,119,158
https://kawalpemilu.org#53114,"UNYUR, SERANG, KOTA SERANG, BANTEN",90,87,150,237
https://kawalpemilu.org#52392,"PEKAYON, SUKADIRI, TANGERANG, BANTEN",14,38,100,138
https://kawalpemilu.org#89645,"PASIR KEMBANG, PAMARAYAN, SERANG, BANTEN",7,77,122,199
https://kawalpemilu.org#52105,"MUARA CIUJUNG TIMUR, RANGKASBITUNG, LEBAK, BANTEN",16,77,167,244
https://kawalpemilu.org#53184,"LENGKONG GUDANG, SERPONG, KOTA TANGERANG SELATAN, BANTEN",28,105,80,185
https://kawalpemilu.org#52993,"CIMONE JAYA, KARAWACI, KOTA TANGERANG, BANTEN",32,72,102,174
https://kawalpemilu.org#84987,"BOJENWETAN, SOBANG, PANDEGLANG, BANTEN",1,103,77,180
https://kawalpemilu.org#52634,"PULO AMPEL, PULO AMPEL, SERANG, BANTEN",3,25,200,225
https://kawalpemilu.org#52110,"JATIMULYA, RANGKASBITUNG, LEBAK, BANTEN",13,113,83,196
https://kawalpemilu.org#52196,"CIBARENO, CILOGRANG, LEBAK, BANTEN",2,52,139,191
https://kawalpemilu.org#53070,"LEBAKGEDE, PULOMERAK, KOTA CILEGON, BANTEN",18,68,183,251
https://kawalpemilu.org#52487,"BITUNG JAYA, CIKUPA, TANGERANG, BANTEN",23,40,82,122
https://kawalpemilu.org#53126,"BANTEN, KASEMEN, KOTA SERANG, BANTEN",35,87,147,234
https://kawalpemilu.org#52330,"MEKARSARI, JAMBE, TANGERANG, BANTEN",1,81,118,199
https://kawalpemilu.org#52482,"TALAGA, CIKUPA, TANGERANG, BANTEN",22,53,196,249
https://kawalpemilu.org#53079,"RANDAKARI, CIWANDAN, KOTA CILEGON, BANTEN",7,42,182,224
https://kawalpemilu.org#53226,"PAMULANG BARAT, PAMULANG, KOTA TANGERANG SELATAN, BANTEN",89,119,18,137
https://kawalpemilu.org#52113,"RANGKASBITUNG TIMUR, RANGKASBITUNG, LEBAK, BANTEN",22,59,132,191
https://kawalpemilu.org#53212,"SERUA, CIPUTAT, KOTA TANGERANG SELATAN, BANTEN",51,88,76,164
https://kawalpemilu.org#52343,"JEUNGJING, CISOKA, TANGERANG, BANTEN",23,55,133,188
https://kawalpemilu.org#52346,"PASIR AMPO, KRESEK, TANGERANG, BANTEN",12,117,59,176
https://kawalpemilu.org#53221,"PISANGAN, CIPUTAT TIMUR, KOTA TANGERANG SELATAN, BANTEN",4,128,105,233
https://kawalpemilu.org#52066,"SANGKANMANIK, CIMARGA, LEBAK, BANTEN",4,42,171,213
https://kawalpemilu.org#52418,"PANGADEGAN, PASAR KEMIS, TANGERANG, BANTEN",22,61,80,141
https://kawalpemilu.org#52551,"WANAKERTA, SINDANG JAYA, TANGERANG, BANTEN",9,44,131,175
https://kawalpemilu.org#51586,"TAMANJAYA, SUMUR, PANDEGLANG, BANTEN",8,116,16,132
https://kawalpemilu.org#21563,"PASAR SAOH, KAUR SELATAN, KAUR, BENGKULU",1,72,152,224
https://kawalpemilu.org#21259,"PAL VIII, BERMANI ULU RAYA, REJANG LEBONG, BENGKULU",2,151,96,247
https://kawalpemilu.org#22307,"SAWAH LEBAR, RATU AGUNG, KOTA BENGKULU, BENGKULU",11,70,137,207
https://kawalpemilu.org#21371,"JAGOBAYO, LAIS, BENGKULU UTARA, BENGKULU",1,64,158,222
https://kawalpemilu.org#22255,"PAGAR DEWA, SELEBAR, KOTA BENGKULU, BENGKULU",45,102,57,159
https://kawalpemilu.org#21237,"IV SUKU MENANTI, SINDANG DATARAN, REJANG LEBONG, BENGKULU",9,95,52,117
https://kawalpemilu.org#20906,"PUNGGUK KETUPAK, MERIGI KELINDANG, BENGKULU TENGAH, BENGKULU",1,116,117,233
https://kawalpemilu.org#22297,"KANDANG MAS, KAMPUNG MELAYU, KOTA BENGKULU, BENGKULU",5,72,194,266
https://kawalpemilu.org#41990,"TRIHARJO, PANDAK, BANTUL, DAERAH ISTIMEWA YOGYAKARTA",10,186,58,244
https://kawalpemilu.org#41932,"SENDANGSARI, PENGASIH, KULON PROGO, DAERAH ISTIMEWA YOGYAKARTA",21,159,89,248
https://kawalpemilu.org#42190,"NGALANG, GEDANGSARI, GUNUNGKIDUL, DAERAH ISTIMEWA YOGYAKARTA",24,129,33,162
https://kawalpemilu.org#42119,"GIRIMULYO, PANGGANG, GUNUNGKIDUL, DAERAH ISTIMEWA YOGYAKARTA",8,198,23,221
https://kawalpemilu.org#42298,"TRIMULYO, SLEMAN, SLEMAN, DAERAH ISTIMEWA YOGYAKARTA",22,161,51,212
https://kawalpemilu.org#41942,"GIRIPURWO, GIRIMULYO, KULON PROGO, DAERAH ISTIMEWA YOGYAKARTA",7,128,67,195
https://kawalpemilu.org#42249,"MARGODADI, SEYEGAN, SLEMAN, DAERAH ISTIMEWA YOGYAKARTA",25,193,65,258
https://kawalpemilu.org#42295,"TRIHARJO, SLEMAN, SLEMAN, DAERAH ISTIMEWA YOGYAKARTA",22,158,93,251
https://kawalpemilu.org#42197,"KANIGORO, SAPTOSARI, GUNUNGKIDUL, DAERAH ISTIMEWA YOGYAKARTA",7,135,23,158
https://kawalpemilu.org#42041,"SRIMULYO, PIYUNGAN, BANTUL, DAERAH ISTIMEWA YOGYAKARTA",58,146,52,198
https://kawalpemilu.org#42161,"PETIR, RONGKOP, GUNUNGKIDUL, DAERAH ISTIMEWA YOGYAKARTA",5,138,43,181
https://kawalpemilu.org#42382,"REJOWINANGUN, KOTAGEDE, KOTA YOGYAKARTA, DAERAH ISTIMEWA YOGYAKARTA",31,104,75,179
https://kawalpemilu.org#42076,"PILANGREJO, NGLIPAR, GUNUNGKIDUL, DAERAH ISTIMEWA YOGYAKARTA",6,126,25,151
https://kawalpemilu.org#42271,"GAYAMHARJO, PRAMBANAN, SLEMAN, DAERAH ISTIMEWA YOGYAKARTA",17,94,68,162
https://kawalpemilu.org#42224,"AMBARKETAWANG, GAMPING, SLEMAN, DAERAH ISTIMEWA YOGYAKARTA",36,168,78,246
https://kawalpemilu.org#25904,"LAGOA, KOJA, JAKARTA UTARA, DKI JAKARTA",25,149,66,215
https://kawalpemilu.org#25930,"KAPUK, CENGKARENG, JAKARTA BARAT, DKI JAKARTA",233,181,61,242
https://kawalpemilu.org#26095,"BALEKAMBANG, KRAMATJATI, JAKARTA TIMUR, DKI JAKARTA",74,80,146,226
https://kawalpemilu.org#25962,"KEBON JERUK, KEBON JERUK, JAKARTA BARAT, DKI JAKARTA",22,85,124,209
https://kawalpemilu.org#26103,"GEDONG, PASAR REBO, JAKARTA TIMUR, DKI JAKARTA",9,98,114,212
https://kawalpemilu.org#26139,"LUBANG BUAYA, CIPAYUNG, JAKARTA TIMUR, DKI JAKARTA",196,106,144,250
https://kawalpemilu.org#26049,"DUREN TIGA, PANCORAN, JAKARTA SELATAN, DKI JAKARTA",46,82,129,211
https://kawalpemilu.org#26087,"CIPINANG MUARA, JATINEGARA, JAKARTA TIMUR, DKI JAKARTA",110,211,37,248
https://kawalpemilu.org#25891,"PEJAGALAN, PENJARINGAN, JAKARTA UTARA, DKI JAKARTA",70,105,100,205
https://kawalpemilu.org#26100,"KALISARI, PASAR REBO, JAKARTA TIMUR, DKI JAKARTA",120,124,148,272
https://kawalpemilu.org#26024,"CIPULIR, KEBAYORAN LAMA, JAKARTA SELATAN, DKI JAKARTA",92,87,116,203
https://kawalpemilu.org#25910,"SUKAPURA, CILINCING, JAKARTA UTARA, DKI JAKARTA",157,113,86,199
https://kawalpemilu.org#26108,"PENGGILINGAN, CAKUNG, JAKARTA TIMUR, DKI JAKARTA",90,140,113,253
https://kawalpemilu.org#25845,"GUNUNG SAHARI UTARA, SAWAH BESAR, JAKARTA PUSAT, DKI JAKARTA",45,178,59,237
https://kawalpemilu.org#25897,"SUNGAI BAMBU, TANJUNG PRIOK, JAKARTA UTARA, DKI JAKARTA",75,96,128,224
https://kawalpemilu.org#25898,"KEBON BAWANG, TANJUNG PRIOK, JAKARTA UTARA, DKI JAKARTA",150,79,97,176
https://kawalpemilu.org#26106,"JATINEGARA, CAKUNG, JAKARTA TIMUR, DKI JAKARTA",81,98,83,182
https://kawalpemilu.org#25962,"KEBON JERUK, KEBON JERUK, JAKARTA BARAT, DKI JAKARTA",98,106,113,219
https://kawalpemilu.org#26117,"MALAKA SARI, DUREN SAWIT, JAKARTA TIMUR, DKI JAKARTA",11,97,159,256
https://kawalpemilu.org#25970,"KALIDERES, KALIDERES, JAKARTA BARAT, DKI JAKARTA",134,110,103,213
https://kawalpemilu.org#25880,"KAMPUNG BALI, TANAH ABANG, JAKARTA PUSAT, DKI JAKARTA",26,93,135,228
https://kawalpemilu.org#26033,"CIPETE SELATAN, CILANDAK, JAKARTA SELATAN, DKI JAKARTA",72,103,94,197
https://kawalpemilu.org#25983,"KEMBANGAN UTARA, KEMBANGAN, JAKARTA BARAT, DKI JAKARTA",122,147,66,213
https://kawalpemilu.org#25879,"KEBON KACANG, TANAH ABANG, JAKARTA PUSAT, DKI JAKARTA",18,110,119,229
https://kawalpemilu.org#25870,"CIKINI, MENTENG, JAKARTA PUSAT, DKI JAKARTA",25,173,37,210
https://kawalpemilu.org#25926,"CENGKARENG BARAT, CENGKARENG, JAKARTA BARAT, DKI JAKARTA",40,151,50,201
https://kawalpemilu.org#25846,"MANGGA DUA SELATAN, SAWAH BESAR, JAKARTA PUSAT, DKI JAKARTA",16,122,85,207
https://kawalpemilu.org#25999,"SETIA BUDI, SETIABUDI, JAKARTA SELATAN, DKI JAKARTA",1,118,67,185
https://kawalpemilu.org#25927,"DURI KOSAMBI, CENGKARENG, JAKARTA BARAT, DKI JAKARTA",187,223,4,227
https://kawalpemilu.org#25928,"RAWA BUAYA, CENGKARENG, JAKARTA BARAT, DKI JAKARTA",153,149,134,283
https://kawalpemilu.org#25996,"MANGGARAI SELATAN, TEBET, JAKARTA SELATAN, DKI JAKARTA",74,96,100,196
https://kawalpemilu.org#25948,"PINANGSIA, TAMAN SARI, JAKARTA BARAT, DKI JAKARTA",28,88,163,251
https://kawalpemilu.org#25938,"JELAMBAR BARU, GROGOL PETAMBURAN, JAKARTA BARAT, DKI JAKARTA",115,159,7,166
https://kawalpemilu.org#25876,"KARET TENGSIN, TANAH ABANG, JAKARTA PUSAT, DKI JAKARTA",16,77,112,189
https://kawalpemilu.org#26115,"KLENDER, DUREN SAWIT, JAKARTA TIMUR, DKI JAKARTA",136,112,137,249
https://kawalpemilu.org#26134,"CILANGKAP, CIPAYUNG, JAKARTA TIMUR, DKI JAKARTA",75,88,125,213
https://kawalpemilu.org#74726,"TENILO, LIMBOTO, GORONTALO, GORONTALO",1,131,96,227
https://kawalpemilu.org#74745,"BUA, BATUDAA, GORONTALO, GORONTALO",1,135,75,210
https://kawalpemilu.org#75251,"MALANGO, TALUDITI, PAHUWATO, GORONTALO",1,95,67,162
https://kawalpemilu.org#74768,"ULOBUA, TIBAWA, GORONTALO, GORONTALO",3,206,44,250
https://kawalpemilu.org#75211,"PATUHU, RANDANGAN, PAHUWATO, GORONTALO",3,107,104,211
https://kawalpemilu.org#17290,"SUMBER SARI, RIMBO ULU, TEBO, JAMBI",1,122,83,205
https://kawalpemilu.org#17258,"PURWO HARJO, RIMBO BUJANG, TEBO, JAMBI",6,105,69,174
https://kawalpemilu.org#16649,"TEBING TINGGI, PEMAYUNG, BATANGHARI, JAMBI",4,127,120,247
https://kawalpemilu.org#17392,"KENALI BESAR, ALAM BARAJO, KOTA JAMBI, JAMBI",13,60,153,213
https://kawalpemilu.org#16764,"DANAU KEDAP, MARO SEBO, MUARO JAMBI, JAMBI",1,32,114,146
https://kawalpemilu.org#16697,"DESA TERUSAN, MARO SEBO ILIR, BATANGHARI, JAMBI",3,33,177,210
https://kawalpemilu.org#84604,"MENDALO INDAH, JAMBI LUAR KOTA, MUARO JAMBI, JAMBI",2,85,127,212
https://kawalpemilu.org#16456,"MUARA MENSAO, LIMUN, SAROLANGUN, JAMBI",1,70,183,253
https://kawalpemilu.org#17395,"BAGAN PETE, ALAM BARAJO, KOTA JAMBI, JAMBI",15,110,102,212
https://kawalpemilu.org#16822,"PETALING JAYA, SUNGAI GELAM, MUARO JAMBI, JAMBI",4,53,16,69
https://kawalpemilu.org#17354,"EKA JAYA, PAAL MERAH, KOTA JAMBI, JAMBI",28,86,136,222
https://kawalpemilu.org#16771,"SUNGAI LANDAI, MESTONG, MUARO JAMBI, JAMBI",9,152,48,200
https://kawalpemilu.org#16073,"DSN. BARU P. TENGAH, KELILING DANAU, KERINCI, JAMBI",2,27,117,144
https://kawalpemilu.org#17257,"RIMBO MULYO, RIMBO BUJANG, TEBO, JAMBI",8,97,102,199
https://kawalpemilu.org#28413,"CINUNJANG, GUNUNGTANJUNG, TASIKMALAYA, JAWA BARAT",4,41,143,184
https://kawalpemilu.org#27667,"PARUNGSERAB, SOREANG, BANDUNG, JAWA BARAT",1,68,185,253
https://kawalpemilu.org#27726,"CIMUNCANG, GARUT KOTA, GARUT, JAWA BARAT",10,81,144,225
https://kawalpemilu.org#27776,"SUKAJAYA, TAROGONG KIDUL, GARUT, JAWA BARAT",10,50,123,173
https://kawalpemilu.org#26636,"GANDASOLI, CIKAKAK, SUKABUMI, JAWA BARAT",8,36,83,119
https://kawalpemilu.org#31203,"DEPOK, DARANGDAN, PURWAKARTA, JAWA BARAT",16,21,106,127
https://kawalpemilu.org#26402,"BANTARKARET, NANGGUNG, BOGOR, JAWA BARAT",18,23,127,150
https://kawalpemilu.org#32387,"KALIJAGA, HARJAMUKTI, KOTA CIREBON, JAWA BARAT",66,78,92,170
https://kawalpemilu.org#29967,"SINDANGPANO, RAJAGALUH, MAJALENGKA, JAWA BARAT",4,137,71,208
https://kawalpemilu.org#31702,"KEBALEN, BABELAN, BEKASI, JAWA BARAT",18,75,189,264
https://kawalpemilu.org#27549,"MEKARLAKSANA, CIKANCUNG, BANDUNG, JAWA BARAT",8,106,47,153
https://kawalpemilu.org#26145,"KARADENAN, CIBINONG, BOGOR, JAWA BARAT",38,23,125,148
https://kawalpemilu.org#27777,"JAYARAGA, TAROGONG KIDUL, GARUT, JAWA BARAT",16,56,209,265
https://kawalpemilu.org#28734,"KAWUNGLARANG, RANCAH, CIAMIS, JAWA BARAT",22,53,82,135
https://kawalpemilu.org#32137,"CILUAR, BOGOR UTARA, KOTA BOGOR, JAWA BARAT",45,116,136,252
https://kawalpemilu.org#27532,"TENJOLAYA, CICALENGKA, BANDUNG, JAWA BARAT",31,45,126,171
https://kawalpemilu.org#31513,"RAWAGEMPOL KULON, CILAMAYA WETAN, KARAWANG, JAWA BARAT",16,142,51,193
https://kawalpemilu.org#32439,"BANTARGEBANG, BANTAR GEBANG, KOTA BEKASI, JAWA BARAT",26,66,94,160
https://kawalpemilu.org#31348,"ADIARSA BARAT, KARAWANG BARAT, KARAWANG, JAWA BARAT",32,95,197,292
https://kawalpemilu.org#27629,"BOJONGEMAS, SOLOKANJERUK, BANDUNG, JAWA BARAT",32,114,113,227
https://kawalpemilu.org#32596,"URUG, KAWALU, KOTA TASIKMALAYA, JAWA BARAT",6,80,160,240
https://kawalpemilu.org#28787,"BANGUNSARI, PAMARICAN, CIAMIS, JAWA BARAT",11,62,99,161
https://kawalpemilu.org#32573,"TUGURAJA, CIHIDEUNG, KOTA TASIKMALAYA, JAWA BARAT",63,70,155,225
https://kawalpemilu.org#30962,"JALANCAGAK, JALANCAGAK, SUBANG, JAWA BARAT",25,94,130,224
https://kawalpemilu.org#32576,"CIPEDES, CIPEDES, KOTA TASIKMALAYA, JAWA BARAT",23,72,125,197
https://kawalpemilu.org#31234,"KAROYA, TEGALWARU, PURWAKARTA, JAWA BARAT",11,54,190,244
https://kawalpemilu.org#26390,"PINGKU, PARUNG PANJANG, BOGOR, JAWA BARAT",9,61,102,163
https://kawalpemilu.org#28341,"PUSPARAHAYU, PUSPAHIANG, TASIKMALAYA, JAWA BARAT",1,144,113,257
https://kawalpemilu.org#29339,"CIKAHURIPAN, MALEBER, KUNINGAN, JAWA BARAT",11,91,51,142
https://kawalpemilu.org#32429,"BOJONG RAWALUMBU, RAWA LUMBU, KOTA BEKASI, JAWA BARAT",45,92,107,199
https://kawalpemilu.org#32191,"SINDANGPALAY, CIBEUREUM, KOTA SUKABUMI, JAWA BARAT",17,65,74,139
https://kawalpemilu.org#27762,"RANCABANGO, TAROGONG KALER, GARUT, JAWA BARAT",6,63,108,171
https://kawalpemilu.org#28200,"CIDADAP, KARANGNUNGGAL, TASIKMALAYA, JAWA BARAT",11,69,135,204
https://kawalpemilu.org#32612,"SETIAJAYA, CIBEUREUM, KOTA TASIKMALAYA, JAWA BARAT",5,72,170,242
https://kawalpemilu.org#32393,"JAGASATRU, PEKALIPAN, KOTA CIREBON, JAWA BARAT",13,110,116,226
https://kawalpemilu.org#29178,"RAGAWACANA, KRAMATMULYA, KUNINGAN, JAWA BARAT",9,80,101,181
https://kawalpemilu.org#32405,"BEKASI JAYA, BEKASI TIMUR, KOTA BEKASI, JAWA BARAT",28,74,93,167
https://kawalpemilu.org#27490,"SUKAMANAH, PANGALENGAN, BANDUNG, JAWA BARAT",20,65,132,197
https://kawalpemilu.org#26214,"CIBODAS, JONGGOL, BOGOR, JAWA BARAT",11,50,169,219
https://kawalpemilu.org#30704,"PANYINGKIRAN LOR, CANTIGI, INDRAMAYU, JAWA BARAT",10,116,37,153
https://kawalpemilu.org#27105,"BOJONG, KARANGTENGAH, CIANJUR, JAWA BARAT",49,104,104,208
https://kawalpemilu.org#31154,"KERTAMUKTI, CAMPAKA, PURWAKARTA, JAWA BARAT",13,39,110,149
https://kawalpemilu.org#31473,"TANJUNGBUNGIN, PAKISJAYA, KARAWANG, JAWA BARAT",1,48,150,198
https://kawalpemilu.org#28812,"PUTRAPINGGAN, KALIPUCANG, PANGANDARAN, JAWA BARAT",7,180,31,211
https://kawalpemilu.org#27252,"SINDANGKERTA, PAGELARAN, CIANJUR, JAWA BARAT",19,70,140,210
https://kawalpemilu.org#29541,"KALIWADAS, SUMBER, CIREBON, JAWA BARAT",21,186,69,255
https://kawalpemilu.org#32137,"CILUAR, BOGOR UTARA, KOTA BOGOR, JAWA BARAT",52,60,103,163
https://kawalpemilu.org#32563,"CIBABAT, CIMAHI UTARA, KOTA CIMAHI, JAWA BARAT",84,66,162,228
https://kawalpemilu.org#30150,"SUNIA BARU, BANJARAN, MAJALENGKA, JAWA BARAT",3,101,106,207
https://kawalpemilu.org#30881,"KALIJATI TIMUR, KALIJATI, SUBANG, JAWA BARAT",6,88,136,224
https://kawalpemilu.org#29108,"CIHIDEUNG GIRANG, CIDAHU, KUNINGAN, JAWA BARAT",6,48,123,171
https://kawalpemilu.org#32098,"KATULAMPA, BOGOR TIMUR, KOTA BOGOR, JAWA BARAT",23,38,138,176
https://kawalpemilu.org#27444,"SAYATI, MARGAHAYU, BANDUNG, JAWA BARAT",30,39,133,172
https://kawalpemilu.org#29844,"KALAPADUA, LEMAHSUGIH, MAJALENGKA, JAWA BARAT",12,63,89,152
https://kawalpemilu.org#31002,"TAMBAKJATI, PATOKBEUSI, SUBANG, JAWA BARAT",12,129,65,194
https://kawalpemilu.org#28184,"CIHERAS, CIPATUJAH, TASIKMALAYA, JAWA BARAT",5,143,118,261
https://kawalpemilu.org#28084,"BOJONG, BUNGBULANG, GARUT, JAWA BARAT",8,60,90,150
https://kawalpemilu.org#28434,"MANGUNREJA, MANGUNREJA, TASIKMALAYA, JAWA BARAT",23,85,150,235
https://kawalpemilu.org#26877,"CIBATU, CISAAT, SUKABUMI, JAWA BARAT",6,31,148,179
https://kawalpemilu.org#27469,"BANJARAN WETAN, BANJARAN, BANDUNG, JAWA BARAT",45,161,60,221
https://kawalpemilu.org#31962,"TANIMULYA, NGAMPRAH, BANDUNG BARAT, JAWA BARAT",17,96,139,235
https://kawalpemilu.org#27597,"CIBEUREUM, KERTASARI, BANDUNG, JAWA BARAT",10,26,186,212
https://kawalpemilu.org#30784,"SUKRAWETAN, SUKRA, INDRAMAYU, JAWA BARAT",7,123,15,138
https://kawalpemilu.org#32341,"CISARANTEN BINA HARAPAN, ARCAMANIK, KOTA BANDUNG, JAWA BARAT",21,47,98,145
https://kawalpemilu.org#26299,"PURASARI, LEUWILIANG, BOGOR, JAWA BARAT",22,37,159,196
https://kawalpemilu.org#28193,"CIPANAS, CIPATUJAH, TASIKMALAYA, JAWA BARAT",1,139,93,232
https://kawalpemilu.org#29062,"TEMBONG, GARAWANGI, KUNINGAN, JAWA BARAT",3,93,95,188
https://kawalpemilu.org#31422,"TELUKBANGO, BATUJAYA, KARAWANG, JAWA BARAT",25,73,161,234
https://kawalpemilu.org#30979,"SINDANGLAYA, TANJUNGSIANG, SUBANG, JAWA BARAT",4,43,177,220
https://kawalpemilu.org#26795,"MEKAR MUKTI, WALURAN, SUKABUMI, JAWA BARAT",15,62,94,156
https://kawalpemilu.org#32138,"TANAH BARU, BOGOR UTARA, KOTA BOGOR, JAWA BARAT",60,32,106,138
https://kawalpemilu.org#26402,"BANTARKARET, NANGGUNG, BOGOR, JAWA BARAT",22,54,185,239
https://kawalpemilu.org#30375,"CILELES, JATINANGOR, SUMEDANG, JAWA BARAT",10,69,170,239
https://kawalpemilu.org#32322,"ANTAPANI TENGAH, ANTAPANI, KOTA BANDUNG, JAWA BARAT",46,98,120,218
https://kawalpemilu.org#31995,"BATUJAJAR TIMUR, BATUJAJAR, BANDUNG BARAT, JAWA BARAT",39,46,214,260
https://kawalpemilu.org#30182,"INDRAKILA, SINDANG, MAJALENGKA, JAWA BARAT",6,106,72,178
https://kawalpemilu.org#31145,"MUNJULJAYA, PURWAKARTA, PURWAKARTA, JAWA BARAT",37,76,198,274
https://kawalpemilu.org#26296,"BOJONGGEDE, BOJONG GEDE, BOGOR, JAWA BARAT",121,67,160,227
https://kawalpemilu.org#32185,"LEMBURSITU, LEMBURSITU, KOTA SUKABUMI, JAWA BARAT",5,49,146,195
https://kawalpemilu.org#30528,"GABUS KULON, GABUSWETAN, INDRAMAYU, JAWA BARAT",9,165,33,198
https://kawalpemilu.org#26490,"CIPICUNG, CIJERUK, BOGOR, JAWA BARAT",39,19,118,137
https://kawalpemilu.org#31046,"MAYANGAN, LEGONKULON, SUBANG, JAWA BARAT",2,39,65,104
https://kawalpemilu.org#26501,"PAGELARAN, CIOMAS, BOGOR, JAWA BARAT",47,74,127,201
https://kawalpemilu.org#32090,"HARJASARI, BOGOR SELATAN, KOTA BOGOR, JAWA BARAT",13,29,102,131
https://kawalpemilu.org#31358,"TAMANSARI, PANGKALAN, KARAWANG, JAWA BARAT",10,74,136,210
https://kawalpemilu.org#29537,"WANASABA LOR, TALUN, CIREBON, JAWA BARAT",7,118,99,217
https://kawalpemilu.org#31044,"CIPEUNDEUY, CIPEUNDEUY, SUBANG, JAWA BARAT",12,55,128,183
https://kawalpemilu.org#32421,"HARAPAN JAYA, BEKASI UTARA, KOTA BEKASI, JAWA BARAT",45,81,105,186
https://kawalpemilu.org#31351,"TUNGGAKJATI, KARAWANG BARAT, KARAWANG, JAWA BARAT",12,57,150,207
https://kawalpemilu.org#26599,"WANGUNJAYA, LEUWISADENG, BOGOR, JAWA BARAT",15,50,101,151
https://kawalpemilu.org#27232,"WARINGINSARI, TAKOKAK, CIANJUR, JAWA BARAT",11,44,138,182
https://kawalpemilu.org#26843,"BANYUWANGI, CIBITUNG, SUKABUMI, JAWA BARAT",6,56,145,201
https://kawalpemilu.org#27891,"SUKAMANAH, MALANGBONG, GARUT, JAWA BARAT",12,40,104,144
https://kawalpemilu.org#32571,"ARGASARI, CIHIDEUNG, KOTA TASIKMALAYA, JAWA BARAT",31,53,79,132
https://kawalpemilu.org#26335,"CIBATOK II, CIBUNGBULANG, BOGOR, JAWA BARAT",10,42,109,151
https://kawalpemilu.org#29142,"CILIMUS, CILIMUS, KUNINGAN, JAWA BARAT",14,29,172,201
https://kawalpemilu.org#32198,"SARIJADI, SUKASARI, KOTA BANDUNG, JAWA BARAT",51,77,144,221
https://kawalpemilu.org#32229,"PAJAJARAN, CICENDO, KOTA BANDUNG, JAWA BARAT",66,89,95,184
https://kawalpemilu.org#32431,"SEPANJANG JAYA, RAWA LUMBU, KOTA BEKASI, JAWA BARAT",92,94,106,200
https://kawalpemilu.org#30679,"PLUMBON, INDRAMAYU, INDRAMAYU, JAWA BARAT",10,175,48,223
https://kawalpemilu.org#28905,"MEKARMUKTI, CISAGA, CIAMIS, JAWA BARAT",5,74,76,150
https://kawalpemilu.org#27550,"TANJUNGLAYA, CIKANCUNG, BANDUNG, JAWA BARAT",24,61,162,223
https://kawalpemilu.org#26231,"CIPENJO, CILEUNGSI, BOGOR, JAWA BARAT",36,53,53,106
https://kawalpemilu.org#32504,"BAKTIJAYA, SUKMAJAYA, KOTA DEPOK, JAWA BARAT",58,126,160,286
https://kawalpemilu.org#27773,"SUKAGALIH, TAROGONG KIDUL, GARUT, JAWA BARAT",25,53,189,242
https://kawalpemilu.org#31971,"CIPTAHARJA, CIPATAT, BANDUNG BARAT, JAWA BARAT",33,63,112,175
https://kawalpemilu.org#31128,"PUSAKAJAYA, PUSAKAJAYA, SUBANG, JAWA BARAT",14,163,45,208
https://kawalpemilu.org#32454,"JATILUHUR, JATIASIH, KOTA BEKASI, JAWA BARAT",26,75,142,217
https://kawalpemilu.org#32372,"KARANG PAMULANG, MANDALAJATI, KOTA BANDUNG, JAWA BARAT",15,75,145,220
https://kawalpemilu.org#29009,"CIBINGBIN, CIBINGBIN, KUNINGAN, JAWA BARAT",18,89,76,165
https://kawalpemilu.org#28948,"KARANGPANINGGAL, PURWADADI, CIAMIS, JAWA BARAT",11,82,76,158
https://kawalpemilu.org#32351,"PASANGGRAHAN, UJUNG BERUNG, KOTA BANDUNG, JAWA BARAT",33,86,144,230
https://kawalpemilu.org#32115,"MENTENG, BOGOR BARAT, KOTA BOGOR, JAWA BARAT",6,74,97,171
https://kawalpemilu.org#27434,"BOJONGSOANG, BOJONGSOANG, BANDUNG, JAWA BARAT",41,66,161,227
https://kawalpemilu.org#27599,"TARUMAJAYA, KERTASARI, BANDUNG, JAWA BARAT",7,109,154,263
https://kawalpemilu.org#28822,"BABAKAN, PANGANDARAN, PANGANDARAN, JAWA BARAT",3,145,107,252
https://kawalpemilu.org#28594,"NASOL, CIKONENG, CIAMIS, JAWA BARAT",14,82,65,147
https://kawalpemilu.org#32466,"MUSTIKAJAYA, MUSTIKA JAYA, KOTA BEKASI, JAWA BARAT",96,112,141,253
https://kawalpemilu.org#28917,"SUKASENANG, SINDANGKASIH, CIAMIS, JAWA BARAT",16,34,151,185
https://kawalpemilu.org#29439,"KARANGMEKAR, KARANGSEMBUNG, CIREBON, JAWA BARAT",11,128,68,196
https://kawalpemilu.org#32215,"BABAKAN TAROGONG, BOJONGLOA KALER, KOTA BANDUNG, JAWA BARAT",52,74,104,178
https://kawalpemilu.org#28864,"KERTAMUKTI, CIMERAK, PANGANDARAN, JAWA BARAT",15,98,27,125
https://kawalpemilu.org#28033,"PANGRUMASAN, PEUNDEUY, GARUT, JAWA BARAT",5,10,110,120
https://kawalpemilu.org#30937,"SUKAMANDI JAYA, CIASEM, SUBANG, JAWA BARAT",52,71,124,195
https://kawalpemilu.org#32011,"CIHAMPELAS, CIHAMPELAS, BANDUNG BARAT, JAWA BARAT",22,60,161,221
https://kawalpemilu.org#32378,"SUKAPURA, KEJAKSAN, KOTA CIREBON, JAWA BARAT",8,116,109,225
